[
    {
        "unit_id": "unit_0",
        "token_input": "PZGNZCTSZL",
        "token_output": "IAFOIPWVQA",
        "documents": [
            {
                "filename": "law_458_090G0032_1990-01-20.json",
                "title": "DECRETO-LEGGE 20 gennaio 1990, n. 3",
                "subject": "Disposizioni in materia di fiscalizzazione degli oneri sociali, di malattia e di sgravi contributivi nel Mezzogiorno.",
                "type": "decreto.legge",
                "number": "3",
                "year": "1990",
                "editorial_code": "090G0032",
                "gazette_reference": "(GU n.16 del 20-01-1990)",
                "publication_date": "1990-01-20",
                "gazette_date": "1990-01-20",
                "valid_from": "1990-01-20",
                "last_updated": "(Ultimo aggiornamento all'atto pubblicato il 21/03/1990)",
                "link_gazette": "http://www.gazzettaufficiale.it/eli/gu/1990/01/20/16/sg/pdf",
                "link_urn_nir": "http://www.normattiva.it/uri-res/N2Ls?urn:nir:stato:decreto.legge:1990-01-20;3",
                "link_eli_id": "http://www.normattiva.it/eli/id/1990/01/20/090G0032",
                "link_eli_type": "http://www.normattiva.it/eli/stato/DECRETO_LEGGE/1990/01/20/3",
                "id": "art_4_law_458_090G0032_1990-01-20.json",
                "article_number": "4",
                "article_text": [
                    "                               Art. 4. \n                          Entrata in vigore \n 1. Il presente decreto entra in vigore il giorno  stesso  della  sua\npubblicazione nella Gazzetta Ufficiale della  Repubblica  italiana  e\nsara' presentato alle Camere per la conversione in legge. \n  Il presente decreto, munito del sigillo dello Stato, sara' inserito\nnella  Raccolta  ufficiale  degli  atti  normativi  della  Repubblica\nitaliana. E' fatto obbligo a chiunque spetti di osservarlo e di farlo\nosservare. \n   Dato a Roma, addi' 20 gennaio 1990 \n                               COSSIGA \n                                  ANDREOTTI, Presidente del Consiglio \n                                  dei Ministri \n                                  DONAT CATTIN, Ministro del lavoro e \n                                  della previdenza sociale \n                                  CIRINO POMICINO, Ministro \n                                    del bilancio e della \n                                  programmazione economica \n                                  CARLI, Ministro del tesoro \n Visto, il Guardasigilli: VASSALLI "
                ]
            },
            {
                "filename": "law_1021_083U0290_1983-06-17.json",
                "title": "DECRETO DEL PRESIDENTE DELLA REPUBBLICA 18 marzo 1983, n. 290",
                "subject": "Approvazione dei programmi e delle modalita' delle prove di esame, dei criteri di valutazione dei titoli e della composizione della commissione esaminatrice dei concorsi per la nomina a tenente di vascello in servizio permanente effettivo del Corpo musicale della Marina militare.",
                "type": "decreto.del.presidente.della.repubblica",
                "number": "290",
                "year": "1983",
                "editorial_code": "083U0290",
                "gazette_reference": "(GU n.165 del 17-06-1983)",
                "publication_date": "1983-03-18",
                "gazette_date": "1983-06-17",
                "valid_from": "2010-10-09",
                "last_updated": "(Ultimo aggiornamento all'atto pubblicato il 08/05/2010)",
                "link_gazette": "http://www.gazzettaufficiale.it/eli/gu/1983/06/17/165/sg/pdf",
                "link_urn_nir": "http://www.normattiva.it/uri-res/N2Ls?urn:nir:stato:decreto.del.presidente.della.repubblica:1983-03-18;290",
                "link_eli_id": "http://www.normattiva.it/eli/id/1983/06/17/083U0290",
                "link_eli_type": "http://www.normattiva.it/eli/stato/DECRETO_DEL_PRESIDENTE_DELLA_REPUBBLICA/1983/03/18/290",
                "id": "art_3_law_1021_083U0290_1983-06-17.json",
                "article_number": "3",
                "article_text": [
                    "                             Art. 3\n     ((PROVVEDIMENTO ABROGATO DAL D.LGS. 15 MARZO 2010, N. 66))"
                ]
            },
            {
                "filename": "law_239_094G0580_1994-09-17.json",
                "title": "DECRETO-LEGGE 17 settembre 1994, n. 538",
                "subject": "Disposizioni fiscali urgenti in materia di accertamento, contenzioso, potenziamento degli organici, controlli e anagrafe patrimoniale dei dipendenti, al fine di contrastare l'evasione e la corruzione.",
                "type": "decreto.legge",
                "number": "538",
                "year": "1994",
                "editorial_code": "094G0580",
                "gazette_reference": "(GU n.218 del 17-09-1994)",
                "publication_date": "1994-09-17",
                "gazette_date": "1994-09-17",
                "valid_from": "1994-11-17",
                "last_updated": "(Ultimo aggiornamento all'atto pubblicato il 22/09/1994)",
                "link_gazette": "http://www.gazzettaufficiale.it/eli/gu/1994/09/17/218/sg/pdf",
                "link_urn_nir": "http://www.normattiva.it/uri-res/N2Ls?urn:nir:stato:decreto.legge:1994-09-17;538",
                "link_eli_id": "http://www.normattiva.it/eli/id/1994/09/17/094G0580",
                "link_eli_type": "http://www.normattiva.it/eli/stato/DECRETO_LEGGE/1994/09/17/538",
                "id": "art_11_law_239_094G0580_1994-09-17.json",
                "article_number": "11",
                "article_text": [
                    "                            Art. 11. \n       DECRETO DECADUTO; I SUOI EFFETTI SONO STATI FATTI SALVI \n                  DALLA L. 24 OTTOBRE 1996, N. 556 "
                ]
            },
            {
                "filename": "law_471_098G0067_1998-03-20.json",
                "title": "DECRETO LEGISLATIVO 19 febbraio 1998, n. 51",
                "subject": "Norme in materia di istituzione del giudice unico di primo grado.",
                "type": "decreto.legislativo",
                "number": "51",
                "year": "1998",
                "editorial_code": "098G0067",
                "gazette_reference": "(GU n.66 del 20-03-1998 - Suppl. Ordinario n. 48)",
                "publication_date": "1998-02-19",
                "gazette_date": "1998-03-20",
                "valid_from": "1998-03-21",
                "last_updated": "(Ultimo aggiornamento all'atto pubblicato il 31/07/2017)",
                "link_gazette": "http://www.gazzettaufficiale.it/eli/gu/1998/03/20/66/so/48/sg/pdf",
                "link_urn_nir": "http://www.normattiva.it/uri-res/N2Ls?urn:nir:stato:decreto.legislativo:1998-02-19;51",
                "link_eli_id": "http://www.normattiva.it/eli/id/1998/03/20/098G0067",
                "link_eli_type": "http://www.normattiva.it/eli/stato/DECRETO_LEGISLATIVO/1998/02/19/51",
                "id": "art_13_law_471_098G0067_1998-03-20.json",
                "article_number": "13",
                "article_text": [
                    "                              Art. 13.\n\n  1. Dopo l'articolo 47 del regio decreto 30 gennaio 1941, n. 12 sono\ninseriti i seguenti:\n  \"Art. 47-bis. (Direzione delle sezioni). - Nei tribunali costituiti\nin sezioni e nei quali sono istituiti posti di presidente di sezione,\n  la  direzione  delle  sezioni  e'  attribuita  ad  un presidente di\n  sezione.\nNei tribunali nei quali non sono istituiti posti di presidente di\nsezione,  dell'organizzazione  del lavoro della sezione e' incaricato\nil  magistrato designato nelle tabelle formate ai sensi dell'articolo\n7-bis.\n  Art.  47-ter.  (Istituzione  dei posti di presidente di sezione). -\nSalvo  quanto  previsto  dal secondo e dal terzo comma, nei tribunali\ncostituiti  in  sezioni  ai  quali sono addetti piu' di dieci giudici\nordinari  possono essere istituiti posti di presidente di sezione, in\nnumero  non superiore a quello determinato dalla proporzione di uno a\ndieci.  Non  si  tiene conto, a tali fini, dei giudici assegnati alle\nsezioni distaccate.\n  Il  posto di presidente di sezione e' istituito in ogni caso per la\ndirezione  delle  seguenti  sezioni,  se ad esse sono addetti piu' di\ndieci giudici:\n    a)  sezioni  incaricate  della  trattazione delle controversie in\nmateria di lavoro e di previdenza e assistenza obbligatorie;\n    b)  sezioni  incaricate  degli  affari  inerenti  alle  procedure\nconcorsuali;\n    c)  sezioni dei giudici incaricati dei provvedimenti previsti dal\ncodice  di  procedura penale per la fase delle indagini preliminari e\nper l'udienza preliminare, salvo quanto previsto dal terzo comma.\n  In  ogni  tribunale  ordinario  di cui alla tabella A allegata alla\nlegge 22 dicembre 1973, n. 884, la sezione dei giudici incaricati dei\nprovvedimenti  previsti  dal  codice  di procedura penale per la fase\ndelle  indagini preliminari e per l'udienza preliminare e' diretta da\nun  presidente di sezione. Si applicano le disposizioni dell'articolo\n1,  commi  1  e  2,  del  decreto-legge  25  settembre  1989, n. 327,\nconvertito dalla legge 24 novembre 1989, n. 380.\n  Art.  47-quater.  (Attribuzioni  del  presidente  di sezione). - Il\npresidente di sezione, oltre a svolgere il lavoro giudiziario, dirige\nla  sezione cui e' assegnato e, in particolare, sorveglia l'andamento\ndei servizi di cancelleria ed ausiliari, distribuisce il lavoro tra i\ngiudici  e  vigila  sulla loro attivita', curando anche lo scambio di\ninformazioni  sulle  esperienze  giurisprudenziali  all'interno della\nsezione.   Collabora,  altresi',  con  il  presidente  del  tribunale\nnell'attivita' di direzione dell'ufficio.\n  Con  le tabelle formate ai sensi dell'articolo 7-bis, al presidente\ndi sezione puo' essere attribuito l'incarico di dirigere piu' sezioni\nche  trattano  materie  omogenee,  ovvero  di  coordinare  uno o piu'\nsettori di attivita' dell'ufficio.\n  Art.  47-quinquies. (Presidenza dei collegi). - Quando il tribunale\ngiudica  in  composizione  collegiale,  la presidenza del collegio e'\nassunta  dal presidente del tribunale o da un presidente di sezione o\ndal  magistrato  piu'  elevato  in  qualifica  o dal piu' anziano dei\nmagistrati di pari qualifica componenti il collegio.\"."
                ]
            },
            {
                "filename": "law_495_095G0134_1995-04-03.json",
                "title": "DECRETO-LEGGE 3 aprile 1995, n. 101",
                "subject": "Norme urgenti in materia di lavori pubblici.",
                "type": "decreto.legge",
                "number": "101",
                "year": "1995",
                "editorial_code": "095G0134",
                "gazette_reference": "(GU n.78 del 03-04-1995)",
                "publication_date": "1995-04-3",
                "gazette_date": "1995-04-03",
                "valid_from": "2008-12-22",
                "last_updated": "(Ultimo aggiornamento all'atto pubblicato il 25/06/2008)",
                "link_gazette": "http://www.gazzettaufficiale.it/eli/gu/1995/04/03/78/sg/pdf",
                "link_urn_nir": "http://www.normattiva.it/uri-res/N2Ls?urn:nir:stato:decreto.legge:1995-04-3;101",
                "link_eli_id": "http://www.normattiva.it/eli/id/1995/04/03/095G0134",
                "link_eli_type": "http://www.normattiva.it/eli/stato/DECRETO_LEGGE/1995/04/3/101",
                "id": "art_5 quinquies_law_495_095G0134_1995-04-03.json",
                "article_number": "5 quinquies",
                "article_text": [
                    "                          Art. 5-quinquies\n            ((IL D.L. 25 GIUGNO 2008, N.112, CONVERTITO,\n   CON MODIFICAZIONI, DALLA L. 6 AGOSTO 2008, N. 133 HA CONFERMATO\n             L'ABROGAZIONE DEL PRESENTE PROVVEDIMENTO))"
                ]
            },
            {
                "filename": "law_189_094G0630_1994-10-24.json",
                "title": "DECRETO-LEGGE 21 ottobre 1994, n. 588",
                "subject": "Disposizioni urgenti per il funzionamento delle universita'.",
                "type": "decreto.legge",
                "number": "588",
                "year": "1994",
                "editorial_code": "094G0630",
                "gazette_reference": "(GU n.249 del 24-10-1994)",
                "publication_date": "1994-10-21",
                "gazette_date": "1994-10-24",
                "valid_from": "1994-12-24",
                "last_updated": "(Ultimo aggiornamento all'atto pubblicato il 21/06/1995)",
                "link_gazette": "http://www.gazzettaufficiale.it/eli/gu/1994/10/24/249/sg/pdf",
                "link_urn_nir": "http://www.normattiva.it/uri-res/N2Ls?urn:nir:stato:decreto.legge:1994-10-21;588",
                "link_eli_id": "http://www.normattiva.it/eli/id/1994/10/24/094G0630",
                "link_eli_type": "http://www.normattiva.it/eli/stato/DECRETO_LEGGE/1994/10/21/588",
                "id": "art_12_law_189_094G0630_1994-10-24.json",
                "article_number": "12",
                "article_text": [
                    "                            Art. 12. \n       DECRETO DECADUTO; I SUOI EFFETTI SONO STATI FATTI SALVI \n                   DALLA L. 21 GIUGNO 1995, N. 236 "
                ]
            },
            {
                "filename": "law_98_096G0619_1996-12-04.json",
                "title": "DECRETO DEL PRESIDENTE DELLA REPUBBLICA 16 settembre 1996, n. 610",
                "subject": "Regolamento recante modifiche al decreto del Presidente della Repubblica 16 dicembre 1992, n. 495, concernente il regolamento di esecuzione e di attuazione del nuovo Codice della strada.",
                "type": "decreto.del.presidente.della.repubblica",
                "number": "610",
                "year": "1996",
                "editorial_code": "096G0619",
                "gazette_reference": "(GU n.284 del 04-12-1996 - Suppl. Ordinario n. 212)",
                "publication_date": "1996-09-16",
                "gazette_date": "1996-12-04",
                "valid_from": "1996-12-19",
                "last_updated": "(Ultimo aggiornamento all'atto pubblicato il 11/12/1996)",
                "link_gazette": "http://www.gazzettaufficiale.it/eli/gu/1996/12/04/284/so/212/sg/pdf",
                "link_urn_nir": "http://www.normattiva.it/uri-res/N2Ls?urn:nir:stato:decreto.del.presidente.della.repubblica:1996-09-16;610",
                "link_eli_id": "http://www.normattiva.it/eli/id/1996/12/04/096G0619",
                "link_eli_type": "http://www.normattiva.it/eli/stato/DECRETO_DEL_PRESIDENTE_DELLA_REPUBBLICA/1996/09/16/610",
                "id": "art_48_law_98_096G0619_1996-12-04.json",
                "article_number": "48",
                "article_text": [
                    "                               ART. 48 \n1. All'articolo 58, comma 1, del D.P.R. 16  dicembre  1992,  n.  495,\nsono apportate le seguenti modificazioni: \na) Le parole: \"rimossi  entro  dodici  mesi\"  sono  sostituite  dalle\nseguenti: \"adeguati entro tre anni\"; \nb) In fine il segno di interpunzione  <punto>  e'  soppresso  e  sono\naggiunte le seguenti parole: \",  qualora  il  cartello  debba  essere\nrimosso per impossibilita' di adeguamento.  Qualora  l'autorizzazione\nscada  prima  del  termine  suddetto,  il  rinnovo  della  stessa  e'\nsubordinato  all'adeguamento  entro  il  termine  di  decorrenza  del\nrinnovo stesso.\". "
                ]
            },
            {
                "filename": "law_874_085U0268_1985-06-15.json",
                "title": "DECRETO DEL PRESIDENTE DELLA REPUBBLICA 25 febbraio 1985, n. 268",
                "subject": "Approvazione del nuovo statuto dell'Associazione nazionale allevatori del cavallo agricolo italiano da tiro pesante rapido, in Verona.",
                "type": "decreto.del.presidente.della.repubblica",
                "number": "268",
                "year": "1985",
                "editorial_code": "085U0268",
                "gazette_reference": "(GU n.140 del 15-06-1985)",
                "publication_date": "1985-02-25",
                "gazette_date": "1985-06-15",
                "valid_from": "1985-06-30",
                "last_updated": "",
                "link_gazette": "http://www.gazzettaufficiale.it/eli/gu/1985/06/15/140/sg/pdf",
                "link_urn_nir": "http://www.normattiva.it/uri-res/N2Ls?urn:nir:stato:decreto.del.presidente.della.repubblica:1985-02-25;268",
                "link_eli_id": "http://www.normattiva.it/eli/id/1985/06/15/085U0268",
                "link_eli_type": "http://www.normattiva.it/eli/stato/DECRETO_DEL_PRESIDENTE_DELLA_REPUBBLICA/1985/02/25/268",
                "id": "art_1_law_874_085U0268_1985-06-15.json",
                "article_number": "1",
                "article_text": [
                    "N. 268. Decreto del Presidente della Repubblica 25 febbraio 1985, col\n  quale,   sulla  proposta  del  Ministro  dell'agricoltura  e  delle\n  foreste,   viene   approvato  il  nuovo  statuto  dell'Associazione\n  nazionale  allevatori del cavallo agricolo italiano da tiro pesante\n  rapido, in Verona, eretta in ente morale con decreto del Presidente\n  della Repubblica 28 novembre 1974, n. 924.\n\nVisto, il Guardasigilli: MARTINAZZOLI\n  Registrato alla Corte dei conti, addi' 29 maggio 1985\n  Registro n. 8 Agricoltura, foglio n. 81"
                ]
            },
            {
                "filename": "law_135_098G0443_1998-11-07.json",
                "title": "DECRETO LEGISLATIVO 29 ottobre 1998, n. 387",
                "subject": "Ulteriori disposizioni integrative e correttive del decreto legislativo 3 febbraio 1993, n. 29, e successive modificazioni, e del decreto legislativo 31 marzo 1998, n. 80.",
                "type": "decreto.legislativo",
                "number": "387",
                "year": "1998",
                "editorial_code": "098G0443",
                "gazette_reference": "(GU n.261 del 07-11-1998)",
                "publication_date": "1998-10-29",
                "gazette_date": "1998-11-07",
                "valid_from": "2001-05-24",
                "last_updated": "(Ultimo aggiornamento all'atto pubblicato il 31/10/2009)",
                "link_gazette": "http://www.gazzettaufficiale.it/eli/gu/1998/11/07/261/sg/pdf",
                "link_urn_nir": "http://www.normattiva.it/uri-res/N2Ls?urn:nir:stato:decreto.legislativo:1998-10-29;387",
                "link_eli_id": "http://www.normattiva.it/eli/id/1998/11/07/098G0443",
                "link_eli_type": "http://www.normattiva.it/eli/stato/DECRETO_LEGISLATIVO/1998/10/29/387",
                "id": "art_16_law_135_098G0443_1998-11-07.json",
                "article_number": "16",
                "article_text": [
                    "                               Art. 16\n       ((ARTICOLO ABROGATO DAL D.LGS. 30 MARZO 2001, N. 165))"
                ]
            },
            {
                "filename": "law_929_080U0336_1980-07-18.json",
                "title": "LEGGE 8 luglio 1980, n. 336",
                "subject": "Provvedimenti straordinari per il potenziamento e l'ammodernamento dei servizi del Corpo nazionale dei vigili del fuoco.",
                "type": "legge",
                "number": "336",
                "year": "1980",
                "editorial_code": "080U0336",
                "gazette_reference": "(GU n.196 del 18-07-1980)",
                "publication_date": "1980-07-8",
                "gazette_date": "1980-07-18",
                "valid_from": "2008-12-22",
                "last_updated": "(Ultimo aggiornamento all'atto pubblicato il 25/06/2008)",
                "link_gazette": "http://www.gazzettaufficiale.it/eli/gu/1980/07/18/196/sg/pdf",
                "link_urn_nir": "http://www.normattiva.it/uri-res/N2Ls?urn:nir:stato:legge:1980-07-8;336",
                "link_eli_id": "http://www.normattiva.it/eli/id/1980/07/18/080U0336",
                "link_eli_type": "http://www.normattiva.it/eli/stato/LEGGE/1980/07/8/336",
                "id": "art_4_law_929_080U0336_1980-07-18.json",
                "article_number": "4",
                "article_text": [
                    "                               Art. 4 \n((IL D.L. 25 GIUGNO 2008, N.112, CONVERTITO, CON MODIFICAZIONI, DALLA\nL. 6 AGOSTO 2008, N. 133 HA  CONFERMATO  L'ABROGAZIONE  DEL  PRESENTE\n                           PROVVEDIMENTO)) "
                ]
            }
        ]
    },
    {
        "unit_id": "unit_1",
        "token_input": "ISYKNMKJPY",
        "token_output": "VCZRRBJFMZ",
        "documents": [
            {
                "filename": "law_122_093G0563_1993-12-01.json",
                "title": "LEGGE 26 novembre 1993, n. 483",
                "subject": "Disciplina del conto intrattenuto dal Tesoro presso la Banca d'Italia per il servizio di tesoreria e modifica della disciplina della riserva obbligatoria degli enti creditizi.",
                "type": "legge",
                "number": "483",
                "year": "1993",
                "editorial_code": "093G0563",
                "gazette_reference": "(GU n.282 del 01-12-1993)",
                "publication_date": "1993-11-26",
                "gazette_date": "1993-12-01",
                "valid_from": "1993-12-16",
                "last_updated": "(Ultimo aggiornamento all'atto pubblicato il 01/10/1998)",
                "link_gazette": "http://www.gazzettaufficiale.it/eli/gu/1993/12/01/282/sg/pdf",
                "link_urn_nir": "http://www.normattiva.it/uri-res/N2Ls?urn:nir:stato:legge:1993-11-26;483",
                "link_eli_id": "http://www.normattiva.it/eli/id/1993/12/01/093G0563",
                "link_eli_type": "http://www.normattiva.it/eli/stato/LEGGE/1993/11/26/483",
                "id": "art_12_law_122_093G0563_1993-12-01.json",
                "article_number": "12",
                "article_text": [
                    "                              Art. 12. \n  1. Il Ministro del tesoro e' autorizzato ad apportare,  con  propri\ndecreti, le occorrenti variazioni di bilancio. \n  La presente legge, munita del sigillo dello Stato,  sara'  inserita\nnella  Raccolta  ufficiale  degli  atti  normativi  della  Repubblica\nitaliana. E' fatto obbligo a chiunque spetti di osservarla e di farla\nosservare come legge dello Stato. \n   Data a Roma, addi' 26 novembre 1993 \n                              SCALFARO \n \n                                   CIAMPI, Presidente  del  Consiglio\n                                   dei Ministri \n                                   BARUCCI, Ministro del tesoro \n \nVisto, il Guardasigilli: CONSO "
                ]
            },
            {
                "filename": "law_353_087U0295_1987-07-21.json",
                "title": "DECRETO 9 luglio 1987, n. 295",
                "subject": "Adeguamento delle disposizioni contenute nel decreto ministeriale 7 dicembre 1971, relative alle modalita' di utilizzazione e gestione del fondo di cui alla legge 14 agosto 1971, n. 819, recante: \"Interventi a favore del credito cinematografico\".",
                "type": "decreto",
                "number": "295",
                "year": "1987",
                "editorial_code": "087U0295",
                "gazette_reference": "(GU n.168 del 21-07-1987)",
                "publication_date": "1987-07-9",
                "gazette_date": "1987-07-21",
                "valid_from": "1987-07-21",
                "last_updated": "",
                "link_gazette": "http://www.gazzettaufficiale.it/eli/gu/1987/07/21/168/sg/pdf",
                "link_urn_nir": "http://www.normattiva.it/uri-res/N2Ls?urn:nir:stato:decreto:1987-07-9;295",
                "link_eli_id": "http://www.normattiva.it/eli/id/1987/07/21/087U0295",
                "link_eli_type": "http://www.normattiva.it/eli/stato/DECRETO/1987/07/9/295",
                "id": "art_5_law_353_087U0295_1987-07-21.json",
                "article_number": "5",
                "article_text": [
                    "                               Art. 5.\n\n  Nell'art. 2, lettera d), secondo capoverso del decreto ministeriale\n7 dicembre 1971 le parole \"40 per cento\" sono sostituite dalle parole\n\"60 per cento\"."
                ]
            },
            {
                "filename": "law_408_092G0111_1992-02-29.json",
                "title": "LEGGE 5 febbraio 1992, n. 177",
                "subject": "Norme riguardanti aree demaniali nelle province di Belluno, Como, Bergamo e Rovigo, per il trasferimento al patrimonio disponibile e successiva cessione a privati.",
                "type": "legge",
                "number": "177",
                "year": "1992",
                "editorial_code": "092G0111",
                "gazette_reference": "(GU n.50 del 29-02-1992)",
                "publication_date": "1992-02-5",
                "gazette_date": "1992-02-29",
                "valid_from": "2002-01-01",
                "last_updated": "(Ultimo aggiornamento all'atto pubblicato il 29/12/2001)",
                "link_gazette": "http://www.gazzettaufficiale.it/eli/gu/1992/02/29/50/sg/pdf",
                "link_urn_nir": "http://www.normattiva.it/uri-res/N2Ls?urn:nir:stato:legge:1992-02-5;177",
                "link_eli_id": "http://www.normattiva.it/eli/id/1992/02/29/092G0111",
                "link_eli_type": "http://www.normattiva.it/eli/stato/LEGGE/1992/02/5/177",
                "id": "art_6_law_408_092G0111_1992-02-29.json",
                "article_number": "6",
                "article_text": [
                    "                               Art. 6.\n  1.  L'acquisto  delle  aree  ha  valore  di  sanatoria agli effetti\nurbanistici e fa venire  meno  le  pretese  dello  Stato  per  canoni\npregressi  ed  in genere per compensi richiesti a qualsiasi titolo in\ndipendenza dell'occupazione delle aree. Dalla data  di  presentazione\ndella  domanda  di  cui all'articolo 2 sono sospesi i procedimenti di\ningiunzione o di rilascio delle aree, comunque motivati."
                ]
            },
            {
                "filename": "law_698_094G0093_1994-02-02.json",
                "title": "DECRETO-LEGGE 1 febbraio 1994, n. 79",
                "subject": "Misure urgenti in materia di partecipazione alla spesa sanitaria, di formazione dei medici e di farmacovigilanza.",
                "type": "decreto.legge",
                "number": "79",
                "year": "1994",
                "editorial_code": "094G0093",
                "gazette_reference": "(GU n.26 del 02-02-1994)",
                "publication_date": "1994-02-1",
                "gazette_date": "1994-02-02",
                "valid_from": "1994-04-04",
                "last_updated": "(Ultimo aggiornamento all'atto pubblicato il 28/07/1994)",
                "link_gazette": "http://www.gazzettaufficiale.it/eli/gu/1994/02/02/26/sg/pdf",
                "link_urn_nir": "http://www.normattiva.it/uri-res/N2Ls?urn:nir:stato:decreto.legge:1994-02-1;79",
                "link_eli_id": "http://www.normattiva.it/eli/id/1994/02/02/094G0093",
                "link_eli_type": "http://www.normattiva.it/eli/stato/DECRETO_LEGGE/1994/02/1/79",
                "id": "art_6_law_698_094G0093_1994-02-02.json",
                "article_number": "6",
                "article_text": [
                    "                             Art. 6. \n       DECRETO DECADUTO; I SUOI EFFETTI SONO STATI FATTI SALVI \n                   DALLA L. 19 LUGLIO 1994, N. 467 "
                ]
            },
            {
                "filename": "law_98_093G0558_1993-12-09.json",
                "title": "DECRETO LEGISLATIVO 15 novembre 1993, n. 507",
                "subject": "Revisione ed armonizzazione dell'imposta comunale sulla pubblicita' e del diritto sulle pubbliche affissioni, della tassa per l'occupazione di spazi ed aree pubbliche dei comuni e delle province nonche' della tassa per lo smaltimento dei rifiuti solidi urbani a norma dell'art. 4 della legge 23 ottobre 1992, n. 421, concernente il riordino della finanza territoriale.",
                "type": "decreto.legislativo",
                "number": "507",
                "year": "1993",
                "editorial_code": "093G0558",
                "gazette_reference": "(GU n.288 del 09-12-1993 - Suppl. Ordinario n. 108)",
                "publication_date": "1993-11-15",
                "gazette_date": "1993-12-09",
                "valid_from": "2020-03-01",
                "last_updated": "(Ultimo aggiornamento all'atto pubblicato il 29/02/2020)",
                "link_gazette": "http://www.gazzettaufficiale.it/eli/gu/1993/12/09/288/so/108/sg/pdf",
                "link_urn_nir": "http://www.normattiva.it/uri-res/N2Ls?urn:nir:stato:decreto.legislativo:1993-11-15;507",
                "link_eli_id": "http://www.normattiva.it/eli/id/1993/12/09/093G0558",
                "link_eli_type": "http://www.normattiva.it/eli/stato/DECRETO_LEGISLATIVO/1993/11/15/507",
                "id": "art_49_law_98_093G0558_1993-12-09.json",
                "article_number": "49",
                "article_text": [
                    "                               Art. 49 \n \n         ARTICOLO ABROGATO DALLA L. 27 DICEMBRE 2019, N. 160 \n                                                          (33) ((34)) \n \n--------------- \nAGGIORNAMENTO (33) \n  La L. 27 dicembre 2019, n. 160 ha disposto  (con  l'art.  1,  comma\n847)che \"Restano ferme le disposizioni inerenti alla  pubblicita'  in\nambito  ferroviario  e  quelle   che   disciplinano   la   propaganda\nelettorale. Il capo II del decreto legislativo n. 507 del 1993 rimane\ncome riferimento per la determinazione della tassa per  l'occupazione\ndi spazi ed aree pubbliche appartenenti  alle  regioni  di  cui  agli\narticoli 5 della legge 16 maggio  1970,  n.  281,  e  8  del  decreto\nlegislativo 6 maggio 2011, n. 68.\" \n---------- \nAGGIORNAMENTO (34) \n  Il D.L. 30 dicembre 2019,  n.  162,  convertito  con  modificazioni\ndalla L. 28 febbraio 2020, n. 8, nel modificare l'art. 1,  comma  847\ndella L. 27 dicembre 2019, n. 160, ha conseguentemente disposto  (con\nl'art. 4, comma 3-quater) che \"Limitatamente  all'anno  2020  non  ha\neffetto l'abrogazione disposta dal comma 847  dell'articolo  1  della\nlegge 27 dicembre 2019, n. 160; si applicano, per il  medesimo  anno,\nl'imposta comunale sulla pubblicita' e  il  diritto  sulle  pubbliche\naffissioni nonche' la  tassa  per  l'occupazione  di  spazi  ed  aree\npubbliche, di  cui  rispettivamente  ai  capi  I  e  II  del  decreto\nlegislativo  15  novembre  1993,  n.  507,  nonche'  il  canone   per\nl'installazione dei mezzi pubblicitari e il canone per  l'occupazione\ndi spazi ed aree pubbliche, di cui rispettivamente agli articoli 62 e\n63 del decreto legislativo 15 dicembre 1997, n. 446\". "
                ]
            },
            {
                "filename": "law_359_094G0461_1994-06-30.json",
                "title": "DECRETO-LEGGE 30 giugno 1994, n. 418",
                "subject": "Disposizioni urgenti per il risanamento ed il riordino della RAI - S.p.a.",
                "type": "decreto.legge",
                "number": "418",
                "year": "1994",
                "editorial_code": "094G0461",
                "gazette_reference": "(GU n.151 del 30-06-1994)",
                "publication_date": "1994-06-30",
                "gazette_date": "1994-06-30",
                "valid_from": "1994-08-30",
                "last_updated": "(Ultimo aggiornamento all'atto pubblicato il 30/08/1994)",
                "link_gazette": "http://www.gazzettaufficiale.it/eli/gu/1994/06/30/151/sg/pdf",
                "link_urn_nir": "http://www.normattiva.it/uri-res/N2Ls?urn:nir:stato:decreto.legge:1994-06-30;418",
                "link_eli_id": "http://www.normattiva.it/eli/id/1994/06/30/094G0461",
                "link_eli_type": "http://www.normattiva.it/eli/stato/DECRETO_LEGGE/1994/06/30/418",
                "id": "art_2_law_359_094G0461_1994-06-30.json",
                "article_number": "2",
                "article_text": [
                    "                               Art. 2. \n                          DECRETO DECADUTO "
                ]
            },
            {
                "filename": "law_854_085U0288_1985-06-21.json",
                "title": "DECRETO-LEGGE 21 giugno 1985, n. 288",
                "subject": "Proroga del termine previsto dall'articolo 1, ultimo comma, della legge 7 dicembre 1984, n. 818, relativo alla presentazione dell'istanza per il rilascio del nullaosta provvisorio di prevenzione incendi.",
                "type": "decreto.legge",
                "number": "288",
                "year": "1985",
                "editorial_code": "085U0288",
                "gazette_reference": "(GU n.145 del 21-06-1985)",
                "publication_date": "1985-06-21",
                "gazette_date": "1985-06-21",
                "valid_from": "1985-06-21",
                "last_updated": "(Ultimo aggiornamento all'atto pubblicato il 13/08/1985)",
                "link_gazette": "http://www.gazzettaufficiale.it/eli/gu/1985/06/21/145/sg/pdf",
                "link_urn_nir": "http://www.normattiva.it/uri-res/N2Ls?urn:nir:stato:decreto.legge:1985-06-21;288",
                "link_eli_id": "http://www.normattiva.it/eli/id/1985/06/21/085U0288",
                "link_eli_type": "http://www.normattiva.it/eli/stato/DECRETO_LEGGE/1985/06/21/288",
                "id": "art_1_law_854_085U0288_1985-06-21.json",
                "article_number": "1",
                "article_text": [
                    "                   IL PRESIDENTE DELLA REPUBBLICA\n\n  Visti gli articoli 77 e 87 della Costituzione;\n  Vista la legge 7 dicembre 1984, n. 818;\n  Ritenuta  la  straordinaria  necessita'  ed  urgenza  di assicurare\nl'esecuzione  delle  misure piu' urgenti ed essenziali di prevenzione\nincendi  di  cui al decreto del Ministro dell'interno in data 8 marzo\n1985, pubblicato nel supplemento ordinario alla Gazzetta Ufficiale n.\n95  del  22  aprile  1985,  al  fine  di evitare l'interruzione delle\nattivita' soggette ai controlli di prevenzione incendi;\n  Vista  la  deliberazione del Consiglio dei Ministri, adottata nella\nriunione del 21 giugno 1985;\n  Sulla  proposta  del  Presidente  del  Consiglio dei Ministri e del\nMinistro dell'interno;\n\n                                EMANA\n\nil seguente decreto:\n                               Art. 1.\n\n  L'ultimo comma dell'articolo 1 della legge 7 dicembre 1984, n. 818,\ne' sostituito dal seguente:\n  \"Nell'attesa  del  rilascio  del  certificato  di cui ai precedenti\ncommi,  i  titolari delle attivita' esistenti alla data di entrata in\nvigore  della presente legge debbono presentare, entro il 31 dicembre\n1985,  istanza  per  il  rilascio del nullaosta provvisorio di cui al\nsuccessivo articolo 2\"."
                ]
            },
            {
                "filename": "law_372_095G0265_1995-06-09.json",
                "title": "DECRETO DEL PRESIDENTE DELLA REPUBBLICA 19 maggio 1995, n. 223",
                "subject": "Approvazione del nuovo statuto della Societa' italiana degli autori ed editori.",
                "type": "decreto.del.presidente.della.repubblica",
                "number": "223",
                "year": "1995",
                "editorial_code": "095G0265",
                "gazette_reference": "(GU n.133 del 09-06-1995 - Suppl. Ordinario n. 71)",
                "publication_date": "1995-05-19",
                "gazette_date": "1995-06-09",
                "valid_from": "1995-06-24",
                "last_updated": "",
                "link_gazette": "http://www.gazzettaufficiale.it/eli/gu/1995/06/09/133/so/71/sg/pdf",
                "link_urn_nir": "http://www.normattiva.it/uri-res/N2Ls?urn:nir:stato:decreto.del.presidente.della.repubblica:1995-05-19;223",
                "link_eli_id": "http://www.normattiva.it/eli/id/1995/06/09/095G0265",
                "link_eli_type": "http://www.normattiva.it/eli/stato/DECRETO_DEL_PRESIDENTE_DELLA_REPUBBLICA/1995/05/19/223",
                "id": "art_35_law_372_095G0265_1995-06-09.json",
                "article_number": "35",
                "article_text": [
                    "                               Art. 35\n   1. Il consiglio di amministrazione e' convocato per iniziativa del\npresidente o su richiesta di almeno cinque dei suoi componenti.\n   2. Normalmente e' convocato quattro volte l'anno.\n   3. Per la validita' delle riunioni occorre la presenza  di  almeno\nsei dei suoi componenti, incluso il presidente."
                ]
            },
            {
                "filename": "law_794_081U0378_1981-07-21.json",
                "title": "DECRETO-LEGGE 20 luglio 1981, n. 378",
                "subject": "Adeguamento del limite di reddito per l'applicazione della detrazione d'imposta di cui all'art. 3 della legge 24 aprile 1980, n. 146.",
                "type": "decreto.legge",
                "number": "378",
                "year": "1981",
                "editorial_code": "081U0378",
                "gazette_reference": "(GU n.198 del 21-07-1981)",
                "publication_date": "1981-07-20",
                "gazette_date": "1981-07-21",
                "valid_from": "1982-01-01",
                "last_updated": "(Ultimo aggiornamento all'atto pubblicato il 31/12/1981)",
                "link_gazette": "http://www.gazzettaufficiale.it/eli/gu/1981/07/21/198/sg/pdf",
                "link_urn_nir": "http://www.normattiva.it/uri-res/N2Ls?urn:nir:stato:decreto.legge:1981-07-20;378",
                "link_eli_id": "http://www.normattiva.it/eli/id/1981/07/21/081U0378",
                "link_eli_type": "http://www.normattiva.it/eli/stato/DECRETO_LEGGE/1981/07/20/378",
                "id": "art_1_law_794_081U0378_1981-07-21.json",
                "article_number": "1",
                "article_text": [
                    "                   IL PRESIDENTE DELLA REPUBBLICA\n\n  Visti gli articoli 77 e 87 della Costituzione;\n  Visto l'art. 3 della legge 24 aprile 1980, n. 146;\n  Considerato  che  per  il  corrente anno 1981 il trattamento minimo\nannuo  delle  pensioni  da  lavoro  dipendente  erogato dall'I.N.P.S.\nsupera l'importo di lire due milioni cinquecentomila;\n  Ritenuta  la  straordinaria  necessita'  ed  urgenza di adeguare il\npredetto limite di reddito per consentire all'I.N.P.S. l'applicazione\ndell'ulteriore  detrazione  prevista dal citato art. 3 della legge n.\n146;\n  Vista  la  deliberazione del Consiglio dei Ministri, adottata nella\nriunione del 18 luglio 1981;\n  Sulla  proposta  del  Presidente  del  Consiglio dei Ministri e del\nMinistro  delle  finanze,  di  concerto con i Ministri del bilancio e\ndella programmazione economica e del tesoro;\n\n                                EMANA\n\nil seguente decreto:\n                               Art. 1.\n\n  Con effetto dal 1 gennaio 1981 l'importo di lire 2 milioni 500 mila\ndi  cui  all'art.  3 della legge 24 aprile 1980, n. 146, e' elevato a\nlire 3 milioni.((1))\n---------------\nAGGIORNAMENTO (1)\n  Il D.L. 22 dicembre 1981 n. 787, convertito con modificazioni dalla\nL.  26  febbraio  1982  n.  52,  ha disposto (con l'art. 11) che \"Con\neffetto  dal  1  gennaio  1982 l'ulteriore detrazione d'imposta di L.\n52.000,  di  cui  all'art.  3  della legge 24 aprile 1980, n. 146, e'\nelevata a L. 130.000 e l'importo di L. 3.000.000 previsto dall'art. 1\ndel  decreto-legge  20 luglio 1981, n. 378, convertito nella legge 10\nagosto 1981 n. 490, e' elevato a L. 3.500.000\"."
                ]
            },
            {
                "filename": "law_211_088G0439_1988-09-05.json",
                "title": "DECRETO MINISTERIALE 30 giugno 1988, n. 386",
                "subject": "Recepimento della direttiva CEE n. 87/358 del 25 giugno 1987 di modifica della direttiva n. 70/156/CEE relativa alla omologazione CEE dei tipi di veicoli a motore, dei loro rimorchi nonche' dei dispositivi di equipaggiamento (entita' tecniche indipendenti o componenti).",
                "type": "decreto.ministeriale",
                "number": "386",
                "year": "1988",
                "editorial_code": "088G0439",
                "gazette_reference": "(GU n.208 del 05-09-1988 - Suppl. Ordinario n. 82)",
                "publication_date": "1988-06-30",
                "gazette_date": "1988-09-05",
                "valid_from": "1988-09-20",
                "last_updated": "",
                "link_gazette": "http://www.gazzettaufficiale.it/eli/gu/1988/09/05/208/so/82/sg/pdf",
                "link_urn_nir": "http://www.normattiva.it/uri-res/N2Ls?urn:nir:stato:decreto.ministeriale:1988-06-30;386",
                "link_eli_id": "http://www.normattiva.it/eli/id/1988/09/05/088G0439",
                "link_eli_type": "http://www.normattiva.it/eli/stato/DECRETO_MINISTERIALE/1988/06/30/386",
                "id": "art_4_law_211_088G0439_1988-09-05.json",
                "article_number": "4",
                "article_text": [
                    "                               Art. 4.\n1. Il detentore di una omologazione CEE di un tipo di entita' tecnica\nindipendente  o  di  componente  e'  tenuto  a rilasciare per ciascun\nesemplare  di entita' tecnica indipendente o di componente, costruito\nconformemente  al  tipo omologato, un certificato di conformita' e ad\napporre  sull'esemplare  stesso  il  proprio  marchio  di  fabbrica o\ncommerciale,  l'indicazione  del  tipo e, se prescritto dall'apposito\ndecreto,  il  numero di omologazione CEE. In quest'ultimo caso non e'\ntenuto a compilare il certificato di conformita'."
                ]
            }
        ]
    },
    {
        "unit_id": "unit_2",
        "token_input": "BJRHLFRQXO",
        "token_output": "EPBCDICUEZ",
        "documents": [
            {
                "filename": "law_471_098G0067_1998-03-20.json",
                "title": "DECRETO LEGISLATIVO 19 febbraio 1998, n. 51",
                "subject": "Norme in materia di istituzione del giudice unico di primo grado.",
                "type": "decreto.legislativo",
                "number": "51",
                "year": "1998",
                "editorial_code": "098G0067",
                "gazette_reference": "(GU n.66 del 20-03-1998 - Suppl. Ordinario n. 48)",
                "publication_date": "1998-02-19",
                "gazette_date": "1998-03-20",
                "valid_from": "1998-03-21",
                "last_updated": "(Ultimo aggiornamento all'atto pubblicato il 31/07/2017)",
                "link_gazette": "http://www.gazzettaufficiale.it/eli/gu/1998/03/20/66/so/48/sg/pdf",
                "link_urn_nir": "http://www.normattiva.it/uri-res/N2Ls?urn:nir:stato:decreto.legislativo:1998-02-19;51",
                "link_eli_id": "http://www.normattiva.it/eli/id/1998/03/20/098G0067",
                "link_eli_type": "http://www.normattiva.it/eli/stato/DECRETO_LEGISLATIVO/1998/02/19/51",
                "id": "art_217_law_471_098G0067_1998-03-20.json",
                "article_number": "217",
                "article_text": [
                    "                              Art. 217.\n  1.  Dopo  il  capo  XII  del titolo I delle norme di attuazione, di\ncoordinamento e transitorie del codice di procedura penale, approvate\ncon  decreto  legislativo  28  luglio  1989,  n.  271, e' inserito il\nseguente:\n                            \"Capo XII-bis\n            Disposizioni relative alle sezioni distaccate\n                            del tribunale\n  Art.  163-bis.  (Inosservanza delle disposizioni sulle attribuzioni\ndelle  sezioni  distaccate  del tribunale). - 1. L'inosservanza delle\ndisposizioni  di  ordinamento  giudiziario relative alla ripartizione\ntra  sede  principale  e  sezioni  distaccate,  o tra diverse sezioni\ndistaccate,  dei  procedimenti  nei  quali  il  tribunale  giudica in\ncomposizione  monocratica  e'  rilevata  fino  alla  dichiarazione di\napertura del dibattimento di primo grado.\n  2.  Il  giudice,  se  ravvisa l'inosservanza o ritiene comunque non\nmanifestamente  infondata  la relativa questione, rimette gli atti al\npresidente del tribunale, che provvede con decreto non impugnabile.\n  Art.  163-ter.  (Presentazione  dell'atto di impugnazione presso la\nsezione  distaccata). - 1. Nei casi previsti dagli articoli 461 comma\n1  e  582  comma  2  del  codice,  le dichiarazioni e le impugnazioni\npossono  essere  presentate  anche  nella  cancelleria  della sezione\ndistaccata del tribunale.\"."
                ]
            },
            {
                "filename": "law_457_093G0217_1993-05-21.json",
                "title": "LEGGE 20 maggio 1993, n. 151",
                "subject": "Conversione in legge del decreto-legge 22 marzo 1993, n. 71, recante disposizioni in materia di sgravi contributivi nel Mezzogiorno e di fiscalizzazione degli oneri sociali.",
                "type": "legge",
                "number": "151",
                "year": "1993",
                "editorial_code": "093G0217",
                "gazette_reference": "(GU n.117 del 21-05-1993)",
                "publication_date": "1993-05-20",
                "gazette_date": "1993-05-21",
                "valid_from": "1993-05-22",
                "last_updated": "",
                "link_gazette": "http://www.gazzettaufficiale.it/eli/gu/1993/05/21/117/sg/pdf",
                "link_urn_nir": "http://www.normattiva.it/uri-res/N2Ls?urn:nir:stato:legge:1993-05-20;151",
                "link_eli_id": "http://www.normattiva.it/eli/id/1993/05/21/093G0217",
                "link_eli_type": "http://www.normattiva.it/eli/stato/LEGGE/1993/05/20/151",
                "id": "art_1_law_457_093G0217_1993-05-21.json",
                "article_number": "1",
                "article_text": [
                    "  La  Camera  dei  deputati  ed  il  Senato  della  Repubblica  hanno\napprovato;\n                   IL PRESIDENTE DELLA REPUBBLICA\n                              PROMULGA\nla seguente legge:\n                               Art. 1.\n  1. E' convertito in legge il decreto-legge 22 marzo  1993,  n.  71,\nrecante   disposizioni   in   materia   di  sgravi  contributivi  nel\nMezzogiorno e di fiscalizzazione degli oneri sociali.\n  2. Restano validi gli atti ed i provvedimenti adottati e sono fatti\nsalvi gli effetti prodottisi ed i rapporti giuridici sorti sulla base\ndei decreti-legge 18 settembre 1992, n. 383,  19  novembre  1992,  n.\n442, e 18 gennaio 1993, n. 12.\n  La  presente  legge, munita del sigillo dello Stato, sara' inserita\nnella  Raccolta  ufficiale  degli  atti  normativi  della  Repubblica\nitaliana. E' fatto obbligo a chiunque spetti di osservarla e di farla\nosservare come legge dello Stato.\n   Data a Roma, addi' 20 maggio 1993\n                              SCALFARO\n                                  CIAMPI,  Presidente  del  Consiglio\n                                  dei Ministri\n                                  GIUGNI, Ministro del lavoro e della\n                                  previdenza sociale\nVisto, il Guardasigilli: CONSO\n          AVVERTENZA:\n             Il  decreto-legge  22  marzo  1993,  n.  71,  e'   stato\n          pubblicato  nella  Gazzetta Ufficiale - serie generale - n.\n          67 del 22 marzo 1993.\n             In questa stessa Gazzetta Ufficiale, alla  pag.  19,  e'\n          ripubblicato  il  testo del decreto-legge 22 marzo 1993, n.\n          71, corredato delle relative note, ai  sensi  dell'art.  8,\n          comma  3,  del  regolamento  di  esecuzione del testo unico\n          delle disposizioni sulla promulgazione delle  leggi,  sulla\n          emanazione  dei  decreti  del Presidente della Repubblica e\n          sulle pubblicazioni ufficiali  della  Repubblica  italiana,\n          approvato  con  decreto  del Presidente della Repubblica 14\n          marzo 1986, n. 217.\n                         ___________________"
                ]
            },
            {
                "filename": "law_474_082U0728_1982-10-12.json",
                "title": "DECRETO DEL PRESIDENTE DELLA REPUBBLICA 21 luglio 1982, n. 728",
                "subject": "Attuazione della direttiva (CEE) n. 72/461 relativa a problemi di polizia sanitaria in materia di scambi intracomunitari di carni fresche.",
                "type": "decreto.del.presidente.della.repubblica",
                "number": "728",
                "year": "1982",
                "editorial_code": "082U0728",
                "gazette_reference": "(GU n.281 del 12-10-1982)",
                "publication_date": "1982-07-21",
                "gazette_date": "1982-10-12",
                "valid_from": "1982-10-13",
                "last_updated": "(Ultimo aggiornamento all'atto pubblicato il 28/06/1988)",
                "link_gazette": "http://www.gazzettaufficiale.it/eli/gu/1982/10/12/281/sg/pdf",
                "link_urn_nir": "http://www.normattiva.it/uri-res/N2Ls?urn:nir:stato:decreto.del.presidente.della.repubblica:1982-07-21;728",
                "link_eli_id": "http://www.normattiva.it/eli/id/1982/10/12/082U0728",
                "link_eli_type": "http://www.normattiva.it/eli/stato/DECRETO_DEL_PRESIDENTE_DELLA_REPUBBLICA/1982/07/21/728",
                "id": "art_7_law_474_082U0728_1982-10-12.json",
                "article_number": "7",
                "article_text": [
                    "                               Art. 7.\n\n  I  veterinari  di confine vietano l'inoltro a destinazione di carni\nfresche provenienti da Paesi membri della Comunita' quando, a seguito\ndel  controllo  sanitario,  sia  stato  constatato che non sono state\nosservate le disposizioni di cui ai precedenti articoli 2 e 3 ((fatto\nsalvo quanto disposto dall'art. 4)).\n  In tal caso, ove non si oppongono motivi di carattere sanitario, le\ncarni fresche possono essere rispedite all'origine su richiesta dello\nspeditore o del suo mandatario.\n  Qualora il Paese speditore o eventualmente il Paese di transito non\nautorizzino  la  rispedizione o sia vietata l'immissione in commercio\ndelle  carni  fresche per i motivi di cui al primo comma, puo' essere\nordinata la distruzione della partita.\n  Per  l'applicazione  delle  misure  di  cui al presente articolo si\napplicano  le  norme  di  cui  al terzo e al quarto comma dell'art. 9\ndella legge 29 novembre 1971, n. 1073."
                ]
            },
            {
                "filename": "law_944_083U0367_1983-08-04.json",
                "title": "DECRETO DEL PRESIDENTE DELLA REPUBBLICA 17 maggio 1983, n. 367",
                "subject": "Modificazioni allo statuto della fondazione \"Dott. Attilio Ruffi, tenente 8 reggimento alpini - battaglione Cividale 16 compagnia - medaglia d'argento al valor militare\", in Tolmezzo.",
                "type": "decreto.del.presidente.della.repubblica",
                "number": "367",
                "year": "1983",
                "editorial_code": "083U0367",
                "gazette_reference": "(GU n.213 del 04-08-1983)",
                "publication_date": "1983-05-17",
                "gazette_date": "1983-08-04",
                "valid_from": "1983-08-19",
                "last_updated": "",
                "link_gazette": "http://www.gazzettaufficiale.it/eli/gu/1983/08/04/213/sg/pdf",
                "link_urn_nir": "http://www.normattiva.it/uri-res/N2Ls?urn:nir:stato:decreto.del.presidente.della.repubblica:1983-05-17;367",
                "link_eli_id": "http://www.normattiva.it/eli/id/1983/08/04/083U0367",
                "link_eli_type": "http://www.normattiva.it/eli/stato/DECRETO_DEL_PRESIDENTE_DELLA_REPUBBLICA/1983/05/17/367",
                "id": "art_1_law_944_083U0367_1983-08-04.json",
                "article_number": "1",
                "article_text": [
                    "N. 367. Decreto del Presidente della Repubblica 17 maggio  1983,  col\n  quale, sulla proposta del Ministro della difesa, vengono  approvate\n  le modificazioni agli articoli  1  e  4  e  la  sostituzione  degli\n  articoli 2, 3 e 5 dello statuto  della  fondazione  \"Dott.  Attilio\n  Ruffi, tenente 8 reggimento  alpini  -  battaglione  Cividale  16\n  compagnia  medaglia  d'argento  al  valor  militare\",  in  Tolmezzo\n  (Udine), presso il comando dell'8 reggimento alpini, approvato con\n  decreto del Presidente della Repubblica 8 luglio 1978, n. 443. \n \nVisto, il Guardasigilli: DARIDA \nRegistrato alla Corte dei conti, addi' 26 luglio 1983 \nRegistrato n. 28 Difesa, foglio n. 79 "
                ]
            },
            {
                "filename": "law_450_088G0183_1988-05-09.json",
                "title": "DECRETO 30 marzo 1988, n. 147",
                "subject": "Norme fitosanitarie relative all'importazione, esportazione e transito dei vegetali e prodotti vegetali.",
                "type": "decreto",
                "number": "147",
                "year": "1988",
                "editorial_code": "088G0183",
                "gazette_reference": "(GU n.107 del 09-05-1988)",
                "publication_date": "1988-03-30",
                "gazette_date": "1988-05-09",
                "valid_from": "1988-05-24",
                "last_updated": "",
                "link_gazette": "http://www.gazzettaufficiale.it/eli/gu/1988/05/09/107/sg/pdf",
                "link_urn_nir": "http://www.normattiva.it/uri-res/N2Ls?urn:nir:stato:decreto:1988-03-30;147",
                "link_eli_id": "http://www.normattiva.it/eli/id/1988/05/09/088G0183",
                "link_eli_type": "http://www.normattiva.it/eli/stato/DECRETO/1988/03/30/147",
                "id": "art_16_law_450_088G0183_1988-05-09.json",
                "article_number": "16",
                "article_text": [
                    "                              Art. 16. \n  Le sementi di piante foraggere sono ammesse  all'importazione  dopo\nl'accertamento dell'assenza di semi di ogni specie di cuscuta o altre\npiante parassite o infestanti, nel rispetto di quanto previsto  dalla\nlegge 25 novembre 1971,  n.  1096,  e  dal  relativo  regolamento  di\nesecuzione, approvato con decreto del Presidente della  Repubblica  8\nottobre 1973, n. 1065. \n  L'importazione  delle  sementi  di  piante  foraggere   riscontrate\ninquinate puo' essere effettuata solamente dalle imprese in  possesso\ndella licenza per l'attivita' sementiera  di  cui  all'art.  2  della\nlegge 25 novembre 1971, n. 1096, con l'osservanza delle  disposizioni\ndi cui all'art. 16 del regolamento per l'applicazione della legge  18\ngiugno 1931, n. 987, approvato con regio decreto 12 ottobre 1933,  n.\n1700, e modificato con regio decreto 2 dicembre 1937, n. 2504. \n  L'importazione delle sementi di cui al comma precedente e' ammessa,\nin via temporanea per la riesportazione nei Paesi terzi,  ovvero  per\nla  libera  commercializzazione  nel  territorio   della   Repubblica\nitaliana, qualora dette sementi risultino conformi alle  disposizioni\npreviste dalla legge e  regolamento  indicati  nel  primo  comma  del\npresente articolo. "
                ]
            },
            {
                "filename": "law_446_097G0123_1997-03-29.json",
                "title": "DECRETO-LEGGE 28 marzo 1997, n. 79",
                "subject": "Misure urgenti per il riequilibrio della finanza pubblica",
                "type": "decreto.legge",
                "number": "79",
                "year": "1997",
                "editorial_code": "097G0123",
                "gazette_reference": "(GU n.74 del 29-03-1997)",
                "publication_date": "1997-03-28",
                "gazette_date": "1997-03-29",
                "valid_from": "1997-03-29",
                "last_updated": "(Ultimo aggiornamento all'atto pubblicato il 29/12/2017)",
                "link_gazette": "http://www.gazzettaufficiale.it/eli/gu/1997/03/29/74/sg/pdf",
                "link_urn_nir": "http://www.normattiva.it/uri-res/N2Ls?urn:nir:stato:decreto.legge:1997-03-28;79",
                "link_eli_id": "http://www.normattiva.it/eli/id/1997/03/29/097G0123",
                "link_eli_type": "http://www.normattiva.it/eli/stato/DECRETO_LEGGE/1997/03/28/79",
                "id": "art_14_law_446_097G0123_1997-03-29.json",
                "article_number": "14",
                "article_text": [
                    "                              Art. 14.\n         Devoluzione delle entrate e variazioni di bilancio\n\n  1.  Le  entrate  tributarie  derivanti  dal  presente  decreto sono\nriservate  all'erario  e concorrono alla copertura degli oneri per il\nservizio  del debito pubblico, nonche' alla realizzazione delle linee\ndi  politica  economica  e  finanziaria  in funzione degli impegni di\nriequilibrio  del  bilancio  assunti in sede comunitaria. Con decreto\ndel  Ministro  delle finanze, di concerto con il Ministro del tesoro,\nda  emanare  entro novanta giorni dalla data di entrata in vigore del\npresente  decreto,  sono  stabilite,  ove necessario, le modalita' di\nattuazione del presente articolo. ((11))\n  2.  Il  Ministro del tesoro e' autorizzato ad apportare, con propri\ndecreti,  le  variazioni  di bilancio occorrenti per l'attuazione del\npresente decreto.\n--------------\nAGGIORNAMENTO (11)\n  La  Corte  Costituzionale, con sentenza 12 - 25 luglio 2000, n. 347\n(in  G.U. 1a s.s. 02/08/2000, n. 32), ha dichiarato \"l'illegittimita'\ncostituzionale  dell'art.  14,  comma  1,  del decreto-legge 28 marzo\n1997,  n.  79  (Misure  urgenti  per  il  riequilibrio  della finanza\npubblica)  convertito nella legge 28 maggio 1997, n. 140, nella parte\nin  cui,  nel  disporre  che  le modalita' di attuazione dello stesso\narticolo  sono stabilite con decreto ministeriale, non prevede che al\nrelativo procedimento partecipi la Regione Siciliana\"."
                ]
            },
            {
                "filename": "law_424_099G0213_1999-05-18.json",
                "title": "LEGGE 30 aprile 1999, n. 136",
                "subject": "Norme per il sostegno ed il rilancio dell'edilizia residenziale pubblica e per interventi in materia di opere a carattere ambientale.",
                "type": "legge",
                "number": "136",
                "year": "1999",
                "editorial_code": "099G0213",
                "gazette_reference": "(GU n.114 del 18-05-1999 - Suppl. Ordinario n. 97)",
                "publication_date": "1999-04-30",
                "gazette_date": "1999-05-18",
                "valid_from": "1999-05-19",
                "last_updated": "(Ultimo aggiornamento all'atto pubblicato il 14/04/2006)",
                "link_gazette": "http://www.gazzettaufficiale.it/eli/gu/1999/05/18/114/so/97/sg/pdf",
                "link_urn_nir": "http://www.normattiva.it/uri-res/N2Ls?urn:nir:stato:legge:1999-04-30;136",
                "link_eli_id": "http://www.normattiva.it/eli/id/1999/05/18/099G0213",
                "link_eli_type": "http://www.normattiva.it/eli/stato/LEGGE/1999/04/30/136",
                "id": "art_20_law_424_099G0213_1999-05-18.json",
                "article_number": "20",
                "article_text": [
                    "                              Art. 20.\n                (Programmi pluriennali di attuazione)\n\n  1.  Nel  termine  di  un anno dalla data di entrata in vigore della\npresente  legge,  le  regioni  provvedono  ad  aggiornare  la propria\nlegislazione in materia di programmi pluriennali di attuazione di cui\nall'articolo  13 della legge 28 gennaio 1977, n. 10, e all'articolo 6\ndel   decreto-legge   23   gennaio   1982,   n.  9,  convertito,  con\nmodificazioni,  dalla  legge  25  marzo  1982,  n.  94,  e successive\nmodificazioni, secondo principi che ne circoscrivano la funzione alla\nprogrammazione   della   formazione  dei  piani  attuativi  di  nuovi\ninsediamenti    o   di   rilevanti   ristrutturazioni   urbanistiche,\nindividuati  territorialmente in modo univoco, anche in coordinamento\ncon  il  programma  triennale dei lavori pubblici del comune e con lo\nstato  delle urbanizzazioni nel territorio interessato, e riferiscano\ni criteri di obbligatorieta' alle effettive esigenze di sviluppo e di\ntrasformazione  degli  aggregati  urbani.  Le opere di urbanizzazione\ncomunali da realizzare in attuazione degli strumenti urbanistici sono\ninserite nel programma triennale dei lavori pubblici del comune.\n  2.  Qualora  le  regioni  non adottino, entro un anno dalla data di\nentrata  in  vigore della presente legge, proprie leggi in attuazione\ndelle  disposizioni  di  cui  al  comma  1, restano valide le vigenti\ndisposizioni nazionali e regionali."
                ]
            },
            {
                "filename": "law_352_097G0204_1997-06-21.json",
                "title": "DECRETO LEGISLATIVO 26 maggio 1997, n. 173",
                "subject": "Attuazione della direttiva 91/674/CEE in materia di conti annuali e consolidati delle imprese di assicurazione.",
                "type": "decreto.legislativo",
                "number": "173",
                "year": "1997",
                "editorial_code": "097G0204",
                "gazette_reference": "(GU n.143 del 21-06-1997 - Suppl. Ordinario n. 123)",
                "publication_date": "1997-05-26",
                "gazette_date": "1997-06-21",
                "valid_from": "2006-01-01",
                "last_updated": "(Ultimo aggiornamento all'atto pubblicato il 04/09/2015)",
                "link_gazette": "http://www.gazzettaufficiale.it/eli/gu/1997/06/21/143/so/123/sg/pdf",
                "link_urn_nir": "http://www.normattiva.it/uri-res/N2Ls?urn:nir:stato:decreto.legislativo:1997-05-26;173",
                "link_eli_id": "http://www.normattiva.it/eli/id/1997/06/21/097G0204",
                "link_eli_type": "http://www.normattiva.it/eli/stato/DECRETO_LEGISLATIVO/1997/05/26/173",
                "id": "art_66_law_352_097G0204_1997-06-21.json",
                "article_number": "66",
                "article_text": [
                    "                               Art. 66\n     (( ARTICOLO ABROGATO DAL D.LGS. 7 SETTEMBRE 2005, N. 209 ))"
                ]
            },
            {
                "filename": "law_126_091G0390_1991-10-30.json",
                "title": "LEGGE 19 ottobre 1991, n. 337",
                "subject": "Disposizioni a favore dei connazionali coinvolti dalla crisi del Golfo Persico.",
                "type": "legge",
                "number": "337",
                "year": "1991",
                "editorial_code": "091G0390",
                "gazette_reference": "(GU n.255 del 30-10-1991)",
                "publication_date": "1991-10-19",
                "gazette_date": "1991-10-30",
                "valid_from": "2012-06-06",
                "last_updated": "(Ultimo aggiornamento all'atto pubblicato il 09/02/2012)",
                "link_gazette": "http://www.gazzettaufficiale.it/eli/gu/1991/10/30/255/sg/pdf",
                "link_urn_nir": "http://www.normattiva.it/uri-res/N2Ls?urn:nir:stato:legge:1991-10-19;337",
                "link_eli_id": "http://www.normattiva.it/eli/id/1991/10/30/091G0390",
                "link_eli_type": "http://www.normattiva.it/eli/stato/LEGGE/1991/10/19/337",
                "id": "art_2_law_126_091G0390_1991-10-30.json",
                "article_number": "2",
                "article_text": [
                    "                             Art. 2                                                                                                                                                                                                       \n      ((PROVVEDIMENTO ABROGATO DAL D.L. 9 FEBBRAIO 2012, N. 5, \n    CONVERTITO CON MODIFICAZIONI DALLA L. 4 APRILE 2012, N. 35))"
                ]
            },
            {
                "filename": "law_397_95G0212A_1995-05-27.json",
                "title": "DECRETO LEGISLATIVO 12 maggio 1995, n. 198",
                "subject": "Attuazione dell'art. 3 della legge 6 marzo 1992, n. 216, in materia di riordino dei ruoli e modifica delle norme di reclutamento, stato ed avanzamento del personale non direttivo e non dirigente dell'Arma dei carabinieri.",
                "type": "decreto.legislativo",
                "number": "198",
                "year": "1995",
                "editorial_code": "95G0212A",
                "gazette_reference": "(GU n.122 del 27-05-1995 - Suppl. Ordinario n. 61)",
                "publication_date": "1995-05-12",
                "gazette_date": "1995-05-27",
                "valid_from": "2010-10-09",
                "last_updated": "(Ultimo aggiornamento all'atto pubblicato il 08/05/2010)",
                "link_gazette": "http://www.gazzettaufficiale.it/eli/gu/1995/05/27/122/so/61/sg/pdf",
                "link_urn_nir": "http://www.normattiva.it/uri-res/N2Ls?urn:nir:stato:decreto.legislativo:1995-05-12;198",
                "link_eli_id": "http://www.normattiva.it/eli/id/1995/05/27/95G0212A",
                "link_eli_type": "http://www.normattiva.it/eli/stato/DECRETO_LEGISLATIVO/1995/05/12/198",
                "id": "art_16_law_397_95G0212A_1995-05-27.json",
                "article_number": "16",
                "article_text": [
                    "                             Art. 16\n     ((PROVVEDIMENTO ABROGATO DAL D.LGS. 15 MARZO 2010, N. 66))"
                ]
            }
        ]
    },
    {
        "unit_id": "unit_3",
        "token_input": "WCMYCJBBRJ",
        "token_output": "YTYMKFRUJN",
        "documents": [
            {
                "filename": "law_309_098G0261_1998-07-08.json",
                "title": "DECRETO LEGISLATIVO 24 giugno 1998, n. 213",
                "subject": "Disposizioni per l'introduzione dell'EURO nell'ordinamento nazionale, a norma dell'articolo 1, comma 1, della legge 17 dicembre 1997, n. 433.",
                "type": "decreto.legislativo",
                "number": "213",
                "year": "1998",
                "editorial_code": "098G0261",
                "gazette_reference": "(GU n.157 del 08-07-1998 - Suppl. Ordinario n. 116)",
                "publication_date": "1998-06-24",
                "gazette_date": "1998-07-08",
                "valid_from": "1998-07-09",
                "last_updated": "(Ultimo aggiornamento all'atto pubblicato il 11/11/2015)",
                "link_gazette": "http://www.gazzettaufficiale.it/eli/gu/1998/07/08/157/so/116/sg/pdf",
                "link_urn_nir": "http://www.normattiva.it/uri-res/N2Ls?urn:nir:stato:decreto.legislativo:1998-06-24;213",
                "link_eli_id": "http://www.normattiva.it/eli/id/1998/07/08/098G0261",
                "link_eli_type": "http://www.normattiva.it/eli/stato/DECRETO_LEGISLATIVO/1998/06/24/213",
                "id": "art_40_law_309_098G0261_1998-07-08.json",
                "article_number": "40",
                "article_text": [
                    "                             Articolo 40\n   (Ritiro delle materialita' e immissione in gestione accentrata)\n    1.  Entro  trenta  giorni  dalla  data  di  entrata in vigore del\npresente decreto, con decreto del Ministro del tesoro, del bilancio e\ndella  programmazione economica sono stabilite le ulteriori modalita'\ndi abdicazione delle disposizioni di cui alla presente Sezione.\n    2.  A  patire  dalla  data  di  entrata  in  vigore  del  decreto\nministeriale  di cui al comma 1, il Tesoro non rilascia piu' titoli o\ncertificati    provvisori   o   definitivi   con   o   senza   cedole\nrappresentativi di prestiti.\n    3.  Per l'esercizio di qualsiasi diritto patrimoniale i detentori\ndei  titoli  al  portatore  e  nominativi,  appartenenti  a  prestiti\nvigenti,  rilasciati  anteriormente  alla  data del presente decreto,\ndebbono  presentare, non oltre il 31 dicembre 1998, i titoli medesimi\nad  un  intermediario  di  cui  ((all'articolo  79-quater del decreto\nlegislativo 24 febbraio 1998, n. 58)), il quale provvede all'apertura\ndel  conto  ed alla consegna tempestiva dei titoli alla filiale della\nBanca   d'Italia   competente   per   territorio,   che   provvedera'\nall'immissione  nel sistema di gestione accentrata e all'annullamento\ndei  titoli  o  certificati,  trasmettendo  i  relativi  documenti al\nTesoro.  Con  decreto  del  Ministro del tesoro, del bilancio e della\nprogrammazione economica sono fissate le modalita' per il trattamento\ndei titoli non consegnati entro il 31 dicembre 1998.\n    4.  A  partire  dal  giorno  successivo all'entrata in vigore del\ndecreto  ministeriale  di  cui  al  comma  1,  i  titoli  in gestione\naccentrata non possono piu' essere ritirati.\n    5.  I  titoli  in essere presso il sistema di gestione accentrata\ndella  Banca  d'Italia sono annullati e inviati al Tesoro a decorrere\ndal 5 ottobre 1998.\n    6.  Il  5 ottobre 1998 il sistema di gestione centralizzata della\nBanca  d'Italia comunica a ciascun depositario l'ammontare dei titoli\ndetenuti  in gestione accentrata con riferimento ai saldi dell'ultimo\ngiorno    lavorativo   precedente;   alla   medesima   data   ciascun\nintermediario ((di cui all'articolo 79-quater del decreto legislativo\n24  febbraio 1998, n. 58,)) annota altresi', sui conti accesi a norma\ndel  comma 3, i diritti corrispondenti per ciascun cliente e aggiorna\nle evidenze sui conti di cui all'articolo 34.\n    7.  Le  disposizioni di cui al comma 2 del presente articolo sono\napplicate  ai  titoli emessi dagli enti pubblici indicati dal decreto\nministeriale  di  cui  al  comma  1,  anche  limitatamente  a singoli\nprestiti."
                ]
            },
            {
                "filename": "law_749_083U0562_1983-10-17.json",
                "title": "LEGGE 15 ottobre 1983, n. 562",
                "subject": "Disposizioni per l'assestamento del bilancio dello Stato e dei bilanci delle Aziende autonome per l'anno finanziario 1983.",
                "type": "legge",
                "number": "562",
                "year": "1983",
                "editorial_code": "083U0562",
                "gazette_reference": "(GU n.285 del 17-10-1983 - Suppl. Ordinario)",
                "publication_date": "1983-10-15",
                "gazette_date": "1983-10-17",
                "valid_from": "1983-10-17",
                "last_updated": "",
                "link_gazette": "http://www.gazzettaufficiale.it/eli/gu/1983/10/17/285/so/0/sg/pdf",
                "link_urn_nir": "http://www.normattiva.it/uri-res/N2Ls?urn:nir:stato:legge:1983-10-15;562",
                "link_eli_id": "http://www.normattiva.it/eli/id/1983/10/17/083U0562",
                "link_eli_type": "http://www.normattiva.it/eli/stato/LEGGE/1983/10/15/562",
                "id": "art_8_law_749_083U0562_1983-10-17.json",
                "article_number": "8",
                "article_text": [
                    "                               Art. 8.\n\n  La presente legge entra in vigore il giorno della sua pubblicazione\nnella Gazzetta Ufficiale della Repubblica.\n\n  La  presente  legge,  munita del sigillo dello Stato, sara' inserta\nnella  Raccolta  ufficiale delle leggi e dei decreti della Repubblica\nitaliana. E' fatto obbligo a chiunque spetti di osservarla e di farla\nosservare come legge dello Stato.\n\n  Data a Roma, addi' 15 ottobre 1983\n\n                               PERTINI\n\n                                                CRAXI - GORIA - LONGO\n\nVisto, il Guardasigilli: MARTINAZZOLI"
                ]
            },
            {
                "filename": "law_42_093G0009_1993-01-12.json",
                "title": "DECRETO 12 novembre 1992, n. 542",
                "subject": "Regolamento recante i criteri di valutazione delle caratteristiche delle acque minerali naturali.",
                "type": "decreto",
                "number": "542",
                "year": "1992",
                "editorial_code": "093G0009",
                "gazette_reference": "(GU n.8 del 12-01-1993)",
                "publication_date": "1992-11-12",
                "gazette_date": "1993-01-12",
                "valid_from": "2011-11-20",
                "last_updated": "(Ultimo aggiornamento all'atto pubblicato il 05/11/2011)",
                "link_gazette": "http://www.gazzettaufficiale.it/eli/gu/1993/01/12/8/sg/pdf",
                "link_urn_nir": "http://www.normattiva.it/uri-res/N2Ls?urn:nir:stato:decreto:1992-11-12;542",
                "link_eli_id": "http://www.normattiva.it/eli/id/1993/01/12/093G0009",
                "link_eli_type": "http://www.normattiva.it/eli/stato/DECRETO/1992/11/12/542",
                "id": "art_13_law_42_093G0009_1993-01-12.json",
                "article_number": "13",
                "article_text": [
                    "                              Art. 13. \n \n  Gli studi clinici, farmacologici  e  tossicologici  debbono  essere\ncondotti presso strutture ospedaliere o  universitarie  nel  rispetto\ndelle  regole  di  buona  pratica  clinica  e  di  buona  pratica  di\nlaboratorio. \n                                                                ((3)) \n \n------------- \nAGGIORNAMENTO (3) \n  Il D.Lgs. 8 ottobre 2011, n. 176 ha disposto (con l'art. 34,  comma\n3) che alla data  di  entrata  in  vigore  del  decreto  ministeriale\nprevisto all'articolo 3, comma 1, e' abrogato il decreto del Ministro\ndella sanita' 12 novembre 1992, n. 542. "
                ]
            },
            {
                "filename": "law_207_097G0347_1997-09-22.json",
                "title": "DECRETO DEL PRESIDENTE DELLA REPUBBLICA 19 settembre 1997, n. 318",
                "subject": "Regolamento per l'attuazione di direttive comunitarie nel settore delle telecomunicazioni.",
                "type": "decreto.del.presidente.della.repubblica",
                "number": "318",
                "year": "1997",
                "editorial_code": "097G0347",
                "gazette_reference": "(GU n.221 del 22-09-1997 - Suppl. Ordinario n. 191)",
                "publication_date": "1997-09-19",
                "gazette_date": "1997-09-22",
                "valid_from": "2003-09-16",
                "last_updated": "(Ultimo aggiornamento all'atto pubblicato il 15/09/2003)",
                "link_gazette": "http://www.gazzettaufficiale.it/eli/gu/1997/09/22/221/so/191/sg/pdf",
                "link_urn_nir": "http://www.normattiva.it/uri-res/N2Ls?urn:nir:stato:decreto.del.presidente.della.repubblica:1997-09-19;318",
                "link_eli_id": "http://www.normattiva.it/eli/id/1997/09/22/097G0347",
                "link_eli_type": "http://www.normattiva.it/eli/stato/DECRETO_DEL_PRESIDENTE_DELLA_REPUBBLICA/1997/09/19/318",
                "id": "art_18_law_207_097G0347_1997-09-22.json",
                "article_number": "18",
                "article_text": [
                    "                               Art. 18\n     ((PROVVEDIMENTO ABROGATO DAL D.LGS. 1 AGOSTO 2003, N. 259))"
                ]
            },
            {
                "filename": "law_4_000G0150_2000-04-28.json",
                "title": "DECRETO DEL PRESIDENTE DELLA REPUBBLICA 21 dicembre 1999, n. 554",
                "subject": "Regolamento di attuazione della legge quadro in materia di lavori pubblici 11 febbraio 1994, n. 109, e successive modificazioni.",
                "type": "decreto.del.presidente.della.repubblica",
                "number": "554",
                "year": "1999",
                "editorial_code": "000G0150",
                "gazette_reference": "(GU n.98 del 28-04-2000 - Suppl. Ordinario n. 66)",
                "publication_date": "1999-12-21",
                "gazette_date": "2000-04-28",
                "valid_from": "2011-07-13",
                "last_updated": "(Ultimo aggiornamento all'atto pubblicato il 13/05/2011)",
                "link_gazette": "http://www.gazzettaufficiale.it/eli/gu/2000/04/28/98/so/66/sg/pdf",
                "link_urn_nir": "http://www.normattiva.it/uri-res/N2Ls?urn:nir:stato:decreto.del.presidente.della.repubblica:1999-12-21;554",
                "link_eli_id": "http://www.normattiva.it/eli/id/2000/04/28/000G0150",
                "link_eli_type": "http://www.normattiva.it/eli/stato/DECRETO_DEL_PRESIDENTE_DELLA_REPUBBLICA/1999/12/21/554",
                "id": "art_115_law_4_000G0150_2000-04-28.json",
                "article_number": "115",
                "article_text": [
                    "                             Art. 115 \n   PROVVEDIMENTO ABROGATO DAL D.P.R. 5 OTTOBRE 2010, N. 207 ((7)) \n \n    \n---------------\n\n\nAGGIORNAMENTO (7)\nIl D.P.R. 5 ottobre 2010, n.  207,  come  modificato  dall'art.  4,\ncomma 15, lettera d), del D.L. 13 maggio 2011, n. 70, convertito, con\nmodificazioni, dalla L. 12 luglio 2011,  n.  106,  ha  disposto  (con\nl'art. 358, comma 1) l'abrogazione dell'intero  provvedimento  \"fermo\nrestando quanto disposto dall'articolo 357\".\n    "
                ]
            },
            {
                "filename": "law_481_099G0136_1999-03-31.json",
                "title": "DECRETO LEGISLATIVO 16 marzo 1999, n. 79",
                "subject": "Attuazione della direttiva 96/92/CE recante norme comuni per il mercato interno dell'energia elettrica.",
                "type": "decreto.legislativo",
                "number": "79",
                "year": "1999",
                "editorial_code": "099G0136",
                "gazette_reference": "(GU n.75 del 31-03-1999)",
                "publication_date": "1999-03-16",
                "gazette_date": "1999-03-31",
                "valid_from": "1999-04-01",
                "last_updated": "(Ultimo aggiornamento all'atto pubblicato il 22/07/2020)",
                "link_gazette": "http://www.gazzettaufficiale.it/eli/gu/1999/03/31/75/sg/pdf",
                "link_urn_nir": "http://www.normattiva.it/uri-res/N2Ls?urn:nir:stato:decreto.legislativo:1999-03-16;79",
                "link_eli_id": "http://www.normattiva.it/eli/id/1999/03/31/099G0136",
                "link_eli_type": "http://www.normattiva.it/eli/stato/DECRETO_LEGISLATIVO/1999/03/16/79",
                "id": "art_8_law_481_099G0136_1999-03-31.json",
                "article_number": "8",
                "article_text": [
                    "                               Art. 8.\n                       Attivita' di produzione\n  1.  A  decorrere dal 1 gennaio 2003 a nessun soggetto e' consentito\nprodurre  o importare, direttamente o indirettamente, piu' del 50 per\ncento  del  totale  dell'energia  elettrica  prodotta  e importata in\nItalia. Nel caso tale soglia, calcolata come media su base triennale,\nsia  superata,  l'Autorita'  garante  della concorrenza e del mercato\nadotta  i provvedimenti di cui all'articolo 15 della legge 10 ottobre\n1990,  n.  287. A tale scopo, entro la stessa data l'ENEL S.p.a. cede\nnon  meno di 15.000 MW della propria capacita' produttiva. A tal fine\nl'ENEL  S.p.a.  predispone  entro  centoventi  gioni  dall'entrata in\nvigore  del presente decreto un piano per le cessioni degli impianti;\nl'approvazione  del suddetto piano, nonche' la scelta delle modalita'\ndi  alienazione  sono  determinate  con  decreto  del  Presidente del\nConsiglio  dei  Ministri,  su  proposta  del Ministro del tesoro, del\nbilancio  e  della  programmazione  economica,  di  concerto  con  il\nMinistro  dell'industria,  del commercio e dell'artigianato. Il piano\nper   le   cessioni  degli  impianti  deve  consentire  sia  adeguate\ncondizioni  di  mercato sia la necessaria attenzione alla presenza di\npiani  industriali,  al mantenimento della produzione nei siti e alle\nricadute  occupazionali  e  deve  tener conto delle esigenze relative\nalle   attivita'  di  sviluppo,  di  innovazione,  di  ricerca  e  di\ninternazionalizzazione dell'ENEL S.p.a.\n  2.  Ove  il  termine  del  1 gennaio 2003 di cui al comma 1 non sia\ncompatibile,  per  le  condizioni  del mercato, con il rispetto degli\nobblighi  nello  stesso  comma  previsti,  l'Autorita'  garante della\nconcorrenza   e   del  mercato  con  proprio  provvedimento,  sentita\nl'Autorita'  per  l'energia  elettrica  e  il  gas, puo' disporre, su\nrichiesta  del  soggetto  interessato, una proroga non superiore a un\nanno.\n  3.  Fermi restando quanto previsto dal decreto legislativo 31 marzo\n1998,  n.  112,  nonche'  la  disciplina relativa alla valutazione di\nimpatto ambientale, entro un anno dalla data di entrata in vigore del\npresente  decreto  sono  emanati, ai sensi dell'articolo 17, comma 2,\ndella  legge  23  agosto  1988,  n.  400,  uno o piu' regolamenti per\ndisciplinare  l'autorizzazione  alla  costruzione  e all'esercizio di\nnuovi  impianti  di produzione dell'energia elettrica o la modifica o\nil   ripotenziamento  di  impianti  esistenti,  alimentati  da  fonti\nconvenzionali.\n  4. I regolamenti si conformano ai seguenti principi:\n  a)  i  progetti  sono  autorizzati  mediante  lo svolgimento di una\nprocedura  unificata e semplificata, riferita a ciascuna categoria di\nimpianto  nonche'  mediante  il rilascio, in tempi determinati, di un\nunico  provvedimento  riguardante  sia  l'impianto  principale che le\nopere connesse e le infrastrutture indispensabili al suo esercizio;\n  b)  i progetti di modifica o ripotenziamento sono valutati sotto il\nprofilo  urbanistico  solo  in  caso di occupazione di aree esterne a\nquelle di pertinenza dell'impianto esistente.\n  5.  Il  diniego  di  autorizzazione, fondato in ogni caso su motivi\nobiettivi  e  non  discriminatori,  e'  comunicato,  con  la relativa\nmotivazione,  al  richiedente. Del provvedimento e' data informazione\nalla Commissione delle Comunita' europee.\n  6.  Sino  alla  data di entrata in vigore dei regolamenti di cui al\ncomma 3 si applicano le norme e le procedure attualmente vigenti."
                ]
            },
            {
                "filename": "law_1101_085U0041_1985-03-01.json",
                "title": "LEGGE 20 febbraio 1985, n. 41",
                "subject": "Norme sull'esplorazione e la coltivazione delle risorse minerali dei fondi marini.",
                "type": "legge",
                "number": "41",
                "year": "1985",
                "editorial_code": "085U0041",
                "gazette_reference": "(GU n.52 del 01-03-1985)",
                "publication_date": "1985-02-20",
                "gazette_date": "1985-03-01",
                "valid_from": "1994-12-20",
                "last_updated": "(Ultimo aggiornamento all'atto pubblicato il 19/12/1994)",
                "link_gazette": "http://www.gazzettaufficiale.it/eli/gu/1985/03/01/52/sg/pdf",
                "link_urn_nir": "http://www.normattiva.it/uri-res/N2Ls?urn:nir:stato:legge:1985-02-20;41",
                "link_eli_id": "http://www.normattiva.it/eli/id/1985/03/01/085U0041",
                "link_eli_type": "http://www.normattiva.it/eli/stato/LEGGE/1985/02/20/41",
                "id": "art_6_law_1101_085U0041_1985-03-01.json",
                "article_number": "6",
                "article_text": [
                    "                               Art. 6\n    (( PROVVEDIMENTO ABROGATO DALLA L. 2 DICEMBRE 1994, N. 689 ))"
                ]
            },
            {
                "filename": "law_698_094G0093_1994-02-02.json",
                "title": "DECRETO-LEGGE 1 febbraio 1994, n. 79",
                "subject": "Misure urgenti in materia di partecipazione alla spesa sanitaria, di formazione dei medici e di farmacovigilanza.",
                "type": "decreto.legge",
                "number": "79",
                "year": "1994",
                "editorial_code": "094G0093",
                "gazette_reference": "(GU n.26 del 02-02-1994)",
                "publication_date": "1994-02-1",
                "gazette_date": "1994-02-02",
                "valid_from": "1994-04-04",
                "last_updated": "(Ultimo aggiornamento all'atto pubblicato il 28/07/1994)",
                "link_gazette": "http://www.gazzettaufficiale.it/eli/gu/1994/02/02/26/sg/pdf",
                "link_urn_nir": "http://www.normattiva.it/uri-res/N2Ls?urn:nir:stato:decreto.legge:1994-02-1;79",
                "link_eli_id": "http://www.normattiva.it/eli/id/1994/02/02/094G0093",
                "link_eli_type": "http://www.normattiva.it/eli/stato/DECRETO_LEGGE/1994/02/1/79",
                "id": "art_6_law_698_094G0093_1994-02-02.json",
                "article_number": "6",
                "article_text": [
                    "                             Art. 6. \n       DECRETO DECADUTO; I SUOI EFFETTI SONO STATI FATTI SALVI \n                   DALLA L. 19 LUGLIO 1994, N. 467 "
                ]
            },
            {
                "filename": "law_938_084U0284_1984-07-06.json",
                "title": "DECRETO DEL PRESIDENTE DELLA REPUBBLICA 26 aprile 1984, n. 284",
                "subject": "Modificazioni allo statuto dell'Universita' degli studi di Pisa.",
                "type": "decreto.del.presidente.della.repubblica",
                "number": "284",
                "year": "1984",
                "editorial_code": "084U0284",
                "gazette_reference": "(GU n.185 del 06-07-1984)",
                "publication_date": "1984-04-26",
                "gazette_date": "1984-07-06",
                "valid_from": "1984-07-21",
                "last_updated": "",
                "link_gazette": "http://www.gazzettaufficiale.it/eli/gu/1984/07/06/185/sg/pdf",
                "link_urn_nir": "http://www.normattiva.it/uri-res/N2Ls?urn:nir:stato:decreto.del.presidente.della.repubblica:1984-04-26;284",
                "link_eli_id": "http://www.normattiva.it/eli/id/1984/07/06/084U0284",
                "link_eli_type": "http://www.normattiva.it/eli/stato/DECRETO_DEL_PRESIDENTE_DELLA_REPUBBLICA/1984/04/26/284",
                "id": "art_5_law_938_084U0284_1984-07-06.json",
                "article_number": "5",
                "article_text": [
                    "                               Art. 5.\n\n  Nell'art.  94,  relativo  al  corso  di laurea in matematica per la\nfacolta' di scienze matematiche, fisiche e naturali, all'elenco degli\ninsegnamenti   complementari   sono   aggiunti   i   seguenti   nuovi\ninsegnamenti:\n    Per l'indirizzo fisico:\n      meccanica dei continui.\n    Per l'indirizzo matematico:\n      analisi complessa;\n      analisi non lineare.\n    Per l'indirizzo applicativo:\n      teoria e metodi dell'ottimizzazione.\n\n  Il  presente decreto, munito del sigillo dello Stato, sara' inserto\nnella  Raccolta  ufficiale delle leggi e dei decreti della Repubblica\nitaliana. E' fatto obbligo a chiunque spetti di osservarlo e di farlo\nosservare.\n\n  Dato a Roma, addi' 26 aprile 1984\n\n                               PERTINI\n\n                                                             FALCUCCI\n\nVisto, il Guardasigilli: MARTINAZZOLI\n  Registrato alla Corte dei conti, addi' 26 giugno 1984\n  Registro n. 39 Istruzione, foglio n. 64"
                ]
            },
            {
                "filename": "law_375_090G0110_1990-04-27.json",
                "title": "LEGGE 26 aprile 1990, n. 86",
                "subject": "Modifiche in tema di delitti dei pubblici ufficiali contro la pubblica amministrazione.",
                "type": "legge",
                "number": "86",
                "year": "1990",
                "editorial_code": "090G0110",
                "gazette_reference": "(GU n.97 del 27-04-1990)",
                "publication_date": "1990-04-26",
                "gazette_date": "1990-04-27",
                "valid_from": "1990-05-12",
                "last_updated": "",
                "link_gazette": "http://www.gazzettaufficiale.it/eli/gu/1990/04/27/97/sg/pdf",
                "link_urn_nir": "http://www.normattiva.it/uri-res/N2Ls?urn:nir:stato:legge:1990-04-26;86",
                "link_eli_id": "http://www.normattiva.it/eli/id/1990/04/27/090G0110",
                "link_eli_type": "http://www.normattiva.it/eli/stato/LEGGE/1990/04/26/86",
                "id": "art_9_law_375_090G0110_1990-04-27.json",
                "article_number": "9",
                "article_text": [
                    "                               Art. 9. \n1. Dopo l'articolo 319-bis del codice penale e' inserito il seguente: \n\"Art. 319-ter. - (Corruzione  in  atti  giudiziari).  -  Se  i  fatti\nindicati negli articoli 318  e  319  sono  commessi  per  favorire  o\ndanneggiare una parte in un processo civile, penale o amministrativo,\nsi applica la pena della reclusione da tre a otto anni. \nSe dal fatto deriva l'ingiusta condanna di taluno alla reclusione non\nsuperiore a cinque anni, la pena e' della  reclusione  da  quattro  a\ndodici anni; se deriva l'ingiusta condanna alla reclusione  superiore\na cinque anni o all'ergastolo, la pena e' della reclusione da  sei  a\nventi anni\". "
                ]
            }
        ]
    },
    {
        "unit_id": "unit_4",
        "token_input": "YSYZUUXIZT",
        "token_output": "VBEFYNLRWE",
        "documents": [
            {
                "filename": "law_1145_082U0057_1982-03-02.json",
                "title": "DECRETO-LEGGE 27 febbraio 1982, n. 57",
                "subject": "Disciplina per la gestione stralcio dell'attivita' del commissario per le zone terremotate della Campania e della Basilicata.",
                "type": "decreto.legge",
                "number": "57",
                "year": "1982",
                "editorial_code": "082U0057",
                "gazette_reference": "(GU n.59 del 02-03-1982)",
                "publication_date": "1982-02-27",
                "gazette_date": "1982-03-02",
                "valid_from": "1983-04-13",
                "last_updated": "(Ultimo aggiornamento all'atto pubblicato il 08/05/2010)",
                "link_gazette": "http://www.gazzettaufficiale.it/eli/gu/1982/03/02/59/sg/pdf",
                "link_urn_nir": "http://www.normattiva.it/uri-res/N2Ls?urn:nir:stato:decreto.legge:1982-02-27;57",
                "link_eli_id": "http://www.normattiva.it/eli/id/1982/03/02/082U0057",
                "link_eli_type": "http://www.normattiva.it/eli/stato/DECRETO_LEGGE/1982/02/27/57",
                "id": "art_2_law_1145_082U0057_1982-03-02.json",
                "article_number": "2",
                "article_text": [
                    "                               Art. 2.\n\n  Gli  alloggi  prefabbricati,  acquistati  con i fondi stanziati nel\nbilancio  dello  Stato  e  quelli  pervenuti  in  dono  ((tramite  il\ncommissario  per  le  zone  terremotate,  o  che  pervengano in dono,\ntramite il Ministro per il coordinamento della protezione civile, con\ndestinazione  alle  zone terremotate)), sono trasferiti in proprieta'\nai comuni nel cui territorio sono installati.\n  ((I prefabbricati destinati a uffici o servizi statali o, comunque,\npubblici  sono  acquisiti  gratuitamente  al  patrimonio comunale con\nvincolo  di  destinazione  a  pubblico servizio. Le spese per la loro\nmanutenzione,  nonche'  quelle  per i servizi generali, sono a carico\ndelle amministrazioni dalle quali gli uffici o i servizi dipendono)).\n  Gli alloggi prefabbricati monoblocco tipo containers e le roulottes\nacquisiti  dal  commissario per le zone terremotate sono assegnati in\nuso  precario  ai  comuni  nel  cui  territorio  sono installati, con\nl'onere  di  provvedere  alla  loro  manutenzione ordinaria, ai sensi\ndell'art.  1-ter  del decreto-legge 19 marzo 1981, n. 75, convertito,\ncon modificazioni, nella legge 14 maggio 1981, n. 219.\n  In  attesa  della  definitiva destinazione ai fini della protezione\ncivile,  il  Ministro  per  il  coordinamento della protezione civile\nprocede  ((, entro il 30 giugno 1982,)) alla ricognizione dei beni di\ncui  al  precedente  comma,  nonche'  di tutti gli altri beni mobili,\nattrezzature  e  materiali  acquisiti  al fondo di cui all'art. 2 del\ndecreto-legge   26   novembre   1980,   n.   776,   convertito,   con\nmodificazioni, nella legge 22 dicembre 1980, n. 874.\n  ((I  beni di cui al terzo e quarto comma dalla data della richiesta\ndel  loro  ritiro  da  parte  dell'ente  consegnatario  sono presi in\nconsegna  e  gestiti  dalle Forze armate e dislocati sulla base delle\nindicazioni   formulate  dal  Ministro  per  il  coordinamento  della\nprotezione   civile,   di  intesa  col  Ministro  della  difesa,  nel\nterritorio  nazionale su aree appositamente attrezzate, di preferenza\ndemaniali,  con  riferimento  alle  zone ad alto rischio di calamita'\nnaturali.\n  Gli  enti  consegnatari  dei  suddetti  beni sono comunque tenuti a\ncomunicare  al Ministro per il coordinamento della protezione civile,\nentro  i  primi  dieci  giorni di ciascun mese, l'elenco dei beni non\npiu'  necessari  alle  finalita' per le quali i beni stessi furono ad\nessi assegnati)).\n  ((In   ordine   a  quanto  previsto  dal  precedente  comma))  sono\napplicabili   al  personale  militare  della  Difesa  ((i  limiti  di\ncompetenza  nella  spesa))  gia'  previsti nel decreto del Presidente\ndella  Repubblica  30  giugno  1972,  n.  748,  per le corrispondenti\nqualifiche del personale civile. ((I contratti e le spese autorizzate\nin  economia  sono  soggetti al solo controllo successivo della Corte\ndei conti))."
                ]
            },
            {
                "filename": "law_895_082U0307_1982-06-05.json",
                "title": "DECRETO DEL PRESIDENTE DELLA REPUBBLICA 23 febbraio 1982, n. 307",
                "subject": "Regolamento di esecuzione della legge 4 luglio 1970, n. 507, sulla tutela delle denominazioni di origine e tipica del prosciutto di San Daniele.",
                "type": "decreto.del.presidente.della.repubblica",
                "number": "307",
                "year": "1982",
                "editorial_code": "082U0307",
                "gazette_reference": "(GU n.153 del 05-06-1982)",
                "publication_date": "1982-02-23",
                "gazette_date": "1982-06-05",
                "valid_from": "1982-12-05",
                "last_updated": "",
                "link_gazette": "http://www.gazzettaufficiale.it/eli/gu/1982/06/05/153/sg/pdf",
                "link_urn_nir": "http://www.normattiva.it/uri-res/N2Ls?urn:nir:stato:decreto.del.presidente.della.repubblica:1982-02-23;307",
                "link_eli_id": "http://www.normattiva.it/eli/id/1982/06/05/082U0307",
                "link_eli_type": "http://www.normattiva.it/eli/stato/DECRETO_DEL_PRESIDENTE_DELLA_REPUBBLICA/1982/02/23/307",
                "id": "art_26_law_895_082U0307_1982-06-05.json",
                "article_number": "26",
                "article_text": [
                    "                              Art. 26.\n\n  Il  presente  regolamento  entra  in  vigore  sei  mesi dopo la sua\npubblicazione  nella Gazzetta Ufficiale della Repubblica italiana, ad\neccezione degli articoli 24, primo comma, e 25, che entrano in vigore\nil giorno successivo alla pubblicazione nella Gazzetta Ufficiale.\n\n  Il  presente decreto, munito del sigillo dello Stato, sara' inserto\nnella  Raccolta  ufficiale delle leggi e dei decreti della Repubblica\nitaliana. E' fatto obbligo a chiunque spetti di osservarlo e di farlo\nosservare.\n\n  Dato a Roma, addi' 23 febbraio 1982\n\n                               PERTINI\n\n                                                SPADOLINI - MARCORA -\n                                               BARTOLOMEI - ALTISSIMO\n\nVisto, il Guardasigilli: DARIDA\n  Registrato alla Corte dei conti, addi' 27 maggio 1982\n  Atti di Governo, registro n. 40, foglio n. 1"
                ]
            },
            {
                "filename": "law_434_082U0768_1982-10-22.json",
                "title": "DECRETO DEL PRESIDENTE DELLA REPUBBLICA 19 ottobre 1982, n. 768",
                "subject": "Norme per l'esecuzione del terzo censimento generale dell'agricoltura.",
                "type": "decreto.del.presidente.della.repubblica",
                "number": "768",
                "year": "1982",
                "editorial_code": "082U0768",
                "gazette_reference": "(GU n.292 del 22-10-1982)",
                "publication_date": "1982-10-19",
                "gazette_date": "1982-10-22",
                "valid_from": "1982-10-23",
                "last_updated": "",
                "link_gazette": "http://www.gazzettaufficiale.it/eli/gu/1982/10/22/292/sg/pdf",
                "link_urn_nir": "http://www.normattiva.it/uri-res/N2Ls?urn:nir:stato:decreto.del.presidente.della.repubblica:1982-10-19;768",
                "link_eli_id": "http://www.normattiva.it/eli/id/1982/10/22/082U0768",
                "link_eli_type": "http://www.normattiva.it/eli/stato/DECRETO_DEL_PRESIDENTE_DELLA_REPUBBLICA/1982/10/19/768",
                "id": "art_11_law_434_082U0768_1982-10-22.json",
                "article_number": "11",
                "article_text": [
                    "                              Art. 11.\n\n  In  ogni  comune  e'  data  facolta'  al  sindaco di costituire una\ncommissione  comunale  di  censimento avente il compito di facilitare\nl'esecuzione   del  censimento  fornendo  ai  conduttori  di  azienda\ninformazioni  e  chiarimenti  sulle  finalita'  e sull'importanza del\ncensimento stesso.\n  Tale  commissione,  presieduta dal sindaco o da un suo delegato, e'\ncomposta:   dal   segretario  comunale;  dal  dirigente  dell'ufficio\ncomunale  di  censimento;  dal responsabile del servizio veterinario;\ndal  preside  di  una  scuola  od  istituto ad indirizzo agrario (ove\nesista); dal direttore didattico oppure da un insegnante elementare;\n  da  un  rappresentante  di  ciascuna  delle  quattro organizzazioni\nsindacali dei datori di lavoro e dei lavoratori dell'agricoltura piu'\nrappresentative in sede comunale."
                ]
            },
            {
                "filename": "law_266_090G0235_1990-07-23.json",
                "title": "DECRETO DEL PRESIDENTE DELLA REPUBBLICA 23 giugno 1990, n. 195",
                "subject": "Regolamento recante modificazioni alle norme in materia di concessione della croce al merito di servizio ai militari della Guardia di finanza.",
                "type": "decreto.del.presidente.della.repubblica",
                "number": "195",
                "year": "1990",
                "editorial_code": "090G0235",
                "gazette_reference": "(GU n.170 del 23-07-1990)",
                "publication_date": "1990-06-23",
                "gazette_date": "1990-07-23",
                "valid_from": "1990-08-07",
                "last_updated": "",
                "link_gazette": "http://www.gazzettaufficiale.it/eli/gu/1990/07/23/170/sg/pdf",
                "link_urn_nir": "http://www.normattiva.it/uri-res/N2Ls?urn:nir:stato:decreto.del.presidente.della.repubblica:1990-06-23;195",
                "link_eli_id": "http://www.normattiva.it/eli/id/1990/07/23/090G0235",
                "link_eli_type": "http://www.normattiva.it/eli/stato/DECRETO_DEL_PRESIDENTE_DELLA_REPUBBLICA/1990/06/23/195",
                "id": "art_2_law_266_090G0235_1990-07-23.json",
                "article_number": "2",
                "article_text": [
                    "                               Art. 2.\n  1.  La croce, conforme al modello annesso al decreto del Presidente\ndella Repubblica 31 luglio 1954, n. 1052, e' coniata  in  oro  ed  in\nargento.\n  2.  Si  porta  appesa  al  petto  con un nastro di seta color verde\nscuro, tramezzato e limitato ai margini da una lista gialla  in  palo\ndelle  dimensioni  di  quello  della croce per anzianita' di servizio\ndell'Esercito di cui al decreto del Presidente  della  Repubblica  10\nfebbraio 1953, n. 331.\n  3. Il nastro puo' portarsi senza croce."
                ]
            },
            {
                "filename": "law_98_093G0558_1993-12-09.json",
                "title": "DECRETO LEGISLATIVO 15 novembre 1993, n. 507",
                "subject": "Revisione ed armonizzazione dell'imposta comunale sulla pubblicita' e del diritto sulle pubbliche affissioni, della tassa per l'occupazione di spazi ed aree pubbliche dei comuni e delle province nonche' della tassa per lo smaltimento dei rifiuti solidi urbani a norma dell'art. 4 della legge 23 ottobre 1992, n. 421, concernente il riordino della finanza territoriale.",
                "type": "decreto.legislativo",
                "number": "507",
                "year": "1993",
                "editorial_code": "093G0558",
                "gazette_reference": "(GU n.288 del 09-12-1993 - Suppl. Ordinario n. 108)",
                "publication_date": "1993-11-15",
                "gazette_date": "1993-12-09",
                "valid_from": "2020-03-01",
                "last_updated": "(Ultimo aggiornamento all'atto pubblicato il 29/02/2020)",
                "link_gazette": "http://www.gazzettaufficiale.it/eli/gu/1993/12/09/288/so/108/sg/pdf",
                "link_urn_nir": "http://www.normattiva.it/uri-res/N2Ls?urn:nir:stato:decreto.legislativo:1993-11-15;507",
                "link_eli_id": "http://www.normattiva.it/eli/id/1993/12/09/093G0558",
                "link_eli_type": "http://www.normattiva.it/eli/stato/DECRETO_LEGISLATIVO/1993/11/15/507",
                "id": "art_59_law_98_093G0558_1993-12-09.json",
                "article_number": "59",
                "article_text": [
                    "                              Art. 59. \n                      Attivazione del servizio \n \n  1. Nel regolamento del servizio di nettezza urbana, da adottare  ai\nsensi dell'art. 8 del decreto  del  Presidente  della  Repubblica  10\nsettembre 1982, n.  915,  sono  stabiliti  i  limiti  della  zona  di\nraccolta obbligatoria e dell'eventuale estensione del servizio a zone\ncon insediamenti sparsi, la forma organizzativa  e  le  modalita'  di\neffettuazione del servizio di smaltimento dei rifiuti  solidi  urbani\ninterni, con indicazione, a seconda dei singoli ambiti o zone,  delle\nrelative distanze massime  di  collocazione  dei  contenitori  o  dei\ncriteri per determinarle nonche' delle relative capacita'  minime  da\nassicurare in  relazione  all'entita'  e  tipologia  dei  rifiuti  da\nsmaltire. \n  2. Fermo restando il potere di determinazione dei perimetri entro i\nquali e' obbligatoriamente istituito il servizio dei  rifiuti  urbani\ninterni ai sensi degli articoli 3 e  8  del  decreto  del  Presidente\ndella Repubblica 10 settembre 1982, n. 915, previa  ricognizione  dei\nperimetri del centro abitato, delle frazioni e  dei  nuclei  abitati,\nivi compresi i centri commerciali e produttivi  integrati,  i  comuni\npossono estendere il regime di privativa di smaltimento  dei  rifiuti\nsolidi urbani interni ed equiparati ad insediamenti sparsi siti oltre\nle zone  perimetrate  sopramenzionate.  Nelle  zone  in  cui  non  e'\neffettuata la raccolta in regime  di  privativa  dei  rifiuti  solidi\nurbani interni ed equiparati,  la  tassa  e'  dovuta  in  misura  non\nsuperiore al 40 per cento della tariffa da determinare  in  relazione\nalla distanza dal piu' vicino punto di raccolta rientrante nella zona\nperimetrata o di fatto servita. \n  3. Tenuto conto del disposto dell'art. 9 del decreto del Presidente\ndella Repubblica 10 settembre 1982, n. 915, gli occupanti o detentori\ndegli insedimanenti comunque situati fuori dell'area di raccolta sono\ntenuti  ad  utilizzare  il  servizio  pubblico  di  nettezza  urbana,\nprovvedendo al conferimento dei rifiuti urbani interni ed  equiparati\nnei contenitori viciniori. \n  4. Se il servizio di raccolta, sebbene istituito ed  attivato,  non\ne' svolto nella  zona  di  residenza  o  di  dimora  nell'immobile  a\ndisposizione ovvero di  esercizio  dell'attivita'  dell'utente  o  e'\neffettuato in grave violazione delle prescrizioni del regolamento  di\ncui al comma 1, relative alle distanze e capacita' dei contenitori ed\nalla frequenza della raccolta, da  stabilire  in  modo  che  l'utente\npossa usufruire agevolmente del servizio di raccolta, il  tributo  e'\ndovuto nella misura ridotta di cui al secondo periodo del comma 2. \n  5. Nelle zone esterne al centro abitato in cui lo  svolgimento  del\nnormale servizio di raccolta dei rifiuti interni  ed  equiparati  sia\nlimitato con apposita delibera a determinati periodi  stagionali,  il\ntributo  e'  dovuto  in  proporzione  al  periodo  di  esercizio  del\nservizio, fermo restando il disposto del secondo periodo del comma 2. \n  6. L'interruzione temporanea del servizio di  raccolta  per  motivi\nsindacali o per imprevedibili impedimenti organizzativi non  comporta\nesonero  o  riduzione  del  tributo.  Qualora  tuttavia  il   mancato\nsvolgimento del servizio si protragga,  determinando  una  situazione\nriconosciuta dalla competente autorita' sanitaria di danno o pericolo\ndi danno alle persone o all'ambiente secondo le norme e  prescrizioni\nsanitarie nazionali, l'utente puo' provvedere  a  proprie  spese  con\ndiritto allo sgravio o restituzione, in base a  domanda  documentata,\ndi una quota della tassa corrispondente al periodo  di  interruzione,\nfermo restando il disposto del comma 4. "
                ]
            },
            {
                "filename": "law_361_090G0144_1990-05-03.json",
                "title": "LEGGE 24 aprile 1990, n. 100",
                "subject": "Norme sulla promozione della partecipazione a societa' ed imprese miste all'estero.",
                "type": "legge",
                "number": "100",
                "year": "1990",
                "editorial_code": "090G0144",
                "gazette_reference": "(GU n.101 del 03-05-1990)",
                "publication_date": "1990-04-24",
                "gazette_date": "1990-05-03",
                "valid_from": "2019-11-21",
                "last_updated": "(Ultimo aggiornamento all'atto pubblicato il 20/11/2019)",
                "link_gazette": "http://www.gazzettaufficiale.it/eli/gu/1990/05/03/101/sg/pdf",
                "link_urn_nir": "http://www.normattiva.it/uri-res/N2Ls?urn:nir:stato:legge:1990-04-24;100",
                "link_eli_id": "http://www.normattiva.it/eli/id/1990/05/03/090G0144",
                "link_eli_type": "http://www.normattiva.it/eli/stato/LEGGE/1990/04/24/100",
                "id": "art_5_law_361_090G0144_1990-05-03.json",
                "article_number": "5",
                "article_text": [
                    "                               Art. 5.\n  1. All'onere derivante dall'attuazione della presente legge, pari a\nlire 50 miliardi per l'anno 1990 ed a lire 100 miliardi per  ciascuno\ndegli anni 1991 e 1992, si provvede mediante corrispondente riduzione\ndello  stanziamento  iscritto,  ai  fini   del   bilancio   triennale\n1990-1992,  al  capitolo 9001 dello stato di previsione del Ministero\ndel  tesoro  per  l'anno  1990,  all'uopo  parzialmente   utilizzando\nl'accantonamento  \"Rifinanziamento dell'articolo 2 della legge n. 394\ndel 1981 e partecipazione ad imprese miste all'estero\".\n  2.  Il  Ministro del tesoro e' autorizzato ad apportare, con propri\ndecreti, le occorrenti variazioni di bilancio.\n  La  presente  legge, munita del sigillo dello Stato, sara' inserita\nnella  Raccolta  ufficiale  degli  atti  normativi  della  Repubblica\nitaliana. E' fatto obbligo a chiunque spetti di osservarla e di farla\nosservare come legge dello Stato.\n   Data a Roma, addi' 24 aprile 1990\n                               COSSIGA\n                                  ANDREOTTI, Presidente del Consiglio\n                                  dei Ministri\n                                  RUGGIERO, Ministro del commercio\n                                  con l'estero\nVisto, il Guardasigilli: VASSALLI"
                ]
            },
            {
                "filename": "law_221_089G0309_1989-06-26.json",
                "title": "DECRETO-LEGGE 24 giugno 1989, n. 238",
                "subject": "Disposizioni urgenti in materia di esonero dall'obbligo di utilizzare sistemi di ritenuta, nonche' modifiche ed integrazioni alle leggi 18 marzo 1988, n. 111, e 22 aprile 1989, n. 143.",
                "type": "decreto.legge",
                "number": "238",
                "year": "1989",
                "editorial_code": "089G0309",
                "gazette_reference": "(GU n.147 del 26-06-1989)",
                "publication_date": "1989-06-24",
                "gazette_date": "1989-06-26",
                "valid_from": "1993-01-01",
                "last_updated": "(Ultimo aggiornamento all'atto pubblicato il 18/05/1992)",
                "link_gazette": "http://www.gazzettaufficiale.it/eli/gu/1989/06/26/147/sg/pdf",
                "link_urn_nir": "http://www.normattiva.it/uri-res/N2Ls?urn:nir:stato:decreto.legge:1989-06-24;238",
                "link_eli_id": "http://www.normattiva.it/eli/id/1989/06/26/089G0309",
                "link_eli_type": "http://www.normattiva.it/eli/stato/DECRETO_LEGGE/1989/06/24/238",
                "id": "art_8 ter_law_221_089G0309_1989-06-26.json",
                "article_number": "8 ter",
                "article_text": [
                    " \n                             Art. 8-ter. \n    (( PROVVEDIMENTO ABROGATO DAL D.LGS. 30 APRILE 1992, N. 285)) "
                ]
            },
            {
                "filename": "law_346_094G0238_1994-07-05.json",
                "title": "DECRETO 19 aprile 1994, n. 431",
                "subject": "Regolamento recante modificazioni al regolamento sulle modalita' per la gestione del Fondo di solidarieta' per le vittime dell'estorsione e per la concessione e la liquidazione delle relative elargizioni, adottato con decreto ministeriale 12 agosto 1992, n. 396.",
                "type": "decreto",
                "number": "431",
                "year": "1994",
                "editorial_code": "094G0238",
                "gazette_reference": "(GU n.155 del 05-07-1994)",
                "publication_date": "1994-04-19",
                "gazette_date": "1994-07-05",
                "valid_from": "1994-07-20",
                "last_updated": "",
                "link_gazette": "http://www.gazzettaufficiale.it/eli/gu/1994/07/05/155/sg/pdf",
                "link_urn_nir": "http://www.normattiva.it/uri-res/N2Ls?urn:nir:stato:decreto:1994-04-19;431",
                "link_eli_id": "http://www.normattiva.it/eli/id/1994/07/05/094G0238",
                "link_eli_type": "http://www.normattiva.it/eli/stato/DECRETO/1994/04/19/431",
                "id": "art_1_law_346_094G0238_1994-07-05.json",
                "article_number": "1",
                "article_text": [
                    "                     IL MINISTRO DELL'INDUSTRIA \n                  DEL COMMERCIO E DELL'ARTIGIANATO \n                           DI CONCERTO CON \n  I MINISTRI DEL TESORO, DELLE FINANZE, DELL'INTERNO E DI GRAZIA E \n                              GIUSTIZIA \n  Visto il decreto-legge 31 dicembre 1991, n.  419,  convertito,  con\nmodificazioni,  dalla  legge  18  febbraio  1992,  n.  172,   recante\nl'istituzione del Fondo di  sostegno  per  le  vittime  di  richieste\nestorsive; \n  Visto il decreto  del  Ministro  dell'industria,  del  commercio  e\ndell'artigianato 12 agosto 1992, n. 396, con il  quale,  di  concerto\ncon i Ministri del tesoro, delle finanze, dell'interno e di grazia  e\ngiustizia, sono state disciplinate ai sensi dell'art. 5, comma 4, del\npredetto decreto n. 419/1991 le modalita' per la gestione  del  sopra\nindicato Fondo e per la concessione e la liquidazione delle  relative\nelargizioni; \n  Visto il decreto-legge 27 settembre 1993, n. 382,  convertito,  con\nmodificazioni, dalla legge 18 novembre 1993, n. 468,  recante  misure\nurgenti a sostegno delle  vittime  di  richieste  estorsive,  che  ha\napportato   alcune   modificazioni   ed   integrazioni   al    citato\ndecreto-legge n. 419/1991; \n  Visto l'art. 15, comma 1, del decreto-legge 11 luglio 1992, n. 333,\nconvertito, con modificazioni, dalla legge 8 agosto 1992, n. 359, che\nha trasformato l'Istituto nazionale delle assicurazioni  in  societa'\nper azioni; \n  Ritenuta la necessita', in ragione delle predette modificazioni  ed\nintegrazioni, di apportare alcune  modifiche  al  citato  decreto  n.\n396/1992, anche al fine di semplificare ed  accelerare  le  procedure\nper la concessione dell'elargizione; \n  Considerato  che  ai  sensi  del  citato  art.  5,  comma  4,   del\ndecreto-legge n. 419/1991, in deroga a quanto stabilito dall'art. 17,\ncomma 4, della legge 23 agosto 1988, n.  400,  per  l'emanazione  del\npresente decreto non e' richiesto il previo parere del  Consiglio  di\nStato; \n  Vista la comunicazione al Presidente del Consiglio dei Ministri,  a\nnorma dell'art. 17, comma 3, della citata legge n. 400 del 1988,  con\nnota n. 15845 del 2 febbraio 1994; \n                             A D O T T A \n                      il seguente regolamento: \n                               Art. 1. \n  1.  Il  decreto  del  Ministro  dell'industria,  del  commercio   e\ndell'artigianato 12 agosto 1992, n. 396, adottato di concerto  con  i\nMinistri del tesoro,  delle  finanze,  dell'interno  e  di  grazia  e\ngiustizia e recante il  regolamento  inerente  le  modalita'  per  la\ngestione del Fondo di solidarieta' per le vittime  dell'estorsione  e\nper la concessione e la liquidazione delle relative  elargizioni,  e'\ncosi' modificato: \n    a) nel comma 1 dell'art. 1 le parole: \"presidente o, in sua vece,\ndal direttore generale dell'Istituto nazionale  delle  assicurazioni\"\nsono sostituite dalle seguenti: \"presidente, o da  un  suo  delegato,\ndella Concessionaria di servizi assicurativi pubblici S.p.a.\"; \n    b) nel comma 4 dell'art. 1 sono aggiunte, in fine, dopo il punto,\nle  seguenti  parole:  \"La  Concessionaria  di  servizi  assicurativi\npubblici S.p.a. provvede a dotare l'ufficio dei beni, degli strumenti\ne del personale amministrativo in numero non inferiore a  due  e  non\nsuperiore a quattro unita', ponendo le relative spese  a  carico  del\nFondo.\"; \n    c) al comma 5 dell'art. 1  e'  aggiunto,  in  fine,  il  seguente\nperiodo: \"Le amministrazioni interessate  assicurano  ogni  possibile\ncollaborazione per agevolare l'espletamento dei compiti del  comitato\ne dell'ufficio di segreteria tecnica.\"; \n    d) al comma 1 dell'art. 2, la  lettera  a)  e'  sostituita  dalla\nseguente: \" a)  accertare,  previo  espletamento  di  ogni  attivita'\nistruttoria utile,  l'esistenza  dei  requisiti  e  delle  condizioni\nnecessarie per la concessione dell'elargizione prevista dall'art.  1,\ncomma 1, della legge  e  della  relativa  provvisionale,  cosi'  come\nstabilito dall'art. 4 della legge stessa.  A  tal  fine  il  comitato\nacquisisce anche  a  mezzo  del  prefetto  della  provincia  nel  cui\nterritorio si e' verificato l'evento denunciato,  oltre  al  rapporto\niniziale di cui all'art. 5-bis, comma 1, della legge,  una  relazione\ndettagliata in ordine alla natura del fatto che ha cagionato il danno\npatrimoniale, al nesso di causalita', ai singoli presupposti positivi\ne negativi  previsti  dalla  legge,  nonche'  all'entita'  del  danno\npatrimoniale. Il prefetto, raccolti  gli  elementi  dagli  organi  di\npolizia e dagli altri organi tecnici competenti,  provvede  all'invio\ndella  relazione  in  tempo  utile  al  rispetto  dei   termini   del\nprocedimento. Ai fini della  relazione,  il  prefetto  puo'  ottenere\ndall'autorita' giudiziaria copie di atti e informazioni  scritte  sul\nloro contenuto, nei limiti di quanto previsto dall'art. 5-bis,  comma\n2,  della  legge.  Il  comitato  puo'  inoltre   esperire   ulteriori\naccertamenti e richiedere alla competente autorita' giudiziaria,  nei\npredetti limiti, copie  di  atti  e  informazioni  scritte  sul  loro\ncontenuto;\"; \n    e) nell'art.  2,  comma  1,  lettera  b),  dopo  le  parole:  \"da\nassumere\" sono aggiunte, prima della virgola, le seguenti: \"in ordine\nalle elargizioni e alle provvisionali\"; \n    f)  nell'art.  2,  comma  1,   lettera   d),   tra   le   parole:\n\"dell'elargizione\" e le parole: \"nei casi previsti dalla legge\"  sono\ninserite le seguenti: \"e della provvisionale\"; \n    g) nell'art. 2 e' aggiunto il seguente comma: \n  \" 2. Nello svolgimento dei compiti indicati nel comma 1 il comitato\npuo' avvalersi delle prestazioni di uno o piu' periti,  retribuiti  a\ntariffa  professionale  quando,  tenuto  conto  anche   dei   termini\nstabiliti per il procedimento, il ricorso a tali prestazioni e'  reso\nnecessario dalla complessita' degli accertamenti o delle verifiche da\neffettuare. Le relative spese sono poste a carico del Fondo.\"; \n    h) al comma 1 dell'art. 3, tra le parole: \"delle  elargizioni\"  e\nle parole: \"di cui al comma 2\" sono inserite le  seguenti:  \"e  delle\nprovvisionali\"; \n    i) al  comma  2  dell'art.  3,  tra  le  parole:  \"dell'ammontare\ncomplessivo  dell'elargizione\"  e  le  parole:   \"che   puo'   essere\ncorrisposta\" sono  inserite  le  seguenti:  \"o  dell'ammontare  della\nprovvisionale\", e le parole: \"venti per cento\" sono sostituite  dalle\nseguenti: \"cinquanta per cento\"; \n    l) al comma 2 dell'art. 4, le parole:  \"giorni  centoventi\"  sono\nsostituite dalle seguenti: \"giorni novanta\"; \n    m) negli articoli 5, comma 2, 7,  comma  2,  e  8,  comma  1,  le\nparole: \"dell'Istituto nazionale delle assicurazioni\" sono sostituite\ndalle  seguenti:  \"della  Concessionaria  di   servizi   assicurativi\npubblici S.p.a.\"; \n    n) al comma 1 dell'art. 6, le parole: \"revoca  del  provvedimento\ndi concessione ai sensi dell'art. 4, commi 4 e 5, della legge,\"  sono\nsostituite dalle seguenti: \"revoca del provvedimento  di  concessione\ndell'elargizione o della provvisionale ai sensi dell'art. 4, commi 4,\n4-bis e 5, della legge,\"; \n    o) negli articoli 7, comma 1,  e  8,  comma  3,  lettera  b),  le\nparole: \"L'Istituto nazionale delle assicurazioni\" e:  \"dall'Istituto\nnazionale  delle  assicurazioni\"  sono  sostituite,  rispettivamente,\ndalle seguenti: \"La Concessionaria di servizi  assicurativi  pubblici\nS.p.a.\" e \"dalla  Concessionaria  di  servizi  assicurativi  pubblici\nS.p.a.\"; \n    p) all'art. 11, e' aggiunto il seguente comma: \n  \" 4. Il comitato, direttamente o per  tramite  del  prefetto,  puo'\nchiedere chiarimenti all'interessato e puo' invitarlo ad integrare la\ndocumentazione mancante.\". \n  Il presente decreto, munito del sigillo dello Stato, sara' inserito\nnella  Raccolta  ufficiale  degli  atti  normativi  della  Repubblica\nitaliana. E' fatto obbligo a chiunque spetti di osservarlo e di farlo\nosservare. \n   Roma, 19 aprile 1994 \n     Il Ministro dell'industria del commercio e dell'artigianato \n                               SAVONA \n                       Il Ministro del tesoro \n                               BARUCCI \n                      Il Ministro delle finanze \n                                GALLO \n                      Il Ministro dell'interno \n                               MANCINO \n                  Il Ministro di grazia e giustizia \n                                CONSO \nVisto, il Guardasigili: CONSO \n  Registrato alla Corte dei conti il 6 giugno 1994 \n  Registro n. 1 Industria, foglio n. 33 "
                ]
            },
            {
                "filename": "law_3_089G0242_1989-05-25.json",
                "title": "DECRETO DEL PRESIDENTE DELLA REPUBBLICA 5 agosto 1987, n. 645",
                "subject": "Istituzione di un istituto professionale di Stato alberghiero in Cassino.",
                "type": "decreto.del.presidente.della.repubblica",
                "number": "645",
                "year": "1987",
                "editorial_code": "089G0242",
                "gazette_reference": "(GU n.120 del 25-05-1989)",
                "publication_date": "1987-08-5",
                "gazette_date": "1989-05-25",
                "valid_from": "1989-06-09",
                "last_updated": "",
                "link_gazette": "http://www.gazzettaufficiale.it/eli/gu/1989/05/25/120/sg/pdf",
                "link_urn_nir": "http://www.normattiva.it/uri-res/N2Ls?urn:nir:stato:decreto.del.presidente.della.repubblica:1987-08-5;645",
                "link_eli_id": "http://www.normattiva.it/eli/id/1989/05/25/089G0242",
                "link_eli_type": "http://www.normattiva.it/eli/stato/DECRETO_DEL_PRESIDENTE_DELLA_REPUBBLICA/1987/08/5/645",
                "id": "art_4_law_3_089G0242_1989-05-25.json",
                "article_number": "4",
                "article_text": [
                    "                               Art. 4.\n  Con   deliberazione   del   consiglio   di   istituto,   sottoposta\nall'approvazione del competente organo della regione, sono  stabilite\nle  sezioni  che debbono funzionare ogni anno nell'istituto e vengono\nfissate le particolari modalita' di attuazione.\n  Le variazioni annuali da apportare al numero ed ai tipi delle varie\nscuole e sezioni, potranno essere disposte  sempre  che  la  relativa\nspesa possa rientrare nelle disponibilita' di bilancio dell'istituto.\n  Qualora  tale  spesa,  ritenuta  indispensabile  dal  consiglio  di\nistituto, non possa  essere  sostenuta  dal  bilancio  dell'istituto,\npotra'  provvedersi  alla  istituzione  di  nuove  scuole  e  sezioni\nmediante la normale procedura e con i fondi annualmente stanziati nel\nbilancio  del  Ministero della pubblica istruzione per la istituzione\ndi nuove scuole e istituti di istruzione tecnica e professionale.\n  Nel  caso previsto dal precedente terzo comma del presente articolo\nla   deliberazione   del   consiglio   di   istituto   e'    soggetta\nall'approvazione del Ministero della pubblica istruzione."
                ]
            },
            {
                "filename": "law_71_092G0561_1992-12-31.json",
                "title": "DECRETO-LEGGE 31 dicembre 1992, n. 513",
                "subject": "Armonizzazione delle disposizioni in materia di imposte sugli oli minerali, sull'alcole, sulle bevande alcoliche, sui tabacchi lavorati e in materia di IVA con quelle recate da direttive CEE e modificazioni conseguenti a detta armonizzazione, nonche' disposizioni concernenti la disciplina dei Centri autorizzati di assistenza fiscale, le procedure dei rimborsi di imposta, l'esclusione dall'ILOR dei redditi di impresa fino all'ammontare corrispondente al contributo diretto lavorativo, l'istituzione per il 1993 di un'imposta erariale straordinaria su taluni beni ed altre disposizioni tributarie.",
                "type": "decreto.legge",
                "number": "513",
                "year": "1992",
                "editorial_code": "092G0561",
                "gazette_reference": "(GU n.306 del 31-12-1992)",
                "publication_date": "1992-12-31",
                "gazette_date": "1992-12-31",
                "valid_from": "1993-03-02",
                "last_updated": "(Ultimo aggiornamento all'atto pubblicato il 09/01/1993)",
                "link_gazette": "http://www.gazzettaufficiale.it/eli/gu/1992/12/31/306/sg/pdf",
                "link_urn_nir": "http://www.normattiva.it/uri-res/N2Ls?urn:nir:stato:decreto.legge:1992-12-31;513",
                "link_eli_id": "http://www.normattiva.it/eli/id/1992/12/31/092G0561",
                "link_eli_type": "http://www.normattiva.it/eli/stato/DECRETO_LEGGE/1992/12/31/513",
                "id": "art_24_law_71_092G0561_1992-12-31.json",
                "article_number": "24",
                "article_text": [
                    "                              Art. 24. \n    DECRETO DECADUTO; I SUOI EFFETTI SONO STATI FATTI SALVI DALLA \n                     L. 29 OTTOBRE 1993, N. 427 "
                ]
            }
        ]
    },
    {
        "unit_id": "unit_5",
        "token_input": "EHEOXCZMYO",
        "token_output": "ROOKELXXTP",
        "documents": [
            {
                "filename": "law_282_099G0357_1999-08-11.json",
                "title": "DECRETO 2 agosto 1999, n. 278",
                "subject": "Regolamento recante norme concernenti l'istituzione di nuove scommesse a totalizzatore o a quota fissa, ai sensi dell'articolo 16 della legge 13 maggio 1999, n. 133.",
                "type": "decreto",
                "number": "278",
                "year": "1999",
                "editorial_code": "099G0357",
                "gazette_reference": "(GU n.187 del 11-08-1999)",
                "publication_date": "1999-08-2",
                "gazette_date": "1999-08-11",
                "valid_from": "2006-04-05",
                "last_updated": "(Ultimo aggiornamento all'atto pubblicato il 31/12/2018)",
                "link_gazette": "http://www.gazzettaufficiale.it/eli/gu/1999/08/11/187/sg/pdf",
                "link_urn_nir": "http://www.normattiva.it/uri-res/N2Ls?urn:nir:stato:decreto:1999-08-2;278",
                "link_eli_id": "http://www.normattiva.it/eli/id/1999/08/11/099G0357",
                "link_eli_type": "http://www.normattiva.it/eli/stato/DECRETO/1999/08/2/278",
                "id": "art_26_law_282_099G0357_1999-08-11.json",
                "article_number": "26",
                "article_text": [
                    "                                Art. 26\n                      Rendicontazione contabile.\n\n    ((1.   Al   fine   di   mettere   a  disposizione  quanto  dovuto\n  all'Amministrazione    autonoma   dei   monopoli   di   Stato,   il\n  concessionario  e'  tenuto  ad  effettuare  i  relativi  versamenti\n  secondo  modalita'  e  tempi  definiti  con  decreto  del Ministero\n  dell'economia  e  delle  finanze  -  Amministrazione  autonoma  dei\n  monopoli di Stato.)) ((5))\n    2.  Le  modalita'  operative di gestione degli importi dovuti dal\n  concessionario,     la     loro     allocazione     nel    bilancio\n  dell'Amministrazione  autonoma  dei  monopoli  di Stato, nonche' le\n  modalita'  ed  i  tempi del versamento di quanto dovuto agli aventi\n  diritto,  sono  definiti  con decreto del Ministero dell'economia e\n  delle finanze - Amministrazione autonoma dei monopoli di Stato.\n    3.  Il  concessionario  apre un conto corrente bancario sul quale\n  l'Amministrazione  autonoma  dei  monopoli  di Stato, con ((cadenza\n  settimanale)), in base alle informazioni ricevute dal totalizzatore\n  nazionale  relativamente  agli importi corrispondenti alle ricevute\n  di  partecipazione  vincenti  e  soggette a rimborso verificate dal\n  singolo   concessionario,   effettua   il  versamento  dell'importo\n  complessivo  delle vincite e dei rimborsi di cui agli articoli 24 e\n  25.  Il  concessionario  provvede  al pagamento delle vincite e dei\n  rimborsi  a  ciascun  partecipante  con le modalita' indicate dallo\n  stesso,  entro  e non oltre i termini di cui agli articoli 24 e 25.\n  ((5))\n    4.  Gli  adempimenti  contabili, giudiziali ed amministrativi del\n  concessionario,  compresi i modelli da utilizzare per il versamento\n  del  saldo settimanale e quelli attestanti il regolare utilizzo dei\n  fondi  versati  dall'Amministrazione autonoma dei monopoli di Stato\n  sul  conto  corrente  del  concessionario  per  il  pagamento delle\n  vincite  e dei rimborsi di cui agli articoli 24 e 25, sono definiti\n  con   decreto   del  Ministero  dell'economia  e  delle  finanze  -\n  Amministrazione autonoma dei monopoli di Stato. (3)\n  ---------------\n  AGGIORNAMENTO (3)\n    Il decreto 5 agosto 2004, n. 229 ha disposto (con l'art. 2, comma\n  1)  che  \"Le  disposizioni del decreto del Ministro delle finanze 2\n  agosto  1999,  n.  278,  come  modificato dal presente regolamento,\n  trovano applicazione dalla data del primo programma di accettazione\n  di  scommesse  approvato  successivamente  alla  data di entrata in\n  vigore  del  presente  regolamento.  Relativamente alle scommesse a\n  totalizzatore  ovvero  a  quota  fissa  accettate  sulla  base  dei\n  programmi  approvati  prima  della  data  di  entrata in vigore del\n  presente  regolamento  continuano  ad applicarsi le disposizioni in\n  vigore alla data di approvazione dei medesimi programmi.\"\n  --------------\n  AGGIORNAMENTO (5)\n    Il decreto 6 agosto 2007, n. 129 ha disposto (con l'art. 2, comma\n  1)  che  \"Le  disposizioni del decreto del Ministro delle finanze 2\n  agosto  1999,  n. 278, modificate dal presente regolamento, trovano\n  applicazione  dalla  data  del  primo  programma di accettazione di\n  scommesse  approvato successivamente alla data di entrata in vigore\n  del   presente   regolamento.   Relativamente   alle   scommesse  a\n  totalizzatore  accettate  sulla  base dei programmi approvati prima\n  della data di entrata in vigore del presente regolamento continuano\n  ad  applicarsi  le disposizioni in vigore alla data di approvazione\n  dei medesimi programmi.\""
                ]
            },
            {
                "filename": "law_489_093G0170_1993-04-24.json",
                "title": "DECRETO LEGISLATIVO 29 marzo 1993, n. 119",
                "subject": "Disciplina del cambiamento delle generalita' per la protezione di coloro che collaborano con la giustizia.",
                "type": "decreto.legislativo",
                "number": "119",
                "year": "1993",
                "editorial_code": "093G0170",
                "gazette_reference": "(GU n.95 del 24-04-1993)",
                "publication_date": "1993-03-29",
                "gazette_date": "1993-04-24",
                "valid_from": "1993-05-09",
                "last_updated": "(Ultimo aggiornamento all'atto pubblicato il 29/06/2020)",
                "link_gazette": "http://www.gazzettaufficiale.it/eli/gu/1993/04/24/95/sg/pdf",
                "link_urn_nir": "http://www.normattiva.it/uri-res/N2Ls?urn:nir:stato:decreto.legislativo:1993-03-29;119",
                "link_eli_id": "http://www.normattiva.it/eli/id/1993/04/24/093G0170",
                "link_eli_type": "http://www.normattiva.it/eli/stato/DECRETO_LEGISLATIVO/1993/03/29/119",
                "id": "art_7_law_489_093G0170_1993-04-24.json",
                "article_number": "7",
                "article_text": [
                    "                               Art. 7.\n     Residenza della persona ammessa allo speciale programma di\n                      protezione. Notificazioni\n  1. L'autorita' di cui all'art. 2 direttamente o a mezzo di  persona\ndelegata   provvede   a   richiedere  alle  competenti  autorita'  le\nvariazioni ed i trasferimenti delle iscrizioni  anagrafiche  relative\nalle  precedenti  generalita'  della  persona  ammessa  allo speciale\nprogramma di protezione, in localita' stabilita dal servizio centrale\ndi protezione.\n  2. Alla residenza fissata ai sensi del comma  1  sono  eseguite  le\nnotificazioni  a  norma  degli  articoli  157 del codice di procedura\npenale e 139 del codice di procedura civile.\n  3. Gli agenti del servizio centrale  di  protezione  e  le  persone\nrichieste  di  collaborare  con  essi  sono  tenuti a consegnare alla\npersona ammessa allo speciale programma  di  protezione  i  plichi  e\naltri  effetti postali, nonche' gli atti notificati ad essa pervenuti\nsotto le  precedenti  generalita',  con  esclusione  del  certificato\nelettorale,  facendosene  rilasciare ricevuta da custodirsi agli atti\ndel servizio."
                ]
            },
            {
                "filename": "law_210_092G0419_1992-09-12.json",
                "title": "DECRETO-LEGGE 11 settembre 1992, n. 374",
                "subject": "Disposizioni urgenti concernenti l'incremento dell'organico del Corpo di polizia penitenziaria, il trattamento di persone detenute affette da infezione da HIV, le modifiche al testo unico delle leggi in materia di stupefacenti e le norme per l'attivazione di nuovi uffici giudiziari.",
                "type": "decreto.legge",
                "number": "374",
                "year": "1992",
                "editorial_code": "092G0419",
                "gazette_reference": "(GU n.215 del 12-09-1992)",
                "publication_date": "1992-09-11",
                "gazette_date": "1992-09-12",
                "valid_from": "1992-11-12",
                "last_updated": "(Ultimo aggiornamento all'atto pubblicato il 14/07/1993)",
                "link_gazette": "http://www.gazzettaufficiale.it/eli/gu/1992/09/12/215/sg/pdf",
                "link_urn_nir": "http://www.normattiva.it/uri-res/N2Ls?urn:nir:stato:decreto.legge:1992-09-11;374",
                "link_eli_id": "http://www.normattiva.it/eli/id/1992/09/12/092G0419",
                "link_eli_type": "http://www.normattiva.it/eli/stato/DECRETO_LEGGE/1992/09/11/374",
                "id": "art_9_law_210_092G0419_1992-09-12.json",
                "article_number": "9",
                "article_text": [
                    "                               Art. 9. \n       DECRETO DECADUTO; I SUOI EFFETTI SONO STATI FATTI SALVI \n                   DALLA L. 14 LUGLIO 1993, N. 222 "
                ]
            },
            {
                "filename": "law_481_099G0136_1999-03-31.json",
                "title": "DECRETO LEGISLATIVO 16 marzo 1999, n. 79",
                "subject": "Attuazione della direttiva 96/92/CE recante norme comuni per il mercato interno dell'energia elettrica.",
                "type": "decreto.legislativo",
                "number": "79",
                "year": "1999",
                "editorial_code": "099G0136",
                "gazette_reference": "(GU n.75 del 31-03-1999)",
                "publication_date": "1999-03-16",
                "gazette_date": "1999-03-31",
                "valid_from": "1999-04-01",
                "last_updated": "(Ultimo aggiornamento all'atto pubblicato il 22/07/2020)",
                "link_gazette": "http://www.gazzettaufficiale.it/eli/gu/1999/03/31/75/sg/pdf",
                "link_urn_nir": "http://www.normattiva.it/uri-res/N2Ls?urn:nir:stato:decreto.legislativo:1999-03-16;79",
                "link_eli_id": "http://www.normattiva.it/eli/id/1999/03/31/099G0136",
                "link_eli_type": "http://www.normattiva.it/eli/stato/DECRETO_LEGISLATIVO/1999/03/16/79",
                "id": "art_8_law_481_099G0136_1999-03-31.json",
                "article_number": "8",
                "article_text": [
                    "                               Art. 8.\n                       Attivita' di produzione\n  1.  A  decorrere dal 1 gennaio 2003 a nessun soggetto e' consentito\nprodurre  o importare, direttamente o indirettamente, piu' del 50 per\ncento  del  totale  dell'energia  elettrica  prodotta  e importata in\nItalia. Nel caso tale soglia, calcolata come media su base triennale,\nsia  superata,  l'Autorita'  garante  della concorrenza e del mercato\nadotta  i provvedimenti di cui all'articolo 15 della legge 10 ottobre\n1990,  n.  287. A tale scopo, entro la stessa data l'ENEL S.p.a. cede\nnon  meno di 15.000 MW della propria capacita' produttiva. A tal fine\nl'ENEL  S.p.a.  predispone  entro  centoventi  gioni  dall'entrata in\nvigore  del presente decreto un piano per le cessioni degli impianti;\nl'approvazione  del suddetto piano, nonche' la scelta delle modalita'\ndi  alienazione  sono  determinate  con  decreto  del  Presidente del\nConsiglio  dei  Ministri,  su  proposta  del Ministro del tesoro, del\nbilancio  e  della  programmazione  economica,  di  concerto  con  il\nMinistro  dell'industria,  del commercio e dell'artigianato. Il piano\nper   le   cessioni  degli  impianti  deve  consentire  sia  adeguate\ncondizioni  di  mercato sia la necessaria attenzione alla presenza di\npiani  industriali,  al mantenimento della produzione nei siti e alle\nricadute  occupazionali  e  deve  tener conto delle esigenze relative\nalle   attivita'  di  sviluppo,  di  innovazione,  di  ricerca  e  di\ninternazionalizzazione dell'ENEL S.p.a.\n  2.  Ove  il  termine  del  1 gennaio 2003 di cui al comma 1 non sia\ncompatibile,  per  le  condizioni  del mercato, con il rispetto degli\nobblighi  nello  stesso  comma  previsti,  l'Autorita'  garante della\nconcorrenza   e   del  mercato  con  proprio  provvedimento,  sentita\nl'Autorita'  per  l'energia  elettrica  e  il  gas, puo' disporre, su\nrichiesta  del  soggetto  interessato, una proroga non superiore a un\nanno.\n  3.  Fermi restando quanto previsto dal decreto legislativo 31 marzo\n1998,  n.  112,  nonche'  la  disciplina relativa alla valutazione di\nimpatto ambientale, entro un anno dalla data di entrata in vigore del\npresente  decreto  sono  emanati, ai sensi dell'articolo 17, comma 2,\ndella  legge  23  agosto  1988,  n.  400,  uno o piu' regolamenti per\ndisciplinare  l'autorizzazione  alla  costruzione  e all'esercizio di\nnuovi  impianti  di produzione dell'energia elettrica o la modifica o\nil   ripotenziamento  di  impianti  esistenti,  alimentati  da  fonti\nconvenzionali.\n  4. I regolamenti si conformano ai seguenti principi:\n  a)  i  progetti  sono  autorizzati  mediante  lo svolgimento di una\nprocedura  unificata e semplificata, riferita a ciascuna categoria di\nimpianto  nonche'  mediante  il rilascio, in tempi determinati, di un\nunico  provvedimento  riguardante  sia  l'impianto  principale che le\nopere connesse e le infrastrutture indispensabili al suo esercizio;\n  b)  i progetti di modifica o ripotenziamento sono valutati sotto il\nprofilo  urbanistico  solo  in  caso di occupazione di aree esterne a\nquelle di pertinenza dell'impianto esistente.\n  5.  Il  diniego  di  autorizzazione, fondato in ogni caso su motivi\nobiettivi  e  non  discriminatori,  e'  comunicato,  con  la relativa\nmotivazione,  al  richiedente. Del provvedimento e' data informazione\nalla Commissione delle Comunita' europee.\n  6.  Sino  alla  data di entrata in vigore dei regolamenti di cui al\ncomma 3 si applicano le norme e le procedure attualmente vigenti."
                ]
            },
            {
                "filename": "law_415_094G0368_1994-06-13.json",
                "title": "DECRETO DEL PRESIDENTE DELLA REPUBBLICA 18 aprile 1994, n. 362",
                "subject": "Regolamento recante disciplina dei procedimenti di acquisto della cittadinanza italiana.",
                "type": "decreto.del.presidente.della.repubblica",
                "number": "362",
                "year": "1994",
                "editorial_code": "094G0368",
                "gazette_reference": "(GU n.136 del 13-06-1994 - Suppl. Ordinario n. 91)",
                "publication_date": "1994-04-18",
                "gazette_date": "1994-06-13",
                "valid_from": "1994-12-10",
                "last_updated": "",
                "link_gazette": "http://www.gazzettaufficiale.it/eli/gu/1994/06/13/136/so/91/sg/pdf",
                "link_urn_nir": "http://www.normattiva.it/uri-res/N2Ls?urn:nir:stato:decreto.del.presidente.della.repubblica:1994-04-18;362",
                "link_eli_id": "http://www.normattiva.it/eli/id/1994/06/13/094G0368",
                "link_eli_type": "http://www.normattiva.it/eli/stato/DECRETO_DEL_PRESIDENTE_DELLA_REPUBBLICA/1994/04/18/362",
                "id": "art_8_law_415_094G0368_1994-06-13.json",
                "article_number": "8",
                "article_text": [
                    "                               Art. 8. \n                           Norme abrogate \n  1. Ai sensi dell'articolo 2, comma 8, della legge 24 dicembre 1993,\nn. 537, a decorrere dalla data di  entrata  in  vigore  del  presente\nregolamento sono abrogate, limitatamente alle parti modificate con il\npresente regolamento, le seguenti norme: l'articolo 7, comma 1, della\nlegge 5 febbraio 1992, n. 91, e gli articoli 4, 7, 14, commi 1, 2 e 4\ndel decreto del Presidente della Repubblica 12 ottobre 1993, n. 572. "
                ]
            },
            {
                "filename": "law_561_094G0245_1994-04-01.json",
                "title": "DECRETO-LEGGE 31 marzo 1994, n. 216",
                "subject": "Norme per l'accelerazione delle procedure di dismissione di partecipazioni del Ministero del tesoro in societa' per azioni.",
                "type": "decreto.legge",
                "number": "216",
                "year": "1994",
                "editorial_code": "094G0245",
                "gazette_reference": "(GU n.76 del 01-04-1994)",
                "publication_date": "1994-03-31",
                "gazette_date": "1994-04-01",
                "valid_from": "1994-06-01",
                "last_updated": "(Ultimo aggiornamento all'atto pubblicato il 23/05/1994)",
                "link_gazette": "http://www.gazzettaufficiale.it/eli/gu/1994/04/01/76/sg/pdf",
                "link_urn_nir": "http://www.normattiva.it/uri-res/N2Ls?urn:nir:stato:decreto.legge:1994-03-31;216",
                "link_eli_id": "http://www.normattiva.it/eli/id/1994/04/01/094G0245",
                "link_eli_type": "http://www.normattiva.it/eli/stato/DECRETO_LEGGE/1994/03/31/216",
                "id": "art_4_law_561_094G0245_1994-04-01.json",
                "article_number": "4",
                "article_text": [
                    "                             Art. 4. \n       DECRETO DECADUTO; I SUOI EFFETTI SONO STATI FATTI SALVI \n                   DALLA L. 30 LUGLIO 1994, N. 474 "
                ]
            },
            {
                "filename": "law_1120_080U0145_1980-04-24.json",
                "title": "DECRETO DEL PRESIDENTE DELLA REPUBBLICA 15 gennaio 1980, n. 145",
                "subject": "Nuova disciplina del premio industriale corrisposto al personale dell'Azienda autonoma delle ferrovie dello Stato e nuove misure giornaliere del premio stesso.",
                "type": "decreto.del.presidente.della.repubblica",
                "number": "145",
                "year": "1980",
                "editorial_code": "080U0145",
                "gazette_reference": "(GU n.113 del 24-04-1980)",
                "publication_date": "1980-01-15",
                "gazette_date": "1980-04-24",
                "valid_from": "1986-01-14",
                "last_updated": "(Ultimo aggiornamento all'atto pubblicato il 30/12/1985)",
                "link_gazette": "http://www.gazzettaufficiale.it/eli/gu/1980/04/24/113/sg/pdf",
                "link_urn_nir": "http://www.normattiva.it/uri-res/N2Ls?urn:nir:stato:decreto.del.presidente.della.repubblica:1980-01-15;145",
                "link_eli_id": "http://www.normattiva.it/eli/id/1980/04/24/080U0145",
                "link_eli_type": "http://www.normattiva.it/eli/stato/DECRETO_DEL_PRESIDENTE_DELLA_REPUBBLICA/1980/01/15/145",
                "id": "art_6_law_1120_080U0145_1980-04-24.json",
                "article_number": "6",
                "article_text": [
                    "                               Art. 6.\n\n  Con  decorrenza  1 ottobre 1978 e' abrogato il compenso giornaliero\nprevisto dal punto B dell'art. 45 delle disposizioni sulle competenze\naccessorie  del  personale dell'Azienda autonoma delle ferrovie dello\nStato,  approvate  con la legge 11 febbraio 1970, n. 34, e successive\nmodificazioni,  per  i  capo  treno  utilizzati  esclusivamente  alla\nscritturazione presso i depositi personale viaggiante, il cui importo\ne'  assorbito,  con  identica  decorrenza,  nella  misura  di  premio\nindustriale,  attribuito  con  decreto del Ministro dei trasporti, di\ncui  al secondo comma dell'art. 1 del presente decreto, al capo treno\nsvolgenti le mansioni sopra indicate."
                ]
            },
            {
                "filename": "law_493_099G0116_1999-03-22.json",
                "title": "DECRETO 22 febbraio 1999, n. 67",
                "subject": "Regolamento recante norme concernenti l'istituzione ed il regime dei depositi fiscali e la circolazione nonche' le attivita' di accertamento e di controllo delle imposte riguardanti i tabacchi lavorati.",
                "type": "decreto",
                "number": "67",
                "year": "1999",
                "editorial_code": "099G0116",
                "gazette_reference": "(GU n.67 del 22-03-1999)",
                "publication_date": "1999-02-22",
                "gazette_date": "1999-03-22",
                "valid_from": "1999-04-06",
                "last_updated": "(Ultimo aggiornamento all'atto pubblicato il 18/06/2002)",
                "link_gazette": "http://www.gazzettaufficiale.it/eli/gu/1999/03/22/67/sg/pdf",
                "link_urn_nir": "http://www.normattiva.it/uri-res/N2Ls?urn:nir:stato:decreto:1999-02-22;67",
                "link_eli_id": "http://www.normattiva.it/eli/id/1999/03/22/099G0116",
                "link_eli_type": "http://www.normattiva.it/eli/stato/DECRETO/1999/02/22/67",
                "id": "art_13_law_493_099G0116_1999-03-22.json",
                "article_number": "13",
                "article_text": [
                    "                              Art. 13.\n      Revoca e decadenza dell'autorizzazione di deposito fiscale\n  1.  L'autorizzazione  alla  istituzione  dei  depositi  fiscali  e'\nrevocata, ovvero il depositario  autorizzato decade dalla stessa, nei\ncasi di:\n  a) violazione di una o  piu' prescrizioni stabilite da disposizioni\ntributarie  anche in  materia  di imposizione  diretta  e sul  valore\naggiunto ovvero dal presente regolamento;\n  b) perdita di uno o piu' requisiti indicati nell'articolo 3.\n  2. Nei casi  indicati al comma 1, l'Amministazione  dei monopoli di\nStato  formula   le  contestazioni  nei  confronti   del  depositario\nautorizzato, assegnando un  termine per le deduzioni  non inferiore a\ngiorni  trenta.  Decorso  tale  termine  l'Amministrazione  adotta  i\nconseguenti provvedimenti.\n  3. L'Amministrazione autonoma dei monopoli  di Stato puo', nei casi\ndi  constatata  grave  violazione,   disporre  con  provvedimento  di\nurgenza, la sospensione, in via cautelativa, dell'autorizzazione."
                ]
            },
            {
                "filename": "law_98_093G0558_1993-12-09.json",
                "title": "DECRETO LEGISLATIVO 15 novembre 1993, n. 507",
                "subject": "Revisione ed armonizzazione dell'imposta comunale sulla pubblicita' e del diritto sulle pubbliche affissioni, della tassa per l'occupazione di spazi ed aree pubbliche dei comuni e delle province nonche' della tassa per lo smaltimento dei rifiuti solidi urbani a norma dell'art. 4 della legge 23 ottobre 1992, n. 421, concernente il riordino della finanza territoriale.",
                "type": "decreto.legislativo",
                "number": "507",
                "year": "1993",
                "editorial_code": "093G0558",
                "gazette_reference": "(GU n.288 del 09-12-1993 - Suppl. Ordinario n. 108)",
                "publication_date": "1993-11-15",
                "gazette_date": "1993-12-09",
                "valid_from": "2020-03-01",
                "last_updated": "(Ultimo aggiornamento all'atto pubblicato il 29/02/2020)",
                "link_gazette": "http://www.gazzettaufficiale.it/eli/gu/1993/12/09/288/so/108/sg/pdf",
                "link_urn_nir": "http://www.normattiva.it/uri-res/N2Ls?urn:nir:stato:decreto.legislativo:1993-11-15;507",
                "link_eli_id": "http://www.normattiva.it/eli/id/1993/12/09/093G0558",
                "link_eli_type": "http://www.normattiva.it/eli/stato/DECRETO_LEGISLATIVO/1993/11/15/507",
                "id": "art_49_law_98_093G0558_1993-12-09.json",
                "article_number": "49",
                "article_text": [
                    "                               Art. 49 \n \n         ARTICOLO ABROGATO DALLA L. 27 DICEMBRE 2019, N. 160 \n                                                          (33) ((34)) \n \n--------------- \nAGGIORNAMENTO (33) \n  La L. 27 dicembre 2019, n. 160 ha disposto  (con  l'art.  1,  comma\n847)che \"Restano ferme le disposizioni inerenti alla  pubblicita'  in\nambito  ferroviario  e  quelle   che   disciplinano   la   propaganda\nelettorale. Il capo II del decreto legislativo n. 507 del 1993 rimane\ncome riferimento per la determinazione della tassa per  l'occupazione\ndi spazi ed aree pubbliche appartenenti  alle  regioni  di  cui  agli\narticoli 5 della legge 16 maggio  1970,  n.  281,  e  8  del  decreto\nlegislativo 6 maggio 2011, n. 68.\" \n---------- \nAGGIORNAMENTO (34) \n  Il D.L. 30 dicembre 2019,  n.  162,  convertito  con  modificazioni\ndalla L. 28 febbraio 2020, n. 8, nel modificare l'art. 1,  comma  847\ndella L. 27 dicembre 2019, n. 160, ha conseguentemente disposto  (con\nl'art. 4, comma 3-quater) che \"Limitatamente  all'anno  2020  non  ha\neffetto l'abrogazione disposta dal comma 847  dell'articolo  1  della\nlegge 27 dicembre 2019, n. 160; si applicano, per il  medesimo  anno,\nl'imposta comunale sulla pubblicita' e  il  diritto  sulle  pubbliche\naffissioni nonche' la  tassa  per  l'occupazione  di  spazi  ed  aree\npubbliche, di  cui  rispettivamente  ai  capi  I  e  II  del  decreto\nlegislativo  15  novembre  1993,  n.  507,  nonche'  il  canone   per\nl'installazione dei mezzi pubblicitari e il canone per  l'occupazione\ndi spazi ed aree pubbliche, di cui rispettivamente agli articoli 62 e\n63 del decreto legislativo 15 dicembre 1997, n. 446\". "
                ]
            },
            {
                "filename": "law_15_089G0211_1989-05-17.json",
                "title": "DECRETO DEL PRESIDENTE DELLA REPUBBLICA 14 ottobre 1987, n. 633",
                "subject": "Istituzione di un istituto professionale di Stato femminile in Roma.",
                "type": "decreto.del.presidente.della.repubblica",
                "number": "633",
                "year": "1987",
                "editorial_code": "089G0211",
                "gazette_reference": "(GU n.113 del 17-05-1989)",
                "publication_date": "1987-10-14",
                "gazette_date": "1989-05-17",
                "valid_from": "1989-06-01",
                "last_updated": "",
                "link_gazette": "http://www.gazzettaufficiale.it/eli/gu/1989/05/17/113/sg/pdf",
                "link_urn_nir": "http://www.normattiva.it/uri-res/N2Ls?urn:nir:stato:decreto.del.presidente.della.repubblica:1987-10-14;633",
                "link_eli_id": "http://www.normattiva.it/eli/id/1989/05/17/089G0211",
                "link_eli_type": "http://www.normattiva.it/eli/stato/DECRETO_DEL_PRESIDENTE_DELLA_REPUBBLICA/1987/10/14/633",
                "id": "art_14_law_15_089G0211_1989-05-17.json",
                "article_number": "14",
                "article_text": [
                    "                               Art. 14.\n  Il   riscontro   della   gestione   finanziaria   e  amministrativa\ndell'istituto e' affidato a due revisori dei conti, dei quali uno  e'\nnominato  dal  Ministro  della  pubblica  istruzione  e  l'altro  dal\nMinistro del tesoro.\n  I revisori esaminano il bilancio preventivo e il conto consuntivo e\ncompiono tutte le verifiche necessarie per assicurarsi  del  regolare\nandamento della gestione dell'istituto."
                ]
            }
        ]
    },
    {
        "unit_id": "unit_6",
        "token_input": "WIHXLTNCRO",
        "token_output": "UEUGMHUYWR",
        "documents": [
            {
                "filename": "law_480_094G0291_1994-05-19.json",
                "title": "DECRETO LEGISLATIVO 16 aprile 1994, n. 297",
                "subject": "Approvazione del testo unico delle disposizioni legislative vigenti in materia di istruzione, relative alle scuole di ogni ordine e grado.",
                "type": "decreto.legislativo",
                "number": "297",
                "year": "1994",
                "editorial_code": "094G0291",
                "gazette_reference": "(GU n.115 del 19-05-1994 - Suppl. Ordinario n. 79)",
                "publication_date": "1994-04-16",
                "gazette_date": "1994-05-19",
                "valid_from": "1994-06-03",
                "last_updated": "(Ultimo aggiornamento all'atto pubblicato il 31/12/2020)",
                "link_gazette": "http://www.gazzettaufficiale.it/eli/gu/1994/05/19/115/so/79/sg/pdf",
                "link_urn_nir": "http://www.normattiva.it/uri-res/N2Ls?urn:nir:stato:decreto.legislativo:1994-04-16;297",
                "link_eli_id": "http://www.normattiva.it/eli/id/1994/05/19/094G0291",
                "link_eli_type": "http://www.normattiva.it/eli/stato/DECRETO_LEGISLATIVO/1994/04/16/297",
                "id": "art_675_law_480_094G0291_1994-05-19.json",
                "article_number": "675",
                "article_text": [
                    "                              Art. 675 \n \n       ((ARTICOLO ABROGATO DAL D.LGS. 13 APRILE 2017, N. 64)) "
                ]
            },
            {
                "filename": "law_512_093G0163_1993-04-05.json",
                "title": "DECRETO LEGISLATIVO 3 aprile 1993, n. 96",
                "subject": "Trasferimento delle competenze dei soppressi Dipartimento per gli interventi straordinari nel Mezzogiorno e Agenzia per la promozione dello sviluppo del Mezzogiorno, a norma dell'art. 3 della legge 19 dicembre 1992, n. 488.",
                "type": "decreto.legislativo",
                "number": "96",
                "year": "1993",
                "editorial_code": "093G0163",
                "gazette_reference": "(GU n.79 del 05-04-1993)",
                "publication_date": "1993-04-3",
                "gazette_date": "1993-04-05",
                "valid_from": "1995-06-24",
                "last_updated": "(Ultimo aggiornamento all'atto pubblicato il 30/12/2005)",
                "link_gazette": "http://www.gazzettaufficiale.it/eli/gu/1993/04/05/79/sg/pdf",
                "link_urn_nir": "http://www.normattiva.it/uri-res/N2Ls?urn:nir:stato:decreto.legislativo:1993-04-3;96",
                "link_eli_id": "http://www.normattiva.it/eli/id/1993/04/05/093G0163",
                "link_eli_type": "http://www.normattiva.it/eli/stato/DECRETO_LEGISLATIVO/1993/04/3/96",
                "id": "art_2_law_512_093G0163_1993-04-05.json",
                "article_number": "2",
                "article_text": [
                    "                               Art. 2. \n              Intervento ordinario nelle aree depresse \n  1. Le risorse finanziarie derivanti dall'art. 1 della legge 1 marzo\n1986, n. 64, e dagli articoli 1 e 1-bis del decreto-legge 22  ottobre\n1992, n. 415, convertito, con modificazioni, dalla legge 19  dicembre\n1992,  n.  488,  sono  destinate  all'espletamento,  da  parte  delle\namministrazioni competenti  ai  sensi  del  presente  decreto,  delle\nfunzioni loro attribuite per l'attuazione  dell'intervento  ordinario\ndi cui all'art. 1,  comma  2,  nelle  aree  depresse  del  territorio\nnazionale. Tali amministrazioni provvedono con  detti  fondi  in  via\nprioritaria al completamento dei programmi cofinanziati con  i  fondi\nstrutturali  della  Comunita'   europea,   al   finanziamento   degli\ninterventi  di  cui  al  decreto-legge  30  dicembre  1985,  n.  786,\nconvertito, con modificazioni, dalla legge 28 febbraio 1986,  n.  44,\nsecondo le modalita' di cui  all'art.  5,  nonche'  alla  definizione\ndelle obbligazioni ed impegni assunti  dai  soppressi  organismi  del\ncessato intervento straordinario. \n \n--------------- \nNota redazionale \n  Il testo del presente articolo e' gia' integrato con le  correzioni\napportate dall'errata-corrige pubblicato in G.U.  06/04/1993,  n.  80\ndurante il periodo di \"vacatio legis\". \n  E'  possibile  visualizzare  il  testo  originario  accedendo  alla\nversione pdf della relativa Gazzetta di pubblicazione. "
                ]
            },
            {
                "filename": "law_46_091G0465_1991-12-31.json",
                "title": "LEGGE 31 dicembre 1991, n. 416",
                "subject": "Bilancio di previsione dello Stato per l'anno finanziario 1992 e bilancio pluriennale per il triennio 1992-1994.",
                "type": "legge",
                "number": "416",
                "year": "1991",
                "editorial_code": "091G0465",
                "gazette_reference": "(GU n.305 del 31-12-1991 - Suppl. Ordinario n. 94)",
                "publication_date": "1991-12-31",
                "gazette_date": "1991-12-31",
                "valid_from": "1992-01-15",
                "last_updated": "(Ultimo aggiornamento all'atto pubblicato il 29/10/1992)",
                "link_gazette": "http://www.gazzettaufficiale.it/eli/gu/1991/12/31/305/so/94/sg/pdf",
                "link_urn_nir": "http://www.normattiva.it/uri-res/N2Ls?urn:nir:stato:legge:1991-12-31;416",
                "link_eli_id": "http://www.normattiva.it/eli/id/1991/12/31/091G0465",
                "link_eli_type": "http://www.normattiva.it/eli/stato/LEGGE/1991/12/31/416",
                "id": "art_28_law_46_091G0465_1991-12-31.json",
                "article_number": "28",
                "article_text": [
                    "                              Art. 28. \n                       (Bilancio pluriennale). \n  1. Resta approvato, ai sensi e  per  gli  effetti  dell'articolo  4\ndella legge 5 agosto 1978, n. 468, come  sostituito  dall'articolo  4\ndella legge 23 agosto 1988, n. 362,  il  bilancio  pluriennale  dello\nStato e della aziende  autonome  per  il  triennio  1992-1994,  nelle\nrisultanze di cui alle tabelle allegate alla presente legge. \n  La presente legge, munita del sigillo dello Stato,  sara'  inserita\nnella  Raccolta  ufficiale  degli  atti  normativi  della  Repubblica\nitaliana. E' fatto obbligo a chiunque spetti di osservarla e di farla\nosservare come legge dello Stato. \n  Data a Roma, addi' 31 dicembre 1991 \n    \n                  COSSIGA\n                                  ANDREOTTI, Presidente del Consiglio\n                                  dei Ministri\n                                  CARLI, Ministro del tesoro\n    \nVisto, il Guardasigilli: MARTELLI "
                ]
            },
            {
                "filename": "law_19_089G0205_1989-05-15.json",
                "title": "DECRETO DEL PRESIDENTE DELLA REPUBBLICA 5 agosto 1987, n. 629",
                "subject": "Istituzione di un istituto professionale di Stato per l'industria e l'artigianato in Lonigo.",
                "type": "decreto.del.presidente.della.repubblica",
                "number": "629",
                "year": "1987",
                "editorial_code": "089G0205",
                "gazette_reference": "(GU n.111 del 15-05-1989)",
                "publication_date": "1987-08-5",
                "gazette_date": "1989-05-15",
                "valid_from": "1989-05-30",
                "last_updated": "",
                "link_gazette": "http://www.gazzettaufficiale.it/eli/gu/1989/05/15/111/sg/pdf",
                "link_urn_nir": "http://www.normattiva.it/uri-res/N2Ls?urn:nir:stato:decreto.del.presidente.della.repubblica:1987-08-5;629",
                "link_eli_id": "http://www.normattiva.it/eli/id/1989/05/15/089G0205",
                "link_eli_type": "http://www.normattiva.it/eli/stato/DECRETO_DEL_PRESIDENTE_DELLA_REPUBBLICA/1987/08/5/629",
                "id": "art_16_law_19_089G0205_1989-05-15.json",
                "article_number": "16",
                "article_text": [
                    "                               Art. 16.\n  A  capo  dell'istituto  e'  un preside. Egli promuove e coordina le\nattivita' di istituto e ha la rappresentanza legale dell'istituto.\n  A  capo  di  ogni  scuola  coordinata  e' un direttore che risponde\ndell'andamento didattico e disciplinare della scuola da lui  diretta.\n  Le  funzioni  di  direttore sono affidate per incarico dalla giunta\nesecutiva del consiglio di istituto,  su  proposta  del  preside,  di\nregola ad insegnanti di ruolo di materie tecniche."
                ]
            },
            {
                "filename": "law_39_093G0006_1993-01-13.json",
                "title": "DECRETO LEGISLATIVO 31 dicembre 1992, n. 545",
                "subject": "Ordinamento degli organi speciali di giurisdizione tributaria ed organizzazione degli uffici di collaborazione in attuazione della delega al Governo contenuta nell'art. 30 della legge 30 dicembre 1991, n. 413.",
                "type": "decreto.legislativo",
                "number": "545",
                "year": "1992",
                "editorial_code": "093G0006",
                "gazette_reference": "(GU n.9 del 13-01-1993 - Suppl. Ordinario n. 8)",
                "publication_date": "1992-12-31",
                "gazette_date": "1993-01-13",
                "valid_from": "1999-03-09",
                "last_updated": "(Ultimo aggiornamento all'atto pubblicato il 07/10/2015)",
                "link_gazette": "http://www.gazzettaufficiale.it/eli/gu/1993/01/13/9/so/8/sg/pdf",
                "link_urn_nir": "http://www.normattiva.it/uri-res/N2Ls?urn:nir:stato:decreto.legislativo:1992-12-31;545",
                "link_eli_id": "http://www.normattiva.it/eli/id/1993/01/13/093G0006",
                "link_eli_type": "http://www.normattiva.it/eli/stato/DECRETO_LEGISLATIVO/1992/12/31/545",
                "id": "art_31_law_39_093G0006_1993-01-13.json",
                "article_number": "31",
                "article_text": [
                    "                              Art. 31. \n          Uffici di segreteria delle commissioni tributarie \n  1. E' istituito presso ogni commissione tributaria  un  ufficio  di\nsegreteria con funzioni di assistenza e collaborazione nell'esercizio\ndell'attivita' giurisdizionale nonche' per  lo  svolgimento  di  ogni\naltra attivita' amministrativa  attribuita  alla  stessa  o  ai  suoi\ncomponenti. "
                ]
            },
            {
                "filename": "law_17_092G0081_1992-02-08.json",
                "title": "DECRETO 29 dicembre 1991, n. 445",
                "subject": "Regolamento per lo svolgimento degli esami di Stato per l'abilitazione all'esercizio della libera professione di perito industriale.",
                "type": "decreto",
                "number": "445",
                "year": "1991",
                "editorial_code": "092G0081",
                "gazette_reference": "(GU n.32 del 08-02-1992)",
                "publication_date": "1991-12-29",
                "gazette_date": "1992-02-08",
                "valid_from": "1992-02-23",
                "last_updated": "(Ultimo aggiornamento all'atto pubblicato il 24/02/2001)",
                "link_gazette": "http://www.gazzettaufficiale.it/eli/gu/1992/02/08/32/sg/pdf",
                "link_urn_nir": "http://www.normattiva.it/uri-res/N2Ls?urn:nir:stato:decreto:1991-12-29;445",
                "link_eli_id": "http://www.normattiva.it/eli/id/1992/02/08/092G0081",
                "link_eli_type": "http://www.normattiva.it/eli/stato/DECRETO/1991/12/29/445",
                "id": "art_2_law_17_092G0081_1992-02-08.json",
                "article_number": "2",
                "article_text": [
                    "                               Art. 2.\n                       Requisiti di ammissione\n  1.  Agli  esami  di  Stato  per  l'abilitazione all'esercizio della\nlibera professione di perito  industriale  sono  ammessi  soltanto  i\ncandidati  che  siano  in  possesso  del diploma di maturita' tecnica\nindustriale  conseguito  presso  un  istituto  statale  o  legalmente\nriconosciuto   e   che   abbiano   soddisfatto,   nel  settore  della\nspecializzazione  relativa  al  diploma  posseduto,  almeno  uno  dei\nrequisiti prescritti dall'art. 2, terzo comma, della legge 2 febbraio\n1990,  n.  17, in conformita' delle direttive impartite dal Consiglio\nnazionale dei periti industriali."
                ]
            },
            {
                "filename": "law_266_090G0235_1990-07-23.json",
                "title": "DECRETO DEL PRESIDENTE DELLA REPUBBLICA 23 giugno 1990, n. 195",
                "subject": "Regolamento recante modificazioni alle norme in materia di concessione della croce al merito di servizio ai militari della Guardia di finanza.",
                "type": "decreto.del.presidente.della.repubblica",
                "number": "195",
                "year": "1990",
                "editorial_code": "090G0235",
                "gazette_reference": "(GU n.170 del 23-07-1990)",
                "publication_date": "1990-06-23",
                "gazette_date": "1990-07-23",
                "valid_from": "1990-08-07",
                "last_updated": "",
                "link_gazette": "http://www.gazzettaufficiale.it/eli/gu/1990/07/23/170/sg/pdf",
                "link_urn_nir": "http://www.normattiva.it/uri-res/N2Ls?urn:nir:stato:decreto.del.presidente.della.repubblica:1990-06-23;195",
                "link_eli_id": "http://www.normattiva.it/eli/id/1990/07/23/090G0235",
                "link_eli_type": "http://www.normattiva.it/eli/stato/DECRETO_DEL_PRESIDENTE_DELLA_REPUBBLICA/1990/06/23/195",
                "id": "art_2_law_266_090G0235_1990-07-23.json",
                "article_number": "2",
                "article_text": [
                    "                               Art. 2.\n  1.  La croce, conforme al modello annesso al decreto del Presidente\ndella Repubblica 31 luglio 1954, n. 1052, e' coniata  in  oro  ed  in\nargento.\n  2.  Si  porta  appesa  al  petto  con un nastro di seta color verde\nscuro, tramezzato e limitato ai margini da una lista gialla  in  palo\ndelle  dimensioni  di  quello  della croce per anzianita' di servizio\ndell'Esercito di cui al decreto del Presidente  della  Repubblica  10\nfebbraio 1953, n. 331.\n  3. Il nastro puo' portarsi senza croce."
                ]
            },
            {
                "filename": "law_160_097G0402_1997-10-28.json",
                "title": "DECRETO DEL PRESIDENTE DEL CONSIGLIO DEI MINISTRI 30 luglio 1997, n. 365",
                "subject": "Regolamento per il giudizio di idoneita' ai sensi dell'articolo 9, comma 8, del decreto legislativo 7 dicembre 1993, n. 517.",
                "type": "decreto.del.presidente.del.consiglio.dei.ministri",
                "number": "365",
                "year": "1997",
                "editorial_code": "097G0402",
                "gazette_reference": "(GU n.252 del 28-10-1997)",
                "publication_date": "1997-07-30",
                "gazette_date": "1997-10-28",
                "valid_from": "1997-11-12",
                "last_updated": "",
                "link_gazette": "http://www.gazzettaufficiale.it/eli/gu/1997/10/28/252/sg/pdf",
                "link_urn_nir": "http://www.normattiva.it/uri-res/N2Ls?urn:nir:stato:decreto.del.presidente.del.consiglio.dei.ministri:1997-07-30;365",
                "link_eli_id": "http://www.normattiva.it/eli/id/1997/10/28/097G0402",
                "link_eli_type": "http://www.normattiva.it/eli/stato/DECRETO_DEL_PRESIDENTE_DEL_CONSIGLIO_DEI_MINISTRI/1997/07/30/365",
                "id": "art_3_law_160_097G0402_1997-10-28.json",
                "article_number": "3",
                "article_text": [
                    "                               Art. 3.\n  1. La commissione, salvo che  ricorrano gravi motivi dei quali deve\nessere fatta  menzione nei verbali  delle riunioni, formula  i propri\ngiudizi  entro   tre  mesi   dalla  scadenza   del  termine   per  la\npresentazione delle domande di cui all'articolo 1."
                ]
            },
            {
                "filename": "law_471_096G0252_1996-05-02.json",
                "title": "DECRETO-LEGGE 29 aprile 1996, n. 237",
                "subject": "Differimento di termini previsti da disposizioni legislative concernenti il Ministero degli affari esteri e norme relative ad impegni internazionali.",
                "type": "decreto.legge",
                "number": "237",
                "year": "1996",
                "editorial_code": "096G0252",
                "gazette_reference": "(GU n.101 del 02-05-1996)",
                "publication_date": "1996-04-29",
                "gazette_date": "1996-05-02",
                "valid_from": "1996-07-02",
                "last_updated": "(Ultimo aggiornamento all'atto pubblicato il 17/08/1996)",
                "link_gazette": "http://www.gazzettaufficiale.it/eli/gu/1996/05/02/101/sg/pdf",
                "link_urn_nir": "http://www.normattiva.it/uri-res/N2Ls?urn:nir:stato:decreto.legge:1996-04-29;237",
                "link_eli_id": "http://www.normattiva.it/eli/id/1996/05/02/096G0252",
                "link_eli_type": "http://www.normattiva.it/eli/stato/DECRETO_LEGGE/1996/04/29/237",
                "id": "art_6_law_471_096G0252_1996-05-02.json",
                "article_number": "6",
                "article_text": [
                    "                               Art. 6\n    DECRETO DECADUTO; I SUOI EFFETTI SONO STATI FATTI SALVI DALLA\n                      L. 8 AGOSTO 1996, N. 426"
                ]
            },
            {
                "filename": "law_290_093G0390_1993-08-23.json",
                "title": "LEGGE 12 agosto 1993, n. 317",
                "subject": "Norme generali per il completamento dei piani di ricostruzione post-bellica.",
                "type": "legge",
                "number": "317",
                "year": "1993",
                "editorial_code": "093G0390",
                "gazette_reference": "(GU n.197 del 23-08-1993)",
                "publication_date": "1993-08-12",
                "gazette_date": "1993-08-23",
                "valid_from": "1993-09-07",
                "last_updated": "(Ultimo aggiornamento all'atto pubblicato il 22/05/1999)",
                "link_gazette": "http://www.gazzettaufficiale.it/eli/gu/1993/08/23/197/sg/pdf",
                "link_urn_nir": "http://www.normattiva.it/uri-res/N2Ls?urn:nir:stato:legge:1993-08-12;317",
                "link_eli_id": "http://www.normattiva.it/eli/id/1993/08/23/093G0390",
                "link_eli_type": "http://www.normattiva.it/eli/stato/LEGGE/1993/08/12/317",
                "id": "art_3_law_290_093G0390_1993-08-23.json",
                "article_number": "3",
                "article_text": [
                    "                               Art. 3.\n                       Completamento dei piani\n  1. Nell'ambito dei lavori di completamento delle opere in corso, di\nquelli finalizzati alla realizzazione di un progetto approvato ovvero\ndi quelli strettamente necessari ad assicurare  la  funzionalita'  ad\nopere  gia'  ultimate,  purche' previsti dai piani di ricostruzione e\ndai  piani  regolatori  generali  vigenti,  il  Ministro  dei  lavori\npubblici,   con   proprio   decreto,  predispone,  sentiti  i  comuni\ninteressati, un elenco di interventi da realizzare, il  cui  onere  a\ncarico  dello  Stato  e'  determinato dall'articolo 4. Entro tre mesi\ndalla data di entrata in vigore della presente legge, il Ministro dei\nlavori pubblici trasmette al Parlamento lo schema di decreto, nonche'\nil quadro del fabbisogno finanziario di cui all'articolo 2, comma  4,\nper  l'espressione  del  parere da parte delle commissioni permanenti\ncompetenti per materia.\n  2. All'affidamento dei lavori e delle  opere  di  cui  al  comma  1\nprovvede il Ministero dei lavori pubblici, anche a mezzo di delega ai\ncomuni  interessati  mediante  contratti  di  appalto,  ai  sensi del\ndecreto legislativo 19 dicembre  1991,  n.  406,  recante  attuazione\ndella  direttiva 89/440/CEE in materia di procedure di aggiudicazione\ndegli  appalti  di  lavori  pubblici,  aventi   ad   oggetto,   oltre\nall'esecuzione,  anche  la  progettazione  esecutiva  e  le ulteriori\nespropriazioni o acquisizioni di aree eventualmente occorrenti."
                ]
            }
        ]
    },
    {
        "unit_id": "unit_7",
        "token_input": "PHZVCRIZLR",
        "token_output": "RGCTQJWSRA",
        "documents": [
            {
                "filename": "law_98_093G0558_1993-12-09.json",
                "title": "DECRETO LEGISLATIVO 15 novembre 1993, n. 507",
                "subject": "Revisione ed armonizzazione dell'imposta comunale sulla pubblicita' e del diritto sulle pubbliche affissioni, della tassa per l'occupazione di spazi ed aree pubbliche dei comuni e delle province nonche' della tassa per lo smaltimento dei rifiuti solidi urbani a norma dell'art. 4 della legge 23 ottobre 1992, n. 421, concernente il riordino della finanza territoriale.",
                "type": "decreto.legislativo",
                "number": "507",
                "year": "1993",
                "editorial_code": "093G0558",
                "gazette_reference": "(GU n.288 del 09-12-1993 - Suppl. Ordinario n. 108)",
                "publication_date": "1993-11-15",
                "gazette_date": "1993-12-09",
                "valid_from": "2020-03-01",
                "last_updated": "(Ultimo aggiornamento all'atto pubblicato il 29/02/2020)",
                "link_gazette": "http://www.gazzettaufficiale.it/eli/gu/1993/12/09/288/so/108/sg/pdf",
                "link_urn_nir": "http://www.normattiva.it/uri-res/N2Ls?urn:nir:stato:decreto.legislativo:1993-11-15;507",
                "link_eli_id": "http://www.normattiva.it/eli/id/1993/12/09/093G0558",
                "link_eli_type": "http://www.normattiva.it/eli/stato/DECRETO_LEGISLATIVO/1993/11/15/507",
                "id": "art_49_law_98_093G0558_1993-12-09.json",
                "article_number": "49",
                "article_text": [
                    "                               Art. 49 \n \n         ARTICOLO ABROGATO DALLA L. 27 DICEMBRE 2019, N. 160 \n                                                          (33) ((34)) \n \n--------------- \nAGGIORNAMENTO (33) \n  La L. 27 dicembre 2019, n. 160 ha disposto  (con  l'art.  1,  comma\n847)che \"Restano ferme le disposizioni inerenti alla  pubblicita'  in\nambito  ferroviario  e  quelle   che   disciplinano   la   propaganda\nelettorale. Il capo II del decreto legislativo n. 507 del 1993 rimane\ncome riferimento per la determinazione della tassa per  l'occupazione\ndi spazi ed aree pubbliche appartenenti  alle  regioni  di  cui  agli\narticoli 5 della legge 16 maggio  1970,  n.  281,  e  8  del  decreto\nlegislativo 6 maggio 2011, n. 68.\" \n---------- \nAGGIORNAMENTO (34) \n  Il D.L. 30 dicembre 2019,  n.  162,  convertito  con  modificazioni\ndalla L. 28 febbraio 2020, n. 8, nel modificare l'art. 1,  comma  847\ndella L. 27 dicembre 2019, n. 160, ha conseguentemente disposto  (con\nl'art. 4, comma 3-quater) che \"Limitatamente  all'anno  2020  non  ha\neffetto l'abrogazione disposta dal comma 847  dell'articolo  1  della\nlegge 27 dicembre 2019, n. 160; si applicano, per il  medesimo  anno,\nl'imposta comunale sulla pubblicita' e  il  diritto  sulle  pubbliche\naffissioni nonche' la  tassa  per  l'occupazione  di  spazi  ed  aree\npubbliche, di  cui  rispettivamente  ai  capi  I  e  II  del  decreto\nlegislativo  15  novembre  1993,  n.  507,  nonche'  il  canone   per\nl'installazione dei mezzi pubblicitari e il canone per  l'occupazione\ndi spazi ed aree pubbliche, di cui rispettivamente agli articoli 62 e\n63 del decreto legislativo 15 dicembre 1997, n. 446\". "
                ]
            },
            {
                "filename": "law_474_080U0791_1980-12-01.json",
                "title": "LEGGE 18 novembre 1980, n. 791",
                "subject": "Istituzione di un assegno vitalizio a favore degli ex deportati nei campi di sterminio nazista K.Z.",
                "type": "legge",
                "number": "791",
                "year": "1980",
                "editorial_code": "080U0791",
                "gazette_reference": "(GU n.329 del 01-12-1980)",
                "publication_date": "1980-11-18",
                "gazette_date": "1980-12-01",
                "valid_from": "1980-12-16",
                "last_updated": "",
                "link_gazette": "http://www.gazzettaufficiale.it/eli/gu/1980/12/01/329/sg/pdf",
                "link_urn_nir": "http://www.normattiva.it/uri-res/N2Ls?urn:nir:stato:legge:1980-11-18;791",
                "link_eli_id": "http://www.normattiva.it/eli/id/1980/12/01/080U0791",
                "link_eli_type": "http://www.normattiva.it/eli/stato/LEGGE/1980/11/18/791",
                "id": "art_5_law_474_080U0791_1980-12-01.json",
                "article_number": "5",
                "article_text": [
                    "                               Art. 5.\n\n  L'assegno  vitalizio  di  cui alla presente legge e' posto a carico\ndel bilancio dello Stato.\n  All'onere  derivante dall'attuazione della presente legge, valutato\nin  lire  3.000  milioni  nell'anno  finanziario  1980,  si  provvede\nmediante  riduzione  di  pari importo dello stanziamento iscritto nel\ncapitolo 6856 dello stato di previsione della spesa del Ministero del\ntesoro  per  l'anno  finanziario  medesimo,  all'uopo utilizzando una\nquota dell'accantonamento \"Rinnovo della convenzione di Lome'\".\n  Il  Ministro  del  tesoro  e'  autorizzato ad apportare, con propri\ndecreti, le occorrenti variazioni di bilancio.\n\n  La  presente  legge,  munita del sigillo dello Stato, sara' inserta\nnella  Raccolta  ufficiale delle leggi e dei decreti della Repubblica\nitaliana. E' fatto obbligo a chiunque spetti di osservarla e di farla\nosservare come legge dello Stato.\n\n  Data a Roma, addi' 18 novembre 1980\n\n                               PERTINI\n\n                                            FORLANI - ROGNONI - SARTI\n                                               - ANDREATTA - LA MALFA\n\nVisto, il Guardasigilli: SARTI"
                ]
            },
            {
                "filename": "law_254_088G0387_1988-08-12.json",
                "title": "DECRETO 12 maggio 1988, n. 343",
                "subject": "Produzione, acquisto e distribuzione dei vaccini per la profilassi immunizzante obbligatoria degli animali.",
                "type": "decreto",
                "number": "343",
                "year": "1988",
                "editorial_code": "088G0387",
                "gazette_reference": "(GU n.189 del 12-08-1988)",
                "publication_date": "1988-05-12",
                "gazette_date": "1988-08-12",
                "valid_from": "1988-08-12",
                "last_updated": "",
                "link_gazette": "http://www.gazzettaufficiale.it/eli/gu/1988/08/12/189/sg/pdf",
                "link_urn_nir": "http://www.normattiva.it/uri-res/N2Ls?urn:nir:stato:decreto:1988-05-12;343",
                "link_eli_id": "http://www.normattiva.it/eli/id/1988/08/12/088G0387",
                "link_eli_type": "http://www.normattiva.it/eli/stato/DECRETO/1988/05/12/343",
                "id": "art_2_law_254_088G0387_1988-08-12.json",
                "article_number": "2",
                "article_text": [
                    "                               Art. 2.\n  Le  modalita' di produzione dei singoli vaccini presso gli istituti\nzooprofilattici sperimentali ed i prezzi di cessione  per  unita'  di\nprodotto sono specificati negli articoli che seguono.\n  L'approvvigionamento  dei prodotti immunizzanti presso gli istituti\nzooprofilattici sperimentali nonche'  la  ripartizione  dei  suddetti\nprodotti  tra  le  regioni e le province autonome avverra' in base al\nprogramma concordato, ai sensi  dell'art.  7,  secondo  comma,  della\nlegge  23  dicembre  1978,  n. 833, tra il Ministro della Sanita' e i\nrappresentanti dei servizi veterinari delle regioni e delle  province\nautonome, tenuto conto dell'attivita' profilattica svolta nel biennio\nprecedente e delle specifiche indicazioni da ciascun  ente  formulate\nper il 1988.\n  Le  regioni  o  le  province  autonome, in conformita' dell'art. 7,\nsecondo comma, della legge sopra citata, provvedono  all'acquisto  ed\nalla distribuzione dei vaccini previsti dal presente decreto.\n  L'onere  derivante  dalle  suddette spese grava sui fondi assegnati\nalle regioni e province autonome sul capitolo 5941 del  bilancio  del\nMinistero  del  tesoro,  esercizio  finanziario  1988, concernente il\nFondo sanitario nazionale."
                ]
            },
            {
                "filename": "law_468_088G0190_1988-04-23.json",
                "title": "DECRETO DEL PRESIDENTE DELLA REPUBBLICA 22 aprile 1988, n. 129",
                "subject": "Modificazioni delle aliquote dell'imposta di fabbricazione su alcuni prodotti petroliferi.",
                "type": "decreto.del.presidente.della.repubblica",
                "number": "129",
                "year": "1988",
                "editorial_code": "088G0190",
                "gazette_reference": "(GU n.95 del 23-04-1988)",
                "publication_date": "1988-04-22",
                "gazette_date": "1988-04-23",
                "valid_from": "1988-05-08",
                "last_updated": "",
                "link_gazette": "http://www.gazzettaufficiale.it/eli/gu/1988/04/23/95/sg/pdf",
                "link_urn_nir": "http://www.normattiva.it/uri-res/N2Ls?urn:nir:stato:decreto.del.presidente.della.repubblica:1988-04-22;129",
                "link_eli_id": "http://www.normattiva.it/eli/id/1988/04/23/088G0190",
                "link_eli_type": "http://www.normattiva.it/eli/stato/DECRETO_DEL_PRESIDENTE_DELLA_REPUBBLICA/1988/04/22/129",
                "id": "art_2_law_468_088G0190_1988-04-23.json",
                "article_number": "2",
                "article_text": [
                    "                               Art. 2.\n  1.  Alle  minori  entrate  derivanti  dall'attuazione  del presente\ndecreto, valutate in lire 315 miliardi per l'anno 1988 ed in lire 456\nmiliardi per gli anni successivi, si provvede a valere sulle maggiori\nentrate derivanti dall'attuazione dei decreti  del  Presidente  della\nRepubblica  precedentemente  emanati  in  forza della legge 9 ottobre\n1987, n. 417.\n  2.  Il  Ministro del tesoro e' autorizzato ad apportare, con propri\ndecreti, le occorrenti variazioni di bilancio.\n  Il presente decreto, munito del sigillo dello Stato, sara' inserito\nnella  Raccolta  ufficiale  degli  atti  normativi  della  Repubblica\nitaliana. E' fatto obbligo a chiunque spetti di osservarlo e di farlo\nosservare.\n   Dato a Roma, addi' 22 aprile 1988\n                               COSSIGA\n                                  DE MITA, Presidente del Consiglio\n                                  dei Ministri\n                                  COLOMBO, Ministro delle finanze\n                                  AMATO, Ministro del tesoro\n                                  FANFANI,  Ministro  del  bilancio e\n                                  della programmazione economica\n                                  BATTAGLIA, Ministro dell'industria,\n                                  del commercio e dell'artigianato\n Visto, il Guardasigilli: VASSALLI\n  Registrato alla Corte dei conti, addi' 23 aprile 1988\n  Atti di Governo, registro n. 73, foglio n. 37"
                ]
            },
            {
                "filename": "law_365_081U0807_1982-01-06.json",
                "title": "DECRETO-LEGGE 22 dicembre 1981, n. 807",
                "subject": "((Autorizzazione alla GEPI S.pa.)) ad intervenire nel settore dell'elettronica dei beni di consumo e della connessa componentistica.",
                "type": "decreto.legge",
                "number": "807",
                "year": "1981",
                "editorial_code": "081U0807",
                "gazette_reference": "(GU n.4 del 06-01-1982)",
                "publication_date": "1981-12-22",
                "gazette_date": "1982-01-06",
                "valid_from": "1982-03-07",
                "last_updated": "(Ultimo aggiornamento all'atto pubblicato il 05/04/1991)",
                "link_gazette": "http://www.gazzettaufficiale.it/eli/gu/1982/01/06/4/sg/pdf",
                "link_urn_nir": "http://www.normattiva.it/uri-res/N2Ls?urn:nir:stato:decreto.legge:1981-12-22;807",
                "link_eli_id": "http://www.normattiva.it/eli/id/1982/01/06/081U0807",
                "link_eli_type": "http://www.normattiva.it/eli/stato/DECRETO_LEGGE/1981/12/22/807",
                "id": "art_1_law_365_081U0807_1982-01-06.json",
                "article_number": "1",
                "article_text": [
                    "                   IL PRESIDENTE DELLA REPUBBLICA \n \n  Visti gli articoli 77 e 87 della Costituzione; \n  Ritenuta la necessita'  e  l'urgenza  di  intervenire  nel  settore\ndell'elettronica e della componentistica anche  per  la  salvaguardia\ndegli attuali livelli occupazionali minacciati dalle difficolta'  del\nsettore; \n  Vista la deliberazione del Consiglio dei Ministri,  adottata  nella\nriunione del 22 dicembre 1981; \n  Sulla proposta del Presidente del  Consiglio  dei  Ministri  e  del\nMinistro  dell'industria,  del  commercio  e   dell'artigianato,   di\nconcerto con i Ministri delle partecipazioni statali e del tesoro; \n \n                                EMANA \n \n                        il seguente decreto: \n                               Art. 1. \n \n  ((Il Comitato interministeriale per la politica industriale  (CIPI)\ndetta le direttive per gli interventi previsti dal  presente  decreto\nnell'ambito del settore dell'elettronica dei beni di consumo e  della\ncomponentistica  elettronica  connessa,  anche  per  quanto  concerne\nl'articolazione territoriale delle iniziative. Con la stessa delibera\nil CIPI determina  la  quota  di  riserva  di  fondi  in  favore  dei\nterritori di cui all'articolo 1 del testo unico approvato con decreto\ndel Presidente della Repubblica 6 marzo 1978,  n.  218,  al  fine  di\nsalvaguardare le attivita' produttive  del  Mezzogiorno  nei  settori\nindicati. \n  Il Ministero dell'industria, del commercio e dell'artigianato,  nel\nrispetto delle direttive di cui al  precedente  comma  e  sulla  base\ndelle indicazioni fornite dalle  imprese  interessate,  predispone  i\npiani  specifici  di  intervento  contenenti  la   previsione   delle\nmodalita' di realizzazione per il risanamento e  la  ristrutturazione\ndelle imprese o dei rami aziendali,  della  struttura  occupazionale,\ndei fabbisogni finanziari specifici. \n  Ciascun piano e' sottoposto all'approvazione  del  CIPI,  che  deve\npronunciarsi entro 30 giorni dalla presentazione di esso da parte del\nMinistero dell'industria, del commercio e dell'artigianato)). "
                ]
            },
            {
                "filename": "law_457_093G0217_1993-05-21.json",
                "title": "LEGGE 20 maggio 1993, n. 151",
                "subject": "Conversione in legge del decreto-legge 22 marzo 1993, n. 71, recante disposizioni in materia di sgravi contributivi nel Mezzogiorno e di fiscalizzazione degli oneri sociali.",
                "type": "legge",
                "number": "151",
                "year": "1993",
                "editorial_code": "093G0217",
                "gazette_reference": "(GU n.117 del 21-05-1993)",
                "publication_date": "1993-05-20",
                "gazette_date": "1993-05-21",
                "valid_from": "1993-05-22",
                "last_updated": "",
                "link_gazette": "http://www.gazzettaufficiale.it/eli/gu/1993/05/21/117/sg/pdf",
                "link_urn_nir": "http://www.normattiva.it/uri-res/N2Ls?urn:nir:stato:legge:1993-05-20;151",
                "link_eli_id": "http://www.normattiva.it/eli/id/1993/05/21/093G0217",
                "link_eli_type": "http://www.normattiva.it/eli/stato/LEGGE/1993/05/20/151",
                "id": "art_1_law_457_093G0217_1993-05-21.json",
                "article_number": "1",
                "article_text": [
                    "  La  Camera  dei  deputati  ed  il  Senato  della  Repubblica  hanno\napprovato;\n                   IL PRESIDENTE DELLA REPUBBLICA\n                              PROMULGA\nla seguente legge:\n                               Art. 1.\n  1. E' convertito in legge il decreto-legge 22 marzo  1993,  n.  71,\nrecante   disposizioni   in   materia   di  sgravi  contributivi  nel\nMezzogiorno e di fiscalizzazione degli oneri sociali.\n  2. Restano validi gli atti ed i provvedimenti adottati e sono fatti\nsalvi gli effetti prodottisi ed i rapporti giuridici sorti sulla base\ndei decreti-legge 18 settembre 1992, n. 383,  19  novembre  1992,  n.\n442, e 18 gennaio 1993, n. 12.\n  La  presente  legge, munita del sigillo dello Stato, sara' inserita\nnella  Raccolta  ufficiale  degli  atti  normativi  della  Repubblica\nitaliana. E' fatto obbligo a chiunque spetti di osservarla e di farla\nosservare come legge dello Stato.\n   Data a Roma, addi' 20 maggio 1993\n                              SCALFARO\n                                  CIAMPI,  Presidente  del  Consiglio\n                                  dei Ministri\n                                  GIUGNI, Ministro del lavoro e della\n                                  previdenza sociale\nVisto, il Guardasigilli: CONSO\n          AVVERTENZA:\n             Il  decreto-legge  22  marzo  1993,  n.  71,  e'   stato\n          pubblicato  nella  Gazzetta Ufficiale - serie generale - n.\n          67 del 22 marzo 1993.\n             In questa stessa Gazzetta Ufficiale, alla  pag.  19,  e'\n          ripubblicato  il  testo del decreto-legge 22 marzo 1993, n.\n          71, corredato delle relative note, ai  sensi  dell'art.  8,\n          comma  3,  del  regolamento  di  esecuzione del testo unico\n          delle disposizioni sulla promulgazione delle  leggi,  sulla\n          emanazione  dei  decreti  del Presidente della Repubblica e\n          sulle pubblicazioni ufficiali  della  Repubblica  italiana,\n          approvato  con  decreto  del Presidente della Repubblica 14\n          marzo 1986, n. 217.\n                         ___________________"
                ]
            },
            {
                "filename": "law_478_093G0194_1993-05-01.json",
                "title": "DECRETO-LEGGE 28 aprile 1993, n. 130",
                "subject": "Disposizioni urgenti in materia di differimento di termini previsti da disposizioni legislative.",
                "type": "decreto.legge",
                "number": "130",
                "year": "1993",
                "editorial_code": "093G0194",
                "gazette_reference": "(GU n.100 del 01-05-1993)",
                "publication_date": "1993-04-28",
                "gazette_date": "1993-05-01",
                "valid_from": "1993-07-01",
                "last_updated": "(Ultimo aggiornamento all'atto pubblicato il 24/07/1995)",
                "link_gazette": "http://www.gazzettaufficiale.it/eli/gu/1993/05/01/100/sg/pdf",
                "link_urn_nir": "http://www.normattiva.it/uri-res/N2Ls?urn:nir:stato:decreto.legge:1993-04-28;130",
                "link_eli_id": "http://www.normattiva.it/eli/id/1993/05/01/093G0194",
                "link_eli_type": "http://www.normattiva.it/eli/stato/DECRETO_LEGGE/1993/04/28/130",
                "id": "art_15_law_478_093G0194_1993-05-01.json",
                "article_number": "15",
                "article_text": [
                    "                              Art. 15. \n    DECRETO DECADUTO; I SUOI EFFETTI SONO STATI FATTI SALVI DALLA \n                      L. 13 LUGLIO 1995, N. 295 "
                ]
            },
            {
                "filename": "law_432_088G0204_1988-05-24.json",
                "title": "LEGGE 29 aprile 1988, n. 165",
                "subject": "Ratifica ed esecuzione dell'accordo istitutivo della \"Inter American Investment Corporation\", adottato a Washington il 19 novembre 1984.",
                "type": "legge",
                "number": "165",
                "year": "1988",
                "editorial_code": "088G0204",
                "gazette_reference": "(GU n.120 del 24-05-1988 - Suppl. Ordinario n. 44)",
                "publication_date": "1988-04-29",
                "gazette_date": "1988-05-24",
                "valid_from": "1988-06-14",
                "last_updated": "",
                "link_gazette": "http://www.gazzettaufficiale.it/eli/gu/1988/05/24/120/so/44/sg/pdf",
                "link_urn_nir": "http://www.normattiva.it/uri-res/N2Ls?urn:nir:stato:legge:1988-04-29;165",
                "link_eli_id": "http://www.normattiva.it/eli/id/1988/05/24/088G0204",
                "link_eli_type": "http://www.normattiva.it/eli/stato/LEGGE/1988/04/29/165",
                "id": "art_2_law_432_088G0204_1988-05-24.json",
                "article_number": "2",
                "article_text": [
                    "                               Art. 2.\n1. Piena ed intera esecuzione e' data all'accordo di cui all'articolo\n1 dalla data della sua entrata in  vigore  in  conformita'  a  quanto\ndisposto dall'articolo XI dell'accordo stesso."
                ]
            },
            {
                "filename": "law_210_086U0929_1987-01-03.json",
                "title": "DECRETO DEL PRESIDENTE DELLA REPUBBLICA 8 luglio 1986, n. 929",
                "subject": "Modificazione allo statuto dell'Universita' degli studi di Parma.",
                "type": "decreto.del.presidente.della.repubblica",
                "number": "929",
                "year": "1986",
                "editorial_code": "086U0929",
                "gazette_reference": "(GU n.2 del 03-01-1987)",
                "publication_date": "1986-07-8",
                "gazette_date": "1987-01-03",
                "valid_from": "1987-01-18",
                "last_updated": "",
                "link_gazette": "http://www.gazzettaufficiale.it/eli/gu/1987/01/03/2/sg/pdf",
                "link_urn_nir": "http://www.normattiva.it/uri-res/N2Ls?urn:nir:stato:decreto.del.presidente.della.repubblica:1986-07-8;929",
                "link_eli_id": "http://www.normattiva.it/eli/id/1987/01/03/086U0929",
                "link_eli_type": "http://www.normattiva.it/eli/stato/DECRETO_DEL_PRESIDENTE_DELLA_REPUBBLICA/1986/07/8/929",
                "id": "art_1_law_210_086U0929_1987-01-03.json",
                "article_number": "1",
                "article_text": [
                    "                   IL PRESIDENTE DELLA REPUBBLICA\n\n  Veduto  lo statuto dell'Universita' degli studi di Parma, approvato\ncon   regio   decreto   13   ottobre  1927,  n.  2797,  e  successive\nmodificazioni;\n  Veduto  il  testo  unico  delle  leggi  sull'istruzione  superiore,\napprovato con regio decreto 31 agosto 1933, n. 1592;\n  Veduto  il  regio decreto-legge 20 giugno 1935, n. 1071, convertito\nnella legge 2 gennaio 1936, n. 73;\n  Veduto  il  regio  decreto 30 settembre 1938, n. 1652, e successive\nmodificazioni;\n  Veduta la legge 11 aprile 1953, n. 312;\n  Veduto  il  decreto del Presidente della Repubblica 11 luglio 1980,\nn. 382;\n  Veduta la legge 30 ottobre 1981, n. 615;\n  Vedute  le  proposte  di  modifica  dello  statuto  formulate dalle\nautorita'  accademiche  dell'Universita'  anzidetta  ai  sensi  della\ncitata legge n. 615;\n  Veduto il parere del Consiglio universitario nazionale;\n  Sulla proposta del Ministro della pubblica istruzione;\n\n                              Decreta:\n\n  Lo  statuto  dell'Universita'  degli  studi  di  Parma, approvato e\nmodificato  con  i decreti sopraindicati, e' ulteriormente modificato\ncome appresso:\n                           Articolo unico\n\n  Nell'art.  22,  relativo  al  corso  di  laurea  in giurisprudenza,\nall'elenco  degli  insegnamenti complementari e' aggiunto il seguente\nnuovo insegnamento:\n    diritto dell'esecuzione civile.\n\n  Il  presente decreto, munito del sigillo dello Stato, sara' inserto\nnella  Raccolta  ufficiale delle leggi e dei decreti della Repubblica\nitaliana. E' fatto obbligo a chiunque spetti di osservarlo e di farlo\nosservare.\n\n  Dato a Roma, addi' 8 luglio 1986\n\n                               COSSIGA\n\n                              FALCUCCI,   Ministro   della   pubblica\n                                istruzione\n\nVisto, il Guardasigilli: ROGNONI\n  Registrato alla Corte dei conti, addi' 18 dicembre 1986\n  Registro n. 89 Istruzione, foglio n. 382"
                ]
            },
            {
                "filename": "law_356_089G0130_1989-03-25.json",
                "title": "DECRETO MINISTERIALE 10 marzo 1989, n. 105",
                "subject": "Disposizioni in materia valutaria.",
                "type": "decreto.ministeriale",
                "number": "105",
                "year": "1989",
                "editorial_code": "089G0130",
                "gazette_reference": "(GU n.71 del 25-03-1989 - Suppl. Ordinario n. 22)",
                "publication_date": "1989-03-10",
                "gazette_date": "1989-03-25",
                "valid_from": "1989-03-26",
                "last_updated": "",
                "link_gazette": "http://www.gazzettaufficiale.it/eli/gu/1989/03/25/71/so/22/sg/pdf",
                "link_urn_nir": "http://www.normattiva.it/uri-res/N2Ls?urn:nir:stato:decreto.ministeriale:1989-03-10;105",
                "link_eli_id": "http://www.normattiva.it/eli/id/1989/03/25/089G0130",
                "link_eli_type": "http://www.normattiva.it/eli/stato/DECRETO_MINISTERIALE/1989/03/10/105",
                "id": "art_28_law_356_089G0130_1989-03-25.json",
                "article_number": "28",
                "article_text": [
                    "                               Art. 28.\n(Rilascio   delle   autorizzazioni  relative  al  commercio  dell'oro\ngreggio)\n1.  Le richieste di autorizzazione all'acquisto di oro greggio devono\nessere inoltrate con cadenza annuale, al Ministero del commercio  con\nl'estero  (Direzione  generale  delle valute), direttamente o tramite\nuna banca abilitata, trasmettendone copia  all'Ufficio  italiano  dei\ncambi.  Esse  devono  essere  inoltrate  nel  mese  di  gennaio,  con\nriferimento al periodo 1 marzo  dello  stesso  anno  -  28  febbraio\ndell'anno  successivo  con  indicazione di quantitativi minimi di Kg.\n20. Nel corso dell'anno possono essere inoltrate  richieste  connesse\nall'avvio  di  nuove attivita' o richieste suppletive. Tali richieste\ndi autorizzazione devono contenere una  dichiarazione  di  impegno  a\ndestinare  l'oro greggio acquistato alla produzione di beni in Italia\no alla vendita all'estero. Nel caso di cessione ad  altro  residente,\nnel  documento  di  vendita  deve  essere indicato che il cessionario\nintende utilizzare l'oro per la produzione di beni.\n2. La richiesta inviata all'Ufficio italiano dei cambi deve contenere\ncopia della precedente autorizzazione, aggiornata con i dati relativi\nagli utilizzi alla data di inoltro.\n3.  Sono  libere le importazioni di oro greggio da parte delle banche\nabilitate per l'immissione in conto  deposito,  utilizzabile  per  le\ncessioni e per prestiti d'uso ai residenti.\n4.  Ai fini delle presenti disposizioni non e' considerata produzione\ndi beni la trasformazione dell'oro greggio in forme diverse da quelle\noriginarie   che   non   presentino   un  valore  aggiunto  idoneo  a\nqualificarle come beni prodotti ai sensi del precedente comma 1.\n5.   L'Ufficio   italiano   dei   cambi   provvede  a  notificare  le\nautorizzazioni rilasciate dal Ministero del commercio con l'estero.\n6.  Il  prelievo del conto deposito o l'importazione dell'oro greggio\ndevono   essere   effettuati   previa   esibizione   della   relativa\nautorizzazione  sulla quale la banca o la dogana deve annotare i dati\ndei  quantitativi  prelevati  o  importati.   L'importazione   e   il\nregolamento   devono  essere  effettuati  nel  rispetto  anche  delle\ndisposizioni  relative  alla   \"dichiarazione   valutaria\"   di   cui\nall'articolo 24.\n7.  I  prestiti  d'uso  sono  liberamente assumibili. Le operazioni a\ntermine e le opzione a termine su oro sono effettuabili presso  borse\nmerci  nonche' con primarie banche estere che operino attivamente nel\nsettore.  I  contratti  della  specie  possono  essere  conclusi  con\nacquisizione  definitiva  del  metallo  esclusivamente da parte delle\nimprese in possesso di autorizzazioni all'acquisto che possono essere\nrichieste  anche  per  quantitativi inferiori a quelli previsti al 1\ncomma del presente articolo."
                ]
            }
        ]
    },
    {
        "unit_id": "unit_8",
        "token_input": "PZDCVONORJ",
        "token_output": "OMJCBTVHHC",
        "documents": [
            {
                "filename": "law_347_098G0217_1998-06-06.json",
                "title": "LEGGE 21 maggio 1998, n. 175",
                "subject": "Ratifica ed esecuzione della convenzione tra il Governo della Repubblica di Albania e il Governo della Repubblica italiana per evitare le doppie imposizioni in materia di imposte sul reddito e sul patrimonio e per prevenire le evasioni fiscali, con protocollo, fatta a Tirana il 12 dicembre 1994.",
                "type": "legge",
                "number": "175",
                "year": "1998",
                "editorial_code": "098G0217",
                "gazette_reference": "(GU n.130 del 06-06-1998 - Suppl. Ordinario n. 107)",
                "publication_date": "1998-05-21",
                "gazette_date": "1998-06-06",
                "valid_from": "1998-06-07",
                "last_updated": "",
                "link_gazette": "http://www.gazzettaufficiale.it/eli/gu/1998/06/06/130/so/107/sg/pdf",
                "link_urn_nir": "http://www.normattiva.it/uri-res/N2Ls?urn:nir:stato:legge:1998-05-21;175",
                "link_eli_id": "http://www.normattiva.it/eli/id/1998/06/06/098G0217",
                "link_eli_type": "http://www.normattiva.it/eli/stato/LEGGE/1998/05/21/175",
                "id": "art_3_law_347_098G0217_1998-06-06.json",
                "article_number": "3",
                "article_text": [
                    "                               Art. 3.\n   1. La presente legge entra in vigore il giorno successivo a quello\ndella sua pubblicazione nella Gazzetta Ufficiale.\n   La  presente legge, munita del sigillo dello Stato, sara' inserita\nnella  Raccolta  ufficiale  degli  atti  normativi  della  Repubblica\nitaliana. E' fatto obbligo a chiunque spetti di osservarla e di farla\nosservare come legge dello Stato.\n   Data a Roma, addi' 21 maggio 1998\n                              SCALFARO\n                                 PRODI, Presidente del Consiglio dei\n                                        Ministri\n                                 DINI, Ministro degli esteri\nVisto, il Guardasigilli: FLICK"
                ]
            },
            {
                "filename": "law_246_091G0267_1991-07-23.json",
                "title": "DECRETO 25 gennaio 1991, n. 217",
                "subject": "Regolamento per l'attuazione dell'art. 15, comma 2, del decreto del Presidente della Repubblica 24 maggio 1988, n. 236, concernente le caratteristiche delle schede per la rilevazione dei dati riguardanti la vendita, l'acquisto e l'utilizzazione dei presidi sanitari, nonche' le relative modalita' di compilazione, tempi e procedure di rilevamento e di trasmissione dei dati.",
                "type": "decreto",
                "number": "217",
                "year": "1991",
                "editorial_code": "091G0267",
                "gazette_reference": "(GU n.171 del 23-07-1991)",
                "publication_date": "1991-01-25",
                "gazette_date": "1991-07-23",
                "valid_from": "1991-08-07",
                "last_updated": "(Ultimo aggiornamento all'atto pubblicato il 17/04/2001)",
                "link_gazette": "http://www.gazzettaufficiale.it/eli/gu/1991/07/23/171/sg/pdf",
                "link_urn_nir": "http://www.normattiva.it/uri-res/N2Ls?urn:nir:stato:decreto:1991-01-25;217",
                "link_eli_id": "http://www.normattiva.it/eli/id/1991/07/23/091G0267",
                "link_eli_type": "http://www.normattiva.it/eli/stato/DECRETO/1991/01/25/217",
                "id": "art_4_law_246_091G0267_1991-07-23.json",
                "article_number": "4",
                "article_text": [
                    "                               Art. 4. \n  1. Le schede relative alla dichiarazione dei dati di acquisto e  di\nutilizzazione, di cui all'allegato 3, da parte degli utilizzatori  di\npresidi sanitari, devono essere trasmesse entro  il  28  febbraio  di\nciascun anno successivo a quello cui i dati si riferiscono. \n  2. La prima dichiarazione di cui al comma 1 va effettuata entro  il\n28 febbraio del secondo anno successivo a quello di pubblicazione del\npresente decreto nella Gazzetta Ufficiale della Repubblica. \n  3. Le schede di cui al comma 1 devono essere presentate in triplice\nesemplare alle unita' sanitarie locali  territorialmente  competenti,\nin relazione al luogo di utilizzazione dei prodotti. \n  4.  Le  unita'  sanitarie  locali  trattengono   un   esemplare   e\ntrasmettono  agli  altri  due  rispettivamente,  alla  Regione  e  al\n\"Ministero dell'agricoltura e delle foreste - s.i.a.n.\" entro  il  31\nmaggio di ciascun anno. \n  5. Tale dichiarazione  potra'  essere  sostituita  da  un  supporto\nmagnetico, secondo quanto previsto dall'art. 2, comma 3. \n  6. Ai fini della compilazione delle schede di cui al comma  1,  gli\nutilizzatori conservano, per i presidi  di  prima  e  seconda  classe\ntossicologica, la copia dei moduli d'acquisto  di  cui  all'art.  22,\nquarto comma, del decreto del Presidente della  Repubblica  3  agosto\n1968, n. 1255 e, per gli acquisti  di  presidi  delle  altre  classi,\ncopia delle relative bolle di accompagnamento. (1) (2) (3) (4) ((5)) \n    \n-------------------\n\n\nAGGIORNAMENTO (1)\nIl Decreto 2 luglio 1992, n. 436 ha disposto (con l'art. 4,  comma  1)\nche l'applicazione delle disposizioni di cui  al  presente  articolo,\ndecorre dal 1 gennaio 1994, tranne che per le zone  territoriali  di\ncui all'art. 1 del Decreto 436/1992.\n\n-------------------\n\n\nAGGIORNAMENTO (2)\nIl D.L. 23 ottobre 1996, n. 542, convertito con modificazioni dalla\nL. 23 dicembre 1996, n. 649, ha disposto (con l'art. 4, comma 5)  che\nl'applicazione delle disposizioni di cui al presente articolo decorre\ndal 31 dicembre 1997, tranne che per  le  zone  territoriali  di  cui\nall'articolo 6 del presente decreto.\n\n-------------------\n\n\nAGGIORNAMENTO (3)\nIl D.L. 23 ottobre 1996, n. 542, convertito con modificazioni dalla\nL. 23 dicembre 1996, n. 649, come modificato dalla L. 17 agosto 1999,\nn. 290, ha disposto (con l'art. 4, comma 5) che l'applicazione  delle\ndisposizioni di cui al presente articolo decorre, dal 30 giugno 2000,\ntranne che per  le  zone  territoriali  di  cui  all'articolo  6  del\npresente decreto.\n\n-------------------\n\n\nAGGIORNAMENTO (4)\nLa L. 14 ottobre 1999, n. 362 ha disposto (con l'art. 1,  comma  1)\nche l'applicazione delle disposizioni di  cui  al  presente  articolo\ndecorre, dal 30 giugno 2000, eccetto che per le zone territoriali  di\ncui all'articolo 6 del presente decreto.\n\n-------------------\n\n\n    \nAGGIORNAMENTO (5) \n  Il D.L. 23 ottobre 1996, n. 542, convertito con modificazioni dalla\nL. 23 dicembre 1996, n. 649, come modificato dalla L. 27 marzo  2001,\nn. 122, ha disposto (con l'art. 4, comma 5) che l'applicazione  delle\ndisposizioni di cui al presente articolo decorre, dal 30 giugno 2001,\ntranne che per  le  zone  territoriali  di  cui  all'articolo  6  del\npresente decreto. "
                ]
            },
            {
                "filename": "law_435_089G0048_1989-01-31.json",
                "title": "DECRETO-LEGGE 30 gennaio 1989, n. 26",
                "subject": "Autorizzazione ad effettuare nell'anno 1989 le lotterie di Viareggio, Venezia, Taormina, Sanremo, Foligno e del Garda.",
                "type": "decreto.legge",
                "number": "26",
                "year": "1989",
                "editorial_code": "089G0048",
                "gazette_reference": "(GU n.25 del 31-01-1989)",
                "publication_date": "1989-01-30",
                "gazette_date": "1989-01-31",
                "valid_from": "1989-04-02",
                "last_updated": "(Ultimo aggiornamento all'atto pubblicato il 09/01/1990)",
                "link_gazette": "http://www.gazzettaufficiale.it/eli/gu/1989/01/31/25/sg/pdf",
                "link_urn_nir": "http://www.normattiva.it/uri-res/N2Ls?urn:nir:stato:decreto.legge:1989-01-30;26",
                "link_eli_id": "http://www.normattiva.it/eli/id/1989/01/31/089G0048",
                "link_eli_type": "http://www.normattiva.it/eli/stato/DECRETO_LEGGE/1989/01/30/26",
                "id": "art_1_law_435_089G0048_1989-01-31.json",
                "article_number": "1",
                "article_text": [
                    "                               Art. 1\n    DECRETO DECADUTO; I SUOI EFFETTI SONO STATI FATTI SALVI DALLA\n                     L. 30 DICEMBRE 1989, N. 423"
                ]
            },
            {
                "filename": "law_319_099G0321_1999-07-29.json",
                "title": "LEGGE 29 luglio 1999, n. 241",
                "subject": "Proroga dei termini per l'esercizio delle deleghe di cui agli articoli 10 e 11 della legge 15 marzo 1997, n. 59, in relazione all'adozione del parere parlamentare.",
                "type": "legge",
                "number": "241",
                "year": "1999",
                "editorial_code": "099G0321",
                "gazette_reference": "(GU n.176 del 29-07-1999)",
                "publication_date": "1999-07-29",
                "gazette_date": "1999-07-29",
                "valid_from": "1999-07-30",
                "last_updated": "",
                "link_gazette": "http://www.gazzettaufficiale.it/eli/gu/1999/07/29/176/sg/pdf",
                "link_urn_nir": "http://www.normattiva.it/uri-res/N2Ls?urn:nir:stato:legge:1999-07-29;241",
                "link_eli_id": "http://www.normattiva.it/eli/id/1999/07/29/099G0321",
                "link_eli_type": "http://www.normattiva.it/eli/stato/LEGGE/1999/07/29/241",
                "id": "art_2_law_319_099G0321_1999-07-29.json",
                "article_number": "2",
                "article_text": [
                    "                               Art. 2.\n  1. La presente legge entra in  vigore il giorno successivo a quello\ndella sua pubblicazione nella Gazzetta Ufficiale.\n  La presente legge,  munita del sigillo dello  Stato, sara' inserita\nnella  Raccolta  ufficiale  degli  atti  normativi  della  Repubblica\nitaliana. E' fatto obbligo a chiunque spetti di osservarla e di farla\nosservare come legge dello Stato.\n   Data a Roma, addi' 29 luglio 1999\n                               CIAMPI\n                                   D'Alema,  Presidente del Consiglio\n                                  dei Ministri\nVisto, il Guardasigilli: Diliberto"
                ]
            },
            {
                "filename": "law_27_091G0451_1992-01-22.json",
                "title": "DECRETO DEL PRESIDENTE DELLA REPUBBLICA 8 novembre 1991, n. 435",
                "subject": "Approvazione del regolamento per la sicurezza della navigazione e della vita umana in mare.",
                "type": "decreto.del.presidente.della.repubblica",
                "number": "435",
                "year": "1991",
                "editorial_code": "091G0451",
                "gazette_reference": "(GU n.17 del 22-01-1992 - Suppl. Ordinario n. 12)",
                "publication_date": "1991-11-8",
                "gazette_date": "1992-01-22",
                "valid_from": "2020-08-15",
                "last_updated": "(Ultimo aggiornamento all'atto pubblicato il 14/08/2020)",
                "link_gazette": "http://www.gazzettaufficiale.it/eli/gu/1992/01/22/17/so/12/sg/pdf",
                "link_urn_nir": "http://www.normattiva.it/uri-res/N2Ls?urn:nir:stato:decreto.del.presidente.della.repubblica:1991-11-8;435",
                "link_eli_id": "http://www.normattiva.it/eli/id/1992/01/22/091G0451",
                "link_eli_type": "http://www.normattiva.it/eli/stato/DECRETO_DEL_PRESIDENTE_DELLA_REPUBBLICA/1991/11/8/435",
                "id": "art_225_law_27_091G0451_1992-01-22.json",
                "article_number": "225",
                "article_text": [
                    "                              Art. 225 \n       Chiusura delle boccaporte, portellini ed altre aperture \n 1. Prima della partenza della nave, tutti i portellini di murata e i\ncontroportellini che devono rimanere chiusi  durante  la  navigazione\ndevono essere  controllati  da  personale  di  bordo  permanentemente\ndesignato  a  tale  incarico,  e  possibilmente  da  ufficiali,   per\naccertare che essi siano chiusi in modo stagno e sicuro. \n 2. La  stessa  verifica  deve  essere  fatta  per  la  chiusura  del\nportelloni  di  murata,  delle  boccaporte,   dei   barcarizzi,   dei\nportelloni da merci e di ogni altra apertura che deve rimanere chiusa\ndurante la navigazione, in  applicazione  delle  norme  del  presente\nregolamento. \n 3. Il personale incaricato deve darne notizia, a verifica  ultimata,\nal proprio  capo  servizio,  che  deve  provvedere  a  sua  volta  ad\ninformarne il comandante. \n 4. All'arrivo della nave in porto, le aperture di cui  sopra  devono\nessere aperte  soltanto  da  personale  autorizzato,  il  quale  deve\nriferirne al proprio capo servizio. Di tali  operazioni  deve  essere\ntempestivamente informato l'ufficiale di coperta di servizio. \n 5. Opportune istruzioni devono essere  date  dal  comando  di  bordo\nperche' durante la navigazione i portellini e le altre  aperture  che\ndevono rimanere chiusi non siano aperti all'insaputa del  comandante;\npersonale specificatamente incaricato deve controllare  giornalmente,\nin navigazione, lo stato di chiusura degli stessi. "
                ]
            },
            {
                "filename": "law_949_084U0273_1984-06-30.json",
                "title": "DECRETO-LEGGE 29 giugno 1984, n. 273",
                "subject": "Misure urgenti a sostegno e ad incremento dei livelli occupazionali.",
                "type": "decreto.legge",
                "number": "273",
                "year": "1984",
                "editorial_code": "084U0273",
                "gazette_reference": "(GU n.179 del 30-06-1984)",
                "publication_date": "1984-06-29",
                "gazette_date": "1984-06-30",
                "valid_from": "1984-07-30",
                "last_updated": "(Ultimo aggiornamento all'atto pubblicato il 11/07/1984)",
                "link_gazette": "http://www.gazzettaufficiale.it/eli/gu/1984/06/30/179/sg/pdf",
                "link_urn_nir": "http://www.normattiva.it/uri-res/N2Ls?urn:nir:stato:decreto.legge:1984-06-29;273",
                "link_eli_id": "http://www.normattiva.it/eli/id/1984/06/30/084U0273",
                "link_eli_type": "http://www.normattiva.it/eli/stato/DECRETO_LEGGE/1984/06/29/273",
                "id": "art_6_law_949_084U0273_1984-06-30.json",
                "article_number": "6",
                "article_text": [
                    "                               Art. 6\n    DECRETO DECADUTO; I SUOI EFFETTI SONO STATI FATTI SALVI DALLA\n                     L. 19 DICEMBRE 1984, N. 863"
                ]
            },
            {
                "filename": "law_223_095G0412_1995-09-09.json",
                "title": "DECRETO-LEGGE 7 settembre 1995, n. 372",
                "subject": "Disciplina operativa concernente partecipazioni e proventi del Tesoro, nonche' norme sugli organismi e sulle procedure attinenti ai mercati, alla Tesoreria e all'EAGAT.",
                "type": "decreto.legge",
                "number": "372",
                "year": "1995",
                "editorial_code": "095G0412",
                "gazette_reference": "(GU n.211 del 09-09-1995)",
                "publication_date": "1995-09-7",
                "gazette_date": "1995-09-09",
                "valid_from": "1995-11-09",
                "last_updated": "(Ultimo aggiornamento all'atto pubblicato il 09/03/1996)",
                "link_gazette": "http://www.gazzettaufficiale.it/eli/gu/1995/09/09/211/sg/pdf",
                "link_urn_nir": "http://www.normattiva.it/uri-res/N2Ls?urn:nir:stato:decreto.legge:1995-09-7;372",
                "link_eli_id": "http://www.normattiva.it/eli/id/1995/09/09/095G0412",
                "link_eli_type": "http://www.normattiva.it/eli/stato/DECRETO_LEGGE/1995/09/7/372",
                "id": "art_16_law_223_095G0412_1995-09-09.json",
                "article_number": "16",
                "article_text": [
                    "                               Art. 16\n       DECRETO DECADUTO; I SUOI EFFETTI SONO STATI FATTI SALVI\n                    DALLA L. 6 MARZO 1996, N. 110"
                ]
            },
            {
                "filename": "law_408_096G0319_1996-06-03.json",
                "title": "DECRETO-LEGGE 3 giugno 1996, n. 300",
                "subject": "Disposizioni urgenti in materia di lavori socialmente utili, di interventi a sostegno del reddito e nel settore previdenziale.",
                "type": "decreto.legge",
                "number": "300",
                "year": "1996",
                "editorial_code": "096G0319",
                "gazette_reference": "(GU n.128 del 03-06-1996)",
                "publication_date": "1996-06-3",
                "gazette_date": "1996-06-03",
                "valid_from": "1996-08-03",
                "last_updated": "(Ultimo aggiornamento all'atto pubblicato il 15/06/1996)",
                "link_gazette": "http://www.gazzettaufficiale.it/eli/gu/1996/06/03/128/sg/pdf",
                "link_urn_nir": "http://www.normattiva.it/uri-res/N2Ls?urn:nir:stato:decreto.legge:1996-06-3;300",
                "link_eli_id": "http://www.normattiva.it/eli/id/1996/06/03/096G0319",
                "link_eli_type": "http://www.normattiva.it/eli/stato/DECRETO_LEGGE/1996/06/3/300",
                "id": "art_8_law_408_096G0319_1996-06-03.json",
                "article_number": "8",
                "article_text": [
                    "                             Art. 8.\nDECRETO  DECADUTO;  I SUOI EFFETTI SONO STATI FATTI SALVI DALLA L. 28\n                        NOVEMBRE 1996, N. 608"
                ]
            },
            {
                "filename": "law_238_097G0315_1997-09-05.json",
                "title": "DECRETO MINISTERIALE 23 luglio 1997, n. 287",
                "subject": "Regolamento concernente la disciplina della gestione patrimoniale e finanziaria delle camere di commercio.",
                "type": "decreto.ministeriale",
                "number": "287",
                "year": "1997",
                "editorial_code": "097G0315",
                "gazette_reference": "(GU n.207 del 05-09-1997 - Suppl. Ordinario n. 175)",
                "publication_date": "1997-07-23",
                "gazette_date": "1997-09-05",
                "valid_from": "2005-12-31",
                "last_updated": "(Ultimo aggiornamento all'atto pubblicato il 16/12/2005)",
                "link_gazette": "http://www.gazzettaufficiale.it/eli/gu/1997/09/05/207/so/175/sg/pdf",
                "link_urn_nir": "http://www.normattiva.it/uri-res/N2Ls?urn:nir:stato:decreto.ministeriale:1997-07-23;287",
                "link_eli_id": "http://www.normattiva.it/eli/id/1997/09/05/097G0315",
                "link_eli_type": "http://www.normattiva.it/eli/stato/DECRETO_MINISTERIALE/1997/07/23/287",
                "id": "art_1_law_238_097G0315_1997-09-05.json",
                "article_number": "1",
                "article_text": [
                    "                               Art. 1\n    ((PROVVEDIMENTO ABROGATO DAL D.P.R. 2 NOVEMBRE 2005, N. 254))"
                ]
            },
            {
                "filename": "law_367_084U0855_1984-12-20.json",
                "title": "LEGGE 18 dicembre 1984, n. 855",
                "subject": "Incremento del fondo di dotazione dell'IRI da destinare alla concessionaria del servizio pubblico radiotelevisivo.",
                "type": "legge",
                "number": "855",
                "year": "1984",
                "editorial_code": "084U0855",
                "gazette_reference": "(GU n.349 del 20-12-1984)",
                "publication_date": "1984-12-18",
                "gazette_date": "1984-12-20",
                "valid_from": "2008-12-22",
                "last_updated": "(Ultimo aggiornamento all'atto pubblicato il 25/06/2008)",
                "link_gazette": "http://www.gazzettaufficiale.it/eli/gu/1984/12/20/349/sg/pdf",
                "link_urn_nir": "http://www.normattiva.it/uri-res/N2Ls?urn:nir:stato:legge:1984-12-18;855",
                "link_eli_id": "http://www.normattiva.it/eli/id/1984/12/20/084U0855",
                "link_eli_type": "http://www.normattiva.it/eli/stato/LEGGE/1984/12/18/855",
                "id": "art_3_law_367_084U0855_1984-12-20.json",
                "article_number": "3",
                "article_text": [
                    "                               Art. 3. \n(( PROVVEDIMENTO ABROGATO DAL D.L. 25 GIUGNO 2008, N.112, CONVERTITO,\nCON MODIFICAZIONI, DALLA L. 6 AGOSTO 2008, N. 133 )). "
                ]
            }
        ]
    },
    {
        "unit_id": "unit_9",
        "token_input": "QSMEPNBUOT",
        "token_output": "KXELMNTBDD",
        "documents": [
            {
                "filename": "law_874_085U0268_1985-06-15.json",
                "title": "DECRETO DEL PRESIDENTE DELLA REPUBBLICA 25 febbraio 1985, n. 268",
                "subject": "Approvazione del nuovo statuto dell'Associazione nazionale allevatori del cavallo agricolo italiano da tiro pesante rapido, in Verona.",
                "type": "decreto.del.presidente.della.repubblica",
                "number": "268",
                "year": "1985",
                "editorial_code": "085U0268",
                "gazette_reference": "(GU n.140 del 15-06-1985)",
                "publication_date": "1985-02-25",
                "gazette_date": "1985-06-15",
                "valid_from": "1985-06-30",
                "last_updated": "",
                "link_gazette": "http://www.gazzettaufficiale.it/eli/gu/1985/06/15/140/sg/pdf",
                "link_urn_nir": "http://www.normattiva.it/uri-res/N2Ls?urn:nir:stato:decreto.del.presidente.della.repubblica:1985-02-25;268",
                "link_eli_id": "http://www.normattiva.it/eli/id/1985/06/15/085U0268",
                "link_eli_type": "http://www.normattiva.it/eli/stato/DECRETO_DEL_PRESIDENTE_DELLA_REPUBBLICA/1985/02/25/268",
                "id": "art_1_law_874_085U0268_1985-06-15.json",
                "article_number": "1",
                "article_text": [
                    "N. 268. Decreto del Presidente della Repubblica 25 febbraio 1985, col\n  quale,   sulla  proposta  del  Ministro  dell'agricoltura  e  delle\n  foreste,   viene   approvato  il  nuovo  statuto  dell'Associazione\n  nazionale  allevatori del cavallo agricolo italiano da tiro pesante\n  rapido, in Verona, eretta in ente morale con decreto del Presidente\n  della Repubblica 28 novembre 1974, n. 924.\n\nVisto, il Guardasigilli: MARTINAZZOLI\n  Registrato alla Corte dei conti, addi' 29 maggio 1985\n  Registro n. 8 Agricoltura, foglio n. 81"
                ]
            },
            {
                "filename": "law_481_099G0136_1999-03-31.json",
                "title": "DECRETO LEGISLATIVO 16 marzo 1999, n. 79",
                "subject": "Attuazione della direttiva 96/92/CE recante norme comuni per il mercato interno dell'energia elettrica.",
                "type": "decreto.legislativo",
                "number": "79",
                "year": "1999",
                "editorial_code": "099G0136",
                "gazette_reference": "(GU n.75 del 31-03-1999)",
                "publication_date": "1999-03-16",
                "gazette_date": "1999-03-31",
                "valid_from": "1999-04-01",
                "last_updated": "(Ultimo aggiornamento all'atto pubblicato il 22/07/2020)",
                "link_gazette": "http://www.gazzettaufficiale.it/eli/gu/1999/03/31/75/sg/pdf",
                "link_urn_nir": "http://www.normattiva.it/uri-res/N2Ls?urn:nir:stato:decreto.legislativo:1999-03-16;79",
                "link_eli_id": "http://www.normattiva.it/eli/id/1999/03/31/099G0136",
                "link_eli_type": "http://www.normattiva.it/eli/stato/DECRETO_LEGISLATIVO/1999/03/16/79",
                "id": "art_8_law_481_099G0136_1999-03-31.json",
                "article_number": "8",
                "article_text": [
                    "                               Art. 8.\n                       Attivita' di produzione\n  1.  A  decorrere dal 1 gennaio 2003 a nessun soggetto e' consentito\nprodurre  o importare, direttamente o indirettamente, piu' del 50 per\ncento  del  totale  dell'energia  elettrica  prodotta  e importata in\nItalia. Nel caso tale soglia, calcolata come media su base triennale,\nsia  superata,  l'Autorita'  garante  della concorrenza e del mercato\nadotta  i provvedimenti di cui all'articolo 15 della legge 10 ottobre\n1990,  n.  287. A tale scopo, entro la stessa data l'ENEL S.p.a. cede\nnon  meno di 15.000 MW della propria capacita' produttiva. A tal fine\nl'ENEL  S.p.a.  predispone  entro  centoventi  gioni  dall'entrata in\nvigore  del presente decreto un piano per le cessioni degli impianti;\nl'approvazione  del suddetto piano, nonche' la scelta delle modalita'\ndi  alienazione  sono  determinate  con  decreto  del  Presidente del\nConsiglio  dei  Ministri,  su  proposta  del Ministro del tesoro, del\nbilancio  e  della  programmazione  economica,  di  concerto  con  il\nMinistro  dell'industria,  del commercio e dell'artigianato. Il piano\nper   le   cessioni  degli  impianti  deve  consentire  sia  adeguate\ncondizioni  di  mercato sia la necessaria attenzione alla presenza di\npiani  industriali,  al mantenimento della produzione nei siti e alle\nricadute  occupazionali  e  deve  tener conto delle esigenze relative\nalle   attivita'  di  sviluppo,  di  innovazione,  di  ricerca  e  di\ninternazionalizzazione dell'ENEL S.p.a.\n  2.  Ove  il  termine  del  1 gennaio 2003 di cui al comma 1 non sia\ncompatibile,  per  le  condizioni  del mercato, con il rispetto degli\nobblighi  nello  stesso  comma  previsti,  l'Autorita'  garante della\nconcorrenza   e   del  mercato  con  proprio  provvedimento,  sentita\nl'Autorita'  per  l'energia  elettrica  e  il  gas, puo' disporre, su\nrichiesta  del  soggetto  interessato, una proroga non superiore a un\nanno.\n  3.  Fermi restando quanto previsto dal decreto legislativo 31 marzo\n1998,  n.  112,  nonche'  la  disciplina relativa alla valutazione di\nimpatto ambientale, entro un anno dalla data di entrata in vigore del\npresente  decreto  sono  emanati, ai sensi dell'articolo 17, comma 2,\ndella  legge  23  agosto  1988,  n.  400,  uno o piu' regolamenti per\ndisciplinare  l'autorizzazione  alla  costruzione  e all'esercizio di\nnuovi  impianti  di produzione dell'energia elettrica o la modifica o\nil   ripotenziamento  di  impianti  esistenti,  alimentati  da  fonti\nconvenzionali.\n  4. I regolamenti si conformano ai seguenti principi:\n  a)  i  progetti  sono  autorizzati  mediante  lo svolgimento di una\nprocedura  unificata e semplificata, riferita a ciascuna categoria di\nimpianto  nonche'  mediante  il rilascio, in tempi determinati, di un\nunico  provvedimento  riguardante  sia  l'impianto  principale che le\nopere connesse e le infrastrutture indispensabili al suo esercizio;\n  b)  i progetti di modifica o ripotenziamento sono valutati sotto il\nprofilo  urbanistico  solo  in  caso di occupazione di aree esterne a\nquelle di pertinenza dell'impianto esistente.\n  5.  Il  diniego  di  autorizzazione, fondato in ogni caso su motivi\nobiettivi  e  non  discriminatori,  e'  comunicato,  con  la relativa\nmotivazione,  al  richiedente. Del provvedimento e' data informazione\nalla Commissione delle Comunita' europee.\n  6.  Sino  alla  data di entrata in vigore dei regolamenti di cui al\ncomma 3 si applicano le norme e le procedure attualmente vigenti."
                ]
            },
            {
                "filename": "law_117_088G0552_1988-11-12.json",
                "title": "LEGGE 31 ottobre 1988, n. 480",
                "subject": "Modificazioni della normativa relativa al Fondo di previdenza per il personale di volo dipendente da aziende di navigazione aerea.",
                "type": "legge",
                "number": "480",
                "year": "1988",
                "editorial_code": "088G0552",
                "gazette_reference": "(GU n.266 del 12-11-1988)",
                "publication_date": "1988-10-31",
                "gazette_date": "1988-11-12",
                "valid_from": "1988-11-27",
                "last_updated": "(Ultimo aggiornamento all'atto pubblicato il 16/06/1997)",
                "link_gazette": "http://www.gazzettaufficiale.it/eli/gu/1988/11/12/266/sg/pdf",
                "link_urn_nir": "http://www.normattiva.it/uri-res/N2Ls?urn:nir:stato:legge:1988-10-31;480",
                "link_eli_id": "http://www.normattiva.it/eli/id/1988/11/12/088G0552",
                "link_eli_type": "http://www.normattiva.it/eli/stato/LEGGE/1988/10/31/480",
                "id": "art_9_law_117_088G0552_1988-11-12.json",
                "article_number": "9",
                "article_text": [
                    "                               Art. 9.\n                        Misura della pensione\n  1.  Per  i periodi di iscrizione successivi alla data di entrata in\nvigore della presente legge, la  misura  della  pensione  dovuta  dal\nFondo  e'  pari al 2,50 per cento della retribuzione pensionabile per\nogni anno  riconosciuto  utile,  considerando  come  anno  intero  la\nfrazione uguale o superiore a sei mesi.\n  2.  Restano  ferme  le disposizioni di cui all'articolo 25, secondo\ncomma,  della  legge  13  luglio  1965,  n.  859,   come   sostituito\ndall'articolo 1 della legge 30 luglio 1973, n. 484."
                ]
            },
            {
                "filename": "law_7_090G0045_1990-02-05.json",
                "title": "DECRETO 15 giugno 1989, n. 452",
                "subject": "Regolamento recante disposizioni nazionali integrative di quelle comunitarie sulla distillazione obbligatoria dei sottoprodotti della vinificazione.",
                "type": "decreto",
                "number": "452",
                "year": "1989",
                "editorial_code": "090G0045",
                "gazette_reference": "(GU n.29 del 05-02-1990)",
                "publication_date": "1989-06-15",
                "gazette_date": "1990-02-05",
                "valid_from": "1990-02-05",
                "last_updated": "",
                "link_gazette": "http://www.gazzettaufficiale.it/eli/gu/1990/02/05/29/sg/pdf",
                "link_urn_nir": "http://www.normattiva.it/uri-res/N2Ls?urn:nir:stato:decreto:1989-06-15;452",
                "link_eli_id": "http://www.normattiva.it/eli/id/1990/02/05/090G0045",
                "link_eli_type": "http://www.normattiva.it/eli/stato/DECRETO/1989/06/15/452",
                "id": "art_3_law_7_090G0045_1990-02-05.json",
                "article_number": "3",
                "article_text": [
                    "                               Art. 3.\n  1.  Possono svincolarsi dalla prestazione obbligatoria i produttori\nvinicoli delle  isole  minori  (escluse,  quindi,  la  Sicilia  e  la\nSardegna)  che  destinano  i  propri  sottoprodotti  al \"ritiro sotto\ncontrollo\"."
                ]
            },
            {
                "filename": "law_540_095G0084_1995-02-28.json",
                "title": "DECRETO-LEGGE 25 febbraio 1995, n. 55",
                "subject": "Disposizioni urgenti in materia di differimento di termini previsti da disposizioni legislative.",
                "type": "decreto.legge",
                "number": "55",
                "year": "1995",
                "editorial_code": "095G0084",
                "gazette_reference": "(GU n.49 del 28-02-1995)",
                "publication_date": "1995-02-25",
                "gazette_date": "1995-02-28",
                "valid_from": "1995-04-30",
                "last_updated": "(Ultimo aggiornamento all'atto pubblicato il 24/07/1995)",
                "link_gazette": "http://www.gazzettaufficiale.it/eli/gu/1995/02/28/49/sg/pdf",
                "link_urn_nir": "http://www.normattiva.it/uri-res/N2Ls?urn:nir:stato:decreto.legge:1995-02-25;55",
                "link_eli_id": "http://www.normattiva.it/eli/id/1995/02/28/095G0084",
                "link_eli_type": "http://www.normattiva.it/eli/stato/DECRETO_LEGGE/1995/02/25/55",
                "id": "art_62_law_540_095G0084_1995-02-28.json",
                "article_number": "62",
                "article_text": [
                    "                              Art. 62.\n       DECRETO DECADUTO; I SUOI EFFETTI SONO STATI FATTI SALVI\n                   DALLA L. 13 LUGLIO 1995, N. 295"
                ]
            },
            {
                "filename": "law_952_085U0190_1985-05-17.json",
                "title": "LEGGE 13 maggio 1985, n. 190",
                "subject": "Riconoscimento giuridico dei quadri intermedi.",
                "type": "legge",
                "number": "190",
                "year": "1985",
                "editorial_code": "085U0190",
                "gazette_reference": "(GU n.115 del 17-05-1985)",
                "publication_date": "1985-05-13",
                "gazette_date": "1985-05-17",
                "valid_from": "1985-06-01",
                "last_updated": "(Ultimo aggiornamento all'atto pubblicato il 24/06/2015)",
                "link_gazette": "http://www.gazzettaufficiale.it/eli/gu/1985/05/17/115/sg/pdf",
                "link_urn_nir": "http://www.normattiva.it/uri-res/N2Ls?urn:nir:stato:legge:1985-05-13;190",
                "link_eli_id": "http://www.normattiva.it/eli/id/1985/05/17/085U0190",
                "link_eli_type": "http://www.normattiva.it/eli/stato/LEGGE/1985/05/13/190",
                "id": "art_5_law_952_085U0190_1985-05-17.json",
                "article_number": "5",
                "article_text": [
                    "                               Art. 5.\n\n  Il  datore  di  lavoro e' tenuto ad assicurare il quadro intermedio\ncontro il rischio di responsabilita' civile verso terzi conseguente a\ncolpa  nello  svolgimento  delle  proprie  mansioni  contrattuali. La\nstessa  assicurazione  deve  essere stipulata dal datore di lavoro in\nfavore di tutti i propri dipendenti che, a causa del tipo di mansioni\nsvolte,  sono  particolarmente  esposti al rischio di responsabilita'\ncivile verso terzi."
                ]
            },
            {
                "filename": "law_42_093G0009_1993-01-12.json",
                "title": "DECRETO 12 novembre 1992, n. 542",
                "subject": "Regolamento recante i criteri di valutazione delle caratteristiche delle acque minerali naturali.",
                "type": "decreto",
                "number": "542",
                "year": "1992",
                "editorial_code": "093G0009",
                "gazette_reference": "(GU n.8 del 12-01-1993)",
                "publication_date": "1992-11-12",
                "gazette_date": "1993-01-12",
                "valid_from": "2011-11-20",
                "last_updated": "(Ultimo aggiornamento all'atto pubblicato il 05/11/2011)",
                "link_gazette": "http://www.gazzettaufficiale.it/eli/gu/1993/01/12/8/sg/pdf",
                "link_urn_nir": "http://www.normattiva.it/uri-res/N2Ls?urn:nir:stato:decreto:1992-11-12;542",
                "link_eli_id": "http://www.normattiva.it/eli/id/1993/01/12/093G0009",
                "link_eli_type": "http://www.normattiva.it/eli/stato/DECRETO/1992/11/12/542",
                "id": "art_13_law_42_093G0009_1993-01-12.json",
                "article_number": "13",
                "article_text": [
                    "                              Art. 13. \n \n  Gli studi clinici, farmacologici  e  tossicologici  debbono  essere\ncondotti presso strutture ospedaliere o  universitarie  nel  rispetto\ndelle  regole  di  buona  pratica  clinica  e  di  buona  pratica  di\nlaboratorio. \n                                                                ((3)) \n \n------------- \nAGGIORNAMENTO (3) \n  Il D.Lgs. 8 ottobre 2011, n. 176 ha disposto (con l'art. 34,  comma\n3) che alla data  di  entrata  in  vigore  del  decreto  ministeriale\nprevisto all'articolo 3, comma 1, e' abrogato il decreto del Ministro\ndella sanita' 12 novembre 1992, n. 542. "
                ]
            },
            {
                "filename": "law_1001_085U0141_1985-04-19.json",
                "title": "LEGGE 17 aprile 1985, n. 141",
                "subject": "Perequazione dei trattamenti pensionistici in atto dei pubblici dipendenti.",
                "type": "legge",
                "number": "141",
                "year": "1985",
                "editorial_code": "085U0141",
                "gazette_reference": "(GU n.93 del 19-04-1985 - Suppl. Ordinario)",
                "publication_date": "1985-04-17",
                "gazette_date": "1985-04-19",
                "valid_from": "1988-05-12",
                "last_updated": "(Ultimo aggiornamento all'atto pubblicato il 11/05/1988)",
                "link_gazette": "http://www.gazzettaufficiale.it/eli/gu/1985/04/19/93/so/0/sg/pdf",
                "link_urn_nir": "http://www.normattiva.it/uri-res/N2Ls?urn:nir:stato:legge:1985-04-17;141",
                "link_eli_id": "http://www.normattiva.it/eli/id/1985/04/19/085U0141",
                "link_eli_type": "http://www.normattiva.it/eli/stato/LEGGE/1985/04/17/141",
                "id": "art_1_law_1001_085U0141_1985-04-19.json",
                "article_number": "1",
                "article_text": [
                    "    La  Camera  dei  deputati  ed  il  Senato  della Repubblica hanno\napprovato;\n\n                   IL PRESIDENTE DELLA REPUBBLICA\n\n                              PROMULGA\n\nla seguente legge:\n                               Art. 1.\n\n  Le  pensioni  di  cui all'articolo 1 della legge 29 aprile 1976, n.\n177,  spettanti  per  le  cessazioni dal servizio relative ai periodi\nindicati  nei  successivi  articoli 2 e 3, sono aumentate a decorrere\ndal  1  gennaio  1984 di un importo determinato in base alle aliquote\npercentuali   stabilite   dagli   articoli  medesimi,  da  applicarsi\nsull'ammontare annuo lordo considerato con esclusione dell'indennita'\nintegrativa  speciale,  delle  quote  di aggiunta di famiglia e degli\nemolumenti   accessori   previsti   per   i   titolari   di  pensione\nprivilegiata.\n  A  decorrere  dal  1  gennaio  1985  le  pensioni  di  cui al comma\nprecedente sono aumentate, previo riassorbimento degli aumenti di cui\nal  comma  stesso, nelle misure percentuali e fisse e con riferimento\nai comparti ed alle date di decorrenza dei trattamenti indicati nella\ntabella   allegata   alla   presente   legge.   Per  le  pensioni  di\nreversibilita'  l'aumento nella misura fissa spetta in ragione del 60\nper cento.\n  Gli  aumenti  percentuali  di  cui  ai  commi  precedenti  sono  da\ncomputare  sull'importo  delle singole pensioni in atto alla data del\n31 dicembre 1981.\n  Gli aumenti di cui al presente articolo non spettano sulle pensioni\ndei  graduati  e militari di truppa delle categorie in congedo di cui\nal successivo articolo 5.\n  L'onere per gli aumenti delle pensioni corrisposte dal Fondo per il\ntrattamento  di  quiescenza  al  personale  degli  uffici  locali, ai\ntitolari  di  agenzia, ai ricevitori ed ai portalettere e della Cassa\nintegrativa  di  previdenza  per il personale telefonico statale e' a\ncarico del Fondo e della Cassa predetti. ((2))\n---------------\nAGGIORNAMENTO (2)\n  La  Corte  Costituzionale, con sentenza 21 aprile-5 maggio 1988, n.\n501   (in   G.U.   1a   s.s.   11/05/1988,   n.  19),  ha  dichiarato\n\"l'illegittimita'  costituzionale  degli artt. 1, 3, primo comma, e 6\ndella  legge  17  aprile  1985, n. 141 (\"Perequazione dei trattamenti\npensionistici  in atto dei pubblici dipendenti\"), nella parte in cui,\nin  luogo  degli  aumenti  ivi previsti, non dispongono, a favore dei\nmagistrati ordinari, amministrativi, contabili, militari, nonche' dei\nprocuratori  e avvocati dello Stato, collocati a riposo anteriormente\nal  1  luglio  1983, la riliquidazione, a cura delle Amministrazioni\ncompetenti,  della  pensione  sulla  base  del  trattamento economico\nderivante  dall'applicazione  degli  artt. 3 e 4 della legge 6 agosto\n1984,  n.  425  (\"Disposizioni  relative al trattamento economico dei\nmagistrati\"), con decorrenza dalla data del 1 gennaio 1988.\""
                ]
            },
            {
                "filename": "law_119_099G0517_1999-11-29.json",
                "title": "DECRETO 22 settembre 1999, n. 441",
                "subject": "Regolamento recante criteri e modalita' per il finanziamento delle spese di partecipazione a gare internazionali di cui alla legge 20 ottobre 1990, n. 304.",
                "type": "decreto",
                "number": "441",
                "year": "1999",
                "editorial_code": "099G0517",
                "gazette_reference": "(GU n.280 del 29-11-1999)",
                "publication_date": "1999-09-22",
                "gazette_date": "1999-11-29",
                "valid_from": "1999-12-14",
                "last_updated": "",
                "link_gazette": "http://www.gazzettaufficiale.it/eli/gu/1999/11/29/280/sg/pdf",
                "link_urn_nir": "http://www.normattiva.it/uri-res/N2Ls?urn:nir:stato:decreto:1999-09-22;441",
                "link_eli_id": "http://www.normattiva.it/eli/id/1999/11/29/099G0517",
                "link_eli_type": "http://www.normattiva.it/eli/stato/DECRETO/1999/09/22/441",
                "id": "art_5_law_119_099G0517_1999-11-29.json",
                "article_number": "5",
                "article_text": [
                    "                               Art. 5.\n                          Costi finanziabili\n  1. Sono  ammesse al finanziamento  le spese di  partecipazione alla\ngara sostenute posteriormente alla data di arrivo al soggetto gestore\ndella domanda di  finanziamento e fino al termine di  scadenza per la\npresentazione dell'offerta definitiva.\n  2. Le fasi temporali dell'offerta  in cui possono essere effettuate\nle spese sono le seguenti:\n    a) fase della prequalifica;\n    b) fase dell'offerta;\n    c) fase della negoziazione dell'offerta.\n  3. Qualora l'impresa richieda il finanziamento delle spese relative\nalla fase  di prequalifica -  fermo restando che il  termine iniziale\nper il riconoscimento di tali spese  resta comunque la data di arrivo\ndella domanda -, l'esame della  richiesta ha luogo dopo che l'impresa\nabbia   comunicato  l'esito   della  fase   di  pre-   qualifica.  Il\nfinanziamento di dette spese e'  ammesso solo qualora la prequalifica\nsia prevista dal  bando di gara o da altra  idonea documentazione. Le\nrelative  spese devono  essere inoltre  inerenti alla  partecipazione\nalla  gara,  costituendo   parte  dei  costi  da   sostenere  per  la\npresentazione  dell'offerta.  Nel caso  in  cui  l'impresa non  abbia\nsuperato la fase di prequalifica,  il comitato delibera riguardo alle\nspese sostenute  ed il relativo  finanziamento e' erogato  per intero\ndopo la stipula del contratto.\n  4. Le  spese sostenute  vanno riferite  al momento  del verificarsi\ndell'evento  generatore  della  spesa, a  prescindere  dall'effettivo\npagamento. In particolare, i costi interni delle imprese, finalizzati\nalla partecipazione alla  gara e sostenuti nei termini  di cui sopra,\nsono  ammissibili al  finanziamento a  prescindere dal  momento della\nloro contabilizzazione.\n  5.  Fra gli  importi delle  singole voci  di spesa  e' ammessa  una\ncompensazione non superiore al quindici per cento."
                ]
            },
            {
                "filename": "law_189_092G0437_1992-10-01.json",
                "title": "DECRETO DEL PRESIDENTE DELLA REPUBBLICA 4 settembre 1992, n. 395",
                "subject": "Regolamento concernente l'assistenza fiscale ai lavoratori dipendenti e assimilati da parte dei sostituti d'imposta e dei Centri autorizzati di assistenza fiscale, in attuazione dell'art. 78, comma 18, della legge 30 dicembre 1991, n. 413.",
                "type": "decreto.del.presidente.della.repubblica",
                "number": "395",
                "year": "1992",
                "editorial_code": "092G0437",
                "gazette_reference": "(GU n.231 del 01-10-1992)",
                "publication_date": "1992-09-4",
                "gazette_date": "1992-10-01",
                "valid_from": "1996-10-26",
                "last_updated": "(Ultimo aggiornamento all'atto pubblicato il 07/09/1998)",
                "link_gazette": "http://www.gazzettaufficiale.it/eli/gu/1992/10/01/231/sg/pdf",
                "link_urn_nir": "http://www.normattiva.it/uri-res/N2Ls?urn:nir:stato:decreto.del.presidente.della.repubblica:1992-09-4;395",
                "link_eli_id": "http://www.normattiva.it/eli/id/1992/10/01/092G0437",
                "link_eli_type": "http://www.normattiva.it/eli/stato/DECRETO_DEL_PRESIDENTE_DELLA_REPUBBLICA/1992/09/4/395",
                "id": "art_2_law_189_092G0437_1992-10-01.json",
                "article_number": "2",
                "article_text": [
                    "                               Art. 2. \n      Termini e modalita' di presentazione della dichiarazione \n  ((1.  I  sostituti  d'imposta  che  prestano  l'assistenza  fiscale\npossono, entro il 15 gennaio di ogni  anno,  richiedere  ai  soggetti\ninteressati la preventiva  comunicazione  che  gli  stessi  intendono\navvalersi della detta assistenza. Tale comunicazione  deve  pervenire\nentro i successivi trenta giorni)). \n  2. I soggetti indicati nel comma 1, agli effetti di quanto disposto\ndal titolo I del decreto del Presidente della Repubblica 29 settembre\n1973, n. 600, e successive modificazioni ed  integrazioni,  adempiono\nall'obbligo di dichiarazione  dei  redditi  presentando  ai  soggetti\neroganti i redditi stessi, una apposita dichiarazione entro  il  mese\ndi marzo dell'anno  successivo  a  quello  cui  la  dichiarazione  si\nriferisce.  Tale  dichiarazione,  redatta  su  stampato  conforme  al\nmodello  approvato  con  decreto  del  Ministro  delle   finanze   da\npubblicare nella Gazzetta Ufficiale,  deve  essere  sottoscritta  dal\ncontribuente o da chi ne ha la rappresentanza legale o negoziale, che\nne assume la responsabilita'.(4) \n  3. Gli stampati  sono  ritirati  gratuitamente  presso  gli  uffici\ncomunali e gli uffici delle entrate; possono essere anche distribuiti\nsecondo  modalita'  stabilite  dal  Dipartimento  delle  entrate  del\nMinistero  delle  finanze,  ovvero  acquistati  presso  le  rivendite\nautorizzate. Il Ministro delle finanze, con  il  decreto  di  cui  al\ncomma 2, fissa il prezzo di vendita degli  stampati  ed  il  compenso\nspettante ai rivenditori. \n  4. L'apposita dichiarazione, il cui modello  e'  approvato  con  il\ndecreto previsto dal comma 2, deve contenere gli  elementi  necessari\nper la determinazione dei redditi,  esclusi  quelli  che  sono  stati\nerogati dal sostituto al quale  la  dichiarazione  viene  presentata.\nPERIODO SOPPRESSO DAL D.L. 31 MAGGIO 1994,  n.  330,  CONVERTITO  CON\nMODIFICAZIONI DALLA L. 27 LUGLIO 1994, N. 473. PERIODO SOPPRESSO  DAL\nD.L. 31 MAGGIO 1994, n. 330, CONVERTITO CON MODIFICAZIONI DALLA L. 27\nLUGLIO 1994, N. 473 . \n  5. La dichiarazione deve contenere, altresi',  tutti  gli  elementi\nnecessari per la liquidazione delle imposte e del contributo  per  le\nprestazioni del Servizio sanitario  nazionale  di  cui  all'art.  31,\ncommi 8, 9 e 11, della legge 28 febbraio 1986, n.  41,  e  successive\nmodificazioni ed integrazioni. \n  6. Alla dichiarazione non devono essere allegati i certificati  dei\nsostituti di imposta, le attestazioni relative  alle  detrazioni  per\ncarichi di famiglia, i documenti probatori degli oneri deducibili ne'\naltra documentazione. Tale documentazione  dovra'  essere  conservata\npresso il domicilio fiscale del contribuente per la  durata  prevista\ndall'art. 43 del decreto del Presidente della Repubblica 29 settembre\n1973,  n.  600,   e   successive   modificazioni   ed   integrazioni.\nL'amministrazione  finanziaria  puo'  chiedere  l'esibizione   o   la\ntrasmissione  dell'originale  o  di  copia   autenticata   di   detta\ndocumentazione, unitamente a copia della dichiarazione contenente  il\nprospetto di liquidazione delle imposte di cui all'art. 3, comma 3. \n  7. I soggetti di cui all'art. 1, commi 1 e 2, operano la scelta  ai\nfini della destinazione dell'8 per  mille  dell'imposta  sul  reddito\ndelle persone fisiche prevista dall'articolo 47 della legge 20 maggio\n1985,  n.  222,  e  dalle  leggi  che  approvano  le  intese  con  le\nconfessioni religiose di  cui  all'articolo  8,  terzo  comma,  della\nCostituzione, e alle leggi 22 novembre 1988,  n.  516  e  n.  517,  e\nsuccessive modificazioni ed integrazioni, mediante la  sottoscrizione\ndi apposite schede, conformi al modello  approvato  con  decreto  del\nMinistro delle finanze, da pubblicare nella  Gazzetta  Ufficiale.  Le\nschede devono essere consegnate in ogni caso al sostituto di  imposta\nin busta  chiusa  e  contrassegnata  dall'interessato  sui  lembi  di\nchiusura. Sulla busta vanno indicate  le  generalita'  ed  il  codice\nfiscale del contribuente.(7) \n  8. La  dichiarazione  di  cui  al  comma  2  puo'  comunque  essere\nintegrata dal contribuente, per i redditi non erogati  dal  sostituto\nd'imposta,  mediante  successiva  dichiarazione   dei   redditi,   da\npresentare entro i termini  di  cui  all'art.  9,  primo  comma,  del\ndecreto del Presidente della Repubblica 29 settembre 1973, n. 600,  e\nsuccessive modificazioni ed integrazioni, con  le  modalita'  di  cui\nall'art. 12 dello stesso decreto. \n  9. I contribuenti che intendono avvalersi delle disposizioni di cui\nall'art. 4, comma 2, lettere b) e c), del decreto-legge 2 marzo 1989,\nn. 69, convertito, con modificazioni, dalla legge 27 aprile 1989,  n.\n154, e successive modificazioni ed integrazioni, e delle disposizioni\nivi  richiamate,  ne  danno  comunicazione  al  sostituto   d'imposta\nindicando, sotto la propria responsabilita',  l'importo  delle  somme\nche, per effetto delle predette disposizioni, ritengono dovute.  Tale\ncomunicazione va effettuata in sede di dichiarazione di cui al  comma\n2 per la prima rata d'acconto, e mediante apposita comunicazione,  da\npresentare entro il mese di settembre, per la seconda rata d'acconto. \n    \n---------------\n\n    \nAGGIORNAMENTO (4) \n  Il D.L. 31 maggio 1994, n. 330 convertito con  modificazioni  dalla\nL. 27 luglio 1994, n. 473 (con l'art. 5, comma 2) ha disposto che \"le\ndisposizioni dei commi 1, 2 e 4 si applicano a decorrere  dalla  data\ndell'8 dicembre 1993\". "
                ]
            }
        ]
    },
    {
        "unit_id": "unit_10",
        "token_input": "UJVYONAWFA",
        "token_output": "MHZLBSKJPZ",
        "documents": [
            {
                "filename": "law_809_084U0413_1984-08-02.json",
                "title": "LEGGE 26 luglio 1984, n. 413",
                "subject": "Riordinamento pensionistico dei lavoratori marittimi.",
                "type": "legge",
                "number": "413",
                "year": "1984",
                "editorial_code": "084U0413",
                "gazette_reference": "(GU n.212 del 02-08-1984 - Suppl. Ordinario)",
                "publication_date": "1984-07-26",
                "gazette_date": "1984-08-02",
                "valid_from": "1984-09-01",
                "last_updated": "(Ultimo aggiornamento all'atto pubblicato il 16/01/2014)",
                "link_gazette": "http://www.gazzettaufficiale.it/eli/gu/1984/08/02/212/so/0/sg/pdf",
                "link_urn_nir": "http://www.normattiva.it/uri-res/N2Ls?urn:nir:stato:legge:1984-07-26;413",
                "link_eli_id": "http://www.normattiva.it/eli/id/1984/08/02/084U0413",
                "link_eli_type": "http://www.normattiva.it/eli/stato/LEGGE/1984/07/26/413",
                "id": "art_22_law_809_084U0413_1984-08-02.json",
                "article_number": "22",
                "article_text": [
                    "                              Art. 22.\n    (Cessazione del riconoscimento dei servizi prestati a terra)\n\n  La  facolta'  prevista dall'articolo 44 della legge 27 luglio 1967,\nn.  658,  cessa  a  far  tempo  dalla data di entrata in vigore della\npresente  legge  e  dalla  stessa  data viene meno la possibilita' di\nversamento dei contributi di pertinenza della soppressa Cassa."
                ]
            },
            {
                "filename": "law_36_088G0557_1988-11-16.json",
                "title": "DECRETO DEL PRESIDENTE DELLA REPUBBLICA 5 agosto 1987, n. 612",
                "subject": "Istituzione di un istituto professionale di Stato per l'industria e l'artigianato in Cusano Milanino.",
                "type": "decreto.del.presidente.della.repubblica",
                "number": "612",
                "year": "1987",
                "editorial_code": "088G0557",
                "gazette_reference": "(GU n.269 del 16-11-1988)",
                "publication_date": "1987-08-5",
                "gazette_date": "1988-11-16",
                "valid_from": "1988-12-01",
                "last_updated": "",
                "link_gazette": "http://www.gazzettaufficiale.it/eli/gu/1988/11/16/269/sg/pdf",
                "link_urn_nir": "http://www.normattiva.it/uri-res/N2Ls?urn:nir:stato:decreto.del.presidente.della.repubblica:1987-08-5;612",
                "link_eli_id": "http://www.normattiva.it/eli/id/1988/11/16/088G0557",
                "link_eli_type": "http://www.normattiva.it/eli/stato/DECRETO_DEL_PRESIDENTE_DELLA_REPUBBLICA/1987/08/5/612",
                "id": "art_8_law_36_088G0557_1988-11-16.json",
                "article_number": "8",
                "article_text": [
                    "                               Art. 8.\n  Nelle  sezioni  dell'istituto professionale indicate nel precedente\nart. 2 si impartiscono i seguenti insegnamenti: cultura  generale  ed\neducazione  civica;  matematica;  fisica;  conversazione  tecnica  in\nlingua estera; disegno tecnico ed elementi di  tecnologia  meccanica;\nelettrotecnica,    misurazioni    elettriche,   impianti   elettrici,\ncostruzioni eletttromeccaniche; esercitazioni  pratiche  e  collaudi;\nelettrotecnica,    radioelettronica   e   videotecnica;   misurazioni\nelettriche,   elettroniche   e   videotecniche;   tecnologia    delle\ncostruzioni elettroniche e disegno relativo; tecnologia e laboratorio\ntecnologico; meccanica applicata; religione; educazione fisica."
                ]
            },
            {
                "filename": "law_150_088G0492_1988-10-24.json",
                "title": "DECRETO DEL PRESIDENTE DELLA REPUBBLICA 22 settembre 1988, n. 447",
                "subject": "Approvazione del codice di procedura penale.",
                "type": "decreto.del.presidente.della.repubblica",
                "number": "447",
                "year": "1988",
                "editorial_code": "088G0492",
                "gazette_reference": "(GU n.250 del 24-10-1988 - Suppl. Ordinario n. 92)",
                "publication_date": "1988-09-22",
                "gazette_date": "1988-10-24",
                "valid_from": "1989-10-24",
                "last_updated": "(Ultimo aggiornamento all'atto pubblicato il 21/10/2020)",
                "link_gazette": "http://www.gazzettaufficiale.it/eli/gu/1988/10/24/250/so/92/sg/pdf",
                "link_urn_nir": "http://www.normattiva.it/uri-res/N2Ls?urn:nir:stato:decreto.del.presidente.della.repubblica:1988-09-22;447",
                "link_eli_id": "http://www.normattiva.it/eli/id/1988/10/24/088G0492",
                "link_eli_type": "http://www.normattiva.it/eli/stato/DECRETO_DEL_PRESIDENTE_DELLA_REPUBBLICA/1988/09/22/447",
                "id": "art_638_law_150_088G0492_1988-10-24.json",
                "article_number": "638",
                "article_text": [
                    "                              Art. 638. \n              Revisione a favore del condannato defunto \n  1. In caso di morte del  condannato  dopo  la  presentazione  della\nrichiesta di revisione, il presidente della corte di  appello  nomina\nun curatore,  il  quale  esercita  i  diritti  che  nel  processo  di\nrevisione sarebbero spettati al condannato. "
                ]
            },
            {
                "filename": "law_488_095G0141_1995-04-10.json",
                "title": "DECRETO-LEGGE 7 aprile 1995, n. 107",
                "subject": "Attuazione delle risoluzioni ONU numeri 942 e 944 del 1994, relative all'embargo nei confronti della Bosnia Erzegovina ed alla revoca dell'embargo nei confronti di Haiti, nonche' autorizzazione alla partecipazione italiana alla missione di polizia civile della U.E.O. a Mostar.",
                "type": "decreto.legge",
                "number": "107",
                "year": "1995",
                "editorial_code": "095G0141",
                "gazette_reference": "(GU n.84 del 10-04-1995)",
                "publication_date": "1995-04-7",
                "gazette_date": "1995-04-10",
                "valid_from": "1995-04-11",
                "last_updated": "(Ultimo aggiornamento all'atto pubblicato il 08/05/2010)",
                "link_gazette": "http://www.gazzettaufficiale.it/eli/gu/1995/04/10/84/sg/pdf",
                "link_urn_nir": "http://www.normattiva.it/uri-res/N2Ls?urn:nir:stato:decreto.legge:1995-04-7;107",
                "link_eli_id": "http://www.normattiva.it/eli/id/1995/04/10/095G0141",
                "link_eli_type": "http://www.normattiva.it/eli/stato/DECRETO_LEGGE/1995/04/7/107",
                "id": "art_6_law_488_095G0141_1995-04-10.json",
                "article_number": "6",
                "article_text": [
                    "                             Art. 6\n        ((ARTICOLO ABROGATO DAL D.LGS. 15 MARZO 2010, N. 66))"
                ]
            },
            {
                "filename": "law_422_088G0228_1988-06-01.json",
                "title": "DECRETO DEL PRESIDENTE DELLA REPUBBLICA 17 maggio 1988, n. 175",
                "subject": "Attuazione della direttiva CEE n. 82/501, relativa ai rischi di incidenti rilevanti connessi con determinate attivita' industriali, ai sensi della legge 16 aprile 1987, n. 183.",
                "type": "decreto.del.presidente.della.repubblica",
                "number": "175",
                "year": "1988",
                "editorial_code": "088G0228",
                "gazette_reference": "(GU n.127 del 01-06-1988)",
                "publication_date": "1988-05-17",
                "gazette_date": "1988-06-01",
                "valid_from": "1999-10-13",
                "last_updated": "(Ultimo aggiornamento all'atto pubblicato il 28/09/1999)",
                "link_gazette": "http://www.gazzettaufficiale.it/eli/gu/1988/06/01/127/sg/pdf",
                "link_urn_nir": "http://www.normattiva.it/uri-res/N2Ls?urn:nir:stato:decreto.del.presidente.della.repubblica:1988-05-17;175",
                "link_eli_id": "http://www.normattiva.it/eli/id/1988/06/01/088G0228",
                "link_eli_type": "http://www.normattiva.it/eli/stato/DECRETO_DEL_PRESIDENTE_DELLA_REPUBBLICA/1988/05/17/175",
                "id": "art_17_law_422_088G0228_1988-06-01.json",
                "article_number": "17",
                "article_text": [
                    "                              Art. 17. \n \n       ((ARTICOLO ABROGATO DAL D.LGS. 17 AGOSTO 1999, N. 334)) "
                ]
            },
            {
                "filename": "law_1021_083U0290_1983-06-17.json",
                "title": "DECRETO DEL PRESIDENTE DELLA REPUBBLICA 18 marzo 1983, n. 290",
                "subject": "Approvazione dei programmi e delle modalita' delle prove di esame, dei criteri di valutazione dei titoli e della composizione della commissione esaminatrice dei concorsi per la nomina a tenente di vascello in servizio permanente effettivo del Corpo musicale della Marina militare.",
                "type": "decreto.del.presidente.della.repubblica",
                "number": "290",
                "year": "1983",
                "editorial_code": "083U0290",
                "gazette_reference": "(GU n.165 del 17-06-1983)",
                "publication_date": "1983-03-18",
                "gazette_date": "1983-06-17",
                "valid_from": "2010-10-09",
                "last_updated": "(Ultimo aggiornamento all'atto pubblicato il 08/05/2010)",
                "link_gazette": "http://www.gazzettaufficiale.it/eli/gu/1983/06/17/165/sg/pdf",
                "link_urn_nir": "http://www.normattiva.it/uri-res/N2Ls?urn:nir:stato:decreto.del.presidente.della.repubblica:1983-03-18;290",
                "link_eli_id": "http://www.normattiva.it/eli/id/1983/06/17/083U0290",
                "link_eli_type": "http://www.normattiva.it/eli/stato/DECRETO_DEL_PRESIDENTE_DELLA_REPUBBLICA/1983/03/18/290",
                "id": "art_3_law_1021_083U0290_1983-06-17.json",
                "article_number": "3",
                "article_text": [
                    "                             Art. 3\n     ((PROVVEDIMENTO ABROGATO DAL D.LGS. 15 MARZO 2010, N. 66))"
                ]
            },
            {
                "filename": "law_223_084U0996_1985-02-06.json",
                "title": "DECRETO DEL PRESIDENTE DELLA REPUBBLICA 14 settembre 1984, n. 996",
                "subject": "Riconoscimento della personalita' giuridica della chiesa di S. Maria di Loreto, in Ercolano.",
                "type": "decreto.del.presidente.della.repubblica",
                "number": "996",
                "year": "1984",
                "editorial_code": "084U0996",
                "gazette_reference": "(GU n.32 del 06-02-1985)",
                "publication_date": "1984-09-14",
                "gazette_date": "1985-02-06",
                "valid_from": "1985-02-21",
                "last_updated": "",
                "link_gazette": "http://www.gazzettaufficiale.it/eli/gu/1985/02/06/32/sg/pdf",
                "link_urn_nir": "http://www.normattiva.it/uri-res/N2Ls?urn:nir:stato:decreto.del.presidente.della.repubblica:1984-09-14;996",
                "link_eli_id": "http://www.normattiva.it/eli/id/1985/02/06/084U0996",
                "link_eli_type": "http://www.normattiva.it/eli/stato/DECRETO_DEL_PRESIDENTE_DELLA_REPUBBLICA/1984/09/14/996",
                "id": "art_1_law_223_084U0996_1985-02-06.json",
                "article_number": "1",
                "article_text": [
                    "N. 996. Decreto del Presidente della Repubblica  14  settembre  1984,\n  col quale, sulla proposta del Ministro dell'interno, viene \n  riconosciuta la personalita' giuridica della chiesa di S. Maria di \n  Loreto, in Ercolano (Napoli). \n \nVisto, il Guardasigilli: MARTINAZZOLI \n  Registrato alla Corte dei conti, addi' 26 gennaio 1985 \n  Registro n. 4 Interno, foglio n. 363 "
                ]
            },
            {
                "filename": "law_452_092G0176_1992-02-19.json",
                "title": "DECRETO LEGISLATIVO 27 gennaio 1992, n. 133",
                "subject": "Attuazione delle direttive n. 76/464/CEE, n. 82/176/CEE, n. 83/513/CEE, n. 84/156/CEE, n. 84/491/CEE, n. 88/347/CEE e n. 90/415/CEE in materia di scarichi industriali di sostanze pericolose nelle acque.",
                "type": "decreto.legislativo",
                "number": "133",
                "year": "1992",
                "editorial_code": "092G0176",
                "gazette_reference": "(GU n.41 del 19-02-1992 - Suppl. Ordinario n. 34)",
                "publication_date": "1992-01-27",
                "gazette_date": "1992-02-19",
                "valid_from": "2006-04-29",
                "last_updated": "(Ultimo aggiornamento all'atto pubblicato il 14/04/2006)",
                "link_gazette": "http://www.gazzettaufficiale.it/eli/gu/1992/02/19/41/so/34/sg/pdf",
                "link_urn_nir": "http://www.normattiva.it/uri-res/N2Ls?urn:nir:stato:decreto.legislativo:1992-01-27;133",
                "link_eli_id": "http://www.normattiva.it/eli/id/1992/02/19/092G0176",
                "link_eli_type": "http://www.normattiva.it/eli/stato/DECRETO_LEGISLATIVO/1992/01/27/133",
                "id": "art_2_law_452_092G0176_1992-02-19.json",
                "article_number": "2",
                "article_text": [
                    "                               Art. 2 \n \n(( IL D. LGS. 3 APRILE 2006, N. 152 HA CONFERMATO  L'ABROGAZIONE  DEL\n                      PRESENTE PROVVEDIMENTO )) "
                ]
            },
            {
                "filename": "law_23_098G0033_1998-01-29.json",
                "title": "DECRETO DEL PRESIDENTE DEL CONSIGLIO DEI MINISTRI 12 dicembre 1997, n. 502",
                "subject": "Regolamento recante norme per l'inquadramento nel ruolo medico del Servizio sanitario nazionale di incaricati del servizio di guardia medica e medicina dei servizi.",
                "type": "decreto.del.presidente.del.consiglio.dei.ministri",
                "number": "502",
                "year": "1997",
                "editorial_code": "098G0033",
                "gazette_reference": "(GU n.23 del 29-01-1998)",
                "publication_date": "1997-12-12",
                "gazette_date": "1998-01-29",
                "valid_from": "1998-02-13",
                "last_updated": "",
                "link_gazette": "http://www.gazzettaufficiale.it/eli/gu/1998/01/29/23/sg/pdf",
                "link_urn_nir": "http://www.normattiva.it/uri-res/N2Ls?urn:nir:stato:decreto.del.presidente.del.consiglio.dei.ministri:1997-12-12;502",
                "link_eli_id": "http://www.normattiva.it/eli/id/1998/01/29/098G0033",
                "link_eli_type": "http://www.normattiva.it/eli/stato/DECRETO_DEL_PRESIDENTE_DEL_CONSIGLIO_DEI_MINISTRI/1997/12/12/502",
                "id": "art_5_law_23_098G0033_1998-01-29.json",
                "article_number": "5",
                "article_text": [
                    "                               Art. 5.\n                           Norme di rinvio\n  1. Per quanto  non previsto nel presente  regolamento si applicano,\nin quanto compatibili,  le norme del decreto  ministeriale 30 gennaio\n1982, pubblicato nel supplemento ordinario alla Gazzetta Ufficiale n.\n51 del  22 febbraio  1982, nonche' del  decreto del  Presidente della\nRepubblica  9  maggio  1994,   n.  487,  pubblicato  nel  supplemento\nordinario alla Gazzetta Ufficiale del 9 agosto 1994, n. 185."
                ]
            },
            {
                "filename": "law_582_096G0150_1996-03-18.json",
                "title": "DECRETO-LEGGE 15 marzo 1996, n. 126",
                "subject": "Disposizioni fiscali urgenti in materia di controlli e anagrafe patrimoniale dei dipendenti, al fine di contrastare l'evasione e la corruzione.",
                "type": "decreto.legge",
                "number": "126",
                "year": "1996",
                "editorial_code": "096G0150",
                "gazette_reference": "(GU n.65 del 18-03-1996)",
                "publication_date": "1996-03-15",
                "gazette_date": "1996-03-18",
                "valid_from": "1996-05-18",
                "last_updated": "(Ultimo aggiornamento all'atto pubblicato il 25/10/1996)",
                "link_gazette": "http://www.gazzettaufficiale.it/eli/gu/1996/03/18/65/sg/pdf",
                "link_urn_nir": "http://www.normattiva.it/uri-res/N2Ls?urn:nir:stato:decreto.legge:1996-03-15;126",
                "link_eli_id": "http://www.normattiva.it/eli/id/1996/03/18/096G0150",
                "link_eli_type": "http://www.normattiva.it/eli/stato/DECRETO_LEGGE/1996/03/15/126",
                "id": "art_2_law_582_096G0150_1996-03-18.json",
                "article_number": "2",
                "article_text": [
                    "                             Art. 2.\n                  DECRETO DECADUTO; I SUOI EFFETTI\n      SONO STATI FATTI SALVI DALLA L. 24 OTTOBRE 1996, N. 556."
                ]
            }
        ]
    },
    {
        "unit_id": "unit_11",
        "token_input": "VRESIPRGKZ",
        "token_output": "LMZGVEDXVH",
        "documents": [
            {
                "filename": "law_42_093G0009_1993-01-12.json",
                "title": "DECRETO 12 novembre 1992, n. 542",
                "subject": "Regolamento recante i criteri di valutazione delle caratteristiche delle acque minerali naturali.",
                "type": "decreto",
                "number": "542",
                "year": "1992",
                "editorial_code": "093G0009",
                "gazette_reference": "(GU n.8 del 12-01-1993)",
                "publication_date": "1992-11-12",
                "gazette_date": "1993-01-12",
                "valid_from": "2011-11-20",
                "last_updated": "(Ultimo aggiornamento all'atto pubblicato il 05/11/2011)",
                "link_gazette": "http://www.gazzettaufficiale.it/eli/gu/1993/01/12/8/sg/pdf",
                "link_urn_nir": "http://www.normattiva.it/uri-res/N2Ls?urn:nir:stato:decreto:1992-11-12;542",
                "link_eli_id": "http://www.normattiva.it/eli/id/1993/01/12/093G0009",
                "link_eli_type": "http://www.normattiva.it/eli/stato/DECRETO/1992/11/12/542",
                "id": "art_13_law_42_093G0009_1993-01-12.json",
                "article_number": "13",
                "article_text": [
                    "                              Art. 13. \n \n  Gli studi clinici, farmacologici  e  tossicologici  debbono  essere\ncondotti presso strutture ospedaliere o  universitarie  nel  rispetto\ndelle  regole  di  buona  pratica  clinica  e  di  buona  pratica  di\nlaboratorio. \n                                                                ((3)) \n \n------------- \nAGGIORNAMENTO (3) \n  Il D.Lgs. 8 ottobre 2011, n. 176 ha disposto (con l'art. 34,  comma\n3) che alla data  di  entrata  in  vigore  del  decreto  ministeriale\nprevisto all'articolo 3, comma 1, e' abrogato il decreto del Ministro\ndella sanita' 12 novembre 1992, n. 542. "
                ]
            },
            {
                "filename": "law_425_097G0138_1997-04-19.json",
                "title": "DECRETO DEL PRESIDENTE DELLA REPUBBLICA 6 marzo 1997, n. 100",
                "subject": "Regolamento recante la disciplina degli onorari, delle indennita' e dei criteri per il rimborso delle spese e per le prestazioni professionali dei ragionieri e periti commerciali.",
                "type": "decreto.del.presidente.della.repubblica",
                "number": "100",
                "year": "1997",
                "editorial_code": "097G0138",
                "gazette_reference": "(GU n.91 del 19-04-1997 - Suppl. Ordinario n. 84)",
                "publication_date": "1997-03-6",
                "gazette_date": "1997-04-19",
                "valid_from": "2010-10-30",
                "last_updated": "(Ultimo aggiornamento all'atto pubblicato il 15/10/2010)",
                "link_gazette": "http://www.gazzettaufficiale.it/eli/gu/1997/04/19/91/so/84/sg/pdf",
                "link_urn_nir": "http://www.normattiva.it/uri-res/N2Ls?urn:nir:stato:decreto.del.presidente.della.repubblica:1997-03-6;100",
                "link_eli_id": "http://www.normattiva.it/eli/id/1997/04/19/097G0138",
                "link_eli_type": "http://www.normattiva.it/eli/stato/DECRETO_DEL_PRESIDENTE_DELLA_REPUBBLICA/1997/03/6/100",
                "id": "art_4_law_425_097G0138_1997-04-19.json",
                "article_number": "4",
                "article_text": [
                    "                               Art. 4\n   ((PROVVEDIMENTO ABROGATO DAL DECRETO 2 SETTEMBRE 2010, N. 169))"
                ]
            },
            {
                "filename": "law_391_088G0276_1988-06-17.json",
                "title": "DECRETO 1 giugno 1988, n. 206",
                "subject": "Norme relative alla pubblicazione degli atti nel Bollettino ufficiale delle societa' per azioni ed a responsabilita' limitata.",
                "type": "decreto",
                "number": "206",
                "year": "1988",
                "editorial_code": "088G0276",
                "gazette_reference": "(GU n.141 del 17-06-1988)",
                "publication_date": "1988-06-1",
                "gazette_date": "1988-06-17",
                "valid_from": "1988-06-18",
                "last_updated": "",
                "link_gazette": "http://www.gazzettaufficiale.it/eli/gu/1988/06/17/141/sg/pdf",
                "link_urn_nir": "http://www.normattiva.it/uri-res/N2Ls?urn:nir:stato:decreto:1988-06-1;206",
                "link_eli_id": "http://www.normattiva.it/eli/id/1988/06/17/088G0276",
                "link_eli_type": "http://www.normattiva.it/eli/stato/DECRETO/1988/06/1/206",
                "id": "art_6_law_391_088G0276_1988-06-17.json",
                "article_number": "6",
                "article_text": [
                    "                               Art. 6.\n  1.  Il  presente  decreto entra in vigore il giorno successivo alla\nsua pubblicazione nella Gazzetta Ufficiale della Repubblica italiana.\n  Il presente decreto, munito del sigillo dello Stato, sara' inserito\nnella  Raccolta  ufficiale  degli  atti  normativi  della  Repubblica\nitaliana. E' fatto obbligo a chiunque spetti di osservarlo e di farlo\nosservare.\n   Roma, addi' 1 giugno 1988\n                                               Il Ministro: BATTAGLIA\nVisto, il Guardasigilli: VASSALLI"
                ]
            },
            {
                "filename": "law_150_088G0492_1988-10-24.json",
                "title": "DECRETO DEL PRESIDENTE DELLA REPUBBLICA 22 settembre 1988, n. 447",
                "subject": "Approvazione del codice di procedura penale.",
                "type": "decreto.del.presidente.della.repubblica",
                "number": "447",
                "year": "1988",
                "editorial_code": "088G0492",
                "gazette_reference": "(GU n.250 del 24-10-1988 - Suppl. Ordinario n. 92)",
                "publication_date": "1988-09-22",
                "gazette_date": "1988-10-24",
                "valid_from": "1989-10-24",
                "last_updated": "(Ultimo aggiornamento all'atto pubblicato il 21/10/2020)",
                "link_gazette": "http://www.gazzettaufficiale.it/eli/gu/1988/10/24/250/so/92/sg/pdf",
                "link_urn_nir": "http://www.normattiva.it/uri-res/N2Ls?urn:nir:stato:decreto.del.presidente.della.repubblica:1988-09-22;447",
                "link_eli_id": "http://www.normattiva.it/eli/id/1988/10/24/088G0492",
                "link_eli_type": "http://www.normattiva.it/eli/stato/DECRETO_DEL_PRESIDENTE_DELLA_REPUBBLICA/1988/09/22/447",
                "id": "art_273_law_150_088G0492_1988-10-24.json",
                "article_number": "273",
                "article_text": [
                    "                            Art. 273. \n           Condizioni generali di applicabilita' delle misure \n  1. Nessuno puo' essere sottoposto  a  misure  cautelari  se  a  suo\ncarico non sussistono gravi indizi di colpevolezza. \n  (( 1-bis. Nella valutazione dei gravi  indizi  di  colpevolezza  si\napplicano le disposizioni degli articoli 192, commi 3 e 4, 195, comma\n7, 203 e 271, comma 1 )). \n  2. Nessuna misura puo' essere applicata se risulta che il fatto  e'\nstato compiuto in presenza di una causa di giustificazione o  di  non\npunibilita' o se sussiste una causa di estinzione del reato \n  ovvero una causa di estinzione della  pena  che  si  ritiene  possa\nessere irrogata. "
                ]
            },
            {
                "filename": "law_9_000G0100_2000-03-21.json",
                "title": "DECRETO DEL PRESIDENTE DELLA REPUBBLICA 3 dicembre 1999, n. 549",
                "subject": "Regolamento recante norme di organizzazione delle strutture di livello dirigenziale generale del Ministero dell'ambiente.",
                "type": "decreto.del.presidente.della.repubblica",
                "number": "549",
                "year": "1999",
                "editorial_code": "000G0100",
                "gazette_reference": "(GU n.67 del 21-03-2000)",
                "publication_date": "1999-12-3",
                "gazette_date": "2000-03-21",
                "valid_from": "2001-06-10",
                "last_updated": "(Ultimo aggiornamento all'atto pubblicato il 18/05/2001)",
                "link_gazette": "http://www.gazzettaufficiale.it/eli/gu/2000/03/21/67/sg/pdf",
                "link_urn_nir": "http://www.normattiva.it/uri-res/N2Ls?urn:nir:stato:decreto.del.presidente.della.repubblica:1999-12-3;549",
                "link_eli_id": "http://www.normattiva.it/eli/id/2000/03/21/000G0100",
                "link_eli_type": "http://www.normattiva.it/eli/stato/DECRETO_DEL_PRESIDENTE_DELLA_REPUBBLICA/1999/12/3/549",
                "id": "art_7_law_9_000G0100_2000-03-21.json",
                "article_number": "7",
                "article_text": [
                    "                               Art. 7\n     ((PROVVEDIMENTO ABROGATO DAL D.P.R. 27 MARZO 2001, N. 178))"
                ]
            },
            {
                "filename": "law_1035_085U0107_1985-04-01.json",
                "title": "LEGGE 25 marzo 1985, n. 107",
                "subject": "Norme di attuazione della Convenzione per la prevenzione e la repressione dei reati contro le persone internazionalmente protette, compresi gli agenti diplomatici, adottata a New York il 14 dicembre 1973.",
                "type": "legge",
                "number": "107",
                "year": "1985",
                "editorial_code": "085U0107",
                "gazette_reference": "(GU n.78 del 01-04-1985)",
                "publication_date": "1985-03-25",
                "gazette_date": "1985-04-01",
                "valid_from": "1985-04-16",
                "last_updated": "",
                "link_gazette": "http://www.gazzettaufficiale.it/eli/gu/1985/04/01/78/sg/pdf",
                "link_urn_nir": "http://www.normattiva.it/uri-res/N2Ls?urn:nir:stato:legge:1985-03-25;107",
                "link_eli_id": "http://www.normattiva.it/eli/id/1985/04/01/085U0107",
                "link_eli_type": "http://www.normattiva.it/eli/stato/LEGGE/1985/03/25/107",
                "id": "art_2_law_1035_085U0107_1985-04-01.json",
                "article_number": "2",
                "article_text": [
                    "                               Art. 2. \n \n  E' punito secondo la legge italiana, a richiesta  del  Ministro  di\ngrazia e giustizia: \n    a) il cittadino che commette all'estero uno  dei  reati  indicati\nnell'articolo 1; \n    b) lo straniero che commette all'estero uno  dei  reati  indicati\nnell'articolo  1  in  danno  di  persona  che  goda  della   speciale\nprotezione  previste  dall'articolo  1  della  Convenzione   per   la\nprevenzione  e  la  repressione   dei   reati   contro   le   persone\ninternazionalmente protette, compresi gli agenti diplomatici, a causa\ndelle funzioni che essa esercita per conto dello Stato italiano; \n    c) lo straniero che commette all'estero uno  dei  reati  indicati\nnell'articolo 1, quando si trovi nel territorio dello Stato e non sia\ndisposta l'estradizione. "
                ]
            },
            {
                "filename": "law_125_089G0411_1989-10-05.json",
                "title": "DECRETO 30 settembre 1989, n. 334",
                "subject": "Regolamento per l'esecuzione del codice di procedura penale.",
                "type": "decreto",
                "number": "334",
                "year": "1989",
                "editorial_code": "089G0411",
                "gazette_reference": "(GU n.233 del 05-10-1989)",
                "publication_date": "1989-09-30",
                "gazette_date": "1989-10-05",
                "valid_from": "1989-10-24",
                "last_updated": "(Ultimo aggiornamento all'atto pubblicato il 15/06/2002)",
                "link_gazette": "http://www.gazzettaufficiale.it/eli/gu/1989/10/05/233/sg/pdf",
                "link_urn_nir": "http://www.normattiva.it/uri-res/N2Ls?urn:nir:stato:decreto:1989-09-30;334",
                "link_eli_id": "http://www.normattiva.it/eli/id/1989/10/05/089G0411",
                "link_eli_type": "http://www.normattiva.it/eli/stato/DECRETO/1989/09/30/334",
                "id": "art_5_law_125_089G0411_1989-10-05.json",
                "article_number": "5",
                "article_text": [
                    "                               Art. 5.\n  1.  Le denunce e gli altri documenti anonimi che non possono essere\nutilizzati  nel  procedimento  sono  annotati  in  apposito  registro\nsuddiviso  per  anni,  nel  quale  sono  iscritti  la  data in cui il\ndocumento e' pervenuto e il relativo oggetto.\n  2. Il registro e i documenti sono custoditi presso la procura della\nRepubblica con modalita' tali da assicurarne la riservatezza.\n  3.  Decorsi  cinque anni da quando i documenti indicati nel comma 1\nsono pervenuti alla procura della Repubblica, i documenti stessi e il\nregistro  sono  distrutti  con provvedimento adottato annualmente dal\nprocuratore della Repubblica. Delle relative  operazioni  e'  redatto\nverbale."
                ]
            },
            {
                "filename": "law_773_083U0538_1983-10-08.json",
                "title": "DECRETO DEL PRESIDENTE DELLA REPUBBLICA 15 luglio 1983, n. 538",
                "subject": "Modificazione allo statuto dell'Universita' degli studi \"La sapienza\" di Roma.",
                "type": "decreto.del.presidente.della.repubblica",
                "number": "538",
                "year": "1983",
                "editorial_code": "083U0538",
                "gazette_reference": "(GU n.277 del 08-10-1983)",
                "publication_date": "1983-07-15",
                "gazette_date": "1983-10-08",
                "valid_from": "1983-10-23",
                "last_updated": "",
                "link_gazette": "http://www.gazzettaufficiale.it/eli/gu/1983/10/08/277/sg/pdf",
                "link_urn_nir": "http://www.normattiva.it/uri-res/N2Ls?urn:nir:stato:decreto.del.presidente.della.repubblica:1983-07-15;538",
                "link_eli_id": "http://www.normattiva.it/eli/id/1983/10/08/083U0538",
                "link_eli_type": "http://www.normattiva.it/eli/stato/DECRETO_DEL_PRESIDENTE_DELLA_REPUBBLICA/1983/07/15/538",
                "id": "art_1_law_773_083U0538_1983-10-08.json",
                "article_number": "1",
                "article_text": [
                    "                   IL PRESIDENTE DELLA REPUBBLICA\n\n  Veduto lo statuto dell'Universita' \"La Sapienza\" di Roma, approvato\ncon   regio   decreto   14   ottobre   1926,  a  2319,  e  successive\nmodificazioni;\n  Veduto  il  testo  unico  delle  leggi  sull'istruzione  superiore,\napprovato con regio decreto 31 agosto 1933, n. 1592;\n  Veduto  il  regio decreto-legge 20 giugno 1935, n. 1071, convertito\nnella legge 2 gennaio 1936, n. 73;\n  Veduto  il  regio  decreto 30 settembre 1938, n. 1652, e successive\nmodificazioni;\n  Veduta la legge 11 aprile 1953, n. 312;\n  Veduto  il  decreto del Presidente della Repubblica 11 luglio 1980,\nn. 382;\n  Veduta la legge 30 ottobre 1981, n. 615;\n  Vedute  le  proposte  di  modifica  dello  statuto  formulate dalle\nautorita'  accademiche  dell'Universita'  anzidetta  ai  sensi  della\ncitata legge n. 615;\n  Veduto il parere del Consiglio universitario nazionale;\n  Sulla proposta del Ministro della pubblica istruzione;\n\n                              Decreta:\n\n  Lo  statuto  dell'Universita'  \"La  Sapienza\"  di Roma, approvato e\nmodificato  con  i decreti sopraindicati, e' ulteriormente modificato\ncome appresso:\n                           Articolo unico\n\n  Art. 92 - nell'elenco degli insegnamenti complementari del corso di\nlaurea in medicina e chirurgia sono inseriti i seguenti insegnamenti:\n    parassitologia medica;\n    rieducazione funzionale e riabilitazione.\n\n  Il  presente decreto, munito del sigillo dello Stato, sara' inserto\nnella  Raccolta  ufficiale delle leggi e dei decreti della Repubblica\nitaliana. E' fatto obbligo a chiunque spetti di osservarlo e di farlo\nosservare.\n\n  Dato a Roma, addi' 15 luglio 1983\n\n                               PERTINI\n\n                                                             FALCUCCI\n\nVisto, il Guardasigilli: MARTINAZZOLI\n  Registrato alla Corte dei conti, addi' 23 settembre 1983\n  Registro n. 62 Istruzione, foglio n. 320"
                ]
            },
            {
                "filename": "law_648_080U0617_1980-10-07.json",
                "title": "DECRETO DEL PRESIDENTE DELLA REPUBBLICA 31 luglio 1980, n. 617",
                "subject": "Ordinamento, controllo e finanziamento degli Istituti di ricovero e cura a carattere scientifico (art. 42, settimo comma, della legge 23 dicembre 1978, n. 833).",
                "type": "decreto.del.presidente.della.repubblica",
                "number": "617",
                "year": "1980",
                "editorial_code": "080U0617",
                "gazette_reference": "(GU n.275 del 07-10-1980 - Suppl. Ordinario)",
                "publication_date": "1980-07-31",
                "gazette_date": "1980-10-07",
                "valid_from": "1993-08-18",
                "last_updated": "(Ultimo aggiornamento all'atto pubblicato il 08/06/2001)",
                "link_gazette": "http://www.gazzettaufficiale.it/eli/gu/1980/10/07/275/so/0/sg/pdf",
                "link_urn_nir": "http://www.normattiva.it/uri-res/N2Ls?urn:nir:stato:decreto.del.presidente.della.repubblica:1980-07-31;617",
                "link_eli_id": "http://www.normattiva.it/eli/id/1980/10/07/080U0617",
                "link_eli_type": "http://www.normattiva.it/eli/stato/DECRETO_DEL_PRESIDENTE_DELLA_REPUBBLICA/1980/07/31/617",
                "id": "art_41_law_648_080U0617_1980-10-07.json",
                "article_number": "41",
                "article_text": [
                    "                              Art. 41.\n\n  Gli   attuali   organi   di   amministrazione  degli  istituti  con\npersonalita'  giuridica  di  diritto  pubblico restano in carica fino\nalla  nomina dei nuovi consigli di amministrazione, che deve avvenire\nentro sei mesi dalla data di entrata in vigore del presente decreto.\n  Entro  sessanta giorni da tale ultima data, gli attuali consigli di\namministrazione  debbono individuare gli organi o gli enti competenti\na  designare  i  membri  di  cui al precedente art. 3, n. 8), dandone\nimmediata   comunicazione   al   Ministero   della  sanita';  scaduto\ninfruttuosamente  il  predetto  termine, alla individuazione provvede\ndirettamente il Ministero della sanita'. ((2))\n---------------\nAGGIORNAMENTO (2)\n  Il  D.LGS. 30 giugno 1993, n. 269, ha disposto (con l'art. 8, commi\n1  e  2)  che  e'  abrogato  il  D.P.R.  31  luglio 1980, n. 617, con\nefficacia  a  decorrere  dalla  entrata  in  vigore  dei  regolamenti\nprevisti   dal   predetto  decreto,  in  relazione  alle  materie  di\nrispettiva competenza"
                ]
            },
            {
                "filename": "law_480_094G0291_1994-05-19.json",
                "title": "DECRETO LEGISLATIVO 16 aprile 1994, n. 297",
                "subject": "Approvazione del testo unico delle disposizioni legislative vigenti in materia di istruzione, relative alle scuole di ogni ordine e grado.",
                "type": "decreto.legislativo",
                "number": "297",
                "year": "1994",
                "editorial_code": "094G0291",
                "gazette_reference": "(GU n.115 del 19-05-1994 - Suppl. Ordinario n. 79)",
                "publication_date": "1994-04-16",
                "gazette_date": "1994-05-19",
                "valid_from": "1994-06-03",
                "last_updated": "(Ultimo aggiornamento all'atto pubblicato il 31/12/2020)",
                "link_gazette": "http://www.gazzettaufficiale.it/eli/gu/1994/05/19/115/so/79/sg/pdf",
                "link_urn_nir": "http://www.normattiva.it/uri-res/N2Ls?urn:nir:stato:decreto.legislativo:1994-04-16;297",
                "link_eli_id": "http://www.normattiva.it/eli/id/1994/05/19/094G0291",
                "link_eli_type": "http://www.normattiva.it/eli/stato/DECRETO_LEGISLATIVO/1994/04/16/297",
                "id": "art_38_law_480_094G0291_1994-05-19.json",
                "article_number": "38",
                "article_text": [
                    "                              Art. 38. \n                              Decadenza \n \n  1. I membri eletti e quelli designati, i  quali  non  intervengono,\nsenza giusitificati motivi, a tre sedute consecutive  dell'organo  di\ncui fanno parte, decadono dalla carica e  vengono  surrogati  con  le\nmodalita' previste dall'articolo 35. "
                ]
            }
        ]
    },
    {
        "unit_id": "unit_12",
        "token_input": "PWIPHINBDC",
        "token_output": "WECMWPSRBR",
        "documents": [
            {
                "filename": "law_71_092G0561_1992-12-31.json",
                "title": "DECRETO-LEGGE 31 dicembre 1992, n. 513",
                "subject": "Armonizzazione delle disposizioni in materia di imposte sugli oli minerali, sull'alcole, sulle bevande alcoliche, sui tabacchi lavorati e in materia di IVA con quelle recate da direttive CEE e modificazioni conseguenti a detta armonizzazione, nonche' disposizioni concernenti la disciplina dei Centri autorizzati di assistenza fiscale, le procedure dei rimborsi di imposta, l'esclusione dall'ILOR dei redditi di impresa fino all'ammontare corrispondente al contributo diretto lavorativo, l'istituzione per il 1993 di un'imposta erariale straordinaria su taluni beni ed altre disposizioni tributarie.",
                "type": "decreto.legge",
                "number": "513",
                "year": "1992",
                "editorial_code": "092G0561",
                "gazette_reference": "(GU n.306 del 31-12-1992)",
                "publication_date": "1992-12-31",
                "gazette_date": "1992-12-31",
                "valid_from": "1993-03-02",
                "last_updated": "(Ultimo aggiornamento all'atto pubblicato il 09/01/1993)",
                "link_gazette": "http://www.gazzettaufficiale.it/eli/gu/1992/12/31/306/sg/pdf",
                "link_urn_nir": "http://www.normattiva.it/uri-res/N2Ls?urn:nir:stato:decreto.legge:1992-12-31;513",
                "link_eli_id": "http://www.normattiva.it/eli/id/1992/12/31/092G0561",
                "link_eli_type": "http://www.normattiva.it/eli/stato/DECRETO_LEGGE/1992/12/31/513",
                "id": "art_24_law_71_092G0561_1992-12-31.json",
                "article_number": "24",
                "article_text": [
                    "                              Art. 24. \n    DECRETO DECADUTO; I SUOI EFFETTI SONO STATI FATTI SALVI DALLA \n                     L. 29 OTTOBRE 1993, N. 427 "
                ]
            },
            {
                "filename": "law_90_095G0543_1995-11-30.json",
                "title": "LEGGE 25 novembre 1995, n. 505",
                "subject": "Partecipazione italiana ad organismi internazionali e disposizioni relative ad enti sottoposti alla vigilanza del Ministero degli affari esteri.",
                "type": "legge",
                "number": "505",
                "year": "1995",
                "editorial_code": "095G0543",
                "gazette_reference": "(GU n.280 del 30-11-1995)",
                "publication_date": "1995-11-25",
                "gazette_date": "1995-11-30",
                "valid_from": "1995-12-01",
                "last_updated": "",
                "link_gazette": "http://www.gazzettaufficiale.it/eli/gu/1995/11/30/280/sg/pdf",
                "link_urn_nir": "http://www.normattiva.it/uri-res/N2Ls?urn:nir:stato:legge:1995-11-25;505",
                "link_eli_id": "http://www.normattiva.it/eli/id/1995/11/30/095G0543",
                "link_eli_type": "http://www.normattiva.it/eli/stato/LEGGE/1995/11/25/505",
                "id": "art_16_law_90_095G0543_1995-11-30.json",
                "article_number": "16",
                "article_text": [
                    "                              Art. 16.\n  1.  In  sede  di  prima  attuazione  della  presente   legge   sono\nconsiderati   soci   dell'Istituto,   aventi   titolo  a  partecipare\nall'assemblea, i soci onorari, ordinari, effettivi e sostenitori  dei\ndue  enti  soppressi,  risultanti tali alla data di entrata in vigore\ndella presente legge, a meno che, entro trenta giorni dalla  predetta\ndata,  abbiano  presentato o fatto pervenire ai rispettivi presidenti\ndichiarazione scritta attestante la  volonta'  di  non  mantenere  la\nqualita'   di   soci   dell'Istituto,  ferme  restando  le  quote  di\nassociazione  gia'  stabilite  per  l'anno  1995.  I  soci   ordinari\ndell'Istituto  italiano  per  il  Medio  ed  Estremo Oriente e quelli\neffettivi dell'Istituto italo-africano confluiscono  nella  categoria\ndei soci ordinari dell'Istituto.\n  2.  Entro  i  successivi  trenta  giorni i due presidenti convocano\nl'assemblea mediante  avviso  per  lettera  raccomandata,  contenente\nl'ordine  del  giorno,  ai  soci  indicati al comma 1, spedita almeno\nquindici giorni prima della data stabilita per la riunione.\n  3. L'assemblea, per la cui validita' occorre la presenza di  almeno\nla  meta'  dei  suoi  membri  in  prima convocazione e di un terzo in\nseconda convocazione, elegge il presidente  della  seduta  e  procede\nalla  elezione  dei componenti degli organi previsti dall'articolo 7,\ncomma 2, lettera a).\n  4. Ogni socio vota per tre nominativi per l'elezione dei componenti\ndel  consiglio  d'amministrazione,  per  un   solo   nominativo   per\nl'elezione   del  membro  del  collegio  dei  revisori  e  per  dieci\nnominativi per l'elezione dei componenti del  consiglio  scientifico.\nE'  ammesso il voto per delega con un massimo di quattro deleghe allo\nstesso socio.\n  5. Fino alla costituzione  del  collegio  dei  revisori  dei  conti\ndell'Istituto, continuano ad operare i collegi dei revisori dei conti\nin  carica  presso  gli enti soppressi alla data di entrata in vigore\ndella presente legge.\n  6. I contratti dei direttori generali in servizio presso  gli  enti\nsoppressi  alla  data  di entrata in vigore della presente legge sono\nrisolti di diritto  all'atto  della  nomina  del  direttore  generale\ndell'Istituto, ove non siano scaduti in precedenza."
                ]
            },
            {
                "filename": "law_413_086U0726_1986-11-03.json",
                "title": "DECRETO DEL PRESIDENTE DELLA REPUBBLICA 2 agosto 1986, n. 726",
                "subject": "Modificazioni allo statuto della Societa' italiana degli autori ed editori, in Roma.",
                "type": "decreto.del.presidente.della.repubblica",
                "number": "726",
                "year": "1986",
                "editorial_code": "086U0726",
                "gazette_reference": "(GU n.255 del 03-11-1986)",
                "publication_date": "1986-08-2",
                "gazette_date": "1986-11-03",
                "valid_from": "1986-11-18",
                "last_updated": "",
                "link_gazette": "http://www.gazzettaufficiale.it/eli/gu/1986/11/03/255/sg/pdf",
                "link_urn_nir": "http://www.normattiva.it/uri-res/N2Ls?urn:nir:stato:decreto.del.presidente.della.repubblica:1986-08-2;726",
                "link_eli_id": "http://www.normattiva.it/eli/id/1986/11/03/086U0726",
                "link_eli_type": "http://www.normattiva.it/eli/stato/DECRETO_DEL_PRESIDENTE_DELLA_REPUBBLICA/1986/08/2/726",
                "id": "art_1_law_413_086U0726_1986-11-03.json",
                "article_number": "1",
                "article_text": [
                    "n. 726.  Decreto  del  Presidente della Repubblica 2 agosto 1986, col\n  quale, sulla proposta del Presidente del Consiglio dei Ministri, di\n  concerto con i Ministri degli affari esteri, di grazia e giustizia,\n  delle  finanze,  del tesoro, della pubblica istruzione e per i beni\n  culturali  e  ambientali,  vengono  approvate le modificazioni allo\n  statuto della Societa' italiana degli autori ed editori (S.I.A.E.),\n  in  Roma,  approvato con decreto del Presidente della Repubblica 20\n  ottobre 1962, n. 1842.\n\nVisto, il Guardasigilli: ROGNONI\n  Registrato alla Corte dei conti, addi' 23 ottobre 1986\n  Registro n. 10 Presidenza, foglio n. 397"
                ]
            },
            {
                "filename": "law_9_000G0100_2000-03-21.json",
                "title": "DECRETO DEL PRESIDENTE DELLA REPUBBLICA 3 dicembre 1999, n. 549",
                "subject": "Regolamento recante norme di organizzazione delle strutture di livello dirigenziale generale del Ministero dell'ambiente.",
                "type": "decreto.del.presidente.della.repubblica",
                "number": "549",
                "year": "1999",
                "editorial_code": "000G0100",
                "gazette_reference": "(GU n.67 del 21-03-2000)",
                "publication_date": "1999-12-3",
                "gazette_date": "2000-03-21",
                "valid_from": "2001-06-10",
                "last_updated": "(Ultimo aggiornamento all'atto pubblicato il 18/05/2001)",
                "link_gazette": "http://www.gazzettaufficiale.it/eli/gu/2000/03/21/67/sg/pdf",
                "link_urn_nir": "http://www.normattiva.it/uri-res/N2Ls?urn:nir:stato:decreto.del.presidente.della.repubblica:1999-12-3;549",
                "link_eli_id": "http://www.normattiva.it/eli/id/2000/03/21/000G0100",
                "link_eli_type": "http://www.normattiva.it/eli/stato/DECRETO_DEL_PRESIDENTE_DELLA_REPUBBLICA/1999/12/3/549",
                "id": "art_7_law_9_000G0100_2000-03-21.json",
                "article_number": "7",
                "article_text": [
                    "                               Art. 7\n     ((PROVVEDIMENTO ABROGATO DAL D.P.R. 27 MARZO 2001, N. 178))"
                ]
            },
            {
                "filename": "law_70_090G0440_1990-12-21.json",
                "title": "DECRETO-LEGGE 21 dicembre 1990, n. 391",
                "subject": "Trasferimento all'AIMA della gestione delle risorse proprie della CEE e degli aiuti nazionali nel settore dello zucchero, nonche' modifica delle norme per la ristrutturazione del settore bieticolosaccarifero.",
                "type": "decreto.legge",
                "number": "391",
                "year": "1990",
                "editorial_code": "090G0440",
                "gazette_reference": "(GU n.297 del 21-12-1990)",
                "publication_date": "1990-12-21",
                "gazette_date": "1990-12-21",
                "valid_from": "1991-02-20",
                "last_updated": "(Ultimo aggiornamento all'atto pubblicato il 11/08/1997)",
                "link_gazette": "http://www.gazzettaufficiale.it/eli/gu/1990/12/21/297/sg/pdf",
                "link_urn_nir": "http://www.normattiva.it/uri-res/N2Ls?urn:nir:stato:decreto.legge:1990-12-21;391",
                "link_eli_id": "http://www.normattiva.it/eli/id/1990/12/21/090G0440",
                "link_eli_type": "http://www.normattiva.it/eli/stato/DECRETO_LEGGE/1990/12/21/391",
                "id": "art_6 ter_law_70_090G0440_1990-12-21.json",
                "article_number": "6 ter",
                "article_text": [
                    "                               Art. 6-ter. \n  (( 1. La riscossione dei contributi  dovuti  dai  produttori,  soci\ndelle  associazioni  aderenti  a  unioni  riconosciute  titolari   di\nquantitativi di riferimento  di  latte  ai  sensi  dell'articolo  12,\nlettera  c),  del  citato   regolamento   n.   857/84/CEE,   per   il\nperseguimento delle finalita' istituzionali dell'ente, nonche' per il\npagamento del prelievo supplementare sul latte di  vacca  di  cui  al\nmedesimo regolamento, puo' avvenire con le  modalita'  stabilite  dal\nquinto e sesto comma dell'articolo 19 della legge 25 maggio 1970,  n.\n364, come modificato dall'articolo 10 della legge 15 ottobre 1981, n.\n590. \n  2. Con decreto del Ministro dell'agricoltura e  delle  foreste,  da\nemanarsi entro trenta giorni dalla data di entrata  in  vigore  della\nlegge di conversione del presente decreto,  sono  emanate  norme  per\nl'applicazione  del  comma  1  e  per  l'armonizzazione  del   regime\ncomunitario delle quote latte con la normativa sui contratti agrari e\nsulla produzione lattiero-casearia )). "
                ]
            },
            {
                "filename": "law_929_080U0336_1980-07-18.json",
                "title": "LEGGE 8 luglio 1980, n. 336",
                "subject": "Provvedimenti straordinari per il potenziamento e l'ammodernamento dei servizi del Corpo nazionale dei vigili del fuoco.",
                "type": "legge",
                "number": "336",
                "year": "1980",
                "editorial_code": "080U0336",
                "gazette_reference": "(GU n.196 del 18-07-1980)",
                "publication_date": "1980-07-8",
                "gazette_date": "1980-07-18",
                "valid_from": "2008-12-22",
                "last_updated": "(Ultimo aggiornamento all'atto pubblicato il 25/06/2008)",
                "link_gazette": "http://www.gazzettaufficiale.it/eli/gu/1980/07/18/196/sg/pdf",
                "link_urn_nir": "http://www.normattiva.it/uri-res/N2Ls?urn:nir:stato:legge:1980-07-8;336",
                "link_eli_id": "http://www.normattiva.it/eli/id/1980/07/18/080U0336",
                "link_eli_type": "http://www.normattiva.it/eli/stato/LEGGE/1980/07/8/336",
                "id": "art_4_law_929_080U0336_1980-07-18.json",
                "article_number": "4",
                "article_text": [
                    "                               Art. 4 \n((IL D.L. 25 GIUGNO 2008, N.112, CONVERTITO, CON MODIFICAZIONI, DALLA\nL. 6 AGOSTO 2008, N. 133 HA  CONFERMATO  L'ABROGAZIONE  DEL  PRESENTE\n                           PROVVEDIMENTO)) "
                ]
            },
            {
                "filename": "law_554_088G0044_1988-02-29.json",
                "title": "DECRETO DEL PRESIDENTE DELLA REPUBBLICA 28 gennaio 1988, n. 43",
                "subject": "Istituzione del Servizio di riscossione dei tributi e di altre entrate dello Stato e di altri enti pubblici, ai sensi dell'art. 1, comma 1, della legge 4 ottobre 1986, n. 657.",
                "type": "decreto.del.presidente.della.repubblica",
                "number": "43",
                "year": "1988",
                "editorial_code": "088G0044",
                "gazette_reference": "(GU n.49 del 29-02-1988 - Suppl. Ordinario n. 12)",
                "publication_date": "1988-01-28",
                "gazette_date": "1988-02-29",
                "valid_from": "1999-07-01",
                "last_updated": "(Ultimo aggiornamento all'atto pubblicato il 27/04/1999)",
                "link_gazette": "http://www.gazzettaufficiale.it/eli/gu/1988/02/29/49/so/12/sg/pdf",
                "link_urn_nir": "http://www.normattiva.it/uri-res/N2Ls?urn:nir:stato:decreto.del.presidente.della.repubblica:1988-01-28;43",
                "link_eli_id": "http://www.normattiva.it/eli/id/1988/02/29/088G0044",
                "link_eli_type": "http://www.normattiva.it/eli/stato/DECRETO_DEL_PRESIDENTE_DELLA_REPUBBLICA/1988/01/28/43",
                "id": "art_124_law_554_088G0044_1988-02-29.json",
                "article_number": "124",
                "article_text": [
                    "                              Art. 124 \nEsodo volontario del personale gia' dipendente delle esattorie  delle\n                           imposte dirette \n \n  1. Il personale di cui all'articolo 122, che non intende  avvalersi\ndel  diritto  di  essere  manutenuto  in   servizio   puo'   chiedere\nl'applicazione  dei  benefici  previsti  del  presente  articolo  con\ncontestuale obbligo di risolvere anticipatamente il proprio  rapporto\ndi lavoro. \n  2. A coloro che si avvalgono della facolta' di cui al  comma  1  e'\nattribuita una maggiore anzianita' virtuale di tre mesi per ogni anno\ndi servizio effettivo prestato, fino ad un massimo di cinque anni, da\nvalere nei confronti dei fondi pensionistici, previsti per legge,  in\nalternativa agli  effetti  del  raggiungimento  del  limite  di  eta'\npensionabile, ovvero della maturazione del diritto a pensione. \n  3. In deroga alle norme di cui alla legge 2 aprile 1958, n. 377,  e\nsuccessive modificazioni, il personale iscritto al fondo,  che  vuole\navvalersi  dei  benefici  di  cui   al   comma   2,   puo'   chiedere\nl'applicazione della maggiore anzianita' ai  fini  del  diritto  alla\npensione  di  anzianita'  a  carico  della   assicurazione   generale\nobbligatoria. In tal caso non si applicano le disposizioni  contenute\nnegli articoli 32 della citata legge n. 377 del 1958 e  nell'articolo\n7 della legge 29 luglio 1971,  n.  587  e  l'importo  dei  contributi\nversati nel  fondo  di  previdenza  e'  trasferito  all'assicurazione\ngenerale obbligatoria a scomputo dell'onere  finanziario  di  cui  al\ncomma 6 del presente articolo. \n  4. La domanda di risoluzione anticipata del rapporto di lavoro, con\nrichiesta  di  applicazione  dei  benefici  previsti   dal   presente\narticolo, deve essere presentata allo speciale  fondo  di  previdenza\nper gli impiegati esattoriali ed al competente concessionario, a pena\ndi decadenza entro  tre  mesi  dall'entrata  in  funzione  del  nuovo\nservizio di riscossione. Per il personale non iscritto  al  fondo  di\nprevidenza, la domanda va presentata alla compente  sede  provinciale\ndell'Istituto Nazionale  della  previdenza  sociale,  il  trattamento\npensionistico decorre dal  primo  giorno  del  mese  successiva  alla\ndomanda ed il lavoratore e' esonerato  dall'obbligo  di  prestare  il\npreavviso di cui all'articolo 2118 c.c. (3) \n  5. Coloro che si sono  avvalsi  dell'esodo  volontario  di  cui  al\npresente articolo non possono essere  assunti,  a  qualsiati  titolo,\nalle dipendenze dell'amministrazione dello  Stato  o  di  altri  enti\npubblici non economici, ne' possono svolgere  incarichi  affidati  da\ntali amministrazioni. \n  6. Le disposizioni di cui al presente articolo non si applicano nei\nconfronti del personale il cui rapporto di lavoro non e' regolato dai\ncontratti collettivi del settore esattoriale. \n  7. All'onere derivante  dall'applicazione  del  presente  articolo,\nvalutato da lire 10 miliardi per ciascuno degli  anni  1989,  1990  e\n1991 si provvede mediante corrispondente riduzione dello stanziamento\niscritto, ai fini del bilancio triennale 1986, 1990, al capitolo 6856\ndello stato di previsione del Ministero del Tesoro per  l'anno  1988,\nall'uopo utilizzando  quota  parte  della  proiezione  per  gli  anni\nsuddetti dell'accantonamento \"Ristrutturazione della  amministrazione\nfinanziaria\". Il Ministro del tesoro e' autorizzato ad apportare, con\npropri decreti, le occorrenti variazioni di bilancio. Con decreto del\nMinistro del tesoro, di concerto con il Ministro del lavoro  e  della\nprevidenza sociale, sono stabiliti i criteri e le  modalita'  per  il\nrimborso alle gestioni previdenziali delle somme erogate per  effetto\ndelle disposizioni recate dal presente articolo. ((19)) \n \n    \n-----------------\n\n    \nAGGIORNAMENTO (3) \n  Il D.L. 27 aprile 1990, n. 90, convertito, con modificazioni, dalla\nL. 26 giugno 1990, n. 165, ha disposto (con l'art. 8,  comma  9)  che\n\"Il termine di  cui  all'articolo  124,  comma  4,  del  decreto  del\nPresidente della Repubblica 28 gennaio 1988, n. 43, e'  prorogato  al\n31 maggio 1990.\" \n    \n-------------\n\n    \nAGGIORNAMENTO (19) \n  Il D.Lgs. 13 aprile 1999, n. 112 ha disposto (con l'art. 68,  comma\n1) che \"Salvo quanto previsto dagli articoli 58 e 59, e' abrogato  il\ndecreto del Presidente della Repubblica 28 gennaio 1988, n. 43.  Tale\nabrogazione non opera limitatamente al rinvio contenuto nell'articolo\n4, comma 1, ultimo periodo, del decreto legislativo 9 luglio 1997, n.\n237\". "
                ]
            },
            {
                "filename": "law_540_095G0084_1995-02-28.json",
                "title": "DECRETO-LEGGE 25 febbraio 1995, n. 55",
                "subject": "Disposizioni urgenti in materia di differimento di termini previsti da disposizioni legislative.",
                "type": "decreto.legge",
                "number": "55",
                "year": "1995",
                "editorial_code": "095G0084",
                "gazette_reference": "(GU n.49 del 28-02-1995)",
                "publication_date": "1995-02-25",
                "gazette_date": "1995-02-28",
                "valid_from": "1995-04-30",
                "last_updated": "(Ultimo aggiornamento all'atto pubblicato il 24/07/1995)",
                "link_gazette": "http://www.gazzettaufficiale.it/eli/gu/1995/02/28/49/sg/pdf",
                "link_urn_nir": "http://www.normattiva.it/uri-res/N2Ls?urn:nir:stato:decreto.legge:1995-02-25;55",
                "link_eli_id": "http://www.normattiva.it/eli/id/1995/02/28/095G0084",
                "link_eli_type": "http://www.normattiva.it/eli/stato/DECRETO_LEGGE/1995/02/25/55",
                "id": "art_62_law_540_095G0084_1995-02-28.json",
                "article_number": "62",
                "article_text": [
                    "                              Art. 62.\n       DECRETO DECADUTO; I SUOI EFFETTI SONO STATI FATTI SALVI\n                   DALLA L. 13 LUGLIO 1995, N. 295"
                ]
            },
            {
                "filename": "law_357_090G0146_1990-05-08.json",
                "title": "LEGGE 2 maggio 1990, n. 104",
                "subject": "Modifiche ed integrazioni alla legge 24 dicembre 1976, n. 898, concernente nuova regolamentazione delle servitu' militari.",
                "type": "legge",
                "number": "104",
                "year": "1990",
                "editorial_code": "090G0146",
                "gazette_reference": "(GU n.105 del 08-05-1990)",
                "publication_date": "1990-05-2",
                "gazette_date": "1990-05-08",
                "valid_from": "2010-10-09",
                "last_updated": "(Ultimo aggiornamento all'atto pubblicato il 08/05/2010)",
                "link_gazette": "http://www.gazzettaufficiale.it/eli/gu/1990/05/08/105/sg/pdf",
                "link_urn_nir": "http://www.normattiva.it/uri-res/N2Ls?urn:nir:stato:legge:1990-05-2;104",
                "link_eli_id": "http://www.normattiva.it/eli/id/1990/05/08/090G0146",
                "link_eli_type": "http://www.normattiva.it/eli/stato/LEGGE/1990/05/2/104",
                "id": "art_6_law_357_090G0146_1990-05-08.json",
                "article_number": "6",
                "article_text": [
                    "                             Art. 6\n     ((PROVVEDIMENTO ABROGATO DAL D.LGS. 15 MARZO 2010, N. 66))"
                ]
            },
            {
                "filename": "law_42_098G0004_1998-01-17.json",
                "title": "DECRETO DEL PRESIDENTE DELLA REPUBBLICA 10 dicembre 1997, n. 483",
                "subject": "Regolamento recante la disciplina concorsuale per il personale dirigenziale del Servizio sanitario nazionale.",
                "type": "decreto.del.presidente.della.repubblica",
                "number": "483",
                "year": "1997",
                "editorial_code": "098G0004",
                "gazette_reference": "(GU n.13 del 17-01-1998 - Suppl. Ordinario n. 8)",
                "publication_date": "1997-12-10",
                "gazette_date": "1998-01-17",
                "valid_from": "2013-08-21",
                "last_updated": "(Ultimo aggiornamento all'atto pubblicato il 21/06/2013)",
                "link_gazette": "http://www.gazzettaufficiale.it/eli/gu/1998/01/17/13/so/8/sg/pdf",
                "link_urn_nir": "http://www.normattiva.it/uri-res/N2Ls?urn:nir:stato:decreto.del.presidente.della.repubblica:1997-12-10;483",
                "link_eli_id": "http://www.normattiva.it/eli/id/1998/01/17/098G0004",
                "link_eli_type": "http://www.normattiva.it/eli/stato/DECRETO_DEL_PRESIDENTE_DELLA_REPUBBLICA/1997/12/10/483",
                "id": "art_61_law_42_098G0004_1998-01-17.json",
                "article_number": "61",
                "article_text": [
                    "                              Art. 61.\n                          P u n t e g g i o\n 1.  La  commissione  dispone,  complessivamente,  di 100 punti cosi'\nripartiti:\n  a) 20 punti per i titoli;\n  b) 80 punti per le prove d'esame.\n 2. I punti per le prove d'esame sono cosi ripartiti:\n  a) 30 punti per la prova scritta;\n  b) 30 punti per la prova pratica;\n  c) 20 punti per la prova orale.\n 3. I punti per la valutazione dei titoli sono cosi' ripartiti:\n  a) titoli di carriera: 10;\n  b) titoli accademici e di studio: 3;\n  c) pubblicazioni e titoli scientifici: 3;\n  d) curriculum formativo e professionale: 4.\n 4. Titoli di carriera:\n  a) servizio di ruolo nel livello a concorso o in livello  superiore\npresso  le  U.s.l.,  le  aziende  ospedaliere,  gli  enti di cui agli\narticoli 22 e 23 e presso altre pubbliche amministrazioni, punti 1,00\nper anno;\n  b) servizio di ruolo in altra posizione funzionale presso gli  enti\ndi cui alla lettera a), punti 0,50.\n 5. Titoli accademici e di studio:\n  a)  specializzazione  di livello universitario in materie attinenti\nalla posizione funzionale da conferire, punti 1,00 per ognuna;\n  b)  altre  lauree,  oltre  quella  richiesta  per  l'ammissione  al\nconcorso  purche'  attinenti  alla posizione funzionale da conferire,\npunti 0,50 per ognuna, fino ad un massimo di punti 1,00.\n 6. Per la valutazione delle pubblicazioni, dei titoli scientifici  e\ndel  curriculum  formativo  e  professionale  si  applicano i criteri\nindicati nell'articolo 11."
                ]
            }
        ]
    },
    {
        "unit_id": "unit_13",
        "token_input": "FOPUHYBDWV",
        "token_output": "BWDZEXSCTS",
        "documents": [
            {
                "filename": "law_277_090G0226_1990-07-13.json",
                "title": "DECRETO 20 aprile 1990, n. 184",
                "subject": "Regolamento recante disposizioni nazionali di attuazione delle norme del regolamento CEE n. 986/89, relativo ai documenti che scortano il trasporto dei prodotti e alla tenuta dei registri nel settore vitivinicolo.",
                "type": "decreto",
                "number": "184",
                "year": "1990",
                "editorial_code": "090G0226",
                "gazette_reference": "(GU n.162 del 13-07-1990)",
                "publication_date": "1990-04-20",
                "gazette_date": "1990-07-13",
                "valid_from": "1990-07-13",
                "last_updated": "",
                "link_gazette": "http://www.gazzettaufficiale.it/eli/gu/1990/07/13/162/sg/pdf",
                "link_urn_nir": "http://www.normattiva.it/uri-res/N2Ls?urn:nir:stato:decreto:1990-04-20;184",
                "link_eli_id": "http://www.normattiva.it/eli/id/1990/07/13/090G0226",
                "link_eli_type": "http://www.normattiva.it/eli/stato/DECRETO/1990/04/20/184",
                "id": "art_6_law_277_090G0226_1990-07-13.json",
                "article_number": "6",
                "article_text": [
                    "                               Art. 6.\n  1. L'originale del documento commerciale omologato deve scortare il\nprodotto  durante  il  trasporto  e   deve   essere   consegnato   al\ndestinatario,  salvo il disposto di cui all'art. 10, paragrafo 2, del\nregolamento CEE n. 986/89. Delle tre copie,  la  prima,  a  cura  del\nvenditore  o dello speditore, deve essere inviata, a mezzo di lettera\no pacco raccomandato, entro il settimo giorno lavorativo successivo a\nquello  della  compilazione  all'ufficio  repressione frodi che opera\nnella circoscrizione di spedizione, fatto salvo il  disposto  di  cui\nall'art.  12  del  regolamento CEE n.  986/89, la seconda deve essere\nconservata da colui che cede il prodotto, mentre la terza deve essere\nconsegnata al vettore prima dell'inizio del trasporto."
                ]
            },
            {
                "filename": "law_667_080U0598_1980-10-06.json",
                "title": "DECRETO DEL PRESIDENTE DELLA REPUBBLICA 1 luglio 1980, n. 598",
                "subject": "Modificazione allo statuto dell'Universita' degli studi di Pisa.",
                "type": "decreto.del.presidente.della.repubblica",
                "number": "598",
                "year": "1980",
                "editorial_code": "080U0598",
                "gazette_reference": "(GU n.274 del 06-10-1980)",
                "publication_date": "1980-07-1",
                "gazette_date": "1980-10-06",
                "valid_from": "1980-10-21",
                "last_updated": "",
                "link_gazette": "http://www.gazzettaufficiale.it/eli/gu/1980/10/06/274/sg/pdf",
                "link_urn_nir": "http://www.normattiva.it/uri-res/N2Ls?urn:nir:stato:decreto.del.presidente.della.repubblica:1980-07-1;598",
                "link_eli_id": "http://www.normattiva.it/eli/id/1980/10/06/080U0598",
                "link_eli_type": "http://www.normattiva.it/eli/stato/DECRETO_DEL_PRESIDENTE_DELLA_REPUBBLICA/1980/07/1/598",
                "id": "art_1_law_667_080U0598_1980-10-06.json",
                "article_number": "1",
                "article_text": [
                    "                   IL PRESIDENTE DELLA REPUBBLICA\n\n  Veduto  lo  statuto  dell'Universita'  di Pisa, approvato con regio\ndecreto  14  ottobre  1926, n. 2278 e modificato con regio decreto 13\nottobre 1927, n. 2225, e successive modificazioni;\n  Veduto  il  testo  unico  delle  leggi  sull'istruzione  superiore,\napprovato con regio decreto 31 agosto 1933, n. 1592;\n  Veduto  il  regio decreto-legge 20 giugno 1935, n. 1071, convertito\nnella legge 2 gennaio 1936, n. 73;\n  Veduto  il  regio  decreto 30 settembre 1938, n. 1652, e successive\nmodificazioni;\n  Veduta la legge 11 aprile 1953, n. 312;\n  Vedute  le  proposte  di  modifica  dello  statuto  formulate dalle\nautorita' accademiche dell'Universita' anzidetta;\n  Riconosciuta  la  particolare  necessita'  di  approvare  le  nuove\nmodifiche  proposte  in deroga al termine triennale di cui all'ultimo\ncomma  dell'art.  17  del  testo unico 31 agosto 1933, n. 1592, per i\nmotivi   esposti   nelle   deliberazioni   degli   organi  accademici\ndell'Universita'  di  Pisa  e convalidati dal Consiglio universitario\nnazionale nel suo parere;\n  Sentito il parere del Consiglio universitario nazionale;\n  Sulla proposta del Ministro della pubblica istruzione;\n\n                              Decreta:\n\n  Lo  statuto  dell'Universita'  degli  studi  di  Pisa,  approvato e\nmodificato  con  i decreti sopraindicati, e' ulteriormente modificato\ncome appresso:\n                           Articolo unico\n\n  L'art. 78, relativo all'elenco degli insegnamenti complementari del\ncorso  di laurea in medicina e chirurgia, e' modificato nel senso che\nsono aggiunti i seguenti:\n    neurofisiopatologia;\n    neuropatologia;\n    istologia patologica;\n    patologia ultrastrutturale;\n    immunopatologia;\n    immunologia;\n    tossicologia;\n    analisi chimico-cliniche;\n    andrologia;\n    biometria e statistica medica;\n    oncologia medica;\n    chirurgia toracica;\n    chirurgia vascolare;\n    chirurgia d'urgenza;\n    chirurgia sperimentale;\n    urologia pediatrica;\n    nefrologia chirurgica;\n    endocrinologia ginecologica;\n    radioterapia;\n    audiologia;\n    chirurgia maxillo-facciale.\n\n  Il  presente decreto, munito del sigillo dello Stato, sara' inserto\nnella  Raccolta  ufficiale delle leggi e dei decreti della Repubblica\nitaliana. E' fatto obbligo a chiunque spetti di osservarlo e di farlo\nosservare.\n\n  Dato a Roma, addi' 1 luglio 1980\n\n                               PERTINI\n\n                                                                SARTI\n\nVisto, il Guardasigilli: MORLINO\n  Registrato alla Corte dei conti, addi' 18 settembre 1980\n  Registro n. 87 Istruzione, foglio n. 41"
                ]
            },
            {
                "filename": "law_234_094G0578_1994-09-20.json",
                "title": "DECRETO 14 febbraio 1994, n. 543",
                "subject": "Regolamento di attuazione degli articoli 2 e 4 della legge 7 agosto 1990, n. 241, recante nuove norme in materia di procedimento amministrativo e di diritto di accesso ai documenti amministrativi, con riferimento ai procedimenti amministrativi di competenza della Direzione generale dell'aviazione civile.",
                "type": "decreto",
                "number": "543",
                "year": "1994",
                "editorial_code": "094G0578",
                "gazette_reference": "(GU n.220 del 20-09-1994)",
                "publication_date": "1994-02-14",
                "gazette_date": "1994-09-20",
                "valid_from": "2012-02-04",
                "last_updated": "(Ultimo aggiornamento all'atto pubblicato il 20/01/2012)",
                "link_gazette": "http://www.gazzettaufficiale.it/eli/gu/1994/09/20/220/sg/pdf",
                "link_urn_nir": "http://www.normattiva.it/uri-res/N2Ls?urn:nir:stato:decreto:1994-02-14;543",
                "link_eli_id": "http://www.normattiva.it/eli/id/1994/09/20/094G0578",
                "link_eli_type": "http://www.normattiva.it/eli/stato/DECRETO/1994/02/14/543",
                "id": "art_4_law_234_094G0578_1994-09-20.json",
                "article_number": "4",
                "article_text": [
                    "                               Art. 4 \n \n  ((PROVVEDIMENTO ABROGATO DAL D.P.C.M. 11 NOVEMBRE 2011, N. 225)) "
                ]
            },
            {
                "filename": "law_151_094G0610_1994-11-12.json",
                "title": "DECRETO LEGISLATIVO 19 settembre 1994, n. 626",
                "subject": "((Attuazione delle direttive 89/391/CEE, 89/654/CEE, 89/655/CEE, 89/656/CEE, 90/269/CEE, 90/270/CEE, 90/394/CEE, 90/679/CEE, 93/88/CEE, 95/63/CE, 97/42/CE, 98/24/CE, 99/38/CE, 99/92/CE, 2001/45/CE, 2003/10/CE, 2003/18/CE e 2004/40/CE riguardanti il miglioramento della sicurezza e della salute dei lavoratori durante il lavoro.))",
                "type": "decreto.legislativo",
                "number": "626",
                "year": "1994",
                "editorial_code": "094G0610",
                "gazette_reference": "(GU n.265 del 12-11-1994 - Suppl. Ordinario n. 141)",
                "publication_date": "1994-09-19",
                "gazette_date": "1994-11-12",
                "valid_from": "2008-05-15",
                "last_updated": "(Ultimo aggiornamento all'atto pubblicato il 30/04/2008)",
                "link_gazette": "http://www.gazzettaufficiale.it/eli/gu/1994/11/12/265/so/141/sg/pdf",
                "link_urn_nir": "http://www.normattiva.it/uri-res/N2Ls?urn:nir:stato:decreto.legislativo:1994-09-19;626",
                "link_eli_id": "http://www.normattiva.it/eli/id/1994/11/12/094G0610",
                "link_eli_type": "http://www.normattiva.it/eli/stato/DECRETO_LEGISLATIVO/1994/09/19/626",
                "id": "art_18_law_151_094G0610_1994-11-12.json",
                "article_number": "18",
                "article_text": [
                    "                              Art. 18. \n    (( PROVVEDIMENTO ABROGATO DAL D.LGS. 9 APRILE 2008, N. 81 )) "
                ]
            },
            {
                "filename": "law_424_099G0213_1999-05-18.json",
                "title": "LEGGE 30 aprile 1999, n. 136",
                "subject": "Norme per il sostegno ed il rilancio dell'edilizia residenziale pubblica e per interventi in materia di opere a carattere ambientale.",
                "type": "legge",
                "number": "136",
                "year": "1999",
                "editorial_code": "099G0213",
                "gazette_reference": "(GU n.114 del 18-05-1999 - Suppl. Ordinario n. 97)",
                "publication_date": "1999-04-30",
                "gazette_date": "1999-05-18",
                "valid_from": "1999-05-19",
                "last_updated": "(Ultimo aggiornamento all'atto pubblicato il 14/04/2006)",
                "link_gazette": "http://www.gazzettaufficiale.it/eli/gu/1999/05/18/114/so/97/sg/pdf",
                "link_urn_nir": "http://www.normattiva.it/uri-res/N2Ls?urn:nir:stato:legge:1999-04-30;136",
                "link_eli_id": "http://www.normattiva.it/eli/id/1999/05/18/099G0213",
                "link_eli_type": "http://www.normattiva.it/eli/stato/LEGGE/1999/04/30/136",
                "id": "art_20_law_424_099G0213_1999-05-18.json",
                "article_number": "20",
                "article_text": [
                    "                              Art. 20.\n                (Programmi pluriennali di attuazione)\n\n  1.  Nel  termine  di  un anno dalla data di entrata in vigore della\npresente  legge,  le  regioni  provvedono  ad  aggiornare  la propria\nlegislazione in materia di programmi pluriennali di attuazione di cui\nall'articolo  13 della legge 28 gennaio 1977, n. 10, e all'articolo 6\ndel   decreto-legge   23   gennaio   1982,   n.  9,  convertito,  con\nmodificazioni,  dalla  legge  25  marzo  1982,  n.  94,  e successive\nmodificazioni, secondo principi che ne circoscrivano la funzione alla\nprogrammazione   della   formazione  dei  piani  attuativi  di  nuovi\ninsediamenti    o   di   rilevanti   ristrutturazioni   urbanistiche,\nindividuati  territorialmente in modo univoco, anche in coordinamento\ncon  il  programma  triennale dei lavori pubblici del comune e con lo\nstato  delle urbanizzazioni nel territorio interessato, e riferiscano\ni criteri di obbligatorieta' alle effettive esigenze di sviluppo e di\ntrasformazione  degli  aggregati  urbani.  Le opere di urbanizzazione\ncomunali da realizzare in attuazione degli strumenti urbanistici sono\ninserite nel programma triennale dei lavori pubblici del comune.\n  2.  Qualora  le  regioni  non adottino, entro un anno dalla data di\nentrata  in  vigore della presente legge, proprie leggi in attuazione\ndelle  disposizioni  di  cui  al  comma  1, restano valide le vigenti\ndisposizioni nazionali e regionali."
                ]
            },
            {
                "filename": "law_195_095G0438_1995-09-26.json",
                "title": "DECRETO-LEGGE 20 settembre 1995, n. 400",
                "subject": "Misure urgenti per il rilancio economico ed occupazionale dei lavori pubblici e dell'edilizia privata.",
                "type": "decreto.legge",
                "number": "400",
                "year": "1995",
                "editorial_code": "095G0438",
                "gazette_reference": "(GU n.225 del 26-09-1995)",
                "publication_date": "1995-09-20",
                "gazette_date": "1995-09-26",
                "valid_from": "1995-11-26",
                "last_updated": "(Ultimo aggiornamento all'atto pubblicato il 30/12/1997)",
                "link_gazette": "http://www.gazzettaufficiale.it/eli/gu/1995/09/26/225/sg/pdf",
                "link_urn_nir": "http://www.normattiva.it/uri-res/N2Ls?urn:nir:stato:decreto.legge:1995-09-20;400",
                "link_eli_id": "http://www.normattiva.it/eli/id/1995/09/26/095G0438",
                "link_eli_type": "http://www.normattiva.it/eli/stato/DECRETO_LEGGE/1995/09/20/400",
                "id": "art_6_law_195_095G0438_1995-09-26.json",
                "article_number": "6",
                "article_text": [
                    "                             Art. 6\n       DECRETO DECADUTO; I SUOI EFFETTI SONO STATI FATTI SALVI\n                  DALLA L. 23 DICEMBRE 1996, N. 662"
                ]
            },
            {
                "filename": "law_261_097G0296_1997-08-09.json",
                "title": "DECRETO LEGISLATIVO 16 luglio 1997, n. 264",
                "subject": "Riorganizzazione dell'area centrale del Ministero della difesa, a norma dell'articolo 1, comma 1, lettera b), della legge 28 dicembre 1995, n. 549.",
                "type": "decreto.legislativo",
                "number": "264",
                "year": "1997",
                "editorial_code": "097G0296",
                "gazette_reference": "(GU n.185 del 09-08-1997)",
                "publication_date": "1997-07-16",
                "gazette_date": "1997-08-09",
                "valid_from": "2010-10-09",
                "last_updated": "(Ultimo aggiornamento all'atto pubblicato il 08/05/2010)",
                "link_gazette": "http://www.gazzettaufficiale.it/eli/gu/1997/08/09/185/sg/pdf",
                "link_urn_nir": "http://www.normattiva.it/uri-res/N2Ls?urn:nir:stato:decreto.legislativo:1997-07-16;264",
                "link_eli_id": "http://www.normattiva.it/eli/id/1997/08/09/097G0296",
                "link_eli_type": "http://www.normattiva.it/eli/stato/DECRETO_LEGISLATIVO/1997/07/16/264",
                "id": "art_11_law_261_097G0296_1997-08-09.json",
                "article_number": "11",
                "article_text": [
                    "                             Art. 11\n((IL D.LGS. 15 MARZO 2010,  N.  66  HA  CONFERMATO  L'ABROGAZIONE DEL\n                      PRESENTE PROVVEDIMENTO))"
                ]
            },
            {
                "filename": "law_141_090G0373_1990-11-12.json",
                "title": "LEGGE 5 novembre 1990, n. 320",
                "subject": "Norme concernenti le mole abrasive.",
                "type": "legge",
                "number": "320",
                "year": "1990",
                "editorial_code": "090G0373",
                "gazette_reference": "(GU n.264 del 12-11-1990)",
                "publication_date": "1990-11-5",
                "gazette_date": "1990-11-12",
                "valid_from": "1990-11-27",
                "last_updated": "",
                "link_gazette": "http://www.gazzettaufficiale.it/eli/gu/1990/11/12/264/sg/pdf",
                "link_urn_nir": "http://www.normattiva.it/uri-res/N2Ls?urn:nir:stato:legge:1990-11-5;320",
                "link_eli_id": "http://www.normattiva.it/eli/id/1990/11/12/090G0373",
                "link_eli_type": "http://www.normattiva.it/eli/stato/LEGGE/1990/11/5/320",
                "id": "art_1_law_141_090G0373_1990-11-12.json",
                "article_number": "1",
                "article_text": [
                    "  La  Camera  dei  deputati  ed  il  Senato  della  Repubblica  hanno\napprovato;\n                    IL PRESIDENTE DELLA REPUBBLICA\n                               PROMULGA\nla seguente legge:\n                               Art. 1.\n  1.  La  mola  abrasiva e' un utensile da taglio composto da granuli\nabrasivi agglomerati con sostanze organiche od inorganiche."
                ]
            },
            {
                "filename": "law_43_091G0468_1992-01-02.json",
                "title": "DECRETO-LEGGE 31 dicembre 1991, n. 419",
                "subject": "Istituzione del Fondo di sostegno per le vittime di richieste estorsive.",
                "type": "decreto.legge",
                "number": "419",
                "year": "1991",
                "editorial_code": "091G0468",
                "gazette_reference": "(GU n.1 del 02-01-1992)",
                "publication_date": "1991-12-31",
                "gazette_date": "1992-01-02",
                "valid_from": "1999-11-14",
                "last_updated": "(Ultimo aggiornamento all'atto pubblicato il 22/03/2018)",
                "link_gazette": "http://www.gazzettaufficiale.it/eli/gu/1992/01/02/1/sg/pdf",
                "link_urn_nir": "http://www.normattiva.it/uri-res/N2Ls?urn:nir:stato:decreto.legge:1991-12-31;419",
                "link_eli_id": "http://www.normattiva.it/eli/id/1992/01/02/091G0468",
                "link_eli_type": "http://www.normattiva.it/eli/stato/DECRETO_LEGGE/1991/12/31/419",
                "id": "art_3_law_43_091G0468_1992-01-02.json",
                "article_number": "3",
                "article_text": [
                    "                               Art. 3. \n                 Modalita' e termini per la domanda \n  1. L'elargizione e' concessa a domanda. \n  2. La domanda puo' essere presentata dall'interessato  ovvero,  con\nil consenso di questi, dal consiglio nazionale  del  relativo  ordine\nprofessionale o da una  delle  associazioni  nazionali  di  categoria\nrappresentate nel Consiglio nazionale dell'economia e del lavoro. \n  3. La domanda di cui ai commi 1 e 2 deve essere presentata, a  pena\ndi decadenza, entro  il  termine  di  centoventi  giorni  dalla  data\ndell'evento  lesivo  ovvero  dalla  data  in  cui  l'interessato   ha\nconoscenza che dalle indagini preliminari sono  emersi  elementi  dai\nquali appare che l'evento  lesivo  consegue  a  un  fatto  delittuoso\ncommesso per taluna delle  finalita'  indicate  nell'articolo  1.  La\ndomanda puo' essere altresi' presentata, per il  tramite  del  legale\nrappresentante e con il consenso dell'interessato, da associazioni od\norganizzazioni iscritte in apposito elenco tenuto a cura del prefetto\ned aventi  tra  i  propri  scopi  quello  di  prestare  assistenza  e\nsolidarieta' a soggetti danneggiati da attivita' estorsive.  (4)  (6)\n((7)) \n    \n\n---------------\n    \nAGGIORNAMENTO (4) \n  La L. 7 marzo 1996, n. 108 ha disposto (con l'art. 13, comma 2) che\n\"Per le domande relative a fatti verificatisi tra il 1 gennaio 1990 e\nil 2 novembre 1991, il termine fissato dal medesimo  articolo  3  del\ncitato decreto-legge n. 419 del 1991 decorre dalla data di entrata in\nvigore della presente legge\". \n    \n\n---------------\n    \nAGGIORNAMENTO (6) \n  La L. 23 febbraio 1999, n. 44 ha disposto (con l'art. 25, comma  1,\nlettera a)) che a decorrere dalla  data  di  entrata  in  vigore  del\nregolamento di cui all'articolo 21 della L. 44/1999, e  comunque  non\noltre il centottantesimo giorno dalla data di entrata in vigore della\nlegge stessa, sono abrogate le disposizioni del capo I  del  presente\ndecreto. \n    \n\n---------------\n    \nAGGIORNAMENTO (7) \n  La L. 23  febbraio  1999,  n.  44,  come  modificata  dal  D.L.  13\nsettembre 1999, n. 317, convertito  con  modificazioni  dalla  L.  12\nnovembre 1999, n. 414, ha disposto (con l'art. 25, comma  1,  lettera\na)) che a decorrere dalla data di entrata in vigore  del  regolamento\ndi cui all'articolo 21 della L. 44/1999,  e  comunque  non  oltre  il\ntrecentocinquantesimo giorno dalla data di entrata  in  vigore  della\nlegge stessa, sono abrogate le disposizioni del capo I  del  presente\ndecreto. "
                ]
            },
            {
                "filename": "law_222_086U0917_1986-12-31.json",
                "title": "DECRETO DEL PRESIDENTE DELLA REPUBBLICA 22 dicembre 1986, n. 917",
                "subject": "Approvazione del testo unico delle imposte sui redditi.",
                "type": "decreto.del.presidente.della.repubblica",
                "number": "917",
                "year": "1986",
                "editorial_code": "086U0917",
                "gazette_reference": "(GU n.302 del 31-12-1986 - Suppl. Ordinario n. 126)",
                "publication_date": "1986-12-22",
                "gazette_date": "1986-12-31",
                "valid_from": "2004-01-01",
                "last_updated": "(Ultimo aggiornamento all'atto pubblicato il 30/12/2020)",
                "link_gazette": "http://www.gazzettaufficiale.it/eli/gu/1986/12/31/302/so/126/sg/pdf",
                "link_urn_nir": "http://www.normattiva.it/uri-res/N2Ls?urn:nir:stato:decreto.del.presidente.della.repubblica:1986-12-22;917",
                "link_eli_id": "http://www.normattiva.it/eli/id/1986/12/31/086U0917",
                "link_eli_type": "http://www.normattiva.it/eli/stato/DECRETO_DEL_PRESIDENTE_DELLA_REPUBBLICA/1986/12/22/917",
                "id": "art_123 bis_law_222_086U0917_1986-12-31.json",
                "article_number": "123 bis",
                "article_text": [
                    "                            Art. 123-bis \n \n((IL D.LGS. 12 DICEMBRE 2003, N.344 HA DISPOSTO  LA  TOTALE  MODIFICA\nDEL PRESENTE PROVVEDIMENTO RIDEFINENDONE LA STRUTTURA DI TITOLI, CAPI\n                            ED ARTICOLI)) "
                ]
            }
        ]
    },
    {
        "unit_id": "unit_14",
        "token_input": "NXVQORODPT",
        "token_output": "RVBCIATPJZ",
        "documents": [
            {
                "filename": "law_895_082U0307_1982-06-05.json",
                "title": "DECRETO DEL PRESIDENTE DELLA REPUBBLICA 23 febbraio 1982, n. 307",
                "subject": "Regolamento di esecuzione della legge 4 luglio 1970, n. 507, sulla tutela delle denominazioni di origine e tipica del prosciutto di San Daniele.",
                "type": "decreto.del.presidente.della.repubblica",
                "number": "307",
                "year": "1982",
                "editorial_code": "082U0307",
                "gazette_reference": "(GU n.153 del 05-06-1982)",
                "publication_date": "1982-02-23",
                "gazette_date": "1982-06-05",
                "valid_from": "1982-12-05",
                "last_updated": "",
                "link_gazette": "http://www.gazzettaufficiale.it/eli/gu/1982/06/05/153/sg/pdf",
                "link_urn_nir": "http://www.normattiva.it/uri-res/N2Ls?urn:nir:stato:decreto.del.presidente.della.repubblica:1982-02-23;307",
                "link_eli_id": "http://www.normattiva.it/eli/id/1982/06/05/082U0307",
                "link_eli_type": "http://www.normattiva.it/eli/stato/DECRETO_DEL_PRESIDENTE_DELLA_REPUBBLICA/1982/02/23/307",
                "id": "art_26_law_895_082U0307_1982-06-05.json",
                "article_number": "26",
                "article_text": [
                    "                              Art. 26.\n\n  Il  presente  regolamento  entra  in  vigore  sei  mesi dopo la sua\npubblicazione  nella Gazzetta Ufficiale della Repubblica italiana, ad\neccezione degli articoli 24, primo comma, e 25, che entrano in vigore\nil giorno successivo alla pubblicazione nella Gazzetta Ufficiale.\n\n  Il  presente decreto, munito del sigillo dello Stato, sara' inserto\nnella  Raccolta  ufficiale delle leggi e dei decreti della Repubblica\nitaliana. E' fatto obbligo a chiunque spetti di osservarlo e di farlo\nosservare.\n\n  Dato a Roma, addi' 23 febbraio 1982\n\n                               PERTINI\n\n                                                SPADOLINI - MARCORA -\n                                               BARTOLOMEI - ALTISSIMO\n\nVisto, il Guardasigilli: DARIDA\n  Registrato alla Corte dei conti, addi' 27 maggio 1982\n  Atti di Governo, registro n. 40, foglio n. 1"
                ]
            },
            {
                "filename": "law_480_094G0291_1994-05-19.json",
                "title": "DECRETO LEGISLATIVO 16 aprile 1994, n. 297",
                "subject": "Approvazione del testo unico delle disposizioni legislative vigenti in materia di istruzione, relative alle scuole di ogni ordine e grado.",
                "type": "decreto.legislativo",
                "number": "297",
                "year": "1994",
                "editorial_code": "094G0291",
                "gazette_reference": "(GU n.115 del 19-05-1994 - Suppl. Ordinario n. 79)",
                "publication_date": "1994-04-16",
                "gazette_date": "1994-05-19",
                "valid_from": "1994-06-03",
                "last_updated": "(Ultimo aggiornamento all'atto pubblicato il 31/12/2020)",
                "link_gazette": "http://www.gazzettaufficiale.it/eli/gu/1994/05/19/115/so/79/sg/pdf",
                "link_urn_nir": "http://www.normattiva.it/uri-res/N2Ls?urn:nir:stato:decreto.legislativo:1994-04-16;297",
                "link_eli_id": "http://www.normattiva.it/eli/id/1994/05/19/094G0291",
                "link_eli_type": "http://www.normattiva.it/eli/stato/DECRETO_LEGISLATIVO/1994/04/16/297",
                "id": "art_128_law_480_094G0291_1994-05-19.json",
                "article_number": "128",
                "article_text": [
                    "                          Art. 128. \n             Programmazione ed organizzazione didattica \n \n  1. La programmazione dell'attivita' didattica,  nella  salvaguardia\ndella liberta' di insegnamento, e' di competenza dei docenti  che  vi\nprovvedono sulla  base  della  programmazione  dell'azione  educativa\napprovata dal collegio dei docenti in attuazione dell'articolo 7. \n  2.COMMA ABROGATO DAL D.P.R. 8 MARZO 1999, N. 275. \n  3.(( COMMA ABROGATO DAL D.LGS 19 FEBBRAIO 2004, N. 59 )). ((39)) \n  4.(( COMMA ABROGATO DAL D.LGS 19 FEBBRAIO 2004, N. 59 )). ((39)) \n  5. COMMA ABROGATO DAL D.P.R. 8 MARZO 1999, N. 275. \n  6. COMMA ABROGATO DAL D.P.R. 8 MARZO 1999, N. 275. \n  7. COMMA ABROGATO DAL D.P.R. 8 MARZO 1999, N. 275. \n  8. COMMA ABROGATO DAL D.P.R. 8 MARZO 1999, N. 275. \n  9. COMMA ABROGATO DAL D.P.R. 8 MARZO 1999, N. 275. \n    \n------------------\n\n    \nAGGIORNAMENTO (39) \n  Il D.Lgs. 19 febbraio 2004, n. 59 ha disposto (con l'art.  19,comma\n3)che le disposizioni del presente articolo commi 3 e 4 continuano ad\napplicarsi limitatamente alle sezioni di scuola materna e alle classi\ndi scuola elementare e di scuola media ancora funzionanti secondo  il\nprecedente ordinamento ed  agli  alunni  ad  essi  iscritti,  e  sono\nabrogate, a decorrere dall'anno  scolastico  successivo  al  completo\nesaurimento delle predette sezioni e classi. "
                ]
            },
            {
                "filename": "law_251_091G0255_1991-07-18.json",
                "title": "DECRETO LEGISLATIVO 12 luglio 1991, n. 212",
                "subject": "Disciplina delle modalita' di accesso delle amministrazioni pubbliche al sistema informativo dell'anagrafe tributaria.",
                "type": "decreto.legislativo",
                "number": "212",
                "year": "1991",
                "editorial_code": "091G0255",
                "gazette_reference": "(GU n.167 del 18-07-1991)",
                "publication_date": "1991-07-12",
                "gazette_date": "1991-07-18",
                "valid_from": "1991-07-19",
                "last_updated": "",
                "link_gazette": "http://www.gazzettaufficiale.it/eli/gu/1991/07/18/167/sg/pdf",
                "link_urn_nir": "http://www.normattiva.it/uri-res/N2Ls?urn:nir:stato:decreto.legislativo:1991-07-12;212",
                "link_eli_id": "http://www.normattiva.it/eli/id/1991/07/18/091G0255",
                "link_eli_type": "http://www.normattiva.it/eli/stato/DECRETO_LEGISLATIVO/1991/07/12/212",
                "id": "art_2_law_251_091G0255_1991-07-18.json",
                "article_number": "2",
                "article_text": [
                    "                               Art. 2. \n  1. L'accesso ai dati, alle notizie ed alle informazioni autorizzati\npuo'   avvenire   mediante   interrogazione   via   terminale,    per\nl'effettuazione di operazioni giornaliere che  riguardano  un  numero\nlimitato  di  soggetti,  ovvero  mediante  collegamento  diretto  tra\nelaboratori. \n  2. Le modalita' di interconnessione, ancorche' diverse in relazione\nalle architetture, agli ambienti di sistema collegati ed al  tipo  di\napplicazione previste devono essere conformi a quelle  codificate  da\norganismi internazionali e di piu' ampia diffusione. \n  3.   Il   centro   informativo   della   Direzione   generale   per\nl'organizzazione dei servizi tributari indichera' all'amministrazione\nrichiedente le caratteristiche necessarie per l'accesso  nelle  varie\nforme previste dal comma 1. \n  4. I costi per consentire  l'accesso,  periodicamente  determinati,\nsono a carico delle amministrazioni richiedenti e  sono  determinati,\nper  ciascun  tipo  di  collegamento,  dal  centro  informativo   per\nl'organizzazione dei  servizi  tributari  sulla  base  del  visto  di\ncongruita'  dell'ufficio  tecnico  erariale.  I  relativi  versamenti\ndevono essere annualmente effettuati presso le competenti sezioni  di\ntesoreria provinciale dello Stato, direttamente o a  mezzo  di  conto\ncorrente postale sul capitolo 2319 in conto entrate eventuali  e  di-\nverse concernenti il Ministero delle finanze; copia  della  quietanza\ndella tesoreria provinciale e'  inviata  al  centro  informativo  per\nl'organizzazione dei servizi tributari. "
                ]
            },
            {
                "filename": "law_328_097G0236_1997-07-04.json",
                "title": "DECRETO 8 maggio 1997, n. 197",
                "subject": "Regolamento di servizio concernente le norme e le condizioni di abbonamento al servizio telefonico.",
                "type": "decreto",
                "number": "197",
                "year": "1997",
                "editorial_code": "097G0236",
                "gazette_reference": "(GU n.154 del 04-07-1997)",
                "publication_date": "1997-05-8",
                "gazette_date": "1997-07-04",
                "valid_from": "1997-07-19",
                "last_updated": "(Ultimo aggiornamento all'atto pubblicato il 23/07/1997)",
                "link_gazette": "http://www.gazzettaufficiale.it/eli/gu/1997/07/04/154/sg/pdf",
                "link_urn_nir": "http://www.normattiva.it/uri-res/N2Ls?urn:nir:stato:decreto:1997-05-8;197",
                "link_eli_id": "http://www.normattiva.it/eli/id/1997/07/04/097G0236",
                "link_eli_type": "http://www.normattiva.it/eli/stato/DECRETO/1997/05/8/197",
                "id": "art_24_law_328_097G0236_1997-07-04.json",
                "article_number": "24",
                "article_text": [
                    "                              Art. 24.\n                          Verifiche tecniche\n  1.  Per   l'effettuazione  delle  verifiche  all'impianto   e  alle\napparecchiature  collegate  alla   rete  l'abbonato  deve  consentire\nl'accesso  nei propri  locali  ai tecnici  inviati  dal gestore,  che\nsaranno muniti  di apposito tesserino di  riconoscimento, concordando\ncon gli appositi uffici del gestore la data e l'ora dell'intervento.\n  2. In caso di preavviso scritto, e per le ragioni in esso indicate,\nil gestore  puo' sospendere  il servizio fintantoche'  l'abbonato non\nconsentira' l'accesso."
                ]
            },
            {
                "filename": "law_35_095G0611_1995-12-29.json",
                "title": "DECRETO-LEGGE 29 dicembre 1995, n. 560",
                "subject": "Interventi urgenti a favore delle zone colpite da eccezionali eventi calamitosi del 1995 e ulteriori disposizioni riguardanti precedenti alluvioni, nonche' misure urgenti in materia di protezione civile.",
                "type": "decreto.legge",
                "number": "560",
                "year": "1995",
                "editorial_code": "095G0611",
                "gazette_reference": "(GU n.302 del 29-12-1995)",
                "publication_date": "1995-12-29",
                "gazette_date": "1995-12-29",
                "valid_from": "1996-02-28",
                "last_updated": "(Ultimo aggiornamento all'atto pubblicato il 26/06/2012)",
                "link_gazette": "http://www.gazzettaufficiale.it/eli/gu/1995/12/29/302/sg/pdf",
                "link_urn_nir": "http://www.normattiva.it/uri-res/N2Ls?urn:nir:stato:decreto.legge:1995-12-29;560",
                "link_eli_id": "http://www.normattiva.it/eli/id/1995/12/29/095G0611",
                "link_eli_type": "http://www.normattiva.it/eli/stato/DECRETO_LEGGE/1995/12/29/560",
                "id": "art_1_law_35_095G0611_1995-12-29.json",
                "article_number": "1",
                "article_text": [
                    "                               Art. 1.\n                       Ambito di applicazione\n\n  1.  Le  disposizioni del presente decreto sono volte a fronteggiare\nle situazioni di emergenza verificatesi:\n    a)  a seguito degli eccezionali eventi alluvionali nelle regioni:\nBasilicata  il  giorno  15  agosto  1995, Calabria dal 13 al 14 marzo\n1995,  Campania  il  21  settembre  1995, Friuli-Venezia Giulia il 19\nsettembre  1995, Lazio dal 16 al 17 settembre 1995, Liguria dal 25 al\n26  settembre 1995 ed il giorno 16 novembre 1995 e dal 4 al 6 ottobre\n1995,  Lombardia  il  3  luglio  1995  e dal 12 al 14 settembre 1995,\nPuglia  ((  nei  mesi di agosto, settembre e dicembre 1995)), Sicilia\ndal  13  al 14 marzo 1995, il 31 luglio 1995 e nei giorni 13, 16 e 19\nagosto  1995, Toscana dal 18 al 19 settembre 1995 e il 5 ottobre 1995\n(( nonche' il 2 novembre 1995 e dal 24 al 27 dicembre 1995 )), Umbria\ndal  13  al  14  settembre  1995, Veneto dal 30 al 31 maggio 1995 ((,\nPiemonte  dal  16  al  18  maggio 1994 e dal 19 al 20 settembre 1995,\nEmilia-Romagna  dal  22  al 26 dicembre 1995; nonche' a seguito degli\neccezionali     eventi     alluvionali     verificatisi     nell'Agro\nsarnese-nocerino nei mesi di luglio e agosto 1995));\n    b)  a  seguito  degli  eventi  sismici verificatisi nel giorno 10\nottobre 1995 (( nelle province di Massa Carrara, Lucca e La Spezia ))\ne nel giorno 30 settembre 1995 nella regione Puglia;\n    c)  a  seguito del dissesto idrogeologico verificatosi nei giorni\n14 e 15 ottobre 1995 nel comune di Camaiore (Lucca);\n    ((  c-bis)  a seguito del dissesto idrogeologico verificatosi dal\ngiorno 1 marzo 1995 e tuttora in atto nel comune di Civitacampomarano\nin provincia di Campobasso;\n    c-ter)  a  seguito  della  situazione di eccezionale attivita' di\naggressione  del mare e del conseguente fenomeno erosivo verificatosi\nsulla costa abruzzese nel dicembre 1995)).\n  2.  Con  decreto  del  Presidente  del  Consiglio  dei Ministri, da\nemanarsi  entro  trenta  giorni  dalla  data di entrata in vigore del\npresente  decreto,  sentiti  i  presidenti delle giunte delle regioni\ninteressate,  sono  individuati  i comuni nel cui ambito territoriale\nsono  ricomprese  le zone colpite dagli eccezionali eventi calamitosi\nverificatisi  nel  1995,  anche  eventualmente  indicando le parti di\nterritorio comunale effettivamente colpite."
                ]
            },
            {
                "filename": "law_897_080U0368_1980-07-26.json",
                "title": "DECRETO DEL PRESIDENTE DELLA REPUBBLICA 7 marzo 1980, n. 368",
                "subject": "Dichiarazione di pubblica utilita' per alcuni immobili da realizzarsi dalla Marina militare nel comune di Giugliano.",
                "type": "decreto.del.presidente.della.repubblica",
                "number": "368",
                "year": "1980",
                "editorial_code": "080U0368",
                "gazette_reference": "(GU n.204 del 26-07-1980)",
                "publication_date": "1980-03-7",
                "gazette_date": "1980-07-26",
                "valid_from": "1980-08-10",
                "last_updated": "",
                "link_gazette": "http://www.gazzettaufficiale.it/eli/gu/1980/07/26/204/sg/pdf",
                "link_urn_nir": "http://www.normattiva.it/uri-res/N2Ls?urn:nir:stato:decreto.del.presidente.della.repubblica:1980-03-7;368",
                "link_eli_id": "http://www.normattiva.it/eli/id/1980/07/26/080U0368",
                "link_eli_type": "http://www.normattiva.it/eli/stato/DECRETO_DEL_PRESIDENTE_DELLA_REPUBBLICA/1980/03/7/368",
                "id": "art_1_law_897_080U0368_1980-07-26.json",
                "article_number": "1",
                "article_text": [
                    "                   IL PRESIDENTE DELLA REPUBBLICA\n\n  Visti gli articoli 11 e 13 della legge 25 giugno 1865, n. 2359;\n  Vista  la  legge 18 dicembre 1879, n. 5188, che reca modifiche alla\nlegge anzidetta;\n  Visto  l'art.  4  del  decreto-legge  2  maggio  1974, n. 115, come\nmodificato  dalla  legge  di  conversione 27 giugno 1974, n. 247, che\nestende anche alle espropriazioni per opere ed interventi dello Stato\nle  disposizioni contenute nel titolo II della legge 22 ottobre 1971,\nn. 865, sulla determinazione delle indennita' di esproprio;\n  Vista  la  legge  3  gennaio  1978,  n. 1, sull'accelerazione delle\nprocedure per l'esecuzione di opere pubbliche;\n  Sulla proposta del Ministro della difesa;\n\n                              Decreta:\n                               Art. 1.\n\n  Le fortificazioni, i fabbricati e le opere in genere destinate alla\ndifesa,  da realizzarsi dalla Marina militare nel comune di Giugliano\n(Napoli),   localita'   Lago  Patria,  sono  dichiarate  di  pubblica\nutilita'.\n  Le  sistemazioni di cui al precedente comma rientrano nelle ipotesi\npreviste  dall'art.  11  della  legge  25 giugno 1865, n. 2359, sulle\nespropriazioni per causa di pubblica utilita'."
                ]
            },
            {
                "filename": "law_457_093G0217_1993-05-21.json",
                "title": "LEGGE 20 maggio 1993, n. 151",
                "subject": "Conversione in legge del decreto-legge 22 marzo 1993, n. 71, recante disposizioni in materia di sgravi contributivi nel Mezzogiorno e di fiscalizzazione degli oneri sociali.",
                "type": "legge",
                "number": "151",
                "year": "1993",
                "editorial_code": "093G0217",
                "gazette_reference": "(GU n.117 del 21-05-1993)",
                "publication_date": "1993-05-20",
                "gazette_date": "1993-05-21",
                "valid_from": "1993-05-22",
                "last_updated": "",
                "link_gazette": "http://www.gazzettaufficiale.it/eli/gu/1993/05/21/117/sg/pdf",
                "link_urn_nir": "http://www.normattiva.it/uri-res/N2Ls?urn:nir:stato:legge:1993-05-20;151",
                "link_eli_id": "http://www.normattiva.it/eli/id/1993/05/21/093G0217",
                "link_eli_type": "http://www.normattiva.it/eli/stato/LEGGE/1993/05/20/151",
                "id": "art_1_law_457_093G0217_1993-05-21.json",
                "article_number": "1",
                "article_text": [
                    "  La  Camera  dei  deputati  ed  il  Senato  della  Repubblica  hanno\napprovato;\n                   IL PRESIDENTE DELLA REPUBBLICA\n                              PROMULGA\nla seguente legge:\n                               Art. 1.\n  1. E' convertito in legge il decreto-legge 22 marzo  1993,  n.  71,\nrecante   disposizioni   in   materia   di  sgravi  contributivi  nel\nMezzogiorno e di fiscalizzazione degli oneri sociali.\n  2. Restano validi gli atti ed i provvedimenti adottati e sono fatti\nsalvi gli effetti prodottisi ed i rapporti giuridici sorti sulla base\ndei decreti-legge 18 settembre 1992, n. 383,  19  novembre  1992,  n.\n442, e 18 gennaio 1993, n. 12.\n  La  presente  legge, munita del sigillo dello Stato, sara' inserita\nnella  Raccolta  ufficiale  degli  atti  normativi  della  Repubblica\nitaliana. E' fatto obbligo a chiunque spetti di osservarla e di farla\nosservare come legge dello Stato.\n   Data a Roma, addi' 20 maggio 1993\n                              SCALFARO\n                                  CIAMPI,  Presidente  del  Consiglio\n                                  dei Ministri\n                                  GIUGNI, Ministro del lavoro e della\n                                  previdenza sociale\nVisto, il Guardasigilli: CONSO\n          AVVERTENZA:\n             Il  decreto-legge  22  marzo  1993,  n.  71,  e'   stato\n          pubblicato  nella  Gazzetta Ufficiale - serie generale - n.\n          67 del 22 marzo 1993.\n             In questa stessa Gazzetta Ufficiale, alla  pag.  19,  e'\n          ripubblicato  il  testo del decreto-legge 22 marzo 1993, n.\n          71, corredato delle relative note, ai  sensi  dell'art.  8,\n          comma  3,  del  regolamento  di  esecuzione del testo unico\n          delle disposizioni sulla promulgazione delle  leggi,  sulla\n          emanazione  dei  decreti  del Presidente della Repubblica e\n          sulle pubblicazioni ufficiali  della  Repubblica  italiana,\n          approvato  con  decreto  del Presidente della Repubblica 14\n          marzo 1986, n. 217.\n                         ___________________"
                ]
            },
            {
                "filename": "law_264_090G0236_1990-07-24.json",
                "title": "DECRETO 30 giugno 1990, n. 197",
                "subject": "Regolamento per la disciplina delle modalita' di uso e di custodia delle matrici dei moduli di mandato di pagamento usati per la corresponsione delle pensioni, assegni ed indennita' spettanti ai mutilati ed invalidi civili, ai ciechi civili e ai sordomuti.",
                "type": "decreto",
                "number": "197",
                "year": "1990",
                "editorial_code": "090G0236",
                "gazette_reference": "(GU n.171 del 24-07-1990)",
                "publication_date": "1990-06-30",
                "gazette_date": "1990-07-24",
                "valid_from": "1993-09-12",
                "last_updated": "(Ultimo aggiornamento all'atto pubblicato il 28/08/1993)",
                "link_gazette": "http://www.gazzettaufficiale.it/eli/gu/1990/07/24/171/sg/pdf",
                "link_urn_nir": "http://www.normattiva.it/uri-res/N2Ls?urn:nir:stato:decreto:1990-06-30;197",
                "link_eli_id": "http://www.normattiva.it/eli/id/1990/07/24/090G0236",
                "link_eli_type": "http://www.normattiva.it/eli/stato/DECRETO/1990/06/30/197",
                "id": "art_4_law_264_090G0236_1990-07-24.json",
                "article_number": "4",
                "article_text": [
                    "                               Art. 4. \n  1.   Il   direttore   della   divisione   \"Elaborazione   dati    e\nteletrasmissioni\" di cui all'art. 2 ed il suo sostituto esercitano  i\nnecessari controlli ai fini  della  regolare  apposizione  automatica\ndelle firme sui titoli di pagamento. "
                ]
            },
            {
                "filename": "law_477_093G0195_1993-05-01.json",
                "title": "DECRETO-LEGGE 28 aprile 1993, n. 131",
                "subject": "Armonizzazione delle disposizioni in materia di imposte sugli oli minerali, sull'alcole, sulle bevande alcoliche, sui tabacchi lavorati e in materia di IVA con quelle recate da direttive CEE e modificazioni conseguenti a detta armonizzazione, nonche' disposizioni concernenti la disciplina dei centri autorizzati di assistenza fiscale, le procedure dei rimborsi di imposta, l'esclusione dall'ILOR dei redditi di impresa fino all'ammontare corrispondente al contributo diretto lavorativo, l'istituzione per il 1993 di un'imposta erariale straordinaria su taluni beni ed altre disposizioni tributarie.",
                "type": "decreto.legge",
                "number": "131",
                "year": "1993",
                "editorial_code": "093G0195",
                "gazette_reference": "(GU n.100 del 01-05-1993)",
                "publication_date": "1993-04-28",
                "gazette_date": "1993-05-01",
                "valid_from": "1993-07-01",
                "last_updated": "(Ultimo aggiornamento all'atto pubblicato il 06/05/1993)",
                "link_gazette": "http://www.gazzettaufficiale.it/eli/gu/1993/05/01/100/sg/pdf",
                "link_urn_nir": "http://www.normattiva.it/uri-res/N2Ls?urn:nir:stato:decreto.legge:1993-04-28;131",
                "link_eli_id": "http://www.normattiva.it/eli/id/1993/05/01/093G0195",
                "link_eli_type": "http://www.normattiva.it/eli/stato/DECRETO_LEGGE/1993/04/28/131",
                "id": "art_43_law_477_093G0195_1993-05-01.json",
                "article_number": "43",
                "article_text": [
                    "                              Art. 43. \n       DECRETO DECADUTO; I SUOI EFFETTI SONO STATI FATTI SALVI \n                  DALLA L. 29 OTTOBRE 1993, N. 427 "
                ]
            },
            {
                "filename": "law_688_083U0623_1983-11-07.json",
                "title": "DECRETO-LEGGE 7 novembre 1983, n. 623",
                "subject": "Interventi urgenti per le zone colpite dal bradisismo dell'area flegrea e dal terremoto del 1980.",
                "type": "decreto.legge",
                "number": "623",
                "year": "1983",
                "editorial_code": "083U0623",
                "gazette_reference": "(GU n.305 del 07-11-1983)",
                "publication_date": "1983-11-7",
                "gazette_date": "1983-11-07",
                "valid_from": "1984-01-03",
                "last_updated": "(Ultimo aggiornamento all'atto pubblicato il 05/01/1987)",
                "link_gazette": "http://www.gazzettaufficiale.it/eli/gu/1983/11/07/305/sg/pdf",
                "link_urn_nir": "http://www.normattiva.it/uri-res/N2Ls?urn:nir:stato:decreto.legge:1983-11-7;623",
                "link_eli_id": "http://www.normattiva.it/eli/id/1983/11/07/083U0623",
                "link_eli_type": "http://www.normattiva.it/eli/stato/DECRETO_LEGGE/1983/11/7/623",
                "id": "art_3_law_688_083U0623_1983-11-07.json",
                "article_number": "3",
                "article_text": [
                    "                               Art. 3. \n \n  1. I soggetti che nell'anno solare 1983 effettuano cessioni di beni\ne prestazioni di servizi imponibili o non  soggetti  all'imposta  sul\nvalore aggiunto ai sensi dell'articolo 5 del decreto-legge 5 dicembre\n1980, n. 799, convertito, con modificazioni, nella legge 22  dicembre\n1980,  n.  875,  e  successive  modificazioni,  comprese  quelle  non\nsoggette, ai sensi dell'articolo  2,  lettera  l),  del  decreto  del\nPresidente della Repubblica 26 ottobre 1972,  n.  633,  e  successive\nmodificazioni, per un ammontare complessivo superiore a 15 milioni di\nlire,   devono   comunicare   al   competente   ufficio   provinciale\ndell'imposta  sul  valore  aggiunto,  entro  il  31   gennaio   1984,\nl'ammontare  delle  suddette  operazioni  non  soggette  all'imposta,\nsuddiviso per aliquota applicabile,  registrate  nell'anno  1983,  ai\nsensi degli articoli 23 e 24  del  predetto  decreto  del  Presidente\ndella Repubblica 26 ottobre 1972, n. 633. \n  2. L'obbligo relativo  alla  comunicazione  sussiste  anche  per  i\nsoggetti  che  effettuano   nell'anno   solare   1983   acquisti   ed\nimportazioni di beni e servizi  con  l'imposta  sul  valore  aggiunto\ndetraibile ai sensi dell'articolo 19 del decreto del Presidente della\nRepubblica 26 ottobre 1972, n. 633, o  non  soggetti  all'imposta  ai\nsensi  dell'articolo  2,  lettera  l),   del   medesimo   decreto   e\ndell'articolo  5  del  decreto-legge  5  dicembre   1980,   n.   799,\nconvertito, con modificazioni, nella legge 22 dicembre 1980, n.  875,\nregistrati nel medesimo anno ai sensi dell'articolo 25  dello  stesso\ndecreto del Presidente della Repubblica 26 ottobre 1972, n. 633,  per\nun ammontare complessivo superiore al limite stabilito nel precedente\ncomma  1.  I  cennati  soggetti  devono  indicare  distintamente  per\naliquota applicabile l'ammontare delle  operazioni  non  soggette  ai\nsensi dell'articolo 5 del decreto-legge  5  dicembre  1980,  n.  799,\nconvertito, con modificazioni, nella legge 22 dicembre 1980, n. 875. \n  3. Con  decreto  del  Ministro  delle  finanze  sono  stabilite  le\nmodalita' relative alla comunicazione di cui ai precedenti commi 1  e\n2. L'omessa o  inesatta  comunicazione  e'  punita  con  la  sanzione\nprevista dall'articolo 47 del decreto del Presidente della Repubblica\n26 ottobre 1972, n. 633. \n  4. L'articolo 77 della legge 14 maggio 1981, n. 219, e' abrogato. "
                ]
            }
        ]
    },
    {
        "unit_id": "unit_15",
        "token_input": "BJKIMYAHLQ",
        "token_output": "SKCJSIXRFP",
        "documents": [
            {
                "filename": "law_203_095G0427_1995-09-21.json",
                "title": "DECRETO 27 aprile 1995, n. 392",
                "subject": "Regolamento recante norme sull'organizzazione, il funzionamento e la gestione finanziaria ed economico-patrimoniale degli istituti italiani di cultura all'estero.",
                "type": "decreto",
                "number": "392",
                "year": "1995",
                "editorial_code": "095G0427",
                "gazette_reference": "(GU n.221 del 21-09-1995)",
                "publication_date": "1995-04-27",
                "gazette_date": "1995-09-21",
                "valid_from": "1995-10-06",
                "last_updated": "(Ultimo aggiornamento all'atto pubblicato il 31/12/2015)",
                "link_gazette": "http://www.gazzettaufficiale.it/eli/gu/1995/09/21/221/sg/pdf",
                "link_urn_nir": "http://www.normattiva.it/uri-res/N2Ls?urn:nir:stato:decreto:1995-04-27;392",
                "link_eli_id": "http://www.normattiva.it/eli/id/1995/09/21/095G0427",
                "link_eli_type": "http://www.normattiva.it/eli/stato/DECRETO/1995/04/27/392",
                "id": "art_24_law_203_095G0427_1995-09-21.json",
                "article_number": "24",
                "article_text": [
                    "                              Art. 24.\n                 Pareggio del bilancio di previsione\n  1.  Le spese indicate in bilancio devono essere contenute, nel loro\ncomplessivo ammontare, entro  i  limiti  delle  entrate  previste  e,\npertanto, il bilancio deve risultare in pareggio."
                ]
            },
            {
                "filename": "law_463_092G0124_1992-02-19.json",
                "title": "LEGGE 5 febbraio 1992, n. 122",
                "subject": "Disposizioni in materia di sicurezza della circolazione stradale e disciplina dell'attivita' di autoriparazione.",
                "type": "legge",
                "number": "122",
                "year": "1992",
                "editorial_code": "092G0124",
                "gazette_reference": "(GU n.41 del 19-02-1992)",
                "publication_date": "1992-02-5",
                "gazette_date": "1992-02-19",
                "valid_from": "2013-01-05",
                "last_updated": "(Ultimo aggiornamento all'atto pubblicato il 21/12/2012)",
                "link_gazette": "http://www.gazzettaufficiale.it/eli/gu/1992/02/19/41/sg/pdf",
                "link_urn_nir": "http://www.normattiva.it/uri-res/N2Ls?urn:nir:stato:legge:1992-02-5;122",
                "link_eli_id": "http://www.normattiva.it/eli/id/1992/02/19/092G0124",
                "link_eli_type": "http://www.normattiva.it/eli/stato/LEGGE/1992/02/5/122",
                "id": "art_6_law_463_092G0124_1992-02-19.json",
                "article_number": "6",
                "article_text": [
                    "                               Art. 6. \nObblighi del proprietario o possessore di veicoli o di  complessi  di\n                          veicoli a motore \n  1. Il proprietario o possessore dei  veicoli  o  dei  complessi  di\nveicoli a motore di cui al comma 1 dell'articolo  1  deve  avvalersi,\nper la  manutenzione  e  la  riparazione  dei  medesimi,  di  imprese\niscritte nel registro di cui all'articolo 2,  salvo  quanto  previsto\ndal secondo periodo del comma 2 dell'articolo 1 e fatta eccezione per\ngli interventi di ordinaria e minuta manutenzione e riparazione. "
                ]
            },
            {
                "filename": "law_572_092G0031_1992-01-20.json",
                "title": "DECRETO-LEGGE 18 gennaio 1992, n. 9",
                "subject": "Disposizioni urgenti per l'adeguamento degli organici delle forze di polizia e del Corpo nazionale dei vigili del fuoco, nonche' per il potenziamento delle infrastrutture, degli impianti e delle attrezzature delle forze di polizia.",
                "type": "decreto.legge",
                "number": "9",
                "year": "1992",
                "editorial_code": "092G0031",
                "gazette_reference": "(GU n.15 del 20-01-1992)",
                "publication_date": "1992-01-18",
                "gazette_date": "1992-01-20",
                "valid_from": "1995-10-29",
                "last_updated": "(Ultimo aggiornamento all'atto pubblicato il 31/08/2013)",
                "link_gazette": "http://www.gazzettaufficiale.it/eli/gu/1992/01/20/15/sg/pdf",
                "link_urn_nir": "http://www.normattiva.it/uri-res/N2Ls?urn:nir:stato:decreto.legge:1992-01-18;9",
                "link_eli_id": "http://www.normattiva.it/eli/id/1992/01/20/092G0031",
                "link_eli_type": "http://www.normattiva.it/eli/stato/DECRETO_LEGGE/1992/01/18/9",
                "id": "art_1_law_572_092G0031_1992-01-20.json",
                "article_number": "1",
                "article_text": [
                    "                   IL PRESIDENTE DELLA REPUBBLICA \n  Visti gli articoli 77 e 87 della Costituzione; \n  Ritenuta la  straordinaria  necessita'  ed  urgenza  di  assicurare\nl'immediato avvio delle procedure  di  reclutamento  e  concorso  per\nl'aumento degli  organici  dell'Arma  dei  carabinieri,  nonche'  del\npersonale della Polizia di Stato, del Corpo della guardia di  finanza\ne del Corpo nazionale dei vigili del fuoco; \n  Ritenuta, altresi',  la  straordinaria  necessita'  ed  urgenza  di\nassicurare  l'immediato  avvio  di  un  programma  pluriennale  e  di\nsviluppo e ammodernamento delle infrastrutture degli impianti e delle\nattrezzature tecnico-logistiche delle forze di polizia  e  del  Corpo\nnazionale dei vigili del fuoco; \n  Vista la deliberazione del Consiglio dei Ministri,  adottata  nella\nriunione del 28 dicembre 1991; \n  Sulla proposta del Presidente del  Consiglio  dei  Ministri  e  del\nMinistro dell'interno, di concerto con i Ministri della difesa, delle\nfinanze, del bilancio e della programmazione economica e del tesoro; \n                              E M A N A \n                     il seguente decreto-legge: \n                               Art. 1 \n                          Polizia di Stato \n \n  1. Gli organici dei ruoli del personale della Polizia di Stato sono\naumentati   complessivamente,    a    decorrere    dal    1993,    di\ntremilasettecentonovantanove unita' cosi'  ripartite:  sessanta  vice\ncommissari,   diciannove    medici,    duecento    vice    ispettori,\nnovencentoventi   vice   sovrintendenti,   duemilaseicento    agenti.\nConseguentemente la tabella A  allegata  al  decreto  del  Presidente\ndella Repubblica 24 aprile 1982, n. 335, come da ultimo sostituita  a\nnorma del decreto-legge 4  ottobre  1990,  n.  276,  convertito,  con\nmodificazioni, dalla legge 30 novembre 1990, n.  359,  e'  sostituita\ndalla tabella A allegata al presente decreto; la  dotazione  organica\nnelle  qualifiche  di  medico   e   medico   principale   dei   ruoli\nprofessionali dei sanitari della Polizia di Stato di cui alla tabella\nA allegata al decreto del Presidente della Repubblica 24 aprile 1982,\nn. 338, come modificata dal decreto-legge 4  ottobre  1990,  n.  276,\nconvertito, con modificazioni, dalla legge 30 novembre 1990, n.  359,\ne' aumentata di diciannove unita'. \n  2.  La  copertura  dei  posti  risultanti  dall'ampliamento   degli\norganici di cui al comma 1  avverra'  negli  anni  1993-1994  secondo\ncontingenti non superiori a quelli indicati nella tabella B. \n  3. I posti  portati  in  aumento  alle  dotazioni  organiche  delle\nqualifiche di vice sovrintendente per  gli  anni  1993  e  1994  sono\nconferiti, unitamente a  quelli  che  si  renderanno  disponibili  in\nciascuno degli anni precedenti, secondo la normativa vigente e con le\ndecorrenze dalla stessa previste. \n  4. Per i posti di allievo agente da conferire fino al  31  dicembre\n1994, l'amministrazione ha  facolta'  di  utilizzare  la  graduatoria\ndell'arruolamento straordinario per l'assunzione di novecentosessanta\nunita', indetto con decreto del Ministero dell'interno del 21  maggio\n1990, pubblicato nella Gazzetta Ufficiale - 4a serie speciale - n. 52\ndel 3 luglio 1990, conferendo i posti  ai  candidati  idonei  secondo\nl'ordine della stessa. \n  5. Per  assicurare  la  copertura  delle  vacanze  nella  dotazione\norganica della qualifica  di  vice  ispettore,  l'Amministrazione  ha\nfacolta' di utilizzare la graduatoria  degli  idonei  al  concorso  a\nquattrocento posti di vice ispettore indetto con decreto del Ministro\ndell'interno  del  4  settembre  1987,  successivamente   elevati   a\nmilleduecento con decreto del  Ministro  dell'interno  del  1  luglio\n1989, facendo decorrere la nomina, a tutti gli effetti, dalla data di\ninizio del corso da espletarsi a norma dell'articolo 14  del  decreto\ndel Presidente della Repubblica 24 aprile 1982, n. 336.  Allo  stesso\nfine l'Amministrazione puo', fino a completamento della copertura dei\nnovecento posti di vice ispettore, di cui  al  concorso  bandito  con\ndecreto del Ministro dell'interno del 3  luglio  1991,  eventualmente\ndisponibili  dopo  l'espletamento   del   concorso,   utilizzare   la\ngraduatoria degli  idonei  al  concorso  pubblico  a  seicento  posti\nbandito con decreto del Ministro dell'interno del 18  dicembre  1986.\nPer  questo  ultimo  contingente  di  personale,  restano  ferme   le\ndisposizioni dell'articolo 6 del decreto-legge 4 agosto 1987, n. 325,\nconvertito, con modificazioni, dalla legge 3 ottobre 1987, n. 402. ((\nL'Amministrazione ha altresi' facolta' di utilizzare, anche nel corso\ndell'anno 1993, per le vacanze  risultanti  al  30  giugno  1993,  la\ngraduatoria degli idonei al concorso a quarantanove posti  di  medico\ndei ruoli professionali dei sanitari della Polizia di Stato,  indetto\ncon decreto del Ministro dell'interno del 5 settembre 1991 )). \n  6. Per l'accesso ai ruoli del personale della Polizia  di  Stato  e\nper l'ammissione alle relative prove  d'esame  ed  agli  accertamenti\npsico-fisici ed attitudinali, continuano ad osservarsi  le  modalita'\nstabilite dall'articolo 5 del decreto-legge 4 ottobre 1990,  n.  276,\nconvertito, con modificazioni, dalla legge 30 novembre 1990, n. 359. \n  7. Nei confronti del personale comunque nominato  nelle  qualifiche\niniziali dei ruoli del personale della Polizia di Stato  che  espleta\nfunzioni di polizia, l'assegnazione alla sede  e'  disposta  a  norma\ndell'articolo 55, ultimo comma,  del  decreto  del  Presidente  della\nRepubblica 24 aprile 1982, n. 335. \n  8. La spesa derivante  dall'attuazione  del  presente  articolo  e'\nvalutata in lire 51.124 milioni  per  l'anno  1993,  in  lire  91.768\nmilioni per l'anno 1994  ed  in  lire  130.633  milioni  a  decorrere\ndall'anno 1995. "
                ]
            },
            {
                "filename": "law_380_091G0129_1991-03-16.json",
                "title": "DECRETO-LEGGE 16 marzo 1991, n. 83",
                "subject": "Modifiche al decreto-legge 10 luglio 1982, n. 429, convertito, con modificazioni, dalla legge 7 agosto 1982, n. 516, in materia di repressione delle violazioni tributarie e disposizioni per definire le relative pendenze.",
                "type": "decreto.legge",
                "number": "83",
                "year": "1991",
                "editorial_code": "091G0129",
                "gazette_reference": "(GU n.64 del 16-03-1991)",
                "publication_date": "1991-03-16",
                "gazette_date": "1991-03-16",
                "valid_from": "1991-05-16",
                "last_updated": "(Ultimo aggiornamento all'atto pubblicato il 31/12/1999)",
                "link_gazette": "http://www.gazzettaufficiale.it/eli/gu/1991/03/16/64/sg/pdf",
                "link_urn_nir": "http://www.normattiva.it/uri-res/N2Ls?urn:nir:stato:decreto.legge:1991-03-16;83",
                "link_eli_id": "http://www.normattiva.it/eli/id/1991/03/16/091G0129",
                "link_eli_type": "http://www.normattiva.it/eli/stato/DECRETO_LEGGE/1991/03/16/83",
                "id": "art_8_law_380_091G0129_1991-03-16.json",
                "article_number": "8",
                "article_text": [
                    "                               Art. 8. \n  ((1. Le violazioni indicate nell'articolo 21  del  decreto-legge  2\nmarzo 1989, n. 69, convertito,  con  modificazioni,  dalla  legge  27\naprile 1989, n. 154, commesse fino alla data di entrata in vigore del\npresente decreto, possono  essere  definite  con  il  pagamento,  per\nciascuno dei periodi d'imposta cui si  riferiscono,  della  somma  di\nlire  un  milione,  che  deve  essere  versata  contestualmente  alla\npresentazione di apposita istanza entro il  31  luglio  1991,  ovvero\nentro sessanta giorni dalla notifica  dell'avviso  di  garanzia,  nel\ncaso in cui  questo  non  sia  ancora  pervenuto.  E'  data  facolta'\nall'interessato di presentare apposita istanza per  la  rateizzazione\ndell'importo dovuto che dovra' essere  versato  in  quattro  rate  di\nuguale importo scadenti nei mesi di luglio ed ottobre degli anni 1991\ne  1992;  la  rateizzazione  puo'  essere  richiesta   se   l'importo\ncomplessivo supera tre milioni di lire  e  sugli  importi  rateizzati\nsono dovuti gli interessi nella misura del 12  per  cento.  L'istanza\ndeve essere presentata da chiunque vi abbia interesse,  nei  predetti\ntermini, all'ufficio dell'imposta sul valore aggiunto  competente  in\nragione del  domicilio  fiscale  alla  data  di  presentazione  della\nstessa.  L'istanza  deve  essere  redatta  in  duplice  esemplare  in\nconformita' al modello  approvato  con  decreto  del  Ministro  delle\nfinanze, da pubblicare nella Gazzetta Ufficiale entro  il  31  maggio\n1991;  con  lo  stesso  decreto  sono  stabilite  le   modalita'   di\ntrasmissione  all'ufficio  delle  imposte  dirette   di   uno   degli\nesemplari. Le disposizioni di cui sopra non si applicano allorche' le\npredette  violazioni  siano   altresi'   previste   come   reato   da\ndisposizioni diverse da quelle di cui agli articoli 1, ultimo  comma,\n2, commi primo, numeri 2) e  3),  e  secondo,  del  decreto-legge  10\nluglio 1982, n. 429, convertito, con  modificazioni,  dalla  legge  7\nagosto 1982, n. 516, nonche' all'articolo 3, comma  5,  del  decreto-\nlegge 19 dicembre 1984, n. 853, convertito, con modificazioni,  dalla\nlegge 17 febbraio 1985, n. 17, nel testo vigente  anteriormente  alla\ndata di entrata in vigore del presente decreto)). \n  2. Le sanzioni amministrative previste nell'articolo 44 del decreto\ndel  Presidente  della  Repubblica  26  ottobre  1972,  n.   633,   e\nnell'articolo 92 del  decreto  del  Presidente  della  Repubblica  29\nsettembre 1973, n. 602,  non  si  applicano  ai  contribuenti  ed  ai\nsostituti di imposta che hanno provveduto entro il 31  dicembre  1990\nal  pagamento  delle  imposte  o  delle  ritenute  risultanti   dalle\ndichiarazioni annuali e dalle dichiarazioni o liquidazioni periodiche\ndell'imposta sul valore  aggiunto  relative  ai  periodi  di  imposta\nchiusi anteriormente alla data di  entrata  in  vigore  del  presente\ndecreto. Su  istanza  degli  interessati  gli  uffici  delle  imposte\nprovvedono allo sgravio delle soprattasse iscritte a ruolo non ancora\npagate alla data di entrata in  vigore  del  presente  decreto  o  al\nrimborso di quelle pagate  a  partire  dalla  data  medesima.  Se  le\nimposte e le ritenute non versate sono state iscritte in ruoli emessi\nentro il 31 dicembre 1990, la soprattassa non e' dovuta limitatamente\nalle rate non ancora scadute alla  data  di  entrata  in  vigore  del\npresente decreto, a condizione che  le  imposte  e  le  ritenute  non\nversate iscritte a ruolo siano state pagate  o  vengano  pagate  alle\nrelative scadenze del ruolo. \n  3. Il versamento delle somme dovute  ai  sensi  del  comma  1  deve\nessere eseguito a norma dell'articolo  12  della  legge  12  novembre\n1976, n. 751, secondo modalita' stabilite con il decreto previsto dal\nmedesimo  comma.  In  caso  di  mancato  o  insufficiente  versamento\nl'Ufficio  provvede  alla  riscossione  delle   somme   non   versate\napplicando gli interessi in ragione del  10  per  cento  annuo  e  la\nsoprattassa di cui al primo comma dell'articolo 44  del  decreto  del\nPresidente della Repubblica 26 ottobre 1972, n. 633. \n  4. I giudizi pendenti dinanzi alle commissioni tributarie  relativi\nalle violazioni previste nel presente  articolo,  sono  sospesi.  Gli\nuffici devono  trasmettere  alle  commissioni  tributarie,  entro  il\nsemestre successivo a  quello  di  entrata  in  vigore  del  presente\ndecreto, un elenco cumulativo contenente l'indicazione delle parti  e\ndell'oggetto della  controversia  quali  risultano  dalla  copia  del\nricorso. Le commissioni, esaminati gli atti, dichiarano  l'estinzione\ndel giudizio. \n  5. Nello stato di previsione dell'entrata e' istituito un  apposito\ncapitolo cui affluiscono le riscossioni di cui al presente  articolo.\nSullo stesso capitolo affluiscono le riscossioni  degli  interessi  e\nsoprattasse per omesso, insufficiente e ritardato pagamento. \n  ((6. I procedimenti penali relativi ai reati di cui  agli  articoli\n1, ultimo comma, 2, commi primo, numeri  2)  e  3),  e  secondo,  del\ndecreto- legge 10 luglio 1982, n. 429, convertito, con modificazioni,\ndalla legge 7 agosto 1982, n. 516, nonche' all'articolo 3,  comma  5,\ndel  decreto-legge  19  dicembre  1984,  n.  853,   convertito,   con\nmodificazioni, dalla legge 17 febbraio 1985, n. 17, nel testo vigente\nanteriormente alla data di entrata in  vigore  del  presente  decreto\nsono sospesi fino alla data del 31  luglio  1991  o  al  sessantesimo\ngiorno successivo alla notifica dell'avviso di garanzia; in  caso  di\nrateizzazione sono  ulteriormente  sospesi,  su  documentata  istanza\ndell'interessato fino alla scadenza del  termine  per  il  versamento\nrateale)). ((1)) \n    \n\n--------------\n    \nAGGIORNAMENTO (1) \n  La L. 15 maggio 1991, n. 154 ha disposto (con l'art.  1,  comma  2)\nche restano salvi gli effetti dell'articolo del comma 6 del  presente\ndecreto. "
                ]
            },
            {
                "filename": "law_625_086U0514_1986-08-25.json",
                "title": "DECRETO DEL PRESIDENTE DELLA REPUBBLICA 2 maggio 1986, n. 514",
                "subject": "Modificazione allo statuto dell'Universita' degli studi di L'Aquila.",
                "type": "decreto.del.presidente.della.repubblica",
                "number": "514",
                "year": "1986",
                "editorial_code": "086U0514",
                "gazette_reference": "(GU n.196 del 25-08-1986)",
                "publication_date": "1986-05-2",
                "gazette_date": "1986-08-25",
                "valid_from": "1986-09-09",
                "last_updated": "",
                "link_gazette": "http://www.gazzettaufficiale.it/eli/gu/1986/08/25/196/sg/pdf",
                "link_urn_nir": "http://www.normattiva.it/uri-res/N2Ls?urn:nir:stato:decreto.del.presidente.della.repubblica:1986-05-2;514",
                "link_eli_id": "http://www.normattiva.it/eli/id/1986/08/25/086U0514",
                "link_eli_type": "http://www.normattiva.it/eli/stato/DECRETO_DEL_PRESIDENTE_DELLA_REPUBBLICA/1986/05/2/514",
                "id": "art_1_law_625_086U0514_1986-08-25.json",
                "article_number": "1",
                "article_text": [
                    "                   IL PRESIDENTE DELLA REPUBBLICA\n\n  Veduto  lo  statuto  dell'Universita'  di  L'Aquila,  approvato con\ndecreto  del  Presidente  della Repubblica 27 ottobre 1983, n. 837, e\nsuccessive modificazioni;\n  Veduto  il  testo  unico  delle  leggi  sull'istruzione  superiore,\napprovato con regio decreto 31 agosto 1933, n. 1592;\n  Veduto  il  regio decreto-legge 20 giugno 1935, n. 1071, convertito\nnella legge 2 gennaio 1936, n. 73;\n  Veduto  il  regio  decreto 30 settembre 1938, n. 1652, e successive\nmodificazioni;\n  Veduta la legge 11 aprile 1953, n. 312;\n  Veduto  il  decreto del Presidente della Repubblica 11 luglio 1980,\nn. 382;\n  Veduta la legge 30 ottobre 1981, n. 615;\n  Vedute  le  proposte  di  modifica  dello  statuto  formulate dalle\nautorita'  accademiche  dell'Universita'  anzidetta  ai  sensi  della\ncitata legge n. 615;\n  Veduto il parere del Consiglio universitario nazionale;\n  Sulla proposta del Ministro della pubblica istruzione;\n\n                              Decreta:\n\n  Lo statuto dell'Universita' di L'Aquila, approvato e modificato con\ni decreti sopraindicati, e' ulteriormente modificato come appresso:\n\n                           Articolo unico\n\n  Nell'art.   31,   relativo  agli  insegnamenti  della  facolta'  di\ningegneria, e' aggiunto l'insegnamento complementare di \"aerodinamica\ne gasdinamica\".\n\n  Il  presente decreto, munito del sigillo dello Stato, sara' inserto\nnella  Raccolta  ufficiale delle leggi e dei decreti della Repubblica\nitaliana. E' fatto obbligo a chiunque spetti di osservarlo e di farlo\nosservare.\n\n  Dato a Roma, addi' 2 maggio 1986\n\n                               COSSIGA\n\n                              FALCUCCI,   Ministro   della   pubblica\n                                istruzione\n\nVisto, il Guardasigilli: MARTINAZZOLI\n  Registrato alla Corte dei conti, addi' 11 agosto 1986\n  Registro n. 63 Istruzione, foglio n. 337"
                ]
            },
            {
                "filename": "law_90_098G0484_1998-12-16.json",
                "title": "DECRETO LEGISLATIVO 19 novembre 1998, n. 432",
                "subject": "Attuazione delle direttive 93/118/CE e 96/43/CE che modificano e codificano la direttiva 85/73/CEE in materia di finanziamento delle ispezioni e dei controlli veterinari degli animali vivi e di taluni prodotti di origine animale.",
                "type": "decreto.legislativo",
                "number": "432",
                "year": "1998",
                "editorial_code": "098G0484",
                "gazette_reference": "(GU n.293 del 16-12-1998)",
                "publication_date": "1998-11-19",
                "gazette_date": "1998-12-16",
                "valid_from": "2008-12-12",
                "last_updated": "(Ultimo aggiornamento all'atto pubblicato il 11/12/2008)",
                "link_gazette": "http://www.gazzettaufficiale.it/eli/gu/1998/12/16/293/sg/pdf",
                "link_urn_nir": "http://www.normattiva.it/uri-res/N2Ls?urn:nir:stato:decreto.legislativo:1998-11-19;432",
                "link_eli_id": "http://www.normattiva.it/eli/id/1998/12/16/098G0484",
                "link_eli_type": "http://www.normattiva.it/eli/stato/DECRETO_LEGISLATIVO/1998/11/19/432",
                "id": "art_8_law_90_098G0484_1998-12-16.json",
                "article_number": "8",
                "article_text": [
                    "                               Art. 8\n  (( PROVVEDIMENTO ABROGATO DAL D.LGS. 19 NOVEMBRE 2008, N. 194 ))"
                ]
            },
            {
                "filename": "law_39_093G0006_1993-01-13.json",
                "title": "DECRETO LEGISLATIVO 31 dicembre 1992, n. 545",
                "subject": "Ordinamento degli organi speciali di giurisdizione tributaria ed organizzazione degli uffici di collaborazione in attuazione della delega al Governo contenuta nell'art. 30 della legge 30 dicembre 1991, n. 413.",
                "type": "decreto.legislativo",
                "number": "545",
                "year": "1992",
                "editorial_code": "093G0006",
                "gazette_reference": "(GU n.9 del 13-01-1993 - Suppl. Ordinario n. 8)",
                "publication_date": "1992-12-31",
                "gazette_date": "1993-01-13",
                "valid_from": "1999-03-09",
                "last_updated": "(Ultimo aggiornamento all'atto pubblicato il 07/10/2015)",
                "link_gazette": "http://www.gazzettaufficiale.it/eli/gu/1993/01/13/9/so/8/sg/pdf",
                "link_urn_nir": "http://www.normattiva.it/uri-res/N2Ls?urn:nir:stato:decreto.legislativo:1992-12-31;545",
                "link_eli_id": "http://www.normattiva.it/eli/id/1993/01/13/093G0006",
                "link_eli_type": "http://www.normattiva.it/eli/stato/DECRETO_LEGISLATIVO/1992/12/31/545",
                "id": "art_31_law_39_093G0006_1993-01-13.json",
                "article_number": "31",
                "article_text": [
                    "                              Art. 31. \n          Uffici di segreteria delle commissioni tributarie \n  1. E' istituito presso ogni commissione tributaria  un  ufficio  di\nsegreteria con funzioni di assistenza e collaborazione nell'esercizio\ndell'attivita' giurisdizionale nonche' per  lo  svolgimento  di  ogni\naltra attivita' amministrativa  attribuita  alla  stessa  o  ai  suoi\ncomponenti. "
                ]
            },
            {
                "filename": "law_290_099G0349_1999-08-09.json",
                "title": "DECRETO LEGISLATIVO 8 luglio 1999, n. 270",
                "subject": "Nuova disciplina dell'amministrazione straordinaria delle grandi imprese in stato di insolvenza, a norma dell'articolo 1 della legge 30 luglio 1998, n. 274.",
                "type": "decreto.legislativo",
                "number": "270",
                "year": "1999",
                "editorial_code": "099G0349",
                "gazette_reference": "(GU n.185 del 09-08-1999)",
                "publication_date": "1999-07-8",
                "gazette_date": "1999-08-09",
                "valid_from": "1999-08-24",
                "last_updated": "(Ultimo aggiornamento all'atto pubblicato il 19/05/2020)",
                "link_gazette": "http://www.gazzettaufficiale.it/eli/gu/1999/08/09/185/sg/pdf",
                "link_urn_nir": "http://www.normattiva.it/uri-res/N2Ls?urn:nir:stato:decreto.legislativo:1999-07-8;270",
                "link_eli_id": "http://www.normattiva.it/eli/id/1999/08/09/099G0349",
                "link_eli_type": "http://www.normattiva.it/eli/stato/DECRETO_LEGISLATIVO/1999/07/8/270",
                "id": "art_84_law_290_099G0349_1999-08-09.json",
                "article_number": "84",
                "article_text": [
                    "                              Art. 84.\n   (Conversione del fallimento in amministrazione straordinaria).\n1.  Se  il  decreto  che dichiara aperta la procedura madre e' emesso\ndopo  la  sentenza  di  fallimento  di  una  impresa  del  gruppo, il\ntribunale  che  ha dichiarato il fallimento ne dispone la conversione\nin  amministrazione  straordinaria,  qualora sussistano i presupposti\nstabiliti  dall'articolo  81  e  sempre  che non sia gia' esaurita la\nliquidazione   dell'attivo.  Il  tribunale  provvede  su  istanza  di\nchiunque vi abbia interesse o d'ufficio.\n2.  Ai  fini indicati nel comma 1, il tribunale invita con decreto il\ncuratore  ed il commissario straordinario a depositare in cancelleria\ned  a  trasmettere al Ministro dell'industria entro trenta giorni una\nrelazione  contenente  una  valutazione motivata circa la sussistenza\ndei presupposti per la conversione.\n3.  Si  applicano,  in  quanto  compatibili,  le  disposizioni  degli\narticoli  28,  commi  4  e  5, 29, 30 e 33, sostituiti al commissario\ngiudiziale il curatore ed il commissario straordinario."
                ]
            },
            {
                "filename": "law_17_092G0081_1992-02-08.json",
                "title": "DECRETO 29 dicembre 1991, n. 445",
                "subject": "Regolamento per lo svolgimento degli esami di Stato per l'abilitazione all'esercizio della libera professione di perito industriale.",
                "type": "decreto",
                "number": "445",
                "year": "1991",
                "editorial_code": "092G0081",
                "gazette_reference": "(GU n.32 del 08-02-1992)",
                "publication_date": "1991-12-29",
                "gazette_date": "1992-02-08",
                "valid_from": "1992-02-23",
                "last_updated": "(Ultimo aggiornamento all'atto pubblicato il 24/02/2001)",
                "link_gazette": "http://www.gazzettaufficiale.it/eli/gu/1992/02/08/32/sg/pdf",
                "link_urn_nir": "http://www.normattiva.it/uri-res/N2Ls?urn:nir:stato:decreto:1991-12-29;445",
                "link_eli_id": "http://www.normattiva.it/eli/id/1992/02/08/092G0081",
                "link_eli_type": "http://www.normattiva.it/eli/stato/DECRETO/1991/12/29/445",
                "id": "art_2_law_17_092G0081_1992-02-08.json",
                "article_number": "2",
                "article_text": [
                    "                               Art. 2.\n                       Requisiti di ammissione\n  1.  Agli  esami  di  Stato  per  l'abilitazione all'esercizio della\nlibera professione di perito  industriale  sono  ammessi  soltanto  i\ncandidati  che  siano  in  possesso  del diploma di maturita' tecnica\nindustriale  conseguito  presso  un  istituto  statale  o  legalmente\nriconosciuto   e   che   abbiano   soddisfatto,   nel  settore  della\nspecializzazione  relativa  al  diploma  posseduto,  almeno  uno  dei\nrequisiti prescritti dall'art. 2, terzo comma, della legge 2 febbraio\n1990,  n.  17, in conformita' delle direttive impartite dal Consiglio\nnazionale dei periti industriali."
                ]
            },
            {
                "filename": "law_386_099G0251_1999-06-16.json",
                "title": "DECRETO LEGISLATIVO 22 maggio 1999, n. 174",
                "subject": "Disciplina sanzionatoria per le violazioni delle disposizioni del regolamento (CEE) n. 793/93, relativo alla valutazione e al controllo dei rischi presentati dalle sostanze esistenti.",
                "type": "decreto.legislativo",
                "number": "174",
                "year": "1999",
                "editorial_code": "099G0251",
                "gazette_reference": "(GU n.139 del 16-06-1999)",
                "publication_date": "1999-05-22",
                "gazette_date": "1999-06-16",
                "valid_from": "1999-06-17",
                "last_updated": "",
                "link_gazette": "http://www.gazzettaufficiale.it/eli/gu/1999/06/16/139/sg/pdf",
                "link_urn_nir": "http://www.normattiva.it/uri-res/N2Ls?urn:nir:stato:decreto.legislativo:1999-05-22;174",
                "link_eli_id": "http://www.normattiva.it/eli/id/1999/06/16/099G0251",
                "link_eli_type": "http://www.normattiva.it/eli/stato/DECRETO_LEGISLATIVO/1999/05/22/174",
                "id": "art_1_law_386_099G0251_1999-06-16.json",
                "article_number": "1",
                "article_text": [
                    "                   IL PRESIDENTE DELLA REPUBBLICA\n  Visti gli articoli 76 e 87 della Costituzione;\n  Visti gli articoli 8 e 9 della legge 24 aprile 1998, n. 128;\n  Visto il  regolamento (CEE)  n. 793/93 del  Consiglio del  23 marzo\n1993, relativo alla valutazione e  al controllo dei rischi presentati\ndalle sostanze esistenti;\n  Visto l'articolo 14 della legge 23 agosto 1988, n. 400;\n  Vista la  deliberazione del Consiglio dei  Ministri, adottata nella\nriunione del 21 maggio 1999;\n  Sulla  proposta del  Ministro per  le politiche  comunitarie e  del\nMinistro  di grazia  e giustizia,  di concerto  con i  Ministri della\nsanita',   dell'industria,  del   commercio   e  dell'artigianato   e\ndell'ambiente;\n                              E m a n a\n                  il seguente decreto legislativo:\n                               Art. 1.\n            Sanzioni mancate comunicazioni articoli 3 e 4\n                      del regolamento 793/93/CE\n  1.  Salvo  che   il  fatto  costituisca  reato   il  fabbricante  o\nl'importatore  delle  sostanze esistenti  che  non  ha provveduto  ad\neffettuare  la   comunicazione  delle  informazioni   previste  dagli\narticoli 3  e 4,  paragrafo 1,  del regolamento  (CEE) n.  793/93 del\nConsiglio, nel  termine di trenta  giorni dall'entrata in  vigore del\npresente decreto e' punito  con la sanzione amministrativa pecuniaria\nda lire dieci milioni a lire sessanta milioni.\n  2. Salvo  che il fatto  costituisca reato la  mancata comunicazione\ndelle informazioni complementari di cui agli articoli 4, paragrafo 2,\n10, paragrafo  2 e 12, paragrafo  2, del regolamento (CEE)  n. 793/93\ndel Consiglio e' punita con  la sanzione amministrativa pecuniaria da\nlire otto milioni a lire quarantotto milioni.\n          Avvertenza:\n            Il  testo delle  note  qui  pubblicato e'  stato  redatto\n          ai  sensi dell'art.  10, comma  3,  del testo  unico  delle\n          disposizioni        sulla    promulgazione   delle   leggi,\n          sull'emanazione   dei   decreti   del   Presidente    della\n          Repubblica   e     sulle  pubblicazioni    ufficiali  della\n          Repubblica italiana, approvato   con D.P.R.    28  dicembre\n          1985,    n.  1092,    al solo fine di facilitare la lettura\n          delle disposizioni  di  legge  alle  quali  e'  operato  il\n          rinvio.  Restano  invariati  il  valore e l'efficacia degli\n          atti legislativi qui trascritti.\n            Per  i  regolamenti  comunitari   vengono   forniti   gli\n          estremi    di pubblicazione   nella   Gazzetta    ufficiale\n          delle  Comunita'  europee (GUCE)."
                ]
            }
        ]
    },
    {
        "unit_id": "unit_16",
        "token_input": "JECFXBEYMJ",
        "token_output": "DJDDONKJLA",
        "documents": [
            {
                "filename": "law_238_097G0315_1997-09-05.json",
                "title": "DECRETO MINISTERIALE 23 luglio 1997, n. 287",
                "subject": "Regolamento concernente la disciplina della gestione patrimoniale e finanziaria delle camere di commercio.",
                "type": "decreto.ministeriale",
                "number": "287",
                "year": "1997",
                "editorial_code": "097G0315",
                "gazette_reference": "(GU n.207 del 05-09-1997 - Suppl. Ordinario n. 175)",
                "publication_date": "1997-07-23",
                "gazette_date": "1997-09-05",
                "valid_from": "2005-12-31",
                "last_updated": "(Ultimo aggiornamento all'atto pubblicato il 16/12/2005)",
                "link_gazette": "http://www.gazzettaufficiale.it/eli/gu/1997/09/05/207/so/175/sg/pdf",
                "link_urn_nir": "http://www.normattiva.it/uri-res/N2Ls?urn:nir:stato:decreto.ministeriale:1997-07-23;287",
                "link_eli_id": "http://www.normattiva.it/eli/id/1997/09/05/097G0315",
                "link_eli_type": "http://www.normattiva.it/eli/stato/DECRETO_MINISTERIALE/1997/07/23/287",
                "id": "art_1_law_238_097G0315_1997-09-05.json",
                "article_number": "1",
                "article_text": [
                    "                               Art. 1\n    ((PROVVEDIMENTO ABROGATO DAL D.P.R. 2 NOVEMBRE 2005, N. 254))"
                ]
            },
            {
                "filename": "law_63_093G0628_1993-12-29.json",
                "title": "DECRETO-LEGGE 28 dicembre 1993, n. 542",
                "subject": "Disposizioni urgenti in materia di differimento di termini previsti da disposizioni legislative.",
                "type": "decreto.legge",
                "number": "542",
                "year": "1993",
                "editorial_code": "093G0628",
                "gazette_reference": "(GU n.304 del 29-12-1993)",
                "publication_date": "1993-12-28",
                "gazette_date": "1993-12-29",
                "valid_from": "1994-02-28",
                "last_updated": "(Ultimo aggiornamento all'atto pubblicato il 08/01/1994)",
                "link_gazette": "http://www.gazzettaufficiale.it/eli/gu/1993/12/29/304/sg/pdf",
                "link_urn_nir": "http://www.normattiva.it/uri-res/N2Ls?urn:nir:stato:decreto.legge:1993-12-28;542",
                "link_eli_id": "http://www.normattiva.it/eli/id/1993/12/29/093G0628",
                "link_eli_type": "http://www.normattiva.it/eli/stato/DECRETO_LEGGE/1993/12/28/542",
                "id": "art_29_law_63_093G0628_1993-12-29.json",
                "article_number": "29",
                "article_text": [
                    "                              Art. 29. \n    DECRETO DECADUTO; I SUOI EFFETTI SONO STATI FATTI SALVI DALLA \n                      L. 13 LUGLIO 1995, N. 295 "
                ]
            },
            {
                "filename": "law_446_097G0123_1997-03-29.json",
                "title": "DECRETO-LEGGE 28 marzo 1997, n. 79",
                "subject": "Misure urgenti per il riequilibrio della finanza pubblica",
                "type": "decreto.legge",
                "number": "79",
                "year": "1997",
                "editorial_code": "097G0123",
                "gazette_reference": "(GU n.74 del 29-03-1997)",
                "publication_date": "1997-03-28",
                "gazette_date": "1997-03-29",
                "valid_from": "1997-03-29",
                "last_updated": "(Ultimo aggiornamento all'atto pubblicato il 29/12/2017)",
                "link_gazette": "http://www.gazzettaufficiale.it/eli/gu/1997/03/29/74/sg/pdf",
                "link_urn_nir": "http://www.normattiva.it/uri-res/N2Ls?urn:nir:stato:decreto.legge:1997-03-28;79",
                "link_eli_id": "http://www.normattiva.it/eli/id/1997/03/29/097G0123",
                "link_eli_type": "http://www.normattiva.it/eli/stato/DECRETO_LEGGE/1997/03/28/79",
                "id": "art_14_law_446_097G0123_1997-03-29.json",
                "article_number": "14",
                "article_text": [
                    "                              Art. 14.\n         Devoluzione delle entrate e variazioni di bilancio\n\n  1.  Le  entrate  tributarie  derivanti  dal  presente  decreto sono\nriservate  all'erario  e concorrono alla copertura degli oneri per il\nservizio  del debito pubblico, nonche' alla realizzazione delle linee\ndi  politica  economica  e  finanziaria  in funzione degli impegni di\nriequilibrio  del  bilancio  assunti in sede comunitaria. Con decreto\ndel  Ministro  delle finanze, di concerto con il Ministro del tesoro,\nda  emanare  entro novanta giorni dalla data di entrata in vigore del\npresente  decreto,  sono  stabilite,  ove necessario, le modalita' di\nattuazione del presente articolo. ((11))\n  2.  Il  Ministro del tesoro e' autorizzato ad apportare, con propri\ndecreti,  le  variazioni  di bilancio occorrenti per l'attuazione del\npresente decreto.\n--------------\nAGGIORNAMENTO (11)\n  La  Corte  Costituzionale, con sentenza 12 - 25 luglio 2000, n. 347\n(in  G.U. 1a s.s. 02/08/2000, n. 32), ha dichiarato \"l'illegittimita'\ncostituzionale  dell'art.  14,  comma  1,  del decreto-legge 28 marzo\n1997,  n.  79  (Misure  urgenti  per  il  riequilibrio  della finanza\npubblica)  convertito nella legge 28 maggio 1997, n. 140, nella parte\nin  cui,  nel  disporre  che  le modalita' di attuazione dello stesso\narticolo  sono stabilite con decreto ministeriale, non prevede che al\nrelativo procedimento partecipi la Regione Siciliana\"."
                ]
            },
            {
                "filename": "law_333_090G0170_1990-06-04.json",
                "title": "LEGGE 31 maggio 1990, n. 128",
                "subject": "Proroga di termini previsti da disposizioni legislative.",
                "type": "legge",
                "number": "128",
                "year": "1990",
                "editorial_code": "090G0170",
                "gazette_reference": "(GU n.128 del 04-06-1990)",
                "publication_date": "1990-05-31",
                "gazette_date": "1990-06-04",
                "valid_from": "1990-06-04",
                "last_updated": "(Ultimo aggiornamento all'atto pubblicato il 30/12/2000)",
                "link_gazette": "http://www.gazzettaufficiale.it/eli/gu/1990/06/04/128/sg/pdf",
                "link_urn_nir": "http://www.normattiva.it/uri-res/N2Ls?urn:nir:stato:legge:1990-05-31;128",
                "link_eli_id": "http://www.normattiva.it/eli/id/1990/06/04/090G0170",
                "link_eli_type": "http://www.normattiva.it/eli/stato/LEGGE/1990/05/31/128",
                "id": "art_1_law_333_090G0170_1990-06-04.json",
                "article_number": "1",
                "article_text": [
                    "  La Camera dei deputati ed il Senato della Repubblica hanno \napprovato; \n                    IL PRESIDENTE DELLA REPUBBLICA \n                               PROMULGA \nla seguente legge: \n                               Art. 1. \n  1. E' prorogato al 31 dicembre 1990 il termine del 31 dicembre 1989\nindicato dall'articolo 13, comma 1, della legge 10 febbraio 1989,  n.\n48, per quanto concerne l'attuazione degli strumenti urbanistici  nei\ncomuni terremotati dichiarati sismici anche in assenza dei  programmi\npluriennali di cui all'articolo 13 della legge 28  gennaio  1977,  n.\n10. "
                ]
            },
            {
                "filename": "law_410_098G0159_1998-04-21.json",
                "title": "DECRETO LEGISLATIVO 31 marzo 1998, n. 112",
                "subject": "Conferimento di funzioni e compiti amministrativi dello Stato alle regioni ed agli enti locali, in attuazione del capo I della legge 15 marzo 1997, n. 59.",
                "type": "decreto.legislativo",
                "number": "112",
                "year": "1998",
                "editorial_code": "098G0159",
                "gazette_reference": "(GU n.92 del 21-04-1998 - Suppl. Ordinario n. 77)",
                "publication_date": "1998-03-31",
                "gazette_date": "1998-04-21",
                "valid_from": "1998-05-06",
                "last_updated": "(Ultimo aggiornamento all'atto pubblicato il 30/04/2019)",
                "link_gazette": "http://www.gazzettaufficiale.it/eli/gu/1998/04/21/92/so/77/sg/pdf",
                "link_urn_nir": "http://www.normattiva.it/uri-res/N2Ls?urn:nir:stato:decreto.legislativo:1998-03-31;112",
                "link_eli_id": "http://www.normattiva.it/eli/id/1998/04/21/098G0159",
                "link_eli_type": "http://www.normattiva.it/eli/stato/DECRETO_LEGISLATIVO/1998/03/31/112",
                "id": "art_36_law_410_098G0159_1998-04-21.json",
                "article_number": "36",
                "article_text": [
                    "                              Art. 36.\n                             Abrogazioni\n  1.  Dalla  data dell'attuazione delle deleghe previste all'articolo\n34  del  presente decreto legislativo sono abrogati gli articoli 44 e\n53  del  regolamento  approvato  con  decreto  del  Presidente  della\nRepubblica 27 maggio 1991, n. 395."
                ]
            },
            {
                "filename": "law_783_082U0419_1982-07-08.json",
                "title": "LEGGE 25 giugno 1982, n. 419",
                "subject": "Rendiconto generale dell'Amministrazione dello Stato per l'esercizio finanziario 1978.",
                "type": "legge",
                "number": "419",
                "year": "1982",
                "editorial_code": "082U0419",
                "gazette_reference": "(GU n.186 del 08-07-1982 - Suppl. Ordinario)",
                "publication_date": "1982-06-25",
                "gazette_date": "1982-07-08",
                "valid_from": "1982-07-23",
                "last_updated": "",
                "link_gazette": "http://www.gazzettaufficiale.it/eli/gu/1982/07/08/186/so/0/sg/pdf",
                "link_urn_nir": "http://www.normattiva.it/uri-res/N2Ls?urn:nir:stato:legge:1982-06-25;419",
                "link_eli_id": "http://www.normattiva.it/eli/id/1982/07/08/082U0419",
                "link_eli_type": "http://www.normattiva.it/eli/stato/LEGGE/1982/06/25/419",
                "id": "art_10_law_783_082U0419_1982-07-08.json",
                "article_number": "10",
                "article_text": [
                    "                              ART. 10.\n\n  Sono  approvate  le  eccedenze  di  impegni  risultate  in  sede di\nconsuntivo  sul  conto  della  competenza  e sul conto dei residui ai\ncapitoli   degli  stati  di  previsione  della  spesa  dei  Ministeri\nsottoindicati  per  l'esercizio  finanziario  1978,  come risulta dal\ndettaglio che segue:\n                                      Conto               Conto\n                                della competenza       dei residui\n                               --------------------------------------\nMINISTERO DEL TESORO\n  Capitolo n. 4351 - Pensioni\nordinarie  ed  altri  assegni\nfissi  pagabili a mezzo ruoli\ndi  spesa fissa e relativi o-\nneri  previdenziali  e  assi-\nstenziali . . . . . . . . . .  L. 158.427.549.639  L.  98.889.136.381\n  Capitolo n. 4514 -  Assegno\nannuo vitalizio ai combatten-\nti  della  guerra  1914-18  e\ndelle  guerre precedenti, in-\nsigniti dell'Ordine di Vitto-\nrio Veneto. . . . . . . . . .            -         \"   11.397.232.502\n  Capitolo n. 4534  -   Somme\noccorrenti per la regolazione\ncontabile  delle entrate era-\nriali  riscosse dalla Regione\nsiciliana . . . . . . . . . .  \"  383.171.080.612            -\n  Capitolo n. 4535  -   Somme\noccorrenti per la regolazione\ndelle  quote  di entrate era-\nriali  devolute  alla Regione\nsarda . . . . . . . . . . . .  \"    1.676.938.875            -\n  Capitolo n. 4678 - Interes-\nsi  di somme versate in conto\ncorrente   col  Tesoro  dello\nStato . . . . . . . . . . . .  \"   66.607.103.355            -\nMINISTERO DELLE FINANZE\n  Capitolo n. 2811 -  Vincite\nal lotto. . . . . . . . . . .           -          L.     729.470.269\n  Capitolo n. 5591  -   Spese\nper  liti, arbitraggi, risar-\ncimenti  ed  accessori; spese\ndi  giustizia  penale,  altre\nspese  processuali da antici-\nparsi dall'Erario, indennita'\na  testimoni  ed a periti per\nla  rappresentanza dell'Ammi-\nnistrazione, relativamente ai\nprocedimenti di natura extra-\ntributaria. . . . . . . . . .  \"       17.334.030            -\nMINISTERO DI GRAZIA E GIUSTIZIA\n  Capitolo n. 1502 - Indenni-\nta  integrativa  per il rag-\ngiungimento del minimo garan-\ntito  dallo  Stato agli uffi-\nciali  ed  aiutanti ufficiali\ne  coadiutori  giudiziari  ed\naltri  assegni  al detto per-\nsonale. . . . . . . . . . . .            -         \"      931.379.573\n  Capitolo n. 1589 - Spese di\ngiustizia   nei  procedimenti\npenali  ed  in  quelli civili\ncon   ammissione  al  gratui-\nto   patrocinio.   Indennita'\ne  trasferte  ai  funzionari,\ngiudici   popolari,   periti,\ntestimoni,  custodi e diverse\nper  l'accertamento dei reati\ne  dei  colpevoli. Spese ine-\nrenti  alla  estradizione  di\nimputati  e condannati ed al-\nla  traduzione di atti giudi-\nziari  in materia penale pro-\nvenienti  dall'estero  o  di-\nretti ad autorita estere . .   \"    2.568.410.031 \"    3.333.292.811\nMINISTERO DELLA PUBBLICA ISTRUZIONE\n  Capitolo n. 1401 -  Stipen-\ndi, retribuzioni ed altri as-\nsegni  fissi al personale do-\ncente . . . . . . . . . . . .   \"   29.500.000.000            -\n  Capitolo n. 3273  -   Posti\ngratuiti   per  convittori  e\nsemiconvittori  negli Istitu-\nti di educazione. . . . . . .   \"    1.100.000.000            -\n  Capitolo n. 4000 -  Stipen-\ndi, retribuzioni ed altri as-\nsegni  fissi al personale non\ndocente  di  ruolo  e  non di\nruolo . . . . . . . . . . . .   \"   20.000.000.000            -\nMINISTERO DEL LAVORO E DELLA PREVIDENZA SOCIALE\n  Capitolo n. 3531  -   Spese\nper le inchieste sugli infor-\ntuni occorsi alle persone as-\nsicurate contro gli infortuni\nsul lavoro e le malattie pro-\nfessionali. . . . . . . . . .   \"       65.382.831 \"        3.879.910"
                ]
            },
            {
                "filename": "law_182_097G0375_1997-10-11.json",
                "title": "LEGGE 8 ottobre 1997, n. 343",
                "subject": "Partecipazione italiana per l'organizzazione ed il finanziamento dell'Esposizione internazionale di Lisbona del 1998.",
                "type": "legge",
                "number": "343",
                "year": "1997",
                "editorial_code": "097G0375",
                "gazette_reference": "(GU n.238 del 11-10-1997)",
                "publication_date": "1997-10-8",
                "gazette_date": "1997-10-11",
                "valid_from": "2012-06-06",
                "last_updated": "(Ultimo aggiornamento all'atto pubblicato il 09/02/2012)",
                "link_gazette": "http://www.gazzettaufficiale.it/eli/gu/1997/10/11/238/sg/pdf",
                "link_urn_nir": "http://www.normattiva.it/uri-res/N2Ls?urn:nir:stato:legge:1997-10-8;343",
                "link_eli_id": "http://www.normattiva.it/eli/id/1997/10/11/097G0375",
                "link_eli_type": "http://www.normattiva.it/eli/stato/LEGGE/1997/10/8/343",
                "id": "art_3_law_182_097G0375_1997-10-11.json",
                "article_number": "3",
                "article_text": [
                    "                             Art. 3                                                                                                                                                                                                       \n      ((PROVVEDIMENTO ABROGATO DAL D.L. 9 FEBBRAIO 2012, N. 5, \n    CONVERTITO CON MODIFICAZIONI DALLA L. 4 APRILE 2012, N. 35))"
                ]
            },
            {
                "filename": "law_7_098G0092_1998-03-18.json",
                "title": "DECRETO 22 dicembre 1997, n. 518",
                "subject": "Regolamento recante norme sull'espletamento di funzioni ispettive nell'ambito del Corpo nazionale dei vigili del fuoco.",
                "type": "decreto",
                "number": "518",
                "year": "1997",
                "editorial_code": "098G0092",
                "gazette_reference": "(GU n.64 del 18-03-1998)",
                "publication_date": "1997-12-22",
                "gazette_date": "1998-03-18",
                "valid_from": "1998-04-02",
                "last_updated": "",
                "link_gazette": "http://www.gazzettaufficiale.it/eli/gu/1998/03/18/64/sg/pdf",
                "link_urn_nir": "http://www.normattiva.it/uri-res/N2Ls?urn:nir:stato:decreto:1997-12-22;518",
                "link_eli_id": "http://www.normattiva.it/eli/id/1998/03/18/098G0092",
                "link_eli_type": "http://www.normattiva.it/eli/stato/DECRETO/1997/12/22/518",
                "id": "art_2_law_7_098G0092_1998-03-18.json",
                "article_number": "2",
                "article_text": [
                    "                               Art. 2.\n  1. Lo  svolgimento delle funzioni ispettive  compete agli ispettori\nregionali ed interregionali.\n  2.  In  relazione  alle  disposizioni di  cui  all'articolo  1,  il\ndirettore generale della Protezione  civile e dei servizi antincendi,\nsu proposta  dell'ispettore generale  capo, provvede ad  attribuire i\nsingoli incarichi ispettivi."
                ]
            },
            {
                "filename": "law_23_098G0033_1998-01-29.json",
                "title": "DECRETO DEL PRESIDENTE DEL CONSIGLIO DEI MINISTRI 12 dicembre 1997, n. 502",
                "subject": "Regolamento recante norme per l'inquadramento nel ruolo medico del Servizio sanitario nazionale di incaricati del servizio di guardia medica e medicina dei servizi.",
                "type": "decreto.del.presidente.del.consiglio.dei.ministri",
                "number": "502",
                "year": "1997",
                "editorial_code": "098G0033",
                "gazette_reference": "(GU n.23 del 29-01-1998)",
                "publication_date": "1997-12-12",
                "gazette_date": "1998-01-29",
                "valid_from": "1998-02-13",
                "last_updated": "",
                "link_gazette": "http://www.gazzettaufficiale.it/eli/gu/1998/01/29/23/sg/pdf",
                "link_urn_nir": "http://www.normattiva.it/uri-res/N2Ls?urn:nir:stato:decreto.del.presidente.del.consiglio.dei.ministri:1997-12-12;502",
                "link_eli_id": "http://www.normattiva.it/eli/id/1998/01/29/098G0033",
                "link_eli_type": "http://www.normattiva.it/eli/stato/DECRETO_DEL_PRESIDENTE_DEL_CONSIGLIO_DEI_MINISTRI/1997/12/12/502",
                "id": "art_5_law_23_098G0033_1998-01-29.json",
                "article_number": "5",
                "article_text": [
                    "                               Art. 5.\n                           Norme di rinvio\n  1. Per quanto  non previsto nel presente  regolamento si applicano,\nin quanto compatibili,  le norme del decreto  ministeriale 30 gennaio\n1982, pubblicato nel supplemento ordinario alla Gazzetta Ufficiale n.\n51 del  22 febbraio  1982, nonche' del  decreto del  Presidente della\nRepubblica  9  maggio  1994,   n.  487,  pubblicato  nel  supplemento\nordinario alla Gazzetta Ufficiale del 9 agosto 1994, n. 185."
                ]
            },
            {
                "filename": "law_764_081U0408_1981-08-01.json",
                "title": "DECRETO DEL PRESIDENTE DELLA REPUBBLICA 21 maggio 1981, n. 408",
                "subject": "Riconoscimento della personalita' giuridica dell'associazione \"Prometeia - Associazione per le previsioni econometriche\", in Bologna.",
                "type": "decreto.del.presidente.della.repubblica",
                "number": "408",
                "year": "1981",
                "editorial_code": "081U0408",
                "gazette_reference": "(GU n.210 del 01-08-1981)",
                "publication_date": "1981-05-21",
                "gazette_date": "1981-08-01",
                "valid_from": "1981-08-16",
                "last_updated": "",
                "link_gazette": "http://www.gazzettaufficiale.it/eli/gu/1981/08/01/210/sg/pdf",
                "link_urn_nir": "http://www.normattiva.it/uri-res/N2Ls?urn:nir:stato:decreto.del.presidente.della.repubblica:1981-05-21;408",
                "link_eli_id": "http://www.normattiva.it/eli/id/1981/08/01/081U0408",
                "link_eli_type": "http://www.normattiva.it/eli/stato/DECRETO_DEL_PRESIDENTE_DELLA_REPUBBLICA/1981/05/21/408",
                "id": "art_1_law_764_081U0408_1981-08-01.json",
                "article_number": "1",
                "article_text": [
                    "N. 408.  Decreto  del Presidente della Repubblica 21 maggio 1981, col\n  quale,  sulla proposta del Ministro dell'industria, del commercio e\n  dell'artigianato,  viene  riconosciuta la personalita' giuridica ed\n  approvato  lo  statuto  dell'associazione \"Prometeia - Associazione\n  per le previsioni econometriche\", in Bologna.\n\nVisto, il Guardasigilli: DARIDA\n  Registrato alla Corte dei conti, addi' 16 luglio 1981\n  Registro n. 7 Industria, foglio n. 254"
                ]
            }
        ]
    },
    {
        "unit_id": "unit_17",
        "token_input": "KAAJMYWFIC",
        "token_output": "IETHVJXCHY",
        "documents": [
            {
                "filename": "law_167_092G0447_1992-10-24.json",
                "title": "DECRETO DEL PRESIDENTE DELLA REPUBBLICA 7 agosto 1992, n. 417",
                "subject": "Regolamento di amministrazione e di contabilita' dell'Amministrazione della pubblica sicurezza.",
                "type": "decreto.del.presidente.della.repubblica",
                "number": "417",
                "year": "1992",
                "editorial_code": "092G0447",
                "gazette_reference": "(GU n.251 del 24-10-1992 - Suppl. Ordinario n. 115)",
                "publication_date": "1992-08-7",
                "gazette_date": "1992-10-24",
                "valid_from": "1992-11-08",
                "last_updated": "",
                "link_gazette": "http://www.gazzettaufficiale.it/eli/gu/1992/10/24/251/so/115/sg/pdf",
                "link_urn_nir": "http://www.normattiva.it/uri-res/N2Ls?urn:nir:stato:decreto.del.presidente.della.repubblica:1992-08-7;417",
                "link_eli_id": "http://www.normattiva.it/eli/id/1992/10/24/092G0447",
                "link_eli_type": "http://www.normattiva.it/eli/stato/DECRETO_DEL_PRESIDENTE_DELLA_REPUBBLICA/1992/08/7/417",
                "id": "art_34_law_167_092G0447_1992-10-24.json",
                "article_number": "34",
                "article_text": [
                    "                               Art. 34\n          Assenza o cessazione dalle funzioni del cassiere\n1.  Nel  caso di assenza o altro legittimo impedimento del cassiere o\ndi cessazione dalle proprie funzioni, si  procede,  con  l'intervento\ndel   responsabile   del  competente  ufficio  di  amministrazione  e\ncontabilita', o in mancanza,  del  titolare  dell'ufficio  o  reparto\ninteressato alla ricognizione del denaro, dei titoli, dei valori e di\nquant'altro custodito nelle casse, nonche' alla consegna degli stessi\ne delle chiavi, con i relativi duplicati al cassiere subentrante.\n2.  Tali operazioni debbono risultare da una dichiarazione da apporsi\nsui registri di cassa, previa chiusura delle scritture contabili.  La\ndichiarazione   medesima   deve  essere  sottoscritta  da  tutti  gli\nintervenuti. In  caso  di  cessazione  dalle  funzioni,  deve  essere\nredatto apposito verbale di passaggio di consegne."
                ]
            },
            {
                "filename": "law_226_094G0592_1994-09-27.json",
                "title": "DECRETO-LEGGE 27 settembre 1994, n. 551",
                "subject": "Misure urgenti per il rilancio economico ed occupazionale dei lavori pubblici e dell'edilizia privata.",
                "type": "decreto.legge",
                "number": "551",
                "year": "1994",
                "editorial_code": "094G0592",
                "gazette_reference": "(GU n.226 del 27-09-1994)",
                "publication_date": "1994-09-27",
                "gazette_date": "1994-09-27",
                "valid_from": "1994-11-27",
                "last_updated": "(Ultimo aggiornamento all'atto pubblicato il 03/10/1994)",
                "link_gazette": "http://www.gazzettaufficiale.it/eli/gu/1994/09/27/226/sg/pdf",
                "link_urn_nir": "http://www.normattiva.it/uri-res/N2Ls?urn:nir:stato:decreto.legge:1994-09-27;551",
                "link_eli_id": "http://www.normattiva.it/eli/id/1994/09/27/094G0592",
                "link_eli_type": "http://www.normattiva.it/eli/stato/DECRETO_LEGGE/1994/09/27/551",
                "id": "art_6_law_226_094G0592_1994-09-27.json",
                "article_number": "6",
                "article_text": [
                    "                             Art. 6. \n       DECRETO DECADUTO; I SUOI EFFETTI SONO STATI FATTI SALVI \n                  DALLA L. 23 DICEMBRE 1996, N. 662 "
                ]
            },
            {
                "filename": "law_946_086U0193_1986-05-21.json",
                "title": "LEGGE 26 aprile 1986, n. 193",
                "subject": "Modifiche ed integrazioni alle leggi 11 febbraio 1971, n. 50, e 6 marzo 1976, n. 51, sul diporto nautico.",
                "type": "legge",
                "number": "193",
                "year": "1986",
                "editorial_code": "086U0193",
                "gazette_reference": "(GU n.116 del 21-05-1986)",
                "publication_date": "1986-04-26",
                "gazette_date": "1986-05-21",
                "valid_from": "1986-06-05",
                "last_updated": "(Ultimo aggiornamento all'atto pubblicato il 31/08/2005)",
                "link_gazette": "http://www.gazzettaufficiale.it/eli/gu/1986/05/21/116/sg/pdf",
                "link_urn_nir": "http://www.normattiva.it/uri-res/N2Ls?urn:nir:stato:legge:1986-04-26;193",
                "link_eli_id": "http://www.normattiva.it/eli/id/1986/05/21/086U0193",
                "link_eli_type": "http://www.normattiva.it/eli/stato/LEGGE/1986/04/26/193",
                "id": "art_3_law_946_086U0193_1986-05-21.json",
                "article_number": "3",
                "article_text": [
                    "                               Art. 3.\n\n  L'articolo  4  della legge 11 febbraio 1971, n. 50, come modificato\ndalla  legge  6  marzo 1976, n. 51, e l'articolo 217 del codice della\nnavigazione sono abrogati."
                ]
            },
            {
                "filename": "law_119_091G0370_1991-10-31.json",
                "title": "LEGGE 15 ottobre 1991, n. 344",
                "subject": "Provvedimenti in favore dei profughi italiani.",
                "type": "legge",
                "number": "344",
                "year": "1991",
                "editorial_code": "091G0370",
                "gazette_reference": "(GU n.256 del 31-10-1991)",
                "publication_date": "1991-10-15",
                "gazette_date": "1991-10-31",
                "valid_from": "1991-11-15",
                "last_updated": "(Ultimo aggiornamento all'atto pubblicato il 27/12/2003)",
                "link_gazette": "http://www.gazzettaufficiale.it/eli/gu/1991/10/31/256/sg/pdf",
                "link_urn_nir": "http://www.normattiva.it/uri-res/N2Ls?urn:nir:stato:legge:1991-10-15;344",
                "link_eli_id": "http://www.normattiva.it/eli/id/1991/10/31/091G0370",
                "link_eli_type": "http://www.normattiva.it/eli/stato/LEGGE/1991/10/15/344",
                "id": "art_7_law_119_091G0370_1991-10-31.json",
                "article_number": "7",
                "article_text": [
                    "                               Art. 7.\n                           Borse di studio\n 1.  Una  aliquota  del  5  per  cento  dei  premi, borse di studio e\nsussidi, previsti dall'articolo 1, primo  comma,  lettera  a),  della\nlegge  11  aprile  1955,  n. 288, come sostituito dall'articolo unico\ndella legge 12 marzo 1977,  n.  87,  e'  concessa  con  priorita'  ai\nprofughi di cui alla presente legge."
                ]
            },
            {
                "filename": "law_554_088G0044_1988-02-29.json",
                "title": "DECRETO DEL PRESIDENTE DELLA REPUBBLICA 28 gennaio 1988, n. 43",
                "subject": "Istituzione del Servizio di riscossione dei tributi e di altre entrate dello Stato e di altri enti pubblici, ai sensi dell'art. 1, comma 1, della legge 4 ottobre 1986, n. 657.",
                "type": "decreto.del.presidente.della.repubblica",
                "number": "43",
                "year": "1988",
                "editorial_code": "088G0044",
                "gazette_reference": "(GU n.49 del 29-02-1988 - Suppl. Ordinario n. 12)",
                "publication_date": "1988-01-28",
                "gazette_date": "1988-02-29",
                "valid_from": "1999-07-01",
                "last_updated": "(Ultimo aggiornamento all'atto pubblicato il 27/04/1999)",
                "link_gazette": "http://www.gazzettaufficiale.it/eli/gu/1988/02/29/49/so/12/sg/pdf",
                "link_urn_nir": "http://www.normattiva.it/uri-res/N2Ls?urn:nir:stato:decreto.del.presidente.della.repubblica:1988-01-28;43",
                "link_eli_id": "http://www.normattiva.it/eli/id/1988/02/29/088G0044",
                "link_eli_type": "http://www.normattiva.it/eli/stato/DECRETO_DEL_PRESIDENTE_DELLA_REPUBBLICA/1988/01/28/43",
                "id": "art_32_law_554_088G0044_1988-02-29.json",
                "article_number": "32",
                "article_text": [
                    "                               Art. 32 \n                          Obblighi generali \n \n  1. Il concessionario e'  tenuto  ad  osservare  oltre  a  tutte  le\ndisposizioni del presente decreto, del decreto del  Presidente  della\nRepubblica 29 settembre 1973, n.  602,  e  del  disciplinare  di  cui\nall'articolo  9,  comma  1,  le  istruzioni  impartite  dal  servizio\ncentrale per assicurare la regolarita' della gestione. \n  2. Il numero, l'ubicazione e le modalita'  di  funzionamento  degli\nsportelli   di   riscossione,   nonche'    particolari    limitazioni\ndell'apertura degli sportelli, saranno stabilite nel disciplinare. \n  3. COMMA ABROGATO DAL D.LGS. 22 FEBBRAIO 1999, N. 37. \n  4. Il concessionario deve prestare la cauzione nelle  forme  e  nei\ntempi stabiliti dagli articoli 46 e seguenti. \n  5. A richiesta degli  enti  locali  interessati  il  concessionario\nassume il servizio di tesoreria degli enti  stessi,  comprendente  le\nentrate diverse da quelle di cui  all'articolo  2,  comma  1,  ed  il\npagamento delle spese,  nonche'  le  altre  incombenze  demandate  al\ntesoriere da norme legislative e regolamentari. Assumono, altresi' la\nriscossione di entrate spettanti ad enti  autorizzati  per  legge  ad\navvalersi degli esattori delle imposte dirette  in  base  alle  leggi\nvigenti alla data di entrata in vigore della legge 4 ottobre 1986, n.\n657. (16) \n  6. Ai fini della riscossione e dei versamenti agli enti destinatari\nla giornata di sabato e' considerata festiva a tutti gli  effetti  di\nlegge. ((19)) \n    \n-------------\n\n    \nAGGIORNAMENTO (16) \n  La L. 15 maggio 1997, n. 127 ha disposto (con l'art.  9,  comma  6)\nche \"Sono abrogati [.] il comma 5 dell'articolo 32  del  decreto  del\nPresidente della Repubblica 28 gennaio 1988, n. 43,  nella  parte  in\ncui consente l'affidamento senza gara del servizio  di  tesoreria  al\nconcessionario del servizio di riscossione\". \n    \n-------------\n\n    \nAGGIORNAMENTO (19) \n  Il D.Lgs. 13 aprile 1999, n. 112 ha disposto (con l'art. 68,  comma\n1) che \"Salvo quanto previsto dagli articoli 58 e 59, e' abrogato  il\ndecreto del Presidente della Repubblica 28 gennaio 1988, n. 43.  Tale\nabrogazione non opera limitatamente al rinvio contenuto nell'articolo\n4, comma 1, ultimo periodo, del decreto legislativo 9 luglio 1997, n.\n237\". "
                ]
            },
            {
                "filename": "law_485_092G0139_1992-02-15.json",
                "title": "DECRETO LEGISLATIVO 27 gennaio 1992, n. 99",
                "subject": "Attuazione della direttiva n. 86/278/CEE concernente la protezione dell'ambiente, in particolare del suolo, nell'utilizzazione dei fanghi di depurazione in agricoltura.",
                "type": "decreto.legislativo",
                "number": "99",
                "year": "1992",
                "editorial_code": "092G0139",
                "gazette_reference": "(GU n.38 del 15-02-1992 - Suppl. Ordinario n. 28)",
                "publication_date": "1992-01-27",
                "gazette_date": "1992-02-15",
                "valid_from": "1992-03-01",
                "last_updated": "(Ultimo aggiornamento all'atto pubblicato il 10/12/2010)",
                "link_gazette": "http://www.gazzettaufficiale.it/eli/gu/1992/02/15/38/so/28/sg/pdf",
                "link_urn_nir": "http://www.normattiva.it/uri-res/N2Ls?urn:nir:stato:decreto.legislativo:1992-01-27;99",
                "link_eli_id": "http://www.normattiva.it/eli/id/1992/02/15/092G0139",
                "link_eli_type": "http://www.normattiva.it/eli/stato/DECRETO_LEGISLATIVO/1992/01/27/99",
                "id": "art_12_law_485_092G0139_1992-02-15.json",
                "article_number": "12",
                "article_text": [
                    "                              Art. 12.\n                           Norme tecniche\n 1. Raccolta dei fanghi.\n  La  raccolta  dei  fanghi  presso  gli impianti di depurazione deve\navvenire con mezzi meccanici idonei e nel rispetto  delle  condizioni\nigieniche  per  gli  addetti  a  tali operazioni e per l'ambiente. In\nparticolare durante la  fase  di  raccolta  deve  essere  evitata  la\nformazione di aerosoli.\n2. Trasporto dei fanghi.\n  Il  trasporto dei fanghi deve essere effettuato con mezzi idonei ad\nevitare ogni dispersione durante il trasferimento ed a  garantire  la\nmassima sicurezza dal punto di vista igienico-sanitario.\n  I   mezzi   utilizzati  per  il  trasporto  dei  fanghi  liquidi  o\ndisidratati non  possono  essere  utilizzati  per  il  trasporto  dei\nprodotti  destinati  all'alimentazione umana e animale o di materiali\nche possono venire a contatto in maniera diretta o indiretta con  gli\nalimenti medesimi.\n  In  caso  di  trasporto  di  altri  rifiuti  i  mezzi devono essere\nbonificati al fine del successivo trasporto dei fanghi.\n3.  Stoccaggio  dei  fanghi  negli  impianti  di  produzione  e/o  di\ntrattamento e/o stoccaggio per conto terzi.\n  Devono  essere  previsti adeguati sistemi di stoccaggio predisposti\nin relazione allo stato fisico  dei  fanghi  prodotti  ed  alla  loro\nutilizzazione.  I  depositi  devono  essere  realizzati  in  modo  da\nfacilitare le operazioni di caricamento dei mezzi di trasporto.\n4. Condizionamento dei fanghi.\n  Si intende per condizionamento dei fanghi qualsiasi operazione atta\na  modificare  le   caratteristiche   fisico-chimico-biologiche   dei\nmedesimi  in  modo tale da facilitarne l'utilizzazione in agricoltura\ncon esclusione delle operazioni proprie  del  ciclo  fanghi  eseguiti\npresso gli impianti di depurazione.\n  E'   considerata   come   condizionamento   anche  l'operazione  di\nmiscelazione. I fanghi possono essere miscelati con altri  fanghi  di\ncui  all'art. 2 e/o con altri rifiuti a matrice organica naturale o a\ncomposizione analoga a quella dei  fertilizzanti  disciplinati  dalla\nlegge  748/84, secondo criteri che saranno valutati in sede di proce-\ndure per il rilascio della specifica autorizzazione regionale di  cui\nal  precedente articolo 8. In caso di miscelazione e' obbligatoria la\nprocedura di cui all'art. 11 per ciascun componente la miscela.\n  In ogni caso, quando i fanghi vengono sottoposti a  condizionamento\nl'autorizzazione   stabilisce   specifici   criteri   e   limiti   di\naccettabilita' dei materiali  additivati  ai  fanghi  in  entrata  al\ntrattamento,  tali  da assicurare la qualita' dei prodotti finali per\nl'utilizzazione agricola, fatta salva la sicurezza per  l'ambiente  e\nper l'uomo.\n5. Stoccaggio dei fanghi presso l'utilizzatore finale.\n  Per  lo stoccaggio dei fanghi presso l'utilizzatore finale, qualora\nl'azienda utilizzatrice intenda dotarsi di  un  proprio  impianto  di\nstoccaggio,  questo  deve  avere capacita' e dimensioni proporzionate\nsia agli ordinamenti colturali prevalenti, sia  alle  caratteristiche\ndei fanghi:\n   per  i  fanghi  liquidi  o  disidratati  deve essere realizzato un\nbacino impermeabile opportunamente recintato;\n   per  i  fanghi  essiccati,  se  questi  non  vengono  forniti   in\ncontenitori,   e'  necessario  prevedere  opportune  precauzioni  per\nevitarne la dispersione.\n6. Applicazione dei fanghi.\n  I  fanghi  devono  essere  applicati  seguendo  le  buone  pratiche\nagricole;   durante   l'applicazione  o  subito  dopo  va  effettuato\nl'interramento mediante opportuna lavorazione del terreno. Durante le\nfasi di applicazione dei fanghi sul suolo,  deve  essere  evitata  la\ndiffusione di aerosoli, il ruscellamento, il ristagno ed il trasporto\ndel fango al di fuori dell'area interessata alla somministrazione.\n  In  ogni caso l'applicazione dei fanghi deve essere sospesa durante\ne subito dopo abbondanti precipitazioni, nonche' su superfici  gelate\no coperte da coltre nevosa."
                ]
            },
            {
                "filename": "law_131_099G0504_1999-11-19.json",
                "title": "LEGGE 28 ottobre 1999, n. 429",
                "subject": "Ratifica ed esecuzione dell'accordo tra il Governo della Repubblica italiana ed il Governo del Regno Hascemita di Giordania sulla promozione e la protezione degli investimenti, fatto ad Amman il 21 luglio 1996.",
                "type": "legge",
                "number": "429",
                "year": "1999",
                "editorial_code": "099G0504",
                "gazette_reference": "(GU n.272 del 19-11-1999 - Suppl. Ordinario n. 202)",
                "publication_date": "1999-10-28",
                "gazette_date": "1999-11-19",
                "valid_from": "1999-11-20",
                "last_updated": "",
                "link_gazette": "http://www.gazzettaufficiale.it/eli/gu/1999/11/19/272/so/202/sg/pdf",
                "link_urn_nir": "http://www.normattiva.it/uri-res/N2Ls?urn:nir:stato:legge:1999-10-28;429",
                "link_eli_id": "http://www.normattiva.it/eli/id/1999/11/19/099G0504",
                "link_eli_type": "http://www.normattiva.it/eli/stato/LEGGE/1999/10/28/429",
                "id": "art_1_law_131_099G0504_1999-11-19.json",
                "article_number": "1",
                "article_text": [
                    "La Camera dei deputati ed il Senato della Repubblica hanno approvato;\n\n                   IL PRESIDENTE DELLA REPUBBLICA\n                              PROMULGA\n\nla seguente legge:\n\n\n                               Art. 1.\n\n   1.  Il  Presidente  della  Repubblica  e' autorizzato a ratificare\nl'accordo  tra il Governo della Repubblica italiana ed il Governo del\nRegno  Hascemita  di Giordania sulla promozione e la protezione degli\ninvestimenti, fatto ad Amman il 21 luglio 1996."
                ]
            },
            {
                "filename": "law_478_099G0137_1999-04-01.json",
                "title": "DECRETO DEL PRESIDENTE DELLA REPUBBLICA 15 febbraio 1999, n. 82",
                "subject": "Regolamento di servizio del Corpo di polizia penitenziaria.",
                "type": "decreto.del.presidente.della.repubblica",
                "number": "82",
                "year": "1999",
                "editorial_code": "099G0137",
                "gazette_reference": "(GU n.76 del 01-04-1999 - Suppl. Ordinario n. 63)",
                "publication_date": "1999-02-15",
                "gazette_date": "1999-04-01",
                "valid_from": "1999-04-16",
                "last_updated": "(Ultimo aggiornamento all'atto pubblicato il 07/11/2006)",
                "link_gazette": "http://www.gazzettaufficiale.it/eli/gu/1999/04/01/76/so/63/sg/pdf",
                "link_urn_nir": "http://www.normattiva.it/uri-res/N2Ls?urn:nir:stato:decreto.del.presidente.della.repubblica:1999-02-15;82",
                "link_eli_id": "http://www.normattiva.it/eli/id/1999/04/01/099G0137",
                "link_eli_type": "http://www.normattiva.it/eli/stato/DECRETO_DEL_PRESIDENTE_DELLA_REPUBBLICA/1999/02/15/82",
                "id": "art_2_law_478_099G0137_1999-04-01.json",
                "article_number": "2",
                "article_text": [
                    "                               Art. 2\n                             Giuramento\n  1.  All'atto dea nomina in ruolo, il personale del Corpo di polizia\npenitenziaria  presta  giuramento,  dinanzi  al  direttore   generale\ndell'Amministrazione  penitenziaria,  o  ad  un  suo  delegato,  o al\nprovveditore regionale,  o  al  direttore  dell'istituto  o  servizio\npenitenziario,  o  della  scuola o dell'istituto di istruzione e alla\npresenza di due testimoni, secondo la formula prevista  dall'articolo\n11,  secondo comma, del testo unico delle disposizioni concernenti lo\nstatuto degli impiegati civili dello Stato, approvato con decreto del\nPresidente della Repubblica 10 gennaio 1957, n. 3.\n  2. Nell'ambito delle scuole e  degli  istituti  di  istruzione,  il\ngiuramento  puo'  essere  prestato  in  forma  collettiva, davanti al\ndirettore. Questi pronuncia la formula  di  cui  al  comma  1  e  gli\nallievi rispondono all'unisono: \"Lo giuro\".\n  3.  Il  giuramento  in  forma collettiva e' prestato davanti ad una\nrappresentanza di personale gia' in servizio.\n  4. Del giuramento, in qualunque forma prestato, e' redatto processo\nverbale.\n  5. Nel caso di passaggio ad altro ruolo, il  giuramento  non  viene\nprestato nuovamente."
                ]
            },
            {
                "filename": "law_150_088G0492_1988-10-24.json",
                "title": "DECRETO DEL PRESIDENTE DELLA REPUBBLICA 22 settembre 1988, n. 447",
                "subject": "Approvazione del codice di procedura penale.",
                "type": "decreto.del.presidente.della.repubblica",
                "number": "447",
                "year": "1988",
                "editorial_code": "088G0492",
                "gazette_reference": "(GU n.250 del 24-10-1988 - Suppl. Ordinario n. 92)",
                "publication_date": "1988-09-22",
                "gazette_date": "1988-10-24",
                "valid_from": "1989-10-24",
                "last_updated": "(Ultimo aggiornamento all'atto pubblicato il 21/10/2020)",
                "link_gazette": "http://www.gazzettaufficiale.it/eli/gu/1988/10/24/250/so/92/sg/pdf",
                "link_urn_nir": "http://www.normattiva.it/uri-res/N2Ls?urn:nir:stato:decreto.del.presidente.della.repubblica:1988-09-22;447",
                "link_eli_id": "http://www.normattiva.it/eli/id/1988/10/24/088G0492",
                "link_eli_type": "http://www.normattiva.it/eli/stato/DECRETO_DEL_PRESIDENTE_DELLA_REPUBBLICA/1988/09/22/447",
                "id": "art_132_law_150_088G0492_1988-10-24.json",
                "article_number": "132",
                "article_text": [
                    "                              Art. 132. \n               Accompagnamento coattivo dell'imputato \n  1. L'accompagnamento coattivo e' disposto, nei casi previsti  dalla\nlegge, con decreto motivato,  con  il  quale  il  giudice  ordina  di\ncondurre l'imputato alla sua presenza, se occorre anche con la forza. \n  2. La persona  sottoposta  ad  accompagnamento  coattivo  non  puo'\nessere tenuta a disposizione oltre il compimento dell'atto previsto e\ndi quelli conseguenziali per i quali perduri la necessita' della  sua\npresenza. In ogni caso la persona non puo' essere trattenuta oltre le\nventiquattro ore. "
                ]
            },
            {
                "filename": "law_895_082U0307_1982-06-05.json",
                "title": "DECRETO DEL PRESIDENTE DELLA REPUBBLICA 23 febbraio 1982, n. 307",
                "subject": "Regolamento di esecuzione della legge 4 luglio 1970, n. 507, sulla tutela delle denominazioni di origine e tipica del prosciutto di San Daniele.",
                "type": "decreto.del.presidente.della.repubblica",
                "number": "307",
                "year": "1982",
                "editorial_code": "082U0307",
                "gazette_reference": "(GU n.153 del 05-06-1982)",
                "publication_date": "1982-02-23",
                "gazette_date": "1982-06-05",
                "valid_from": "1982-12-05",
                "last_updated": "",
                "link_gazette": "http://www.gazzettaufficiale.it/eli/gu/1982/06/05/153/sg/pdf",
                "link_urn_nir": "http://www.normattiva.it/uri-res/N2Ls?urn:nir:stato:decreto.del.presidente.della.repubblica:1982-02-23;307",
                "link_eli_id": "http://www.normattiva.it/eli/id/1982/06/05/082U0307",
                "link_eli_type": "http://www.normattiva.it/eli/stato/DECRETO_DEL_PRESIDENTE_DELLA_REPUBBLICA/1982/02/23/307",
                "id": "art_26_law_895_082U0307_1982-06-05.json",
                "article_number": "26",
                "article_text": [
                    "                              Art. 26.\n\n  Il  presente  regolamento  entra  in  vigore  sei  mesi dopo la sua\npubblicazione  nella Gazzetta Ufficiale della Repubblica italiana, ad\neccezione degli articoli 24, primo comma, e 25, che entrano in vigore\nil giorno successivo alla pubblicazione nella Gazzetta Ufficiale.\n\n  Il  presente decreto, munito del sigillo dello Stato, sara' inserto\nnella  Raccolta  ufficiale delle leggi e dei decreti della Repubblica\nitaliana. E' fatto obbligo a chiunque spetti di osservarlo e di farlo\nosservare.\n\n  Dato a Roma, addi' 23 febbraio 1982\n\n                               PERTINI\n\n                                                SPADOLINI - MARCORA -\n                                               BARTOLOMEI - ALTISSIMO\n\nVisto, il Guardasigilli: DARIDA\n  Registrato alla Corte dei conti, addi' 27 maggio 1982\n  Atti di Governo, registro n. 40, foglio n. 1"
                ]
            }
        ]
    },
    {
        "unit_id": "unit_18",
        "token_input": "SSJVPEOMXV",
        "token_output": "QNALDASKDS",
        "documents": [
            {
                "filename": "law_229_090G0291_1990-08-11.json",
                "title": "LEGGE 7 agosto 1990, n. 232",
                "subject": "Copertura per le spese derivanti dall'applicazione dell'accordo per il triennio 1988-1990 relativo al personale della Polizia di Stato ed estensione agli altri Corpi di polizia.",
                "type": "legge",
                "number": "232",
                "year": "1990",
                "editorial_code": "090G0291",
                "gazette_reference": "(GU n.187 del 11-08-1990 - Suppl. Ordinario n. 55)",
                "publication_date": "1990-08-7",
                "gazette_date": "1990-08-11",
                "valid_from": "1990-08-12",
                "last_updated": "(Ultimo aggiornamento all'atto pubblicato il 16/08/2013)",
                "link_gazette": "http://www.gazzettaufficiale.it/eli/gu/1990/08/11/187/so/55/sg/pdf",
                "link_urn_nir": "http://www.normattiva.it/uri-res/N2Ls?urn:nir:stato:legge:1990-08-7;232",
                "link_eli_id": "http://www.normattiva.it/eli/id/1990/08/11/090G0291",
                "link_eli_type": "http://www.normattiva.it/eli/stato/LEGGE/1990/08/7/232",
                "id": "art_4_law_229_090G0291_1990-08-11.json",
                "article_number": "4",
                "article_text": [
                    "                                Art. 4 \n                 (Selettore di centro psicotecnico). \n1. Tutti i posti  resisi  eventualmente  disponibili  nei  ruoli  dei\ndirettori   tecnici,   selettori   di   centro   psicotecnico-settore\narruolamento e dei revisori infermieri biologi,  dopo  l'applicazione\ndell'articolo 3, sono riservati a coloro che, alla data di entrata in\nvigore della presente legge, svolgono, rispettivamente  incarichi  di\npsicologo o perito selettore ai sensi dell'articolo 3 della legge  19\naprile 1985, n. 150, e dell'articolo 6 della legge 1 aprile 1981,  n.\n121 e incarichi ai sensi dell'articolo 5, comma 8, del decreto  legge\n21 settembre 1987, n. 387 convertito, con modificazioni  della  legge\n20 novembre 1987, n. 472, prescindendo  dal  limite  di  eta'  e  dal\npossesso del titolo di studio specifico richiesto per l'accesso  alle\nqualifiche iniziali degli stessi ruoli. \n2.  Il  termine  per  la  presentazione  delle   domande,   i   posti\ndisponibili, le modalita' di espletamento dei  concorsi  e  l'oggetto\ndelle prove pratiche saranno indicati nel bando di concorso. \n3. Le modalita' di svolgimento delle prove pratiche, la  composizione\ne la nomina della  commissione  esaminatrice  sono  disciplinate  dal\ndecreto del Presidente  della  Repubblica  6  ottobre  1987,  n.  490\nemanato ai sensi dell'articolo 50  secondo  comma,  del  decreto  del\nPresidente della Repubblica, 24 aprile 1982, n. 337. \n4. I vincitori dei concorsi sono inquadrati nella qualifica  iniziale\ndel ruolo per il quale hanno  concorso  dalla  data  del  decreto  di\nnomina. "
                ]
            },
            {
                "filename": "law_480_094G0291_1994-05-19.json",
                "title": "DECRETO LEGISLATIVO 16 aprile 1994, n. 297",
                "subject": "Approvazione del testo unico delle disposizioni legislative vigenti in materia di istruzione, relative alle scuole di ogni ordine e grado.",
                "type": "decreto.legislativo",
                "number": "297",
                "year": "1994",
                "editorial_code": "094G0291",
                "gazette_reference": "(GU n.115 del 19-05-1994 - Suppl. Ordinario n. 79)",
                "publication_date": "1994-04-16",
                "gazette_date": "1994-05-19",
                "valid_from": "1994-06-03",
                "last_updated": "(Ultimo aggiornamento all'atto pubblicato il 31/12/2020)",
                "link_gazette": "http://www.gazzettaufficiale.it/eli/gu/1994/05/19/115/so/79/sg/pdf",
                "link_urn_nir": "http://www.normattiva.it/uri-res/N2Ls?urn:nir:stato:decreto.legislativo:1994-04-16;297",
                "link_eli_id": "http://www.normattiva.it/eli/id/1994/05/19/094G0291",
                "link_eli_type": "http://www.normattiva.it/eli/stato/DECRETO_LEGISLATIVO/1994/04/16/297",
                "id": "art_103_law_480_094G0291_1994-05-19.json",
                "article_number": "103",
                "article_text": [
                    "                              Art. 103. \n               Direzione della scuola materna statale \n \n  1. Fino a quando non sia costituito il ruolo  dei  direttori  della\nscuola  materna,  la  direzione  delle  scuole  materne  statali   e'\naffidata, nell'ambito del proprio  circolo,  al  direttore  didattico\ndella scuola elementare. "
                ]
            },
            {
                "filename": "law_339_088G0328_1988-07-12.json",
                "title": "DECRETO-LEGGE 11 luglio 1988, n. 258",
                "subject": "Modifiche alla legge 1 marzo 1986, n. 64, in attuazione della decisione della commissione CEE/88/318 del 2 marzo 1988.",
                "type": "decreto.legge",
                "number": "258",
                "year": "1988",
                "editorial_code": "088G0328",
                "gazette_reference": "(GU n.162 del 12-07-1988)",
                "publication_date": "1988-07-11",
                "gazette_date": "1988-07-12",
                "valid_from": "1988-07-13",
                "last_updated": "(Ultimo aggiornamento all'atto pubblicato il 20/05/1994)",
                "link_gazette": "http://www.gazzettaufficiale.it/eli/gu/1988/07/12/162/sg/pdf",
                "link_urn_nir": "http://www.normattiva.it/uri-res/N2Ls?urn:nir:stato:decreto.legge:1988-07-11;258",
                "link_eli_id": "http://www.normattiva.it/eli/id/1988/07/12/088G0328",
                "link_eli_type": "http://www.normattiva.it/eli/stato/DECRETO_LEGGE/1988/07/11/258",
                "id": "art_1_law_339_088G0328_1988-07-12.json",
                "article_number": "1",
                "article_text": [
                    "                   IL PRESIDENTE DELLA REPUBBLICA \n  Visti gli articoli 77 e 87 della Costituzione; \n  Ritenuta  la  straordinaria  necessita'  ed  urgenza   di   emanare\ndisposizioni intese a recepire, nel nostro ordinamento  giuridico,  i\ncontenuti della decisione della commissione CEE/88/318  del  2  marzo\n1988 sul regime di aiuti per il Mezzogiorno; \n  Vista la deliberazione del Consiglio dei Ministri,  adottata  nella\nriunione dell'8 luglio 1988; \n  Sulla proposta del Presidente del  Consiglio  dei  Ministri  e  del\nMinistro per gli interventi straordinari nel Mezzogiorno, di concerto\ncon  i  Ministri  delle  finanze,  del  tesoro,  dell'industria,  del\ncommercio e dell'artigianato e per le politiche comunitarie; \n                                EMANA \n                        il seguente decreto: \n                               Art. 1. \n  1.  Con  il  presente  decreto  la  decisione   della   commissione\nCEE/88/318 del 2 marzo 1988, relativa alla legge 1  marzo  1986,  n.\n64,  sulla  disciplina  organica  dell'intervento  straordinario  nel\nMezzogiorno, riceve piena ed intera esecuzione. "
                ]
            },
            {
                "filename": "law_264_099G0373_1999-08-26.json",
                "title": "DECRETO LEGISLATIVO 23 luglio 1999, n. 296",
                "subject": "Istituzione dell'Istituto nazionale di astrofisica - INAF, a norma dell'art. 11 della legge 15 marzo 1997, n. 59.",
                "type": "decreto.legislativo",
                "number": "296",
                "year": "1999",
                "editorial_code": "099G0373",
                "gazette_reference": "(GU n.200 del 26-08-1999)",
                "publication_date": "1999-07-23",
                "gazette_date": "1999-08-26",
                "valid_from": "2003-06-20",
                "last_updated": "(Ultimo aggiornamento all'atto pubblicato il 19/06/2003)",
                "link_gazette": "http://www.gazzettaufficiale.it/eli/gu/1999/08/26/200/sg/pdf",
                "link_urn_nir": "http://www.normattiva.it/uri-res/N2Ls?urn:nir:stato:decreto.legislativo:1999-07-23;296",
                "link_eli_id": "http://www.normattiva.it/eli/id/1999/08/26/099G0373",
                "link_eli_type": "http://www.normattiva.it/eli/stato/DECRETO_LEGISLATIVO/1999/07/23/296",
                "id": "art_14_law_264_099G0373_1999-08-26.json",
                "article_number": "14",
                "article_text": [
                    "                               Art. 14\n       ((ARTICOLO ABROGATO DAL D.LGS. 4 GIUGNO 2003, N. 138))\n\n  Il presente decreto, munito del sigillo dello Stato, sara' inserito\nnella  Raccolta  ufficiale  degli  atti  normativi  della  Repubblica\nitaliana. E' fatto obbligo a chiunque spetti di osservarlo e di farlo\nosservare.\n   Dato a Roma, addi' 23 luglio 1999\n                               CIAMPI\n                                  D'Alema,  Presidente  del Consiglio\n                                  dei Ministri\n                                  Zecchino, Ministro dell'universita'\n                                  e   della   ricerca  scientifica  e\n                                  tecnologica\n                                  Piazza,  Ministro  per  la funzione\n                                  pubblica\n Visto, il Guardasigilli: Diliberto"
                ]
            },
            {
                "filename": "law_353_092G0260_1992-03-19.json",
                "title": "DECRETO DEL PRESIDENTE DELLA REPUBBLICA 1 marzo 1992, n. 231",
                "subject": "Regolamento di attuazione delle direttive 83/91/CEE, 88/289/CEE e 91/266/CEE relative a problemi sanitari e di polizia sanitaria in materia di importazione di animali, della specie bovina e suina, e di carni fresche in provenienza da Paesi terzi, nonche' di ricerca delle trichine nelle carni fresche di animali domestici della specie suina.",
                "type": "decreto.del.presidente.della.repubblica",
                "number": "231",
                "year": "1992",
                "editorial_code": "092G0260",
                "gazette_reference": "(GU n.66 del 19-03-1992 - Suppl. Ordinario n. 56)",
                "publication_date": "1992-03-1",
                "gazette_date": "1992-03-19",
                "valid_from": "2007-04-26",
                "last_updated": "(Ultimo aggiornamento all'atto pubblicato il 11/04/2007)",
                "link_gazette": "http://www.gazzettaufficiale.it/eli/gu/1992/03/19/66/so/56/sg/pdf",
                "link_urn_nir": "http://www.normattiva.it/uri-res/N2Ls?urn:nir:stato:decreto.del.presidente.della.repubblica:1992-03-1;231",
                "link_eli_id": "http://www.normattiva.it/eli/id/1992/03/19/092G0260",
                "link_eli_type": "http://www.normattiva.it/eli/stato/DECRETO_DEL_PRESIDENTE_DELLA_REPUBBLICA/1992/03/1/231",
                "id": "art_20_law_353_092G0260_1992-03-19.json",
                "article_number": "20",
                "article_text": [
                    "                               Art. 20 \n   (( PROVVEDIMENTO ABROGATO DAL D.LGS. 31 GENNAIO 2007, N. 47 )) "
                ]
            },
            {
                "filename": "law_398_099G0240_1999-06-10.json",
                "title": "DECRETO DEL PRESIDENTE DELLA REPUBBLICA 30 aprile 1999, n. 162",
                "subject": "((Regolamento recante norme per l'attuazione della direttiva 2014/33/UE, relativa agli ascensori ed ai componenti di sicurezza degli ascensori, nonche' per l'esercizio degli ascensori)).",
                "type": "decreto.del.presidente.della.repubblica",
                "number": "162",
                "year": "1999",
                "editorial_code": "099G0240",
                "gazette_reference": "(GU n.134 del 10-06-1999)",
                "publication_date": "1999-04-30",
                "gazette_date": "1999-06-10",
                "valid_from": "2017-03-16",
                "last_updated": "(Ultimo aggiornamento all'atto pubblicato il 27/11/2017)",
                "link_gazette": "http://www.gazzettaufficiale.it/eli/gu/1999/06/10/134/sg/pdf",
                "link_urn_nir": "http://www.normattiva.it/uri-res/N2Ls?urn:nir:stato:decreto.del.presidente.della.repubblica:1999-04-30;162",
                "link_eli_id": "http://www.normattiva.it/eli/id/1999/06/10/099G0240",
                "link_eli_type": "http://www.normattiva.it/eli/stato/DECRETO_DEL_PRESIDENTE_DELLA_REPUBBLICA/1999/04/30/162",
                "id": "art_17_law_398_099G0240_1999-06-10.json",
                "article_number": "17",
                "article_text": [
                    "                              Art. 17.\n                            D i v i e t i\n\n  1.  E'  vietato  l'uso  ((degli ascensori, dei montacarichi e degli\napparecchi  di sollevamento rispondenti alla definizione di ascensore\nla  cui  velocita'  di spostamento non supera 0.15 m/s)) ai minori di\nanni 12, non accompagnati da persone di eta' piu' elevata.\n  2.  E',  inoltre, vietato l'uso degli ascensori a cabine multiple a\nmoto  continuo  ai  ciechi,  alla  persone  con  abolita  o diminuita\nfunzionalita'  degli  arti  ed  ai  minori  di  dodici anni, anche se\naccompagnati.\n  3.  Resta  fermo  il  divieto  di occupazione dei fanciulli e delle\ndonne minorenni in lavori di manovra degli ascensori, montacarichi ed\napparecchi  di sollevamento a trazione meccanica, ai sensi della voce\n69, della tabella A annessa al regio decreto 7 agosto 1936, n. 1720."
                ]
            },
            {
                "filename": "law_318_092G0300_1992-04-22.json",
                "title": "DECRETO LEGISLATIVO 16 marzo 1992, n. 266",
                "subject": "Norme di attuazione dello statuto speciale per il Trentino-Alto Adige concernenti il rapporto tra gli atti legislativi statali e leggi regionali e provinciali, nonche' la potesta' statale di indirizzo e coordinamento.",
                "type": "decreto.legislativo",
                "number": "266",
                "year": "1992",
                "editorial_code": "092G0300",
                "gazette_reference": "(GU n.94 del 22-04-1992 - Suppl. Ordinario n. 69)",
                "publication_date": "1992-03-16",
                "gazette_date": "1992-04-22",
                "valid_from": "1992-05-07",
                "last_updated": "(Ultimo aggiornamento all'atto pubblicato il 18/05/1992)",
                "link_gazette": "http://www.gazzettaufficiale.it/eli/gu/1992/04/22/94/so/69/sg/pdf",
                "link_urn_nir": "http://www.normattiva.it/uri-res/N2Ls?urn:nir:stato:decreto.legislativo:1992-03-16;266",
                "link_eli_id": "http://www.normattiva.it/eli/id/1992/04/22/092G0300",
                "link_eli_type": "http://www.normattiva.it/eli/stato/DECRETO_LEGISLATIVO/1992/03/16/266",
                "id": "art_4_law_318_092G0300_1992-04-22.json",
                "article_number": "4",
                "article_text": [
                    "                               Art. 4.\n                       Funzioni amministrative\n  1. Nelle materie di competenza propria della regione o delle  prov-\nince  autonome  la  legge  non  puo'  attribuire  agli organi statali\nfunzioni amministrative, comprese quelle  di  vigilanza,  di  polizia\namministrativa  e  di  accertamento di violazioni amministrative, di-\nverse da quelle spettanti allo Stato secondo lo statuto speciale e le\nrelative norme di attuazione, salvi gli interventi richiesti ai sensi\ndell'art. 22 dello statuto medesimo.\n  2. Quando nell'esercizio delle proprie funzioni gli organi o uffici\nstatali e quelli regionali o provinciali  riscontrino  violazioni  di\nnorme o provvedimenti rispettivamente regionali o provinciali, ovvero\nstatali, ne riferiscono all'autorita' amministrativa competente per i\nprovvedimenti ad essa spettanti.\n  3.  Fermo  restando  quanto disposto dallo statuto speciale e dalle\nrelative norme di attuazione, nelle materie di  cui  al  comma  1  le\namministrazioni   statali,  comprese  quelle  autonome,  e  gli  enti\ndipendenti dallo Stato non  possono  disporre  spese  ne'  concedere,\ndirettamente   o   indirettamente,  finanziamenti  o  contributi  per\nattivita' nell'ambito del territorio regionale o provinciale.\n  Il presente decreto, munito del sigillo dello Stato, sara' inserito\nnella  Raccolta  ufficiale  degli  atti  normativi  della  Repubblica\nitaliana. E' fatto obbligo a chiunque spetti di osservarlo e di farlo\nosservare.\n   Dato a Roma, addi' 16 marzo 1992\n                               COSSIGA\n                                  ANDREOTTI, Presidente del Consiglio\n                                  dei Ministri\n                                  MARTINAZZOLI,   Ministro   per   le\n                                  riforme istituzionali e gli  affari\n                                  regionali\nVisto, il Guardasigilli: MARTELLI\n  Registrato alla Corte dei conti il 21 aprile 1992\n  Atti di Governo, registro n. 85, foglio n. 25, con esclusione degli\narticoli  2  e 3, commi 4, 5, 6 e 7, ai sensi della delibera n. 28/92\ndella sezione di controllo in data 21 aprile 1992.\n  Registrato alla Corte dei conti il 22 aprile 1992\n  Atti di Governo, registro n. 85, foglio n. 27, con riserva ai sensi\ndella delibera delle sezioni riunite n. 84/SR/E del 22 aprile 1992."
                ]
            },
            {
                "filename": "law_458_088G0201_1988-05-05.json",
                "title": "DECRETO-LEGGE 3 maggio 1988, n. 139",
                "subject": "Proroga di due anni dell'elevazione del limite di eta' per il collocamento in congedo dei sottufficiali e dei militari di truppa del Corpo degli agenti di custodia.",
                "type": "decreto.legge",
                "number": "139",
                "year": "1988",
                "editorial_code": "088G0201",
                "gazette_reference": "(GU n.104 del 05-05-1988)",
                "publication_date": "1988-05-3",
                "gazette_date": "1988-05-05",
                "valid_from": "1990-05-19",
                "last_updated": "(Ultimo aggiornamento all'atto pubblicato il 19/05/1990)",
                "link_gazette": "http://www.gazzettaufficiale.it/eli/gu/1988/05/05/104/sg/pdf",
                "link_urn_nir": "http://www.normattiva.it/uri-res/N2Ls?urn:nir:stato:decreto.legge:1988-05-3;139",
                "link_eli_id": "http://www.normattiva.it/eli/id/1988/05/05/088G0201",
                "link_eli_type": "http://www.normattiva.it/eli/stato/DECRETO_LEGGE/1988/05/3/139",
                "id": "art_1_law_458_088G0201_1988-05-05.json",
                "article_number": "1",
                "article_text": [
                    "                   IL PRESIDENTE DELLA REPUBBLICA \n  Visti gli articoli 77 e 87 della Costituzione; \n  Ritenuta la straordinaria necessita' ed urgenza di prorogare di due\nanni il disposto di cui all'articolo 2 del  decreto-legge  28  agosto\n1987, n. 356,  convertito  dalla  legge  27  ottobre  1987,  n.  436,\nriguardante l'elevazione  a  58  anni  del  limite  di  eta'  per  il\ncollocamento in congedo dei sottufficiali e dei  militari  di  truppa\ndel Corpo degli agenti di custodia; \n  Vista la deliberazione del Consiglio dei Ministri,  adottata  nella\nriunione del 29 aprile 1988; \n  Sulla proposta del Presidente del  Consiglio  dei  Ministri  e  del\nMinistro di grazia e giustizia,  di  concerto  con  il  Ministro  del\ntesoro; \n                                EMANA \n                        il seguente decreto: \n                               Art. 1. \n  1. Il termine di cui al comma 4 dell'articolo 2  del  decreto-legge\n28 agosto 1987, n. 356, convertito dalla legge 27  ottobre  1987,  n.\n436, e' prorogato di due anni.((2)) \n--------------- \nAGGIORNAMENTO (2) \n  Il D.L. 18 maggio 1990, n.  118,  convertito  senza  modificazioni,\ndalla L. 13 luglio 1990 n. 190 ha disposto (con l'art.  1,  comma  1)\nche \"Il termine di cui all'articolo  1  del  decreto-legge  3  maggio\n1988, n. 139, convertito dalla legge  20  giugno  1988,  n.  227,  e'\ndifferito di due anni.\" "
                ]
            },
            {
                "filename": "law_1116_080U0149_1980-04-30.json",
                "title": "LEGGE 30 aprile 1980, n. 149",
                "subject": "Bilancio di previsione dello Stato per l'anno finanziario 1980 e bilancio pluriennale per il triennio 1980-82.",
                "type": "legge",
                "number": "149",
                "year": "1980",
                "editorial_code": "080U0149",
                "gazette_reference": "(GU n.117 del 30-04-1980 - Suppl. Ordinario)",
                "publication_date": "1980-04-30",
                "gazette_date": "1980-04-30",
                "valid_from": "1980-05-15",
                "last_updated": "(Ultimo aggiornamento all'atto pubblicato il 21/03/1981)",
                "link_gazette": "http://www.gazzettaufficiale.it/eli/gu/1980/04/30/117/so/0/sg/pdf",
                "link_urn_nir": "http://www.normattiva.it/uri-res/N2Ls?urn:nir:stato:legge:1980-04-30;149",
                "link_eli_id": "http://www.normattiva.it/eli/id/1980/04/30/080U0149",
                "link_eli_type": "http://www.normattiva.it/eli/stato/LEGGE/1980/04/30/149",
                "id": "art_28_law_1116_080U0149_1980-04-30.json",
                "article_number": "28",
                "article_text": [
                    "                              Art. 28.\n\n  Alle occorrenze relative alla liquidazione dell'Opera nazionale per\nla protezione della maternita' e dell'infanzia prevista dall'articolo\n1  della  legge  23  dicembre  1975,  n.  698,  si  provvede  con  le\ndisponibilita'  del  conto  di tesoreria di cui all'articolo 14 della\nlegge  4  dicembre  1956,  n.  1404,  in favore del quale, per l'anno\nfinanziario 1980, e' stabilito l'apporto di lire 10.000.000.000."
                ]
            },
            {
                "filename": "law_13_093G0129_1993-03-25.json",
                "title": "DECRETO 30 dicembre 1992, n. 571",
                "subject": "Regolamento di attuazione della direttiva del Consiglio delle Comunita' europee n. 89/684/CEE del 21 dicembre 1989 riguardante la formazione professionale di taluni conducenti di veicoli che trasportano merci pericolose su strada.",
                "type": "decreto",
                "number": "571",
                "year": "1992",
                "editorial_code": "093G0129",
                "gazette_reference": "(GU n.70 del 25-03-1993)",
                "publication_date": "1992-12-30",
                "gazette_date": "1993-03-25",
                "valid_from": "1993-03-26",
                "last_updated": "",
                "link_gazette": "http://www.gazzettaufficiale.it/eli/gu/1993/03/25/70/sg/pdf",
                "link_urn_nir": "http://www.normattiva.it/uri-res/N2Ls?urn:nir:stato:decreto:1992-12-30;571",
                "link_eli_id": "http://www.normattiva.it/eli/id/1993/03/25/093G0129",
                "link_eli_type": "http://www.normattiva.it/eli/stato/DECRETO/1992/12/30/571",
                "id": "art_1_law_13_093G0129_1993-03-25.json",
                "article_number": "1",
                "article_text": [
                    "                      IL MINISTRO DEI TRASPORTI\n  Vista la legge 10 luglio 1970, n. 579,  relativa  al  trasporto  su\nstrada di materie pericolose;\n  Visto   il   testo   unico   delle  norme  sulla  disciplina  della\ncircolazione stradale, approvato con  decreto  del  Presidente  della\nRepubblica  15  giugno  1959,  n.  393,  e il relativo regolamento di\nesecuzione approvato con decreto del Presidente della  Repubblica  30\ngiugno 1959, n. 420, e successive modifiche ed integrazioni;\n  Vista  la  legge  12  agosto  1962,  n. 1839, con la quale e' stato\nratificato l'accordo  europeo  del  30  settembre  1957  relativo  al\ntrasporto internazionale su strada di merci pericolose A.D.R., e suc-\ncessive modificazioni;\n  Vista la direttiva CEE n. 89/684 del 21 dicembre 1989 relativa alla\nformazione  professionale  di taluni conducenti che trasportano merci\npericolose su strada;\n  Vista la legge 19 febbraio 1992, n. 142, ed in  particolare  l'art.\n11,  nel  quale e' previsto che il Ministro dei trasporti con proprio\ndecreto da' attuazione alla direttiva n. 89/684/CEE del  21  dicembre\n1989 in precedenza indicata;\n  Vista  la  legge  23 agosto 1988, n. 400, in particolare l'art. 17,\ncommi 3 e 4;\n  Vista la lettera n. 065732 in data 8 maggio 1992 con  la  quale  la\nCommissione CEE afferma che il progetto di decreto di applicazione in\nItalia  delle disposizioni della direttiva n. 89/684/CEE sopracitata,\napplica correttamente le disposizioni della direttiva stessa;\n  Udito il parere del Consiglio di Stato reso nella adunanza generale\ndel 23 luglio 1992;\n  Esperita la procedura prevista dalla sopracitata legge n. 400/1988,\nart. 17, comma 3, ultimo periodo, con la comunicazione al  Presidente\ndel Consiglio dei Ministri;\n  Ritenuta  la necessita', nel recepire tale direttiva, di emanare le\ndisposizioni   regolamentari   ed   amministrative   necessarie   per\nconformare   la   normativa   nazionale   riguardante  la  formazione\nprofessionale di taluni conducenti che trasportano  merci  pericolose\nsu strada alla citata direttiva n. 89/684/CEE;\n                             A D O T T A\n                      il seguente regolamento:\n                               Art. 1.\n                        Campo di applicazione\n  1. Con il presente regolamento viene data attuazione alla direttiva\ndel  Consiglio  delle Comunita' europee n. 89/684/CEE del 21 dicembre\n1989 riguardante la formazione professionale di taluni conducenti che\neffettuano trasporti nazionali ed internazionali su strada  di  merci\npericolose mediante:\n    a)  veicoli  di  massa max autorizzata superiore a 3,5 tonnellate\nche trasportano merci pericolose in  quantita'  superiore  ai  limiti\nprevisti  nel  marginale 10011 dell'A.D.R.; per le materie ed oggetti\nesplosivi si tiene invece conto di tutti i veicoli, qualunque sia  la\nloro massa massima autorizzata;\n    b)  veicoli  cisterna  o  unita'  di  trasporto  che  comprendono\ncisterne o contenitori cisterna aventi capacita' di oltre 3000  litri\ne/o   una  massa  massima  autorizzata  superiore  a  3,5  tonnellate\nallorche' detti veicoli  o  unita'  di  trasporto  trasportino  merci\npericolose  od  effettuino  un percorso su strada dopo aver scaricato\nmerci pericolose senza che le cisterne o i contenitori cisterna siano\nstati puliti o degassati.\n  2. Le norme di cui al presente  regolamento  non  si  applicano  ai\nveicoli   appartenenti   alle   Forze   armate   o   posti  sotto  la\nresponsabilita' di queste."
                ]
            }
        ]
    },
    {
        "unit_id": "unit_19",
        "token_input": "HSFWWCHZCK",
        "token_output": "GTNHWZNGDT",
        "documents": [
            {
                "filename": "law_353_092G0260_1992-03-19.json",
                "title": "DECRETO DEL PRESIDENTE DELLA REPUBBLICA 1 marzo 1992, n. 231",
                "subject": "Regolamento di attuazione delle direttive 83/91/CEE, 88/289/CEE e 91/266/CEE relative a problemi sanitari e di polizia sanitaria in materia di importazione di animali, della specie bovina e suina, e di carni fresche in provenienza da Paesi terzi, nonche' di ricerca delle trichine nelle carni fresche di animali domestici della specie suina.",
                "type": "decreto.del.presidente.della.repubblica",
                "number": "231",
                "year": "1992",
                "editorial_code": "092G0260",
                "gazette_reference": "(GU n.66 del 19-03-1992 - Suppl. Ordinario n. 56)",
                "publication_date": "1992-03-1",
                "gazette_date": "1992-03-19",
                "valid_from": "2007-04-26",
                "last_updated": "(Ultimo aggiornamento all'atto pubblicato il 11/04/2007)",
                "link_gazette": "http://www.gazzettaufficiale.it/eli/gu/1992/03/19/66/so/56/sg/pdf",
                "link_urn_nir": "http://www.normattiva.it/uri-res/N2Ls?urn:nir:stato:decreto.del.presidente.della.repubblica:1992-03-1;231",
                "link_eli_id": "http://www.normattiva.it/eli/id/1992/03/19/092G0260",
                "link_eli_type": "http://www.normattiva.it/eli/stato/DECRETO_DEL_PRESIDENTE_DELLA_REPUBBLICA/1992/03/1/231",
                "id": "art_20_law_353_092G0260_1992-03-19.json",
                "article_number": "20",
                "article_text": [
                    "                               Art. 20 \n   (( PROVVEDIMENTO ABROGATO DAL D.LGS. 31 GENNAIO 2007, N. 47 )) "
                ]
            },
            {
                "filename": "law_127_096G0607_1996-11-18.json",
                "title": "DECRETO LEGISLATIVO 23 ottobre 1996, n. 581",
                "subject": "Attuazione della direttiva 93/83/CEE per il coordinamento di alcune norme in materia di diritto d'autore e diritti connessi, applicabili alla radiodiffusione e alla ritrasmissione via cavo.",
                "type": "decreto.legislativo",
                "number": "581",
                "year": "1996",
                "editorial_code": "096G0607",
                "gazette_reference": "(GU n.270 del 18-11-1996)",
                "publication_date": "1996-10-23",
                "gazette_date": "1996-11-18",
                "valid_from": "1996-11-19",
                "last_updated": "(Ultimo aggiornamento all'atto pubblicato il 13/06/1997)",
                "link_gazette": "http://www.gazzettaufficiale.it/eli/gu/1996/11/18/270/sg/pdf",
                "link_urn_nir": "http://www.normattiva.it/uri-res/N2Ls?urn:nir:stato:decreto.legislativo:1996-10-23;581",
                "link_eli_id": "http://www.normattiva.it/eli/id/1996/11/18/096G0607",
                "link_eli_type": "http://www.normattiva.it/eli/stato/DECRETO_LEGISLATIVO/1996/10/23/581",
                "id": "art_10_law_127_096G0607_1996-11-18.json",
                "article_number": "10",
                "article_text": [
                    "                              Art. 10.\n  1. Al primo comma dell'art. 180 della legge 22 aprile 1941, n. 633,\ndopo la parola: \"radiodiffusione\" sono  aggiunte  le  seguenti:  \"ivi\ncompresa la comunicazione al pubblico via satellite\"."
                ]
            },
            {
                "filename": "law_265_091G0243_1991-07-08.json",
                "title": "DECRETO 16 maggio 1991, n. 198",
                "subject": "Regolamento di attuazione della direttiva del Consiglio delle Comunita' europee n. 438 del 21 giugno 1989 che modifica la direttiva del Consiglio n. 561 del 12 novembre 1974 riguardante l'accesso alla professione di trasportatore di merci su strada nel settore dei trasporti nazionali ed internazionali.",
                "type": "decreto",
                "number": "198",
                "year": "1991",
                "editorial_code": "091G0243",
                "gazette_reference": "(GU n.158 del 08-07-1991)",
                "publication_date": "1991-05-16",
                "gazette_date": "1991-07-08",
                "valid_from": "1991-07-09",
                "last_updated": "(Ultimo aggiornamento all'atto pubblicato il 25/09/1995)",
                "link_gazette": "http://www.gazzettaufficiale.it/eli/gu/1991/07/08/158/sg/pdf",
                "link_urn_nir": "http://www.normattiva.it/uri-res/N2Ls?urn:nir:stato:decreto:1991-05-16;198",
                "link_eli_id": "http://www.normattiva.it/eli/id/1991/07/08/091G0243",
                "link_eli_type": "http://www.normattiva.it/eli/stato/DECRETO/1991/05/16/198",
                "id": "art_5_law_265_091G0243_1991-07-08.json",
                "article_number": "5",
                "article_text": [
                    "                               Art. 5.\n                Requisito della capacita' finanziaria\n  1.  La  capacita'  finanziaria  consiste  nella  disponibilita'  di\nrisorse finanziarie necessarie ad assicurare il corretto avviamento e\nla buona gestione dell'impresa.\n  2.   Ai  fini  dell'accertamento  della  capacita'  finanziaria,  i\ncompetenti comitati provinciali per l'albo  degli  autotrasportatori,\ndi  cui  alla  legge  6  giugno  1974,  n.  298,  citata in premessa,\nconsiderano: i conti annuali  dell'impresa,  ove  esistano;  i  fondi\ndisponibili,  comprese  le  liquidita'  bancarie e le possibilita' di\nscoperti  e  prestiti;  tutti  gli  attivi,  comprese  le  proprieta'\ndisponibili  come garanzia per l'impresa; i costi, compreso il prezzo\ndi acquisto o i pagamenti iniziali dei veicoli, edifici,  impianti  e\ninstallazioni; nonche' il capitale di esercizio.\n  3. Per il soddisfacimento del requisito di capacita' finanziaria le\nimprese  interessate possono produrre una attestazione di affidamento\nrilasciata da aziende od  istituti  di  credito  ovvero  da  societa'\nfinanziaria  con  capitale  sociale non inferiore a 5 miliardi per un\nimporto pari a 100 milioni nella forma di cui all'allegato 1.\n  4. Tale importo dovra' essere integrato nella misura pari a lire  5\nmilioni per ciascun veicolo munito di autorizzazione.\n  5.  Qualora  ritenuto  necessario  ai  fini  dell'accertamento  del\npermanere del  requisito  di  capacita'  finanziaria,  dovra'  essere\nrichiesto  dal  competente  comitato  provinciale al relativo ufficio\nprovinciale  la  consistenza   del   parco   veicolare   dell'impresa\nassoggettata al controllo nonche', all'impresa medesima, un attestato\ndi  conferma  di  attestazione  di  affidamento prodotta dall'impresa\nstessa all'atto dell'iscrizione all'albo degli autotrasportatori  con\nle eventuali integrazioni previste al comma precedente."
                ]
            },
            {
                "filename": "law_334_084U0888_1984-12-29.json",
                "title": "LEGGE 22 dicembre 1984, n. 888",
                "subject": "Bilancio di previsione dello Stato per l'anno finanziario 1985 e bilancio pluriennale per il triennio 1985-87.",
                "type": "legge",
                "number": "888",
                "year": "1984",
                "editorial_code": "084U0888",
                "gazette_reference": "(GU n.356 del 29-12-1984 - Suppl. Ordinario)",
                "publication_date": "1984-12-22",
                "gazette_date": "1984-12-29",
                "valid_from": "1985-01-13",
                "last_updated": "",
                "link_gazette": "http://www.gazzettaufficiale.it/eli/gu/1984/12/29/356/so/0/sg/pdf",
                "link_urn_nir": "http://www.normattiva.it/uri-res/N2Ls?urn:nir:stato:legge:1984-12-22;888",
                "link_eli_id": "http://www.normattiva.it/eli/id/1984/12/29/084U0888",
                "link_eli_type": "http://www.normattiva.it/eli/stato/LEGGE/1984/12/22/888",
                "id": "art_25_law_334_084U0888_1984-12-29.json",
                "article_number": "25",
                "article_text": [
                    "                       (Disposizioni diverse)\n\n                              Art. 25.\n\n  A   valere   sui  fondi  stanziati  per  l'anno  finanziario  1985,\nrispettivamente  per  competenza  e  cassa,  sui  capitoli  di  spesa\nindicati  nella  tabella  A allegata alla presente legge, il Ministro\ndel  tesoro  e'  autorizzato  a  trasferire,  con  propri decreti, al\ncapitolo  n.  5053 dello stato di previsione del Ministero del tesoro\nle somme occorrenti per l'acquisto di mezzi di trasporto.\n  Per  l'anno  1985,  per l'acquisto di mezzi di trasporto, di cui al\ncomma  precedente,  puo' essere trasferita una somma complessivamente\nnon superiore a lire ottocento milioni.\n  Per  l'anno  finanziario  1985 gli importi da iscrivere nei singoli\nstati  di  previsione  dei  dicasteri  interessati,  in  relazione  a\ndisposizioni  di  legge  che  demandano la quantificazione dell'onere\nannuo  alla  legge di approvazione del bilancio, sono quelli indicati\nnella  tabella  B  allegata alla presente legge. Per il medesimo anno\nfinanziario  i  pagamenti  corrispondenti  restano  considerati nelle\nautorizzazioni di cassa dei pertinenti capitoli di spesa.\n  Per  l'anno  finanziario  1985  i  capitoli  dei  singoli  stati di\nprevisione  per  i  quali  il  Ministro  del tesoro e' autorizzato ad\neffettuare,  con  propri  decreti,  variazioni tra loro compensative,\nrispettivamente,  per  competenza e cassa, sono quelli indicati nella\ntabella C allegata alla presente legge.\n  Per  l'anno  finanziario  1985  i  capitoli  del conto capitale dei\nsingoli  stati di previsione per i quali si applicano le disposizioni\ncontenute  nel  quinto  e  sesto comma dell'articolo 20 della legge 5\nagosto  1978,  n.  468, sono quelli indicati nella tabella D allegata\nalla presente legge.\n  Ai  fini  degli  adempimenti  previsti dagli articoli 69 e 76 della\nlegge  23  dicembre  1978,  n.  833,  e  successive modificazioni, e'\nautorizzata  l'estinzione  dei  titoli  di pagamento tratti nell'anno\nfinanziario  1985 per apporti dello Stato a titolo di reintegro delle\nminori  entrate  degli organismi del sistema previdenziale relative a\ncontributi   fiscalizzati,  mediante  commutazione  in  quietanza  di\nentrata, con imputazione al capitolo n. 3342 \"Somme da introitare per\nil finanziamento dell'assistenza sanitaria\" dello stato di previsione\ndell'entrata  per  il  suddetto  anno finanziario. Detta commutazione\nsara' effettuata a titolo di acconto in ragione del novanta per cento\ndelle  relative  somme  iscritte,  in  conto  competenza  e di quelle\nrisultanti  in conto residui, nello stato di previsione del Ministero\ndel lavoro e della previdenza sociale e, per la quota restante, sulla\nbase della relativa rendicontazione.\n  In  relazione  all'accertamento  dei  residui dell'anno finanziario\n1984  per  i quali non esistono i corrispondenti capitoli negli stati\ndi  previsione  dei  vari  Ministeri  per l'anno finanziario 1985, il\nMinistro  del  tesoro e' autorizzato ad istituire, con propri decreti\nda registrare alla Corte dei conti, gli occorrenti capitoli.\n  La  composizione delle razioni viveri in natura per gli allievi del\nCorpo  della  guardia  di finanza, del Corpo degli agenti di custodia\ndegli  istituti  di prevenzione e di pena, degli agenti della polizia\ndi Stato e del Corpo forestale dello Stato e le integrazioni di vitto\ne di generi di conforto per i militari dei Corpi medesimi nonche' per\nil  personale  della  polizia  di  Stato  in  speciali  condizioni di\nservizio  sono stabilite, per l'anno finanziario 1985, in conformita'\ndelle  tabelle  annesse  allo stato di previsione del Ministero della\ndifesa per lo stesso anno (Elenco n. 3).\n  Per  gli  ordini  di  accreditamento  di  cui all'articolo 3, primo\ncomma, del decreto del Presidente del Consiglio dei ministri 24 marzo\n1979,  concernente  la  costituzione  dell'ufficio  stralcio previsto\ndall'articolo  119  del  decreto  del  Presidente della Repubblica 24\nluglio  1977,  n.  616,  non  si  applica  il  limite di somma di cui\nall'articolo  56  del  regio  decreto  18  novembre  1923, n. 2440, e\nsuccessive modificazioni.\n  Il  Ministro  del  tesoro  e'  autorizzato a trasferire, con propri\ndecreti,  in  termini  di  residui,  di  competenza  e  di cassa, dal\ncapitolo  n.  5926 dello stato di previsione del Ministero del tesoro\nper  l'anno  finanziario  1985  e dal capitolo n. 7081 dello stato di\nprevisione   del   Ministero  del  bilancio  e  della  programmazione\neconomica per il medesimo anno finanziario, ai capitoli dei Ministeri\ninteressati,  le  quote da attribuire alle regioni a statuto speciale\ndei fondi considerati ai predetti capitoli n. 5926 e n. 7081 ai sensi\ndell'ultimo  comma dell'articolo 126 del decreto del Presidente della\nRepubblica 24 luglio 1977, n. 616.\n  Il  Ministro  del  tesoro,  sentito  il Ministro per gli interventi\nstraordinari   nel  Mezzogiorno,  provvede,  con  propri  decreti  da\npubblicare nella Gazzetta Ufficiale, alla individuazione dei capitoli\ndi  spesa  di  investimento e, per ciascuno di essi, alla indicazione\ndelle  somme  da  destinare  agli  interventi  nei  territori  di cui\nall'articolo  1  del testo unico approvato con decreto del Presidente\ndella Repubblica 6 marzo 1978, n. 218, ai sensi dell'articolo 107 del\nmedesimo testo unico.\n  Il  Ministro  del  tesoro,  con  propri  decreti,  provvedera', con\nvariazioni  compensative  nel  conto  dei  residui,  a trasferire dai\ncapitoli   individuati   con   i   decreti   emanati   in  attuazione\ndell'articolo  107,  primo  comma,  del  testo  unico,  approvato con\ndecreto  del  Presidente  della  Repubblica  6 marzo 1978, n. 218, ad\napposito  capitolo,  da  istituire  nello  stato  di  previsione  del\nMinistero  del  tesoro ed in quelli della spesa delle amministrazioni\ned  aziende  autonome,  l'importo differenziale fra le somme indicate\nper  ciascuno dei predetti capitoli e quelle effettivamente destinate\nagli  interventi  nei territori indicati nell'articolo 1 del predetto\ntesto  unico,  da  devolvere per il finanziamento degli interventi di\ncui all'articolo 47 del medesimo testo unico.\n  Il  Ministro  del  tesoro  e'  autorizzato a provvedere, con propri\ndecreti,  al  trasferimento  dagli  stati  di  previsione delle varie\nAmministrazioni statali a quello del Ministero del tesoro delle somme\niscritte   in  capitoli  concernenti  spese  inerenti  ai  servizi  e\nforniture  considerati  dal  regio  decreto 18 gennaio 1923, n. 94, e\nrelative norme di applicazione.\n  Il  Ministro  del  tesoro  e'  autorizzato ad apportare, con propri\ndecreti,   in   termini  di  competenza  e  di  cassa  le  variazioni\ncompensative  di  bilancio  occorrenti  per  l'attuazione  di  quanto\ndisposto  dall'articolo  13  della  legge  5  agosto  1981, n. 416, e\nsuccessive integrazioni e modificazioni, concernente disciplina delle\nimprese editrici e provvidenze per l'editoria.\n  Il  Ministro  del  tesoro,  su proposta del Ministro competente, e'\nautorizzato   ad  apportare,  con  propri  decreti,  variazioni  alle\ndotazioni  di  cassa  dei  singoli  capitoli  iscritti negli stati di\nprevisione  della spesa dei Ministeri, purche' risultino compensative\nnell'ambito   della   medesima   categoria   di   bilancio.   Nessuna\ncompensazione  puo'  essere offerta a carico dei capitoli concernenti\nle spese obbligatorie e d'ordine.\n  Il  Ministro  del  tesoro  e'  autorizzato ad apportare, con propri\ndecreti,  le  occorrenti  variazioni  di  bilancio  in relazione alla\nristrutturazione dei debiti esteri, nonche' di quelli contratti dalla\nCassa  per  il  Mezzogiorno,  anche  mediante  l'accensione  di nuovi\nprestiti destinati alla estinzione anticipata di quelli in essere. Il\nMinistro  del  tesoro  e',  altresi',  autorizzato  ad apportare, con\npropri  decreti,  ai  bilanci  delle  aziende  autonome le variazioni\nconnesse  con  le  stesse operazioni da queste effettuate per il loro\nindebitamento sull'interno e sull'estero."
                ]
            },
            {
                "filename": "law_197_098G0377_1998-09-10.json",
                "title": "DECRETO 13 agosto 1998, n. 325",
                "subject": "Regolamento recante norme per l'applicazione al Corpo della guardia di finanza delle disposizioni in materia di sicurezza e salute dei lavoratori nel luogo di lavoro.",
                "type": "decreto",
                "number": "325",
                "year": "1998",
                "editorial_code": "098G0377",
                "gazette_reference": "(GU n.211 del 10-09-1998)",
                "publication_date": "1998-08-13",
                "gazette_date": "1998-09-10",
                "valid_from": "1998-09-25",
                "last_updated": "",
                "link_gazette": "http://www.gazzettaufficiale.it/eli/gu/1998/09/10/211/sg/pdf",
                "link_urn_nir": "http://www.normattiva.it/uri-res/N2Ls?urn:nir:stato:decreto:1998-08-13;325",
                "link_eli_id": "http://www.normattiva.it/eli/id/1998/09/10/098G0377",
                "link_eli_type": "http://www.normattiva.it/eli/stato/DECRETO/1998/08/13/325",
                "id": "art_2_law_197_098G0377_1998-09-10.json",
                "article_number": "2",
                "article_text": [
                    "                               Art. 2.\n  1.  I  rappresentanti  per  la   sicurezza  da  nominare  ai  sensi\ndell'articolo 18 del citato decreto  legislativo n. 626 del 1994, per\nil Corpo della guardia di finanza, sono individuati:\n  a) di norma,  tra i delegati eletti negli  organi di rappresentanza\nmilitare,  ai sensi  del decreto  del Presidente  della Repubblica  4\nnovembre  1979, n.  691, relativamente  alle infrastrutture  ove essi\nabitualmente operano  o che ospitano  il reparto al quale  gli stessi\nsono in forza;\n  b) in assenza di delegati di  cui alla lettera a), tra il personale\nin  servizio presso  il reparto  o i  reparti allocati  nella singola\ninfrastruttura, a seguito  di designazione da parte  del personale in\nservizio presso il  o i reparti medesimi, da  effettuarsi in apposita\nriunione   indetta    dal   datore    di   lavoro    competente   per\nl'infrastruttura.\n  2.  Nella  nomina  di  cui   al  comma  1  dovra'  individuarsi  un\nrappresentante  per  la  sicurezza  per  ciascun  settore  tecnico  o\noperativo  nell'ambito  del  quale  operano  i  reparti  aventi  sede\nnell'infrastruttura.\n  3.  Le modalita'  ed  i contenuti  specifici  della formazione  del\nrappresentante per  la sicurezza  sono stabiliti con  le disposizioni\nemanate dal comando generale, sentito il Co.Ce.R./Guardia di finanza.\n  4.  Il rappresentante  per  la sicurezza  deve  disporre del  tempo\nnecessario  all'espletamento  dell'incarico,   durante  il  quale  le\noperazioni svolte, per le finalita'  e nei limiti previsti dal citato\ndecreto  legislativo  n. 626  del  1994,  sono  a tutti  gli  effetti\nattivita' di  servizio. Le modalita' per  l'esercizio delle funzioni,\ndi cui  all'articolo 19,  comma 1,  del predetto  decreto legislativo\nsono determinate dal comando generale, sentito il Co.Ce.R./Guardia di\nfinanza.\n  5.  Presso ogni  comando di  Corpo  ed equiparato,  le funzioni  di\norientamento  e   di  promozione  di  iniziative   formative  di  cui\nall'articolo 20 del citato decreto  legislativo n. 626 del 1994, sono\nespletate  nel corso  di apposito  incontro fra  il datore  di lavoro\ncompetente   per  l'infrastruttura   e  l'organo   di  rappresentanza\naffiancato al comandante dell'unita' di  base ai sensi del menzionato\ndecreto del Presidente  della Repubblica n. 691 del 1979.  In caso di\npresenza  di  piu'   comandanti  di  unita'  di   base  nella  stessa\ninfrastruttura, al  suddetto incontro partecipano tutti  i rispettivi\norgani di rappresentanza."
                ]
            },
            {
                "filename": "law_715_085U0427_1985-08-21.json",
                "title": "LEGGE 7 agosto 1985, n. 427",
                "subject": "Riordinamento della Ragioneria generale dello Stato.",
                "type": "legge",
                "number": "427",
                "year": "1985",
                "editorial_code": "085U0427",
                "gazette_reference": "(GU n.196 del 21-08-1985 - Suppl. Ordinario)",
                "publication_date": "1985-08-7",
                "gazette_date": "1985-08-21",
                "valid_from": "1998-03-26",
                "last_updated": "(Ultimo aggiornamento all'atto pubblicato il 11/03/1998)",
                "link_gazette": "http://www.gazzettaufficiale.it/eli/gu/1985/08/21/196/so/0/sg/pdf",
                "link_urn_nir": "http://www.normattiva.it/uri-res/N2Ls?urn:nir:stato:legge:1985-08-7;427",
                "link_eli_id": "http://www.normattiva.it/eli/id/1985/08/21/085U0427",
                "link_eli_type": "http://www.normattiva.it/eli/stato/LEGGE/1985/08/7/427",
                "id": "art_2_law_715_085U0427_1985-08-21.json",
                "article_number": "2",
                "article_text": [
                    "                               Art. 2. \n                         Servizi provinciali \n \n  1. E' istituito, nell'ambito dell'Ispettorato generale di  finanza,\nil servizio ispettivo delle ragionerie  provinciali  dello  Stato  il\nquale e' composto dai dirigenti superiori con funzioni  di  ispettori\ngenerali e dai primi dirigenti con funzioni di ispettori capo di  cui\nal quadro M della tabella VII  allegata  al  decreto  del  Presidente\ndella Repubblica 30 giugno 1972, n. 748, e successive modificazioni. \n  2. I  compiti  e  le  attribuzioni  degli  ispettori  addetti  alle\nverifiche  alle  ragionerie  provinciali  dello  Stato  sono  fissati\ndall'articolo 174 del regolamento  per  l'amministrazione  e  per  la\ncontabilita' generale dello Stato, approvato  con  regio  decreto  23\nmaggio 1924, n. 827, e dall'articolo 12 del  decreto  del  Presidente\ndella Repubblica 30 giugno 1972, n. 748, e successive modificazioni. \n  3. Con decreto del Ministro del tesoro, previo parere del consiglio\ndi amministrazione, saranno stabiliti la struttura organizzativa ed i\ncriteri e le modalita' per il funzionamento del servizio ispettivo di\ncui al precedente comma 1. \n  4. ((COMMA ABROGATO DAL D.L. 2 DICEMBRE 1985, N. 688)). "
                ]
            },
            {
                "filename": "law_514_082U0688_1982-09-30.json",
                "title": "DECRETO-LEGGE 30 settembre 1982, n. 688",
                "subject": "Misure urgenti in materia di entrate fiscali.",
                "type": "decreto.legge",
                "number": "688",
                "year": "1982",
                "editorial_code": "082U0688",
                "gazette_reference": "(GU n.270 del 30-09-1982)",
                "publication_date": "1982-09-30",
                "gazette_date": "1982-09-30",
                "valid_from": "1982-09-30",
                "last_updated": "(Ultimo aggiornamento all'atto pubblicato il 17/07/2002)",
                "link_gazette": "http://www.gazzettaufficiale.it/eli/gu/1982/09/30/270/sg/pdf",
                "link_urn_nir": "http://www.normattiva.it/uri-res/N2Ls?urn:nir:stato:decreto.legge:1982-09-30;688",
                "link_eli_id": "http://www.normattiva.it/eli/id/1982/09/30/082U0688",
                "link_eli_type": "http://www.normattiva.it/eli/stato/DECRETO_LEGGE/1982/09/30/688",
                "id": "art_6_law_514_082U0688_1982-09-30.json",
                "article_number": "6",
                "article_text": [
                    "                               Art. 6.\n\n  Con  decorrenza dal periodo d'imposta in corso alla data di entrata\nin  vigore del presente, decreto, l'aliquota dell'imposta sul reddito\ndelle  persone  giuridiche  e'  elevata  al  30  per cento. Per detto\nperiodo  d'imposta  non  e' dovuta l'addizionale straordinaria dell'8\nper   cento   commisurata   all'imposta  sul  reddito  delle  persone\ngiuridiche, istituita dall'art. 4 del decreto-legge 22 dicembre 1981,\nn.  787, convertito, con modificazioni, nella legge 26 febbraio 1982,\nn.  52,  fermo restando l'obbligo del versamento provvisorio previsto\ndall'art.  5  dello  stesso decreto. L'ammontare di tale versamento e\nquello  dell'addizionale  applicata sulle ritenute a titolo d'acconto\ndi  cui  al  secondo  comma  del  predetto  art.  4  sono  detraibili\ndall'imposta sul reddito delle persone giuridiche relativa al periodo\nd'imposta medesimo, con diritto al rimborso dell'eventuale eccedenza.\n  ((Con decorrenza dal periodo d'imposta successivo a quello indicato\nnel  comma  precedente  il  credito  d'imposta  di  cui alla legge 16\ndicembre  1977,  n. 904, sugli utili percepiti dalle societa' nonche'\ndagli  enti  finanziari previsti dall'articolo 19 del decreto-legge 8\naprile  1974,  n.  95,  convertito in legge, con modificazioni, dalla\nlegge   7   giugno   1974,  n.  216,  e'  pari  al  42,85  per  cento\ndell'ammontare  degli  utili  concorrenti  a  formare il loro reddito\nimponibile   ai   fini   dell'imposta   sul   reddito  delle  persone\ngiuridiche))."
                ]
            },
            {
                "filename": "law_398_099G0240_1999-06-10.json",
                "title": "DECRETO DEL PRESIDENTE DELLA REPUBBLICA 30 aprile 1999, n. 162",
                "subject": "((Regolamento recante norme per l'attuazione della direttiva 2014/33/UE, relativa agli ascensori ed ai componenti di sicurezza degli ascensori, nonche' per l'esercizio degli ascensori)).",
                "type": "decreto.del.presidente.della.repubblica",
                "number": "162",
                "year": "1999",
                "editorial_code": "099G0240",
                "gazette_reference": "(GU n.134 del 10-06-1999)",
                "publication_date": "1999-04-30",
                "gazette_date": "1999-06-10",
                "valid_from": "2017-03-16",
                "last_updated": "(Ultimo aggiornamento all'atto pubblicato il 27/11/2017)",
                "link_gazette": "http://www.gazzettaufficiale.it/eli/gu/1999/06/10/134/sg/pdf",
                "link_urn_nir": "http://www.normattiva.it/uri-res/N2Ls?urn:nir:stato:decreto.del.presidente.della.repubblica:1999-04-30;162",
                "link_eli_id": "http://www.normattiva.it/eli/id/1999/06/10/099G0240",
                "link_eli_type": "http://www.normattiva.it/eli/stato/DECRETO_DEL_PRESIDENTE_DELLA_REPUBBLICA/1999/04/30/162",
                "id": "art_17_law_398_099G0240_1999-06-10.json",
                "article_number": "17",
                "article_text": [
                    "                              Art. 17.\n                            D i v i e t i\n\n  1.  E'  vietato  l'uso  ((degli ascensori, dei montacarichi e degli\napparecchi  di sollevamento rispondenti alla definizione di ascensore\nla  cui  velocita'  di spostamento non supera 0.15 m/s)) ai minori di\nanni 12, non accompagnati da persone di eta' piu' elevata.\n  2.  E',  inoltre, vietato l'uso degli ascensori a cabine multiple a\nmoto  continuo  ai  ciechi,  alla  persone  con  abolita  o diminuita\nfunzionalita'  degli  arti  ed  ai  minori  di  dodici anni, anche se\naccompagnati.\n  3.  Resta  fermo  il  divieto  di occupazione dei fanciulli e delle\ndonne minorenni in lavori di manovra degli ascensori, montacarichi ed\napparecchi  di sollevamento a trazione meccanica, ai sensi della voce\n69, della tabella A annessa al regio decreto 7 agosto 1936, n. 1720."
                ]
            },
            {
                "filename": "law_306_095G0341_1995-07-20.json",
